,userName,userImage,content,score,thumbsUpCount,reviewCreatedVersion,at
0,tamires pecellin,https://play-lh.googleusercontent.com/-ZPA7czV_IrY/AAAAAAAAAAI/AAAAAAAAAAA/AMZuuckJVPgHsUToeaEOKkbMa_W-8tHCYA/photo.jpg,"Olha ,eu acho esse jogo muito legal , mas ele é muito limitado ,os monstros demoram demais a nascer ,o tempo de aceleração é pouca , e tudo usa muito diamante ,claro tem vários modos de conseguir mais ,só que é tudo no DINHEIRO ,eu acho que invés de botar mais monstros ,deviam criar mais eventos pro diamante ser mais acessível , não são todas pessoas que podem gastar do jeito que querem,pelo menos eu não",4,41,3.0.2,2020-11-03 13:49:54
1,Ricardo Mello Ferreira,https://play-lh.googleusercontent.com/-dhqfl2hcrhk/AAAAAAAAAAI/AAAAAAAAB7Q/AMZuuclSxJ-FvkAbo4XDGlZhpffZZaHbTg/photo.jpg,"My Singing Monsters é um game excelente. As crianças tem um contato divertido com a musicalidade e princípios básicos de partitura e tempo das melodias. Elas aprendem brincando! O game é bastante intuitivo e trás os pequenos para um ambiente virtual mais limpo, sem violência e descontraído. Meu filhote me apresentou o game e gostei tanto que passei a jogar junto com ele. Sou músico e desenvoldor de sistemas web e achei o insite de vocês maravilhoso. Parabéns a toda a equipe!!!",5,78,3.0.2,2020-11-02 09:04:50
2,Solange Aparecida,https://play-lh.googleusercontent.com/-KhlC453qX_Y/AAAAAAAAAAI/AAAAAAAAAAA/AMZuuclHwJCqa6Q2PFl8_7E_KNh_GihXUg/photo.jpg,"É um jogo bem legal,gostei!,o legal desse jogo é que os monstros cantam, e isso é bem legal,as musiquinhas desse jogo são muito viciantes e legal de se ouvir,as músicas são tão viciantes que eu fico cantando as músicas o dia inteiro, recomendo vcs instalarem e jogarem,ah! Esqueci de falar!, não é só pq o jogo é legal que quer dizer que ele não tem bugs,existem vários bugs,mas eu não vou dizer eles aqui,mas! Recomendo que vcs baixem e joguem,dou 5 estrelas para esse jogo.",5,63,3.0.2,2020-10-30 22:23:22
3,Chavoso do chá,https://play-lh.googleusercontent.com/a-/AOh14GiLZER_YcyhRaiyBDhBijQrnA8pl_wuvAezs5_lgA,"O jogo é otimo, é legal ficar fazendo os monstros e tal, mas a parte que eu mais gosto é os monstros novos e as ilhas!! É tão bom quando lança uma ilha nova e você vai vendo cada monstro e seu som!! 😁 Mas ultimamente o jogo está sendo esquecido, não conheco muita gente que joga o jogo hoje em dia 😥 mas é como todo jogo. Fica famoso e depois cai no mar do esquecimento",3,0,3.0.2,2020-11-07 15:27:30
4,Doranilde Aguiar,https://play-lh.googleusercontent.com/-NsNstpjaY6Q/AAAAAAAAAAI/AAAAAAAAAAA/AMZuucnji3IcOBgTUygms1zR2SZAssGnEg/photo.jpg,"Mano por onde eu começo... deixa eu ver esse jogo é otimo gráficos lindos, jogabilidade incrivel várias ilhas com suas funções, monstros únicos, combinações de monstros ótimas e eu não tenho oque dizer por que esse jogo é simplesmente.... INCRIVEL ESSE JOGO É A PERFEIÇÃO DA TERRA",5,0,3.0.2,2020-11-07 13:46:49
5,gersho,https://play-lh.googleusercontent.com/a-/AOh14Gi025UdU1QqZnatrQpMdocsAheMj1KsNLe6JkeRCQ,"Jogo desde 2013,porém acabei perdendo minha conta e nunca mais joguei,hoje em dia voltei a jogar e já estou level 13,é muito legal o jogo!, jogabilidade simples,no começo é bem estressante mas ao longo do tempo fica melhor! Me adiciona aí ! : 95837521FF,acendo tochas todos os dias :)",5,90,3.0.2,2020-10-28 10:52:48
6,Fabricio Barbosa,https://play-lh.googleusercontent.com/a-/AOh14GiSREDHpMs7HWwMx8iV1VtIkuY1bAy7miYSoBxhuw,"Hoje tive um problema ao entrar no jogo, ele carrega mas logo após aparece que a sessão de downloads foi expirada. Já desinstalei e instalei, ja limpei os dados e cache, não sei mais oque fazer. Alguém pode me ajudar?",3,0,3.0.2,2020-11-07 16:59:18
7,AnØniMØus hacker,https://play-lh.googleusercontent.com/a-/AOh14Gh1_Hrqk6zlvUQGxuk9vmnQe22LU5cZ96RIMGPQ,"o jogo é maravilhoso mais tem que arrumar o jogo da memória todo dia eu jogo ele mais e ganho, mais sempre vem: 100 agrados 100 moedas e do lado sempre tem 1.000 diamantes e 1.000.0000 de moedas ,1.000.000 de agrados e eu nunca pego. e a raspadinha que demora uma semana pra poder usar de novo só vem: dedo enroscado,mamutinho no máximo um dom sapo no máximo. é os diamantes 37.90 R$ pra pegar 225 diamantes as ofertas de diamantes,ou não entra ou não vem recompensa nenhuma emfim legal p/difícil",3,2,3.0.2,2020-11-04 16:58:14
8,Josean.caveirinha Moura,https://play-lh.googleusercontent.com/a-/AOh14Gi0P_ae2NUpeIh6eHFhjcpWjU8O3oRaaigT-NMm6nk,Jogo muito bom os gráficos são legais a jogabilidade também é um jogo que você tem que se dedicar a jogar a forma de ganhar dinheiro também é muito boa os monstros são fofinhos (Alguns nem tanto) o jogo é bem legal joguem ele,5,2,3.0.2,2020-11-02 16:55:30
9,Davi gamer40,https://play-lh.googleusercontent.com/a-/AOh14GhVrxo56LF1DeIjRqQIXneRWdnrBUC8EMa4hvJRGA,É muito legal mas poderia ser um pouco mais barato as coisas e também o uid de pessoas não da pra lembrar mas esse jogo é ótimo ele tem coisas ótimas que nem eu jogo todo o dia esse jogo é muito 💫💫💫💫💫 de 5 estrelas esse jogo é muito top e legal,5,3,3.0.2,2020-11-01 20:32:13
10,thiago iuchema de oliveira,https://play-lh.googleusercontent.com/a-/AOh14GiTaLNPFmDxKtZXGd3M0jJrjqx6fzGa8mAgj_THzQ,"Essas últimas atualizações deixaram o jogo extremamente liso, tem bastante conteúdo e o jogo não trava, isso é sensacional, por conta disso estou jogando novamente.",5,1,3.0.2,2020-10-31 11:57:33
11,Juan Ferreira dos Santos,https://play-lh.googleusercontent.com/a-/AOh14GhNAiv0J5oP5c_9weLAjEvaLtSJF4XYuC4MDbwb,"Super legal esse jogo e eu recomendo bastante mas eh muito difícil conseguir diamantes e as coisas são muito caras igual o castelo básico da ilha de ar,eu nem comprei as outras ainda pq cada vez que vai comprando vai tudo ficando mais caro o castelo da ilha de ar exige 1000000 de moedas.Eu acho q vcs deviam ajudar nisso pq eh muito chato e a mina so da um diamante por dia.Mas fora isso esse jogo eh muito legal.a roleta ajuda bastante tbm pq eu peguei 100 diamantes e me ajudou bastante 95766888EA",4,20,3.0.2,2020-10-27 12:04:33
12,Alguém '-',https://play-lh.googleusercontent.com/a-/AOh14GjL7s38JwLIlmfuMSR5035tNsxcHPSilhDSq2kYgw,"Vincular conta, é uma ferramenta que não funciona no jogo, eu jogava a alguns anos com conta vinculada no Facebook, já estava bem avançada no jogo, hoje baixei pra jogar novamente, fui entrar com o Facebook (que ainda é o mesmo da época) tem que começar dês do início, isso é algo frustrante, perdi a vontade de jogar novamente",1,22,3.0.2,2020-10-29 07:20:06
13,Novacel- Master Games,https://play-lh.googleusercontent.com/a-/AOh14Gjq9tPwUg0Xk8jCblIsmwhZgP06QzzKnfNPoxFa,"Olha esse jogo já foi bom um dia hoje já não compenyjogar mais não , tudo está com tempo elevadíssimo para ser feito oque torna o jogo cansativo e desmotivante, tanto para fazer itens como monstros , tudo está se usando diamante praticamente ou seja fazendo o jogador gastar , o jogo está totalmente pay to Win , não precam tempo pois vão se frustrar.",1,7,3.0.2,2020-10-28 19:41:00
14,Rhuana Lara,https://play-lh.googleusercontent.com/a-/AOh14Gheb5s1jfuvHejZ5GzpuDIWOluNbja0UTxFVzG7,"Boa,mas muitos montros precisam de diamante,isso é mt chato, além de ter muita dificuldade de achar diamantes,precisa de MUUUUUUUITA paciência,pfv diminuam os montros de Diamantes,ou só aumentem as missões com diamantes",4,0,3.0.2,2020-11-08 01:04:27
15,um lixo qualquer,https://play-lh.googleusercontent.com/a-/AOh14Gh0SClioRgDIq_uTjUeK-NxxLEtSbWWkaqjDqxqB1Q,"o jogo é incrivel, gosto muito de jogar, porém, toda vez que eu acelero 15 minutos o tempo de um monstro, vem sempre um comercial do AstroPay, e esse comercial buga e o jogo não acelera os 15 minutos. Gostaria que concertassem isso.",2,20,3.0.2,2020-10-25 10:08:16
16,matheus henrique beltrame,https://play-lh.googleusercontent.com/-oLbjgDCXs7Q/AAAAAAAAAAI/AAAAAAAAAAA/AMZuuckKhNH2nGk4lMRjx2QMjL8oMY-29A/photo.jpg,Fas agente multiplicar tudo com nossos amigos uma ilha com todos os monstros e novo elemento e fas agente pode comprar os monstros de um elemento da ilha eterea com as gemas roxa e fas a wub caixoblims rara estar na ilha das estatuas de diamante e esse jogo é uma maravilha do nota 10 e entra na minha ilha tribal se chama entre por favor amigos,5,2,3.0.2,2020-11-05 00:24:45
17,Evani Moura,https://play-lh.googleusercontent.com/-272vGBTOR6M/AAAAAAAAAAI/AAAAAAAAAAA/AMZuucn4XPESebGMKyDRiFCy9P_wRHPECw/photo.jpg,"eu estou na conta da minha avó. eu atualmente tenho 13 anos, eu jogo esse jogo dês dos meus 7 anos e eu amo esse jogo! eu tinha parado de jogar um tempo, mas eu voltei no começo desse ano quando eu vi a nova ilha, Faerie Island! eu estou apaixonado pelas coisas novas que tem no jogo! as atualizações estão sendo incríveis! como os novos castelos, novas opções, etc... Eu amo vocês, BigBlueBubble! ♥️ Happy Monstering! 😆 06/11/20 Eu estou tendo problemas para entrar na minha conta ""sessão expirada",4,4,3.0.2,2020-11-06 19:03:58
18,Manuele Costa,https://play-lh.googleusercontent.com/-fT4tuAr__3s/AAAAAAAAAAI/AAAAAAAAAAA/AMZuuck69-ygy_cjxs-raMLBCS6Jp2k1oQ/photo.jpg,"O jogo é ótimo mais o problema é que precisa de conexão com a internet pra jogar, mais por que? não dá pra jogar como um jogo qualquer que não precisa disso? consertem isso agora!",2,0,3.0.2,2020-11-06 19:10:21
19,Eduardo Orlando,https://play-lh.googleusercontent.com/a-/AOh14GgPKYISQMQTgfqOBbuFZjfYj0hE7mkoFsEKUiQYng,O jogo e bom e tal mais tem muita propagando e tambem nessa atualizacão e acho meu hotel da ilha principal bugol ele nao aparece mais e tambem quando eu tento mudar os monstros de lugar buga e sair do jogo sem mais e sem menos e aparece que aprenta falhas continuamente espero que o suporte do jogo arrume isso,3,1,3.0.2,2020-10-28 10:23:26
20,Luciléia Ferreira dos Santos,https://play-lh.googleusercontent.com/-NKzkXt_s0Rc/AAAAAAAAAAI/AAAAAAAAAAA/AMZuuclHTbmvUxU60pbnsGy6wNT17_jIKw/photo.jpg,"Gostei demais dei 5 estrelas mais so que obriga a gente a gastar as gemas ai quando vc vai ver n tem mais e o jogo n devolve isso fica ruim pro os jogadores, mais de resto e muito legal",5,1,3.0.2,2020-11-02 18:01:00
21,Natan Brito Silva,https://play-lh.googleusercontent.com/-HxTfRISTCCI/AAAAAAAAAAI/AAAAAAAAAAA/AMZuuckyFCW6cBC01FMP0QBHwUskT9YBDw/photo.jpg,"O jogo hoje está bom não tem a quantidade absurda de anúncios de antes más o meu deu um erro e não passa dos 4 porcento o carregamento, isso ocorreu após essa última atualização",4,3,3.0.2,2020-10-23 17:09:49
22,Marciéli Dallabrida,https://play-lh.googleusercontent.com/-uztuK64l7uk/AAAAAAAAAAI/AAAAAAAAAAA/AMZuucknTlOLa1VnkwKm2A0ZdBvRPUM24A/photo.jpg,"Deixei uma estrela pois agora começou a aparecer propaganda a cada troca de ilha, toda vez que quero ir pra uma outra ilha tenho que aguardar o término do anúncio, isso irrita muito!! Antes tinha mas era de vez em quando, agora toda troca de ilha tem anúncio. Por favor, nem todo mundo usa dinheiro em jogos pra estar acabando com os anúncios e nem por isso é certo abusar na quantidade de anúncio pra tentar ""obrigar"" o jogador a gastar no jogo pra tirá-los. Quando é demais é demais! Arrumem isso!",5,3,3.0.0,2020-10-28 19:43:34
23,Junia Alves Caixeta Cunha,https://play-lh.googleusercontent.com/-zcxqxOg7Yi0/AAAAAAAAAAI/AAAAAAAAAAA/AMZuucnYNFntXXxy-YARdMhdW73SYX4Hdg/photo.jpg,"sinplesmente incrivel, fiquei viciada, tantos monstros, ilhas e coisas para conquistar, espero que os criadores estejão felizes pela obra, por que eu concertesa estou! Vc nunca ce arependira de abaixar, vc pega amor pelos seu ""pts"" monstros e quer envoluir cada vez mais! Ce acabacar uma ilha, não ce preiucupe! Terá mais 40 para vc terminar, cada uma diferente, ou o contesto, ou a história! Um dos melhores jogos do meu celular.",5,2,3.0.0,2020-10-20 15:12:03
24,Pedro Bastos,https://play-lh.googleusercontent.com/a-/AOh14GjO1q7gwzQuKSI6Av72Tj22R7H3RdoHaDfLQX7-Jg,"Exclui a minha última resenha e piorei minha nota, agora sendo a sexta e última vez que reniciei o jogo, por causa desse llogin horroroso que eles tem, Facebook? Por favor né? E sem falar que o e-mail não funciona, não instalem o jogo vcs vão se frustar quando perderem a conta, estou decepcionado",1,2,3.0.2,2020-10-24 19:51:48
25,Pedrinho-Kai,https://play-lh.googleusercontent.com/a-/AOh14GjT9R0HZETspIp68rIOQUtZ2EL5Or7k3Qaw0mO6fQ,"Primeiramente Olá. Esse jogo é monstruosamente perfeito. Várias pessoas por aí dizem que é pay2win, mas não é verdade. Em 2015 vi um anúncio, achei muito criativo e me apaixonei pelo jogo. Já perdi minhas contas várias porque não sabia salvar. Em 2018, comecei a jogar seriamente e tenho uma belíssima conta hoje. Monster-Handlers, vocês estão de parabéns. Você que está lendo essa avaliação antes de baixar, não perca mais tempo e baixe. Nunca se arrependerá.",5,478,3.0.0,2020-09-03 21:53:50
26,Sabrina Rocha,https://play-lh.googleusercontent.com/a-/AOh14GhX4j8KQujmtYJw5vt4hkZPovkYQnqzCoQszkP9lzo,"Olá, desculpe atrapalhar mas vim relatar um erro no seu jogo, quando eu passo de todos os níveis do jogo da memória e chega a hora de escolher um prêmio todas as vezes, não importa oque eu escolha, sempre vem o mesmo prêmio, 200 agrados, deveria vim algo diferente mas sempre vem o mesmo e isso é injusto! Peço desculpas pois esse jogo é ótimo, mas, esse erro é irritante, por isso darei 4 ao invés de 5 estrelas, espero que concertem isso!",4,89,3.0.1,2020-10-18 21:35:18
27,Ismack Alexandre Sousa Silva,https://play-lh.googleusercontent.com/a-/AOh14GgHUXvLOprxjuSTZAmCfzYXY6GiYN_C5eXexgjFvg,"So acho as coisas no geral deveriam ser mais baratas , uma wub Box por 75 Milhões, eu juntei uma vez acho q nao chegou nem nos 5 Milhões Sem condição 😔😔😔👎 O jogo é tão bom a única coisa que estraga e o custo das coisas 😭😭😭",3,1,3.0.2,2020-10-28 00:52:39
28,bonnie games,https://play-lh.googleusercontent.com/a-/AOh14Gg_CCQDXuy2MFCPly8DM9XlK7Erx0mZPZ8g6200,"Olá jogadores novos, tenho um pedido, quanto terminarem o tutorial clique na engrenagem, submeter referência e coloque 70878138JI assim vocês vão ganhar 5 diamantes e eu tbm",5,3,3.0.2,2020-10-25 12:14:54
29,Lucas gamer Oliveira Santos,https://play-lh.googleusercontent.com/-SYq1BT3i1RA/AAAAAAAAAAI/AAAAAAAAAAA/AMZuuclhu5gKdHy8sk6lWEBjW3IrS9V9mg/photo.jpg,O jogo é bem legal eu tinha uma conta a muito mas muito tenpo em 2019 eu tava no level 22 ja tinha o wubb box eu adoro ele mas tem gente que nao gosta do box coloca o som dele la no hultimo em tao tira o negocio de abaixar o som do mostro,5,2,3.0.2,2020-10-23 18:56:54
30,Murilo Oooo,https://play-lh.googleusercontent.com/-OCDM4je-x3s/AAAAAAAAAAI/AAAAAAAAAAA/AMZuuckkYsPjPYHZemA_2RtK4rg_MycXgA/photo.jpg,"Vamos diminuir os anúncios? Toda vex é 30 anúncios pra lidar diminuam os anúncios, tawker e parselona dimuam um pouco só um pouco mesmo a quantidade de coisas pra pagar. Pelo resto está bom",3,2,3.0.2,2020-10-28 15:41:11
31,lindao BONITAO,https://play-lh.googleusercontent.com/-K2jtMTG5gns/AAAAAAAAAAI/AAAAAAAAAAA/AMZuuckvAYw1ybnMU-Qh73PVKAV-DYuicg/photo.jpg,"jogo simplesmente incrivel! voce comeca a tratar os monstros como se fossem seus proprios pets, alem do mais a interface e incrivel! jogo desde quando era pequeno e nao me arrependo, sempre trazem novas atualizacoes uma melhor do que a outra, continuem assim que voces vao longe! faco curso de programacao e entendo como foi para fazer essa beleza de jogo! se vc quer baixar e tiver lendo esse feedback, pode baixar que nunca vai se arrepender!",5,265,3.0.0,2020-09-06 19:11:48
32,Rainbow :3 FC Channel OFC;,https://play-lh.googleusercontent.com/a-/AOh14Ghh3YnRjiYgUC1OiRV-ptTk8-rLDOwnsx9Xyu8p4sA,"Gosto tanto do jogo é tão bom cara :) vocês poderiam reduzir s anúncios, só deixar os anúncios caso queiram ver comerciais, porém, acho o jogo muito top, e vocês devem ter se é esforçado muito para fazer um jogo bom, mas bem que seria bom ter menos comercial, só assistisse comercial caso queira acelerar um vídeo, tirando isso AMO o jogo parabéns ;3 Melhor jogo de monstros musicais meus parabéns BigBlueBubble!",5,6,3.0.1,2020-10-22 14:19:52
33,NADA VER,https://play-lh.googleusercontent.com/a-/AOh14Ggy9qyjdx36LGx4ZHIDftXNoSfeIPrzWF5UkoiHVg,"O jogo em si é bom e eu jogo a bastante tempo já, mas infelizmente agora eu tenho que sofrer com trocentos anúncios. A cada vez que eu mudo de ilha é um anúncio diferente. Abrir a loja? Toma mais um anúncio ae. Isso acaba me dando raiva e fico me remoendo pra não desinstalar o jogo. Eu sei que ele é grátis e que tem que ganhar dinheiro de alguma forma, e anúncios são essa forma. Mas enfiar esse tanto de anúncio na minha cara é sacanagem. Espero que mudem isso.",1,267,3.0.1,2020-10-07 11:48:47
34,ROBERVAL,https://play-lh.googleusercontent.com/-N708HzLSil0/AAAAAAAAAAI/AAAAAAAAAAA/AMZuucnjM46jfxc_TtMDjQz9JyGsFKE42w/photo.jpg,E decepcionante a pessoa ganha um bau na roleta e ganha 1 chave eu sei que chaves sao raras mais no prémio diaria da para ganhar mais do que a roleta eu com esperança de vim 100 diamantes no bau e vim so 1 chave e desepsionante O MAIS IMPORTANTE QUE EU QUERIA QUE ME ESCUTASEM (a ilha do composição seria bom adisionem notas mais graves e agudas e ter como selecionar a clarificação das ilha do composiça que so mostra os 10 melhores devia ter uma opção de escolha com o numero de ilhas para achar.,2,0,3.0.2,2020-10-25 22:22:14
35,BS PRO - BRAWL STARS,https://play-lh.googleusercontent.com/a-/AOh14GhhzUI8nTeQJFku1mv3p1rgijxrJSMzDYVBnNQ3Fw,"Estou nível 21 perdi a conta nivel 27 mas reiniciei de novo muito bom Apenas oque me incomoda são tres coisas, 1 precisa muitas tentativas para conseguir os monstros principalmente os montros Lendários raros ou epicos. 2 estou com muita dificuldade para ter diamantes então se vcs 'donos' disponivilarem alguns diamantes de acordo com as missoes ficaria muito melhor . 3 e última incomodação são as comidas dos montros ex: para por um monstro nivel 15,16..20 nessecita de MUITA comida pfv arrumen♡",5,32,3.0.1,2020-10-16 17:22:52
36,Rizia Silva,https://play-lh.googleusercontent.com/a-/AOh14GgpI8aLGwTiPm-gkdr3zSP1ol1HYPEkZBXLMonaOx8,"Um ótimo jogo,o Dawn Of Fire também é ótimo,sou fã dos dois,mas tem alguns anúncios mas não incomoda,mas Séria ótimo se Pudéssemos criar nossos próprios monstros,com sons dos monstros originais ou editar as ilhas originais com nossos próprios monstros,fazer uma ilha nova e colocar monstros customizados e originais,monstros como os Wubblincaixoblins que tenque ser despertados e outras coisas,por favor adicionem isso",5,1,3.0.1,2020-10-30 14:41:39
37,gato espacial,https://play-lh.googleusercontent.com/a-/AOh14GhiH27Kas8lIy2zoYAyvllIXSycrQcfOVhWS4sMtg,"Antes os monstros do nível 7 podia comprar com dinheiro, agora tem que comprar com gemas, os desenvolvedores pioram o jogo só para conseguir dinheiro",2,2,3.0.2,2020-10-25 00:05:34
38,Pedro Enrique,https://play-lh.googleusercontent.com/a-/AOh14GhuhZkhicube4Z-Rzotl9t0Uhgm5rIjXgBw5xcw,Muito bom parabéns BBB seu jogo e uma maravilha adorei todo dia jogo esse jogo te tão bom que é ele. Mas quando vai ter o moleque-ente rara para eu ter ? Eu quero muito ele pra trocar minha foto de perfil e ter ele na coleção. se não entenderão coloco no gogle tradutor.,5,0,3.0.2,2020-11-01 20:36:45
39,nickolas kaue,https://play-lh.googleusercontent.com/-AglcYh1izqo/AAAAAAAAAAI/AAAAAAAAAAA/AMZuuclrOSmzmQ-H35zJkYyWNr1HhMUo2g/photo.jpg,O jogo e muito legal os gráficos são bons mas tem uma coisa meio ruim pra algumas pessoas que é que as vezes lançam skins feias ou monstros feios,5,0,3.0.2,2020-11-05 21:58:01
40,Rafael rp gamer,https://play-lh.googleusercontent.com/a-/AOh14GhbTa0IIRyat8hjCLrTrxfNdmXzc3UA7dNKBJLggA,"Eu sei que provavelmente a equipe Big blue bobble não vai ver isso mas. O jogo ja ""*foi*""perfeito, digo ja FOI porque tem um problema muito chato que é a quantidade excessiva de anuncios por ter algun(s) anuncio(s) a cada 5 coisas que vc clica e isso deixa o jogo chato por isso vou dar 3 estrelas. mas eu Recomendo para todos, eu jogo a muito tempo e esse jogo continua sendo monstrosamente INCRIVEL❤❤",3,175,3.0.1,2020-10-05 17:12:51
41,João Henrique e o criador Araucária,https://play-lh.googleusercontent.com/-_BuHRyoffgk/AAAAAAAAAAI/AAAAAAAAAAA/AMZuucnVPb969MX5M0WzisyBs7xgUtqRiw/photo.jpg,"Sim,eu vou dizer que sim o jogo é incrível você tem que sobir de niveis,tem raros e épicos novas ilhas simplesmente a ilha coliseu e muito mais.Mas tem anúncios e precisa de internet mas isso não me preocupa,não sei se esse jogo vai ter novas ilhas e até agora tou se perguntando quanto custa a ilha de terra?isso só acontecer se você assistir o meu canal da o Like e ativar o sino e não se esqueça seja um inscrito/membro.O nome do meu canal é João Henrique e o criador.",5,21,3.0.0,2020-09-12 09:04:45
42,Uma Aquariana,https://play-lh.googleusercontent.com/a-/AOh14GigW9KGQk5X7ezQskzi4tVHmf_FSlNRxJueO4_L,"O jogo precisa de wi-fi para pq né kkk para agente ter q ser lotado de anúncios, e a roleta a rapadinha são roubadas, agente nunca ganha coisa boa NUNCA, não percam seu tempo baixando gente pfv",1,0,3.0.2,2020-11-03 04:08:42
43,Luis Roberto,https://play-lh.googleusercontent.com/-egRk75zka9o/AAAAAAAAAAI/AAAAAAAAAAA/AMZuucnDLAAiRe1myOVorT2vc8ERkzACtg/photo.jpg,"Esse jogo é muito bom e super ótimo nota 10,mais tem um problema,quando eu fui no ""Mercado"" e cliquei no ""Ilhas"",apareceu o ""Exige no nível 8 e sua criação completa"",mais é que,eu já subi de nível do jogo até no nível 18 e já desbloqueiei o coliseu da canção,vocês poderiam fazer algo,pfvr 😐",5,158,3.0.0,2020-09-15 20:44:23
44,Miguel Games 316,https://play-lh.googleusercontent.com/a-/AOh14Ghw5lX37PgfVePBjpb01c8CyC5MnwXQytxsIML9fg,"Ótimo jogo. Recentemente eu tive problemas com bugs, mas eu mandei um email para o suporte, e um monster handlers me falou o quê era pra fazer, e na verdade era bem simples! O jogo é ótimo. Até agora tive apenas UM problema com bug. Não tenho nenhuma crítica a fazer. Na minha opinião, esse jogo NÃO TEM ERROS.",5,143,3.0.1,2020-09-30 19:37:18
45,karpeppa pooper,https://play-lh.googleusercontent.com/a-/AOh14GidBGsYmivf-EbyRvotkIZmgKJcyEmyEniH0Dj9Xg,"Jogo muito top, muito legal ficar escutando a músiquinha, cuidar dos bixos, mas eu tenho uma sugestão, pra eu poder completar minha músicar na ilha dos compositores, eu queria que vocês adicionassem uma coisa para escolher a clave, eu preciso muito da clave de Fá pra ter alguem com a voz grave, se vocês fizerem isso eu irei dar 5 estrelas e eu agradeceria muito. Espero que leia minha resenha. Obrigado...",4,3,3.0.0,2020-10-17 22:49:29
46,Gabriel Soares,https://play-lh.googleusercontent.com/a-/AOh14GiCILQ31pUJH2QQLyzTOObeP61rGm3qKyuXRuDz,"Eu adoro esse jogo ele é otimo mas comigo ta acontecendo de que quando eu fecho uma propaganda o jogo volta para a tela de carregamento,nao sei se é meu celular ou é um bug ou algo parecido , pesso que retirem isso",5,0,3.0.1,2020-10-22 21:20:22
47,canal p comentar,https://play-lh.googleusercontent.com/a-/AOh14GjglsP7UgEy93ZrRvCzOBrk-zjqsYQg4tJZ7h_JqA,"Realmente muito bom! Todo mundo q fala que para ser bom precisa pagar esse jogo n e nada p2w, sem dúvidas o melhor jogo desse estilo que vc tem ilhas e tem q ""construir"" nelas, tipo Dragon City ou Dragon Mania que já joguei se vc tá vendo os comentários p ver se o jogo é bom recomendo vc baixar",4,21,3.0.0,2020-09-05 15:55:55
48,Laura Pons,https://play-lh.googleusercontent.com/-6l1Jt5tITng/AAAAAAAAAAI/AAAAAAAAAAA/AMZuucmm60IPp8eDgWmLBno-WHMezGYH5A/photo.jpg,Adoro esse jogo comesei a jogar quando criansa mais desinstalei pois tinha problemas tecnicos... mais não tem mais!!! a e sugestão:vcs podiam deixar as pessoas colocarem varios monstros na ilha tribal em vez de 1 sabe tem gente que não tem amigos interessados na ilha tribal então por favor deixe a pessoa colocar mais de 1 monstro mais tirando isso recomendo a todos que clicaram pra ver esse jogo😄,5,48,3.0.1,2020-10-02 11:18:16
49,GJ R4GAME,https://play-lh.googleusercontent.com/-CV4Pc1xo_vs/AAAAAAAAAAI/AAAAAAAAAAA/AMZuucmx1uLJ9L6Z7Z2QRYHbGUJNK93s9Q/photo.jpg,"Esse jogo eu jogo desde 2015,o jogo parece que ainda não me decepcionou,ele foi o melhor jogo que eu já joguei naquela época,o jogo é maravilhoso,com as canções que dá até vontade de cantar (o que eu sempre canto até agora),com essa nova atualização aposto que ficará melhor que antes,só não coloca os anúncios obrigatórios,pq tu tem que esperar e as vezes a pessoa tá com pressa,fora isso, continua sendo o melhor jogo que eu já joguei [ ◕ ᴥ ◕ ]",5,50,3.0.0,2020-09-04 10:22:04
50,Bernardo Biavati,https://play-lh.googleusercontent.com/a-/AOh14GiZ_Gj8VVXj7VVIRmSA0eTPmDCZjWoqDifwQ3WJ,"Esse jogo é incrível, você poder fazer a ilha do jeito que você quiser com os monstros que você quer, simplesmente maravilhoso e pelo esforço que vocês fazem, está aqui minhas 5 estrelas, eu confesso que tem bastante anúncio mas o jogo continua sendo muito legal (;",5,2,3.0.1,2020-10-13 23:21:59
51,Diana Braz,https://play-lh.googleusercontent.com/a-/AOh14Ghk-xZDUvsbPgh7gphFWxYCWFkqKV7_BKzE83ot,"Mt bom. Super recomendo quanto mais vc passa de niveis vc vai evoluindo cada vez mais, meu primo esta batendo quase o nivel 40 e eu ainda estou no nivel. So podiam colocar mais mostros que custam dinheiro pq quase todos sao pagos com diamante e isso e chato, pq consegir diamantes nesse jogo n e facil . Se vcs fazerem isso pra mim eu agradeço.",5,22,3.0.0,2020-09-11 16:38:32
