,userName,userImage,content,score,thumbsUpCount,reviewCreatedVersion,at
0,Clayton Machado,https://play-lh.googleusercontent.com/a-/AOh14GgzOEsLwnyRoIEgfp0EoYQVAOckCe1edPOeO95sCw,"A variedade de ferramentas de ataque não para de aumentar. Coloquem a visualização das ferramentas em grade ao invés de lista por favor, da mesma forma que fizereram com a escolha dos brasões. Ninguém aguenta mais ficar folheando inventário pra escolher as ferramentas adequadas. Se perde muito tempo com isso na hora de montar os ataques.",4,34,4.4.30,2020-10-30 17:51:46
1,Fred Izar,https://play-lh.googleusercontent.com/-hRXq-v2viI0/AAAAAAAAAAI/AAAAAAAAAAA/AMZuucmaZxJ1DG039wTC_hsxcYIgEmmjiw/photo.jpg,"O jogo é bom, só não é melhor porque só valorizam quem gasta no jogo. Isso porque dizem ""preservar a igualdade"" dos jogadores. Não mesmo! E cada dia eles aumentam valores, criam novos valores... E cheio de bugs, complicado.",1,14,4.4.30,2020-11-05 15:30:31
2,Edmilsom José,https://play-lh.googleusercontent.com/a-/AOh14Gj-SzXWx0qf-mh2m-ZehTveD924oZ0gEKeVBTdNwQ,"Um excelente jogo, muito estimulante e gera uma grande expectativa de diversão. O jogo é muito bom, porém o consumo de comida é muito alto e nunca é o bastante, manera aí por favor.",5,3,4.5.14,2020-11-06 06:12:04
3,Pedro Henrique Bernardo,https://play-lh.googleusercontent.com/a-/AOh14GinW_q95cWY6A5sx1kN5__2Gp2BK_WWj2-3D4m1qQ,"O jogo é ótimo, boa jogabilidade, regras dele e das alianças no game que facilitam o jogo de forma minimamente justa, comunidade muito gente boa e controles fáceis. Bom para executar estratégias e ter aliados .",5,1,4.4.28,2020-10-30 13:00:21
4,Rafael Militani Ferreira,https://play-lh.googleusercontent.com/a-/AOh14GgTiZfkRsAn5npM3aTpFaqX5giiFywOVHQ-LnQkrQ,"O jogo é bom, porém, para celular ele demora demais para carregar qualquer coisa. Ele sempre dá umas travadinhas no mundo, a falha do game pelo que vi é só a falta de otimização para celular.",3,10,4.4.31,2020-10-30 16:59:41
5,João Felipe,https://play-lh.googleusercontent.com/-aF9YchjaXJg/AAAAAAAAAAI/AAAAAAAAAAA/AMZuuckXgdVgBle4imMOB_RuncM1Qxh2YA/photo.jpg,"Sempre quis jogar este jogo no PC, novamente. Mas, tinha apenas o celular. Assim que vi o app do meu jogo favorito, não pensei duas vezes: fui baixá-lo. Em 3 dias consecutivos após instalar, já estou nível 20 (que normalmente é difícil de chegá-lo). Muito obrigado, GoodGame, por desenvolver o app deste maravilhoso game que vocês têm. Só tenho a agradecer.",5,39,4.2.54,2020-09-27 12:08:44
6,Super mega Cell,https://play-lh.googleusercontent.com/a-/AOh14GidXHFVBpM9fjSNnTQ5k8ZxecFGZb_y7KDGfr48,"Otimo jogo, graficos lindos, boa jogabilidade, grande varidade de itens e missoes, preços bons, varios reinos incriveis, so há uma coisa me encomodando as defesas só cabem poucas tropas e não é so tropas de defesas as vezes vai tropas de ataque deixando facil para o inimigo e acabando com as tropas que voce planejou. Por favor melhorem isso.",5,33,4.3.116,2020-10-30 13:24:39
7,Equeline Carminato,https://play-lh.googleusercontent.com/a-/AOh14Gg5TyIAKMpglO9pp-ok-JjhZ7XDN7M6coFHb4aStw,"Gosto muito do Empire porém depois dessa última atualização o jogo não abre mais no meu celular, muito triste isso pq eu tive muito tempo, dedicação e outras coisas para chegar até onde estou, infelizmente se não der certo vou ter que parar de jogar!!! Essa atualização veio para prejudicar muitas pessoas pois não foi só comigo que aconteceu.",2,48,4.3.34,2020-10-02 06:31:53
8,Valkiria Alves,https://play-lh.googleusercontent.com/a-/AOh14GjvAAMxZcUvLKj0pBm7YbI89IA2FCbsFSgD9uH8Rw,"Ótimo jogo, porém ainda tem muito bug, tá com quase 50 dias que ñ consigo usar todos os carrinhos de mão. Sem contar que quando a comida está acabando ela ñ fica mais na cor vermelha, e todos os dias ganhamos muitos sdd. Quem ñ tá on line direto acaba perdendo a comida e os sdd, quando tá com tempo p jogar ñ tem sdd só gastando as moedas.",5,45,4.3.40,2020-10-02 13:50:52
9,Como Surgiu ?,https://play-lh.googleusercontent.com/a-/AOh14Gi-ldQc2S-W8mM8rvRPEaLCjO_qM-DyuLE_b7TVuA,"Agora está muito melhor. Com a correção do bug da expansão do castelo, posso jogar livremente agora. O jogo é maravilhoso, já baixei diversas vezes e continuo amando ele. Desta vez, quando ganhei um celular novo, um Galaxy J1, o jogo não permite eu expandir meu castelo, mesmo no tutorial. Gostaria que arrumassem esse erro. Ele ocorre quando tocamos no ícone do martelo, logo a câmera se posiciona em cima do castelo, mas não aparece as setas para expandir.",5,46,4.3.38,2020-10-02 12:33:45
10,Tiago,https://play-lh.googleusercontent.com/a-/AOh14Gh7HDsbZs9HSxF3eymHG1uO6qHhMyMDWh-X6Mq--Q,"Jogo com uma ideia principal ótima, mas o jogo esta perdendo a graça, ainda mais com essa ultima atualização, o jogo não abre em android, e colocaram um preço absurdo para os exteriores, sinto muita falta de opções basicas que existem na versão de pc, como a organização do castelo em 2D, espero que arrumem esses bugs que acontecem e façam atualizações que ajudem o jogo.",1,13,4.3.38,2020-10-02 09:10:48
11,Hélio Júnio Alves de Oliveira,https://play-lh.googleusercontent.com/-FvNn1biEAag/AAAAAAAAAAI/AAAAAAAAAAA/AMZuuck4Zlhm02qTBhrJpEVvltKZlyH-fA/photo.jpg,"É bom jogo mais sinto falta de algumas coisa da versão para PC como a organização debconstruções para n desperdiçar espaços Castelo sinto falta também das construções e tropas n ter a cor do meu brasão também sinto falta do ferreiro da aliança q ajuda muito na versão PC,acho q as construções demoram muito para ser terminadadas,tirando isso o jogo prende muito a nss atenção nos eventos...Demorou mais até q fim temos símbolo de brasão q dão bônus igual versão do pc",5,88,4.2.48,2020-09-05 22:50:04
12,Hugo Tinoco,https://play-lh.googleusercontent.com/a-/AOh14GiysDSafq_YeveWOmFJ5rPueHwxKYqzYV8S8bFSLA,"O jogo é bastante interessante, no entanto, tem cada vez mais publicidades chatas",4,0,4.5.15,2020-11-05 15:54:56
13,Celio Kozakewicz,https://play-lh.googleusercontent.com/-koBmZDuLmy8/AAAAAAAAAAI/AAAAAAAAAAA/AMZuuclU6JxOBlx3_w5mpw0V5o6vb1JxCg/photo.jpg,"O jogo é básico, nada tão espetacular, é agora ainda fizeram atualização para o jogo, mas parece que não verificam antes, o jogo atualizou e agora não abre mais, simplesmente fica sem jogar, e tudo que investiu no jogo morre no nada, jogo muito irresponsável.",1,4,4.3.34,2020-10-01 12:33:42
14,KAOS FF RED,https://play-lh.googleusercontent.com/a-/AOh14Gj2kQTMT1ZJWI4BzXkgIQR6-NNXRVmtsR6o4McO,"Sobre reinos exteriores,sacanagem isso,peguei lendário pensando em ir para os reinos exteriores,agr colocam uma moeda que custa 50.000.000 de moeda,pq não deixar essa moeda opcional para player que queiram transferir uma cópia de seu castelo e player que queiram não trazer uma cópia do seu castelo,vocês vacilaram nisso ai",1,7,4.3.34,2020-10-01 13:50:24
15,amaro filho,https://play-lh.googleusercontent.com/-FkRebTqkOuo/AAAAAAAAAAI/AAAAAAAAAAA/AMZuucmKg1WAxx1UvFHprXz0iUOk0MlDNQ/photo.jpg,"Está funcionando normalmente agora, tem algumas coisas que poderia acrescentar do PC, visão do Castelo, horário nos relatórios, quant. Limite de avanços,",4,1,4.3.40,2020-10-14 13:38:46
16,canal fut fc,https://play-lh.googleusercontent.com/-npaHTjJJoYY/AAAAAAAAAAI/AAAAAAAAAAA/AMZuucnBD59kpXeJanR_08fVcoZt00kX9Q/photo.jpg,"Adoro o jogo, mas ainda está longe da versão do PC. algumas das coisas que notei é que não tem como posicionar soldados, e isso me prejudicou bastante. Mas tenho esperança que o jogo melhore cada vez mais.",3,0,4.3.40,2020-10-03 16:15:41
17,CANAL T.B,https://play-lh.googleusercontent.com/a-/AOh14Gh_NVDSqCR8NjJEOboRq0JXyDvICn_vaibbALzM,ruim pois poderia ter nas configurações do jogo excluir a conta pra começar tudo de novo chato que fica pendente o antigo retira isso e coloca começar de novo o jogo e também as recompensas e também alguns bugs que está acontecendo no jogo espero que arrume,1,0,4.2.54,2020-09-27 23:02:39
18,Josiane Ramos,https://play-lh.googleusercontent.com/a-/AOh14Gh3LW5PTEaRtQ21PeoxIs24bwKo9aiCButspIjo,"Gosto muito do jogo mas não conseguindo baixar a atualização. Hoje vou desinstalar o jogo não quer mais abrir . Gosto desse jogo mas tô aborrecida por não conseguir mais jogar. Pediu uma atualização fiz , agora só aparece que tá com problema é não abre mais. Fui...",2,1,4.3.34,2020-10-02 16:37:34
19,Gabriel Santana,https://play-lh.googleusercontent.com/a-/AOh14GgS9oO1wvzUy294tnxhT5rlvlIuhiI_Ka8_VdNpig,"Acho que deveriam colocar funções básicas que tem no jogo de PC como o gráfico em 2D para organizar as decorações e também a honra que ganha ao atacar um oponente, as vezes perco honra por atacar castelos do mesmo nível que eu.",4,16,4.2.55,2020-09-28 17:50:06
20,Andreia Gonçalves,https://play-lh.googleusercontent.com/a-/AOh14Gg6-kE5gAdG1ImaZg57u8pItqVxMISi4hX-T-ESdw,Aquando da última atualização a 27/09 tentei desde esse dia fazer a atualização do jogo mas sem sucesso. Hoje quando abro novamente o jogo estava no início do mesmo tendo perdido todo o progresso até agora.,4,1,4.2.54,2020-09-28 17:13:17
21,Máster David,https://play-lh.googleusercontent.com/a-/AOh14GhgVANQxJ_e94copkvi5WSy27DfTVNVa9DUFwJTFA,Melhor jogo de todos super recomendo com as novas atualizações não é só um jogo para rubizeiro como era antes agora todos tem a oportunidade de se tornarem fortes um jogo de estrateja e companheirismo é otimo para jogar com os amigos e fazer novos amigos no jogo super recomendo para quem gosta de um jogo com diversas estratégias e regras para se tornar mais forte sem falar que no servidor BR temos o FAYR PLAY para tornar o jogo justo para todos,5,34,4.3.40,2020-10-02 14:08:16
22,Cildomar Donai,https://play-lh.googleusercontent.com/a-/AOh14GhkfOTMyDDMcMqs6zMugyus328y7y4ypf7P04YiZA,"Estava melhorando, agora no evento do Além do Horizontes onde os server Br se lasca, $1 dola é quase R$ 5,00 aqui, e um level 70 ataca um level 11, onde tá a brincadeira e o espirído de alegria nisso, onde isso vai parar :(...",2,35,4.3.38,2020-10-02 19:26:38
23,Thiago Cardoso,https://play-lh.googleusercontent.com/-W0uUMY6pMQU/AAAAAAAAAAI/AAAAAAAAAAA/AMZuuckXf6yKqBCldPz8SkNVjZcJQowQwg/photo.jpg,O Jogo e excelente porem na ultima atualizacao do reinos dos exteriores fico inviavel jogar pois pede para entrar nele tem que gastar 50 kk e isso nao fica.um jogo para todos acaba ficando um jogo seletivo ate 5 kk ja e muito golde lembrando que o gold veem devagar nos saques entao acabou ficando mais os lv 800 joganfo e os outros ficaram de fora mudem isso por favor esta feio,1,44,4.3.34,2020-10-01 18:21:49
24,joao trindade,https://play-lh.googleusercontent.com/-hlmOH-S3hX0/AAAAAAAAAAI/AAAAAAAAAAA/AMZuuclGtRBgdQX5oQbLHg98VyNeFnXimQ/photo.jpg,"Pena o jogo terminar este ano comprei rubis para nada desmotivei , um jogo com tantos anos e com tantos jogadores que nao se consegue adaptar e funcionar com um outro programa que nao seja o flash nao posso dar mais que 2 estrelas",2,0,4.2.54,2020-10-01 10:52:19
25,Caio game play,https://play-lh.googleusercontent.com/a-/AOh14GiRMjDpwqdwtpJ_MwdtbCl_AOUJYBnU2mlcfevKEg,Muito gráficos ok melhor jogo do gênero que vc vai achar hj completíssimo uma experiência única jogabilidade top de linha,4,0,4.3.117,2020-10-29 18:12:11
26,Ricardo Souza,https://play-lh.googleusercontent.com/-xVt2fX4qw1o/AAAAAAAAAAI/AAAAAAAAAAA/AMZuucm6o8cfTr2SxraVTmrfjMvZVjQSkA/photo.jpg,"Jogo desde o inicio e mudou muita coisa, cada atualização fica ainda mais competitivo, bom e divertido.",5,0,4.3.34,2020-10-01 08:10:05
27,Henrique Mattos,https://play-lh.googleusercontent.com/-YEeHg8WLMoE/AAAAAAAAAAI/AAAAAAAAAAA/AMZuucnNzsPuk6QXnWw_HVmt0zl7oXSEYg/photo.jpg,Minha opinião é já que o jogo é medieval era para ter um dragão jogo ficaria mais interessante,2,0,4.4.31,2020-11-05 12:17:19
28,Levi Augusto Santos,https://play-lh.googleusercontent.com/a-/AOh14GiluJwyVNIvjRFZIHWKoFkiDeykPY1NcfVHdW-S,"Jogo muito legal, muito interessante e pela primeira vez um jogo muito rico em diversidade!!! Eu adoraria q adicionassem pelo menos 2 níveis a mais no esconderijo!",5,6,4.2.49,2020-09-04 06:36:46
29,Lucilene Costa,https://play-lh.googleusercontent.com/-vyg2oNoTRFs/AAAAAAAAAAI/AAAAAAAAAAA/AMZuuclH-C3sXt11HQIGupjGZ0uyy10KXQ/photo.jpg,Está apresentando falhas no j6 mesmo depois da atualização continua abrindo e na hora de aparecer pra conectar o servidor ele some e não abre nada,1,2,4.3.40,2020-10-02 11:46:49
30,Felipe Rodrigues,https://play-lh.googleusercontent.com/a-/AOh14Gg7cVasmK0qncoQr43h_-7pfH7a1i8_B1P-P9Xt,"Que %$#@^ de atualização foi essa hoje, que não funciona? Pior do que imaginava.",1,1,4.3.34,2020-10-01 21:06:08
31,Taelly Eduarda,https://play-lh.googleusercontent.com/-IhoXBWll660/AAAAAAAAAAI/AAAAAAAAAAA/AMZuucnfV03f8TUFX31J0rrq4abgn3Y_7w/photo.jpg,Melhorem o deslizamento de mapa demora demais pra procurar castelos e tmb fica travando e demora a renderização.,3,1,4.3.40,2020-10-02 12:56:31
32,Leiliane Santos,https://play-lh.googleusercontent.com/-n0KhRwXT1Yo/AAAAAAAAAAI/AAAAAAAAAAA/AMZuucnOMko5LQA_P_VJQUHSoGXqb4zibg/photo.jpg,"Pediu para atualizar, porém não abre mais , diz que o jogo tem falhas constantemente.",1,2,4.3.34,2020-10-01 16:01:57
33,Gilson Alves,https://play-lh.googleusercontent.com/-Hz-HD1a7u2k/AAAAAAAAAAI/AAAAAAAAAAA/AMZuuckvVQPTfv9FnjHPmfs5naFehgDCKg/photo.jpg,"Oque está acontecendo atualizei o jogo e agora não entra mais meu celular é o Samsung j6 plus, alguém tbm tá assim sabe como resolver?",1,2,4.3.34,2020-10-01 10:56:26
34,Ricardo Breier,https://play-lh.googleusercontent.com/-D91xY0vfM_Y/AAAAAAAAAAI/AAAAAAAAAAA/AMZuucmgG40BgJa0dKHX1NOnsBWKvWH3BA/photo.jpg,Após a atualização de hoje não estou conseguindo acessar pelo sansung j6.. está dando erro contínuo.nao consigo entrar no jogo,1,4,4.3.34,2020-10-01 09:22:52
35,Mini Gamer,https://play-lh.googleusercontent.com/-lSDsz0_BmE4/AAAAAAAAAAI/AAAAAAAAAAA/AMZuucnBjT2n2g-zjWlkNeGa506WgwdO7A/photo.jpg,Rod jogo tem um lado bom e um lado ruim o lado ruim é que quem joga em PCtem mais vantagem (e isso me deixou muito decepcionado ) :(,4,1,4.2.48,2020-09-22 13:22:11
36,history craft,https://play-lh.googleusercontent.com/-7V8_O-4vEJc/AAAAAAAAAAI/AAAAAAAAAAA/AMZuuckIIVHedgGVLgp_OAarkoxB8OQR4w/photo.jpg,Muito bom tem uma boa jogabilidade porém acho que deveria ter uma função para ocultar todos aqueles icones,4,0,4.3.34,2020-10-02 12:54:05
37,Natanael Lucas,https://play-lh.googleusercontent.com/-ImyLrMubrmw/AAAAAAAAAAI/AAAAAAAAAAA/AMZuucmkhTBHAi6IuWosS2a8QU9KH_DE5Q/photo.jpg,"Jogo ótimo super recomendo para vocês jogarem ,me viciei nesse jogo em dois tempos jogo praticamente 24 horas por dia em fim esse e meu comentário espero q gostem desse jogo.",5,0,4.3.116,2020-10-22 22:34:50
38,Naum Sousa,https://play-lh.googleusercontent.com/-UMVNo1_0YY4/AAAAAAAAAAI/AAAAAAAAAAA/AMZuucm1NK2OsIoyCqlzzZW8jDLKHwQpBg/photo.jpg,"Ótimo game ,joguei por muitos anos na versao de Pc e agora estou ainda mais satisfeito por ter a versão Mobile",5,0,4.3.40,2020-10-17 18:41:49
39,Dherick Del Piero Pariente,https://play-lh.googleusercontent.com/a-/AOh14GhBbvJCTSUwo-7rKXA7t-_KX9s8VVXYiZspq9e7AQ,Esses jogos com temporizador só servem pra querer arrancar seu dinheiro e te fazer perder tempo,1,1,4.2.55,2020-09-27 08:25:05
40,Telmo Santos,https://play-lh.googleusercontent.com/a-/AOh14GhK6SXnx4B6SrFnzBLxx6vcTTR46SJ4VwB5srnl,Começasse a perder o interesse pelo facto de cada vez mais o jogo é pra qm coloca dinheiro É pena,3,0,4.3.34,2020-10-02 13:11:53
41,Adriel Zeferino,https://play-lh.googleusercontent.com/a-/AOh14GhxfkIgXk8wneKsXq25YmCwq-esLBTUUrFJWyAMqQ,"Tá demorando muito pra entrar no servidor, é as vezes nem entra.",1,0,4.2.49,2020-09-12 01:10:14
42,Paulo Martins,https://play-lh.googleusercontent.com/-datOVIwHOAc/AAAAAAAAAAI/AAAAAAAAAAA/AMZuuckktY5lJ1G_BAvyuHGbZ9KL9nK_kg/photo.jpg,Esse jogo e oriveu eu queria um jogo que vc lutar não costruir igual os outros esse jogo é péssimo 😝😝😝😝,1,0,4.2.48,2020-09-15 09:40:48
43,Tiago Silva,https://play-lh.googleusercontent.com/--RbYjAGZ0Vs/AAAAAAAAAAI/AAAAAAAAAAA/AMZuucnEu7y-oZNWP-iy1LJhOIU0azHFwA/photo.jpg,Excelente jogo. Muito envolvente e não tem bugs.,5,1,4.2.48,2020-09-19 16:17:34
44,Marcos Henrique Freitas da Cruz,https://play-lh.googleusercontent.com/a-/AOh14GiFOpO0Iz1xYVL2YpDURh5o_n1yCY-yrJKS8nDPvQ,"Esse é um bom jogo de estratégia, mas parece que só querem arrancar nosso dinheiro, não consigo mais expandir meus territórios com recursos, só se for com rubis, o jogo está com muito bugs, que irritam muitos jogadores, quando estamos preparando um ataque o botão de iniciar o ataque trava e temos que sair e recomeçar tudo de novo, é muito ridículo, um tempo jogado fora, e não têm um dos recursos que tinha no computador que é a ver somente a base das construções, isso ajuda muito na organização.",2,80,3.7.20,2020-06-01 02:58:55
45,Sandri Santana,https://play-lh.googleusercontent.com/-6EJpqWoNcMQ/AAAAAAAAAAI/AAAAAAAAAAA/AMZuucnFbQT_VU96qIP5Jr9lLdGouRCCDQ/photo.jpg,"Tenho uma reclamação a fazer: pq não temos mais os eventos com samurais?Outra,além disso itens que ganhamos em outros eventos,ou nas rodas das fortunas,ou na vidente,incluem placas de samurai,coisas que não estamos utilizando...os eventos estão muito repetitivos,pra um jogo em que se precisa gastar oara evoluir...consertem isso,pfv",5,1,4.1.33,2020-09-03 15:34:24
46,Matheus Miguel,https://play-lh.googleusercontent.com/-XXVbVh2BDek/AAAAAAAAAAI/AAAAAAAAAAA/AMZuucnw9UNlzFcuKMqzF0EEjrj2ThLhSg/photo.jpg,"O jogo é muito bom, muito bem elaborado. Mas pouco explicativo, muitos recursos não são explicados, ou só vagamente. E quando se está recebendo um ataque, o jogo buga muito, aumentando o risco de não conseguir defender o castelo. Além disso, é desapontado o fato de não poder usar a mesma conta no APP e no PC.",1,105,3.8.44,2020-06-22 08:35:54
47,Luan Mateus,https://play-lh.googleusercontent.com/a-/AOh14GgCSKfesSkkoax1N4PIte72UiCYASFa2mQcoAPG4w,"É um bom jogo, amo ele, porém parece sempre estar preso no mesmo lugar, não é viciante, e os eventos deixaram de ser incríveis e disputados em minha opinião, são sempre os mesmos,isso enjoa uma hora,poderiam adicionar muito mais variedade para se divertir como desde a música do jogo que sempre é a mesma até o desempenho do jogo, mesmo sendo "" legal"" tem que melhorar muito mais.",1,38,3.7.30,2020-06-17 11:43:20
48,Jória Barbosa,https://play-lh.googleusercontent.com/a-/AOh14GiAApvywyVD1qkhka8teV18ZfzSfVIZNmKv5lY56w,"O jogo em si é muito bom, tanto a versão pra pc como essa pra celular, só que ele demora muito pra iniciar o aplicativo, não tem a opção de sincronizar as contas do pc e do celular e é muito pay to win também. Mas o maior problema mesmo é a instabilidade do jogo. Se vc não tiver Wi-Fi disponível é melhor nem baixar.",3,27,3.7.20,2020-06-03 22:25:09
49,djonathan Medeiros,https://play-lh.googleusercontent.com/a-/AOh14GhdtdO992P88Vlycpz7Fs9SI0ECpsPtqvB43mRQbQ,"Jogabilidade muito boa. Porem a cinemática poderia ser melhor, exemplo poderia na hora em que o ataque fosse realizado aparecesse os soldados destruindo o castelo ficaria muito show. Mas o jogo esta muito bom 😃",3,1,4.1.33,2020-09-04 06:44:35
50,carlos eduardo,https://play-lh.googleusercontent.com/-B2pgoztU93o/AAAAAAAAAAI/AAAAAAAAAAA/AMZuuclHKFkAtzm_TFG6e3d9r3jXZZKp7Q/photo.jpg,"Amo o jogo, acompanho desde a época que não tinha o mobile ainda Mas tenho 2 sugestões 1-ter promoções para locomoção do Castelo (fica muito caro a partir da segunda vez que vc muda de lugar) 2-de forma bem simples vcs podem tornar a experiência bem melhor. Basta fazer soldados que fiquem circulando o Castelo e as muralhas, desenhados igual aos cidadãos, em porcentagens iguais aos que vc tem de fato Vai tornar tudo ainda mais imersivo Imagina só vc ver a tropa que vc tem andando por seu castel",5,99,4.0.6,2020-07-06 11:46:41
51,Alexandre A. Ribeiro,https://play-lh.googleusercontent.com/-eyGKo-yCXNw/AAAAAAAAAAI/AAAAAAAAAAA/AMZuucnhWU_BB7dD9t-5pESN97WRKBeuZg/photo.jpg,"O jogo é ótimo, joguei a 4 anos, e retornei estratégico e bem competitivo. Mas não posso deixar de alertar que tem muitos ofertas, uma sequência sem fim, quando se vai defender, montar ataque entre outros, infelizmente isso deixa irritante qualquer usuário.",2,2,3.7.20,2020-07-26 20:29:15
52,João Salbego,https://play-lh.googleusercontent.com/a-/AOh14Gi3yrbiFzJG7m70ScDE-8IexQZ6pk_XTa5PA4O3VQ,"Bom jogo! Com servidor próprio pra brasileiros e etc...houveram atualizações que eu não consegui entender direito, mas com o tempo, pega-se o jeito! Já joguei em 2013 mas não tenho mais as contas...e o recomeço é ""complicado"" por recursos mas é muito bom, pois sempre tem-se o que fazer no jogo!",4,9,3.7.20,2020-05-29 20:16:37
53,jaime junior,https://play-lh.googleusercontent.com/-TkVvoEJb7gs/AAAAAAAAAAI/AAAAAAAAU_o/AMZuucmvyeFX6UNQsG8Q3uFH4OlFPW-sPQ/photo.jpg,"Muito bom o jogo, embora seja pago algumas coisas, mas vc joga evoluindo e comprando muitos ítens que precisa muitas vezes sem utilizar dinheiro. O dinheiro geralmente se usa pra comprar peças e equipamentos que necessita na hora ou evoluir rápido. Também deve-utilizar dinheiro quando tiver promoções. Eu aprovo...",5,42,4.1.33,2020-07-31 09:30:30
54,Ezequiel Duarte,https://play-lh.googleusercontent.com/-u2GuD90MGDc/AAAAAAAAAAI/AAAAAAAAAAA/AMZuucnUkAIhsxP6s4xJqE4k6HVEh7Cqbg/photo.jpg,"Eu amo o jogo acho incrível mas infelizmente qualquer um que colocar dinheiro no jogo fica super poderoso enquanto quem não tem condições e muito mais dificil, antes não bastava dinheiro tinha que saber jogar para poder estar nos melhores hoje só precisa gastar, sinto falta da mecânica de estratégia por isso as 3 estrelas",3,35,3.7.31,2020-06-05 12:02:23
55,Damião Silva,https://play-lh.googleusercontent.com/a-/AOh14Gj-6NqI-ckynPFwuTaBsl7j95hP5l_QBagnRMT9iA,"Jogo fraco , não passa de um aplicativo pois as animações , mapas , já tem mais de 10 anos e não mudou nada , o Uber e o 99 tem mais animações que esse jogo ! !",2,17,4.1.33,2020-08-25 09:39:47
56,Adriano Pimenta,https://play-lh.googleusercontent.com/a-/AOh14GgoMDq1znNTPs1ZR6kR-g1sXJ2-m14oakVIezbr9dI,"Amo esse jogo, muito bom! So deveria diminuir os tempos de construções e ataques.",5,2,4.1.32,2020-08-18 18:59:01
57,Rafael P. Viégas,https://play-lh.googleusercontent.com/a-/AOh14GgiPy4eZCfXLj1l2QkaljMT78BZHvRmu0f32CSF,"Eu realmente gosto muito desse jogo, mas o único problema é que em comparação a versão de PC esse App do jogo é muito limitado a necessidade de rubis, eu só dou 4 estrelas pq sei o quão melhor esse jogo é no PC.",4,2,3.7.30,2020-06-18 16:52:33
58,CarlosLothbrok,https://play-lh.googleusercontent.com/a-/AOh14Gjja8HqSgXvvaq_9hiBvLQsu9aZKfLJYje6ALbsNlU,"O jogo é muito bom, mais está ficando muito ruim, o jogo está começando a virar jogo de gente que tem dinheiro, ou vc investi, ou vc sofre, isso é um absurdo, na minha aliança todos estão falando nisso, e por conta disso e de outras coisas infelizmente muitos amigos meus pararam de jogar.",3,49,3.8.45,2020-06-22 07:38:04
59,ryan E,https://play-lh.googleusercontent.com/a-/AOh14Gi0msxes-KRM7YAVI7Q6u2b6RpJUNZsemYp9orjkw,"O jogo é bom, mais tem um problema que esta me incomodando muito ,por que toda vez que estou jogando meu servidor começa a falhar ,então por favor consertem isso porque ja esta ficando chato",4,1,4.1.32,2020-08-30 11:18:24
60,Brayan Yataco,https://play-lh.googleusercontent.com/a-/AOh14GgI39eNeBa3kcEAxP7kFR_euZE1a1evuWDl7eQ4ABw,"Essa nova atualização de 2 de outubro ta dando falha, em aparelhos Samsung ta dando problema, arrumem logo pfv",1,0,4.3.38,2020-10-02 09:14:41
61,Guilherme Fischer Rodrigues,https://play-lh.googleusercontent.com/-S-5DVeOT3U0/AAAAAAAAAAI/AAAAAAAAAAA/AMZuucnflH4NjakgUgufrVpNVsRGwE3J7w/photo.jpg,"O jogo é excelente, um jogo que pode te prender sem desanimar por vários anos seguidos... Só não dou 5 estrelas, pois tem coisas que precisam ser arrumadas, por exemplo o preço excessivo dos rubis e ofertas.... Porém o jogo é o que mais conseguiu me segurar, ótimo demais",4,1,3.7.21,2020-06-22 10:59:00
62,Catia Biscaia Masicz,https://play-lh.googleusercontent.com/-PNfdjEEcytw/AAAAAAAAAAI/AAAAAAAAAAA/AMZuucmMlpdS07mei3KcFa-2KPLWODYl3Q/photo.jpg,"Sempre gostei, não é 100 por cento igual ao original do PC, mas vem com coisas originais.",4,3,4.1.32,2020-08-25 21:50:52
63,Gabriel Dias,https://play-lh.googleusercontent.com/a-/AOh14Gj9-BiIjHCuREg4lN1tI4p5ZL9UoijowuXF4jIt,"Coloquem por favor a opção de ver só a base das edificações assim como tem no PC, ajuda muito na organização do castelo, e diminuam um pouco a taxa de glória por dia, isso é muito chato, em um dia vc perde uma patente inteira, fora outros problemas... Melhoro a nota quando for resolvido",2,40,4.1.33,2020-07-31 08:11:52
64,Antônio Nunes,https://play-lh.googleusercontent.com/-K1HMjcq5_sg/AAAAAAAAAAI/AAAAAAAAAAA/AMZuucmQWfUWc48RpXG6vbsC0iYa6RlEKw/photo.jpg,Esse jogo é bom e fácil eu estou gostando muito mais. gostei muito mais não é tão fácil de jogar eu estou perdendo um pouco 😧😧😧😧😧....mais é bom mesmo assim se vocês ñ gostaram eu gosto do jogo 😌😌😌,5,0,4.1.32,2020-09-04 23:59:51
65,Ezequiel PAULO DOS SANTOS,https://play-lh.googleusercontent.com/-_sVT3NhyG9U/AAAAAAAAAAI/AAAAAAAAAAA/AMZuucmJF92ywqFnvn5PEQDoiiGQmlcj5g/photo.jpg,Não estou conseguindo entrar no jogo após a última atualização,3,0,4.3.34,2020-10-01 18:45:08
