,userName,userImage,content,score,thumbsUpCount,reviewCreatedVersion,at
0,Dark,https://play-lh.googleusercontent.com/a-/AOh14Gjw-oKqj_WLrJy8up59izohoaBCFwuJeTF4xmSYGA,"Excelente. Uma continuação simbólica do primeiro jogo. Plants versus Zombies 2 compre todas as suas expectativas. Apresenta uma jogabilidade simples, uma história bacana de se acompanhar, gráficos não muito complexos, e além disso, possui eventos, concorrendo a plantas muito boas. Não é muito difícil você conseguir dinheiro e/ou gemas nesse jogo. As fases vão ficando mais difíceis e mais elaboradas, exigindo mais estratégia do jogador, o que é incrível.",5,424,8.5.1,2020-11-01 11:06:51
1,Janaina Rafael Moreno,https://play-lh.googleusercontent.com/a-/AOh14GiFGBkYakKNYSkpaNMbl-V9Zre3sVw5pqnpv24lhw,"O jogo é ótimo, gráficos bons, jogabilidade ótima, história interessante, tem tudo que eu lembrava que eu tinha jogado há uns 2, 3 anos atrás; eu comecei a assistir um vídeo antigo desse jogo e vi o desafio: ""memória da múmia"" então eu lembrei que eu já tinha jogado isso, então eu fui procurar se tinha uma fase (não foi em todas) se não tiver, tentem re-adicionar esse desafio, se não conseguir eu vou entender e se tiver me avisem a fase e o mundo(por que eu estou com muita preguiça de ir 1 por 1",4,1193,8.4.2,2020-10-18 05:29:40
2,Personagens 3D por Bruna Romaguera,https://play-lh.googleusercontent.com/-_XosUMATL6g/AAAAAAAAAAI/AAAAAAAAAAA/AMZuucmGVcj-bdx5-4l4ROFirs8pGgAKrA/photo.jpg,"Amo esse jogo! Mas tô tendo problemas constantes.Tela preta, não inicia.. pra entrar novamente fico esperando atualizações para não desinstalar e perder todo o progresso. No momento já tô a 2 semanas sem poder jogar. É muito chato ficar começando tudo do zero e sabendo que será tudo apagado novamente. Vejo que isso também tá acontecendo com outros.. complicado.",5,614,8.4.2,2020-10-27 21:59:25
3,Pedro Afonso Mendonça de Lima,https://play-lh.googleusercontent.com/-J8BbP1OivqI/AAAAAAAAAAI/AAAAAAAAAAA/AMZuucn2iypVwqlyOcmafcNCnnSFCHPVPQ/photo.jpg,"Ta muito bom quando vc consegue umas plantas que te dão uma certa vantagem o jogo fica ótimo mas alguns modos se tornam repitivos se vc usa apenas sua seleção é bom joga como seleções de plantas diferenciadas o ganho de moedas é bom o de gemas também o que me deixou cabreiro foi as pinhatas, com tudo o jogo é bom recomendo para jogadores, ñ se deixem cair nas críticas negativas o jogo é ótimo, e se puder adiciona um modo de criação de mapas seria divertido desafia os outros",4,1,8.4.2,2020-11-08 15:34:14
4,raposinha SuperNoob,https://play-lh.googleusercontent.com/-aoL1R03RXIk/AAAAAAAAAAI/AAAAAAAAAAA/AMZuucnLWAAzk7Vd8BZI5agRu_4YJTaG3w/photo.jpg,Eu realmente Amo este jogo! Nunca pensei que tivesse outro pvz mas esse aqui tem gráficos simples e bonito roda normal no meu celular (no meu) e é super simples de entender o jogo existem várias combinações de plantas para escolher a única coisa que não me chamou muito a atenção foram as plantas pagas eu realmente tenho condições de pagar mas minha mãe acha que isso e uma perda de dinheiro mas enfim por mim esse e o melhor jogo de pvz 2D na minha opinião.,5,150,8.4.2,2020-10-27 23:38:05
5,lindomar cento fante,https://play-lh.googleusercontent.com/-a4K05XyeBhM/AAAAAAAAAAI/AAAAAAAAAAA/AMZuuck5sUh-3rpvSpL30UaoVgGOLTN9UA/photo.jpg,"Jogo muito bom, não tem propaganda e quando você opta por assistir ainda ganha moedas e diamantes, dificuldade ótima, boa imagem som muito bom, gráfico excelente. Parabéns a toda a equipe que desenvolveu esse jogo desafiador e muito interativo aonde o jogador tem que desenvolver as estratégias para passar de fase.",5,259,8.4.2,2020-10-29 16:19:03
6,Guilherme Gonçalves,https://play-lh.googleusercontent.com/a-/AOh14GgnqD-TgnVL9B_nPYxIS7IxKQhpIc0x2EQWZfZ2lw,"O jogo é muito bom, mas poderia ter a opção de comprar mentas por quantidades específicas, fica muito cansativo comprar vários e vários pacotes de mentas para elas evoluírem. Poderiam colocar a opção de escolha, para que pudéssemos pegar a quantidade exata de mentas sem ficar múltiplas vezes comprando os pacotes com 25.",5,154,8.4.2,2020-10-20 09:58:49
7,Kiran Aragão,https://play-lh.googleusercontent.com/a-/AOh14GjxjVrEvYSpUROrFLlfo-u_iKbCvkYUyvsms_uNUQ,"É um jogo bem divertido e diverso, especialmente em comparação ao primeiro jogo. O Redesign tbm foi uma melhoria legal, mas acho que o sistema de subir de nível é lento demais, e o Pay to Win, eu perdoo, não torna o jogo injogável.",4,1,8.4.2,2020-11-05 02:37:41
8,TURBO,https://play-lh.googleusercontent.com/a-/AOh14GjP50TF66kOuqleHBaT-fm9oQNl238T4ei8n-gPoA,"Cara eu amo esse jogo, o problema é que em algumas fases ex: Idade das Trevas noite 18, principalmente nessas de seleção predeterminada de plantas o jogo te obriga a usar o pay to win eu estava com 15.000 de dinheiro e só nessa fase desci pra 10.000, então precisam diminuir a dificuldade das fases ou abaixar o preço dos poderes",4,111,8.4.2,2020-11-05 10:20:07
9,A.R.M.Y FOREVER,https://play-lh.googleusercontent.com/a-/AOh14Gis9i2h12dwfq5xrbRLMIpVf_SCI7sWiQzEaCA5Xg,"O jogo em si é incrível ótimos gráficos e uma boa jogabilidade mas eu por alguma razão não consigo salvar meu progresso já tentei varias vezes e nisso eu perdi o progresso 3 vezes q tive que dessistalar o jogo como quando formatei o celular por problemas de armazenamento e eu tive que recomeçar tudo de novo,tentem melhorar isso por favor o jogo ficaria perfeito",4,76,8.4.2,2020-10-30 17:21:43
10,Isabele Rosa Alves,https://play-lh.googleusercontent.com/-5lDrGOrru7g/AAAAAAAAAAI/AAAAAAAAAAA/AMZuucmEYMJZgo07Yb8qG13n-OR_OLHA8A/photo.jpg,"Esse é o melhor jogo do mundo. Ele quase nem tem anúncios. Esse jogo é muito legal por mim é o melhor jogo do mundo, ele quase não tem nenhum tipo de problema nas fases nem de atualização nem nada, esse jogo é muito bom. Vcs tem que instalar é o jogo que eu mais gosto, eu sei que nesse universo quase não tem ninguém que gosta desse jogo mas eu gosto e é por isso que eu vou continuar motivando pessoas eu nunca vou parar de jogar esse jogo maneirismo.",5,181,8.4.2,2020-10-14 18:34:06
11,SUSTO EM DOBRO,https://play-lh.googleusercontent.com/-fcYvS8DUR48/AAAAAAAAAAI/AAAAAAAAAAA/AMZuuckmx7fHhbOVEW8aVlPjJKPVIfOTrw/photo.jpg,Eu finalizei esse jogo em questão de meses levei 4 ou menos que isso eu amo a franquia mas que pena que eu não posso jogar todos o jogos como O PVZ do Facebook e o Garden 1 o 2 e o 3 e também a cabo as atualizações do PVZ batle for vile😞 mais a vida continua eu só espero que a franquia não acabe agora😁 obrigado Pope Cape por fazer um jogo maravilhoso que nem esse não existirá nem um jogo que nem esse e eu me chamo MIGUEL Felipe tenho 13 anos de idade e agradeço por você fazer esse jogo maravil,5,1,8.4.2,2020-11-07 23:04:22
12,ShadowThe SHAXX,https://play-lh.googleusercontent.com/a-/AOh14GicFtyBsj6XMOsLICaUOr3ivyjsCNIgTyYLgd6mTw,"Para quem reclama da dificuldade do jogo cada fase ou mundo tem plantas específicas, idade das trevas e idade do gelo que são a maioria das reclamações, quem quer pega sols na treva e só usar o cogumelo solar e no gelo sempre der preferência a plantas de fogo simples eu fechei todos os mudos e oq mas tive dificuldade foi o mundo jurássico.",5,32,8.4.2,2020-10-12 04:10:55
13,Denny & Daniel Leandro,https://play-lh.googleusercontent.com/a-/AOh14GgrLH4PkWJeI1IJa7mhdoTFH8NWHZNaYd8-sMi2tQ,"Obrigada por ter devolvido o que eu perdi no jogo, deu um erro no App e apareceu que, eu não tinha nenhum progresso nele, perdi tudo e graças a vocês, conseguir recuperar algumas coisas. Comprei o que aumenta os poderes de adubos, só consta 3 e tá errado. Se puderem devolver as minhas plantas e os adubos que, eu ganhei e comprei, agradeço. Fora isso, está tudo bem. Adoro esse jogo e sou viciada nele, me sinto bem ao jogar. O jogo às vezes buga, mas volta ao normal.",3,12,8.4.2,2020-10-24 02:06:33
14,Modesto149,https://play-lh.googleusercontent.com/a-/AOh14GiENmi-BQFpaZcNdtfYSA9KX8AbGXIj4-d956jbqw,"O jogo em si e bom, mas a monetização do jogo é horrível, as plantas mais interessantes e fortes são paytowin e tem literalmente vantagens pagas, que podem ser usadas no multiplayer (PtW), esses problemas fazem com que o jogo perca a parte boa que o primeiro era e fazem com que não valha a pena jogar depois da campanha :/",3,152,8.4.2,2020-10-29 21:41:57
15,Evandro Soares,https://play-lh.googleusercontent.com/-D-KemeidupE/AAAAAAAAAAI/AAAAAAAAAAA/AMZuucnQdeUBlHyyqv3lV4pr9QJRlSNitQ/photo.jpg,"Jogo ótimo, porém depois de tudo concluído, fica monótono e sem razão para continuar. Aqueles que gastam dinheiro com o jogo, tenho certeza que irão se arrepender. É necessário criar novos desafios constantemente e criar um tipo de duelo mais eficaz e emocionante. O primeiro jogo é ótimo, mas esse deixa muito a desejar.",2,64,8.4.2,2020-10-31 22:55:33
16,Jociane Soares Cardoso,https://play-lh.googleusercontent.com/a-/AOh14Gj0Pt1qDcqAWR5Am5HXms_zLxtyeNXA1Gdp-6i7DA,"Muito bom o jogo, vale apena ainda mais a arena que dão planta grátis na categoria 300 ou 200 pacotes de sementes, diamantes, moedas, etc etc vale muito apena zerar, também a perseguição da Penny que dá MAIS pacotes de sementes pra evolução de plantas",5,0,8.4.2,2020-11-05 16:43:25
17,Elaine Cristina,https://play-lh.googleusercontent.com/-QDjKozYGjNw/AAAAAAAAAAI/AAAAAAAAAAA/AMZuucnX6_VAvS6dsQnkkzyWz-0GyZcgSw/photo.jpg,Eu a mei esse jogo de mais eu nunca tive problemas com bugs mas o meu problema é que as fases estão muito difícil que o nível de dificuldade chega a até um time de plantas prêmio perde tenho um time de plantas prêmio é eu não ganho se um time de plantas prêmio não ganha oque mais ganha mais eu ainda amo esse jogo meu nome verdadeiro é Duan Augusto e que eu tô no celular da minha mãe,5,17,8.4.2,2020-11-08 09:01:19
18,José Aparecido Gomes Rodrigues,https://play-lh.googleusercontent.com/-VHjAfE8HWtA/AAAAAAAAAAI/AAAAAAAAAAA/AMZuuckCbbrcmZmlDJsYe2PbWFSa7Tqlvw/photo.jpg,"Eu gosto muito do jogo,é um dos melhores jogos que eu ja joguei,os gráficos são realmente muito bons,não tem o que reclamar,o jogo devia ganhar um premio,eu sei que tem gente que fala mal, mas nao preocupem com isso,se tem bugs,eu realmente nao vi porque eu jogo quase todo dia e nunca tive problema.",5,1,8.4.2,2020-10-31 17:28:06
19,Bruno Cordova,https://play-lh.googleusercontent.com/a-/AOh14GjVODosQSZzrluxsXU9K3yhR_xbzC3kpsAJurPD,So não dei 3 estrelas por 2 motivos. 1 Quem vai pagar 19 reais por uma planta apenas. Podiam fazer eventos para que jogadores possa coletar as sementes e desbloquear igual na arena. 2) As melhorias da Perseguição da Penny somem no dia seguinte. Como vai coletar 112 objetivos unicos em 1 dia ?,3,89,8.4.2,2020-10-18 12:27:01
20,ariel nunes,https://play-lh.googleusercontent.com/a-/AOh14Gg4mq_HaXBEZu4566XJtI_3VzoSPswK4XXF2a0c,"Ele é muito bom, muitas mas muitas fases mesmo. Para mim não tem um bug de tipo fecha quanto eu aperto um botão e nem uma fase impossível te se vencer.a trilha sonora é ótima,muito boa mesmo principalmente a da idade da juba. quanto eu terminei o último mundo eu comecei a façe a arena Muito boa,eu,pela minha opinião,a perseguição da penny é muito difícil mas jogavel. Parabéns E.A finalmente não me decepcionei com você.",5,736,8.4.2,2020-10-02 09:33:45
21,Adriane Cazarotto,https://play-lh.googleusercontent.com/-OEtPdn1MF3M/AAAAAAAAAAI/AAAAAAAAAAA/AMZuucnKDpnZDvAUgyi9yM9GLGai9lxLvg/photo.jpg,Cara muito legal esse jogo por que o gráfico é excelente mas o difícil é o mapa da idade das trevas por que não cai sol do céu claro tem as sepulturas de sol e o mapa do gelo é difícil pra caramba por causa do cara que joga gelo (3 ataques congela ) mas em si o jogo é um dos melhores jogos que eu já joguei (quando perde : aaaah ZUMBIS... COMER... MIOLOS!,5,1039,8.4.2,2020-10-01 13:16:31
22,Allan Santos,https://play-lh.googleusercontent.com/-yKbpI4QHi9w/AAAAAAAAAAI/AAAAAAAAAAA/AMZuucl0vjtLHvZpL3H0AmRm6bEqALy-1w/photo.jpg,"Eu li muitos comentarios,muitos mesmo,e a maioria é a mesma coisa,gente reclamando de bugs,da dificuldade do jogo,falando sobre a quantia de sois que é usado nas plantas,mas eu digo,plants vs zombies é um jogo muito bom,com mundos muito legais.Se vc acha o jogo dificil,ñ joga,se ñ consegue sois o suficiente,bota mais gira sol,se o seu jogo trava baixa um antivirus,e por ai vai,ñ vou falar tudo por q tem limite de escrita no comentario,mas o jogo ñ é difil,se ñ gosta do jogo ñ baixa,ou va se cata",5,1285,8.4.2,2020-10-02 09:59:51
23,Vini Koda,https://play-lh.googleusercontent.com/a-/AOh14GiaCgfnm4YuBtEMU7teFRlwLKUkIR9HNqdXMzfb,"Melhor jogo cara, se adicionasse os personagens do PvZ Heroes ficaria mais legal, mas o jogo e de voces voces que decidem 😊 Edit: E quando eu to off line e quero jogar, aparece uma tela cinza de download de algo, se puderem melhorar, agradeço",5,1,8.4.2,2020-11-03 17:33:14
24,Marcos Willian,https://play-lh.googleusercontent.com/a-/AOh14GgwL17H49ccRus8WiB5vPcKmv0HTWT5M54Ih3uXKA,"O jogo é bom, assim como o antecessor, as fases são bem elaboradas e tem bastante conteúdo. O problema é a EA e essa monetização escrota que ela faz em tudo que põem as mãos, existem muuitas microtransações que acaba tornando o jogo ""pay to win""",4,4,8.4.2,2020-11-01 13:10:17
25,Rosa Aparecida de Oliveira,https://play-lh.googleusercontent.com/--MwJ_NWQfGM/AAAAAAAAAAI/AAAAAAAAAAA/AMZuuclF3CvjMsKB0T_9MYVExBNNloYXbQ/photo.jpg,"Mano bem que as plantas podiam evoluir + rápido!!!eu tenho o jogo a MILHÕES 🌽🌽🌽🌽🌽 de anos e nunca 1 só chegou ao nível 5, E SÃO 20!!! e olha que eu pego todos premios diários e assisto ads pra ter gemas e comprar pinatas!!!fora as 3 de todo dia!!!",4,1,8.4.2,2020-11-07 01:58:32
26,Meire Loppes,https://play-lh.googleusercontent.com/a-/AOh14GhUB7yb_9idTsULO-6Qag2Z7mpGoesEBcKF3ww,"Gente, esse jogo é sensacional, tô vendo mtos pessoas aq reclamando q tem bug nas fases pq não conseguem passar, ou chega um ponto que não teem mais oq fazer, e estão TDS errados, eu já passei por TDS as fases do mundo perdido e agr tem as perseguições da penny e a arena sempre com novas plantas e missões diferentes, jogo esse game a anos e nunca cai no tedio. Amo demais 💜",5,237,8.4.2,2020-09-30 14:59:01
27,Lílian Barros,https://play-lh.googleusercontent.com/-xSElyC3736Y/AAAAAAAAAAI/AAAAAAAAAAA/AMZuucnTPQboPm43WmJzErgefJF4D2RGEA/photo.jpg,"O jogo é mt bom, as fases são incríveis, porém, o jogo disponibiliza pouquíssimas moedas, assim como eu n consigo salvar meu progresso, nem comprar nenhum produto na loja.",4,0,8.4.2,2020-11-01 14:02:23
28,Deeh Braga,https://play-lh.googleusercontent.com/a-/AOh14GjEZ25-hLV3rqMlWyl0_qDu4Q9FdA2BtSeKkJ3Ru3s,"Depois dessa atualização eu simplesmente não consigo mudar de nível , eu faço as missões direito mas quando é pra avançar fica aparecendo o enunciado de que ""As plantas evoluídas são incríveis"" repetidamente e quando saio e entro de novo tenho que começar do começo a fase",2,1,8.4.2,2020-11-03 01:24:30
29,BETHANIA BE,https://play-lh.googleusercontent.com/-r1KKEtaCQNg/AAAAAAAAAAI/AAAAAAAAAAA/AMZuucmpvNpnIU2HPO8wdmfoz673Z_S5LA/photo.jpg,"Amei muito esse jogo,plantas novas a cada ano,mundos novos,festas de pinhatas, gráficos ótimos, comemorações de festas como o halloween.Esse jogo vai marcar a minha infância pra sempre. Parabéns para quem desenvolveu esse jogo lindo e maravilhoso. E se o criador do jogo vir esse comentário parabéns enorme e abraços❤️❤️❤️❤️",5,4,8.4.2,2020-10-31 10:06:02
30,Ednardo Viana,https://play-lh.googleusercontent.com/a-/AOh14Gg5DIQeL5OxiMPUf3G0bVFx7bJ3chfONECCPMQ,"Só não gostei dessa nova forma de comprar os pacotes de semente das plantas de torneio,antes o valor era fixo mas agora essa forma crescente gasta muito diamante e não benefício nada o player que não gasta dinheiro de verdade.estava bom mas tinha que adicionarem alguma coisa pra ferrar com o pessoal q jogo casualmente sem investir 👎",2,34,8.4.2,2020-10-20 05:50:40
31,Sol Albino,https://play-lh.googleusercontent.com/a-/AOh14GioAU2K3ja2SeAoodY6vBasEhdMVWDBrGAyVq17,Poxa ja estava bem adiantada no jogo tinha zerado algumas fases ai tive que desinstalar pois nao estava funcionando e tinha salvado meu progresso mais nao voltou nada zerou tudo! Queria continuar de onde parei como faço? Por favor se nao voltar nao vou jogar mais ja e a 3 vez que acontece isso,1,18,8.4.2,2020-10-23 19:16:26
32,Samuel Martins,https://play-lh.googleusercontent.com/-oqv5mvbECxQ/AAAAAAAAAAI/AAAAAAAAAAA/AMZuuckottvp4KL04LV_CJGhe7cGZMMifA/photo.jpg,"O jogo é ótimo eu tinha jogado em outro celular que eu tinha completado todas as fases mas eu desinstalei, bem que poderia ter um jeito de salvar a conta do jogador mais o jogo é ótimo reconmendo!",5,2,8.4.2,2020-10-31 10:51:56
33,Renato Augusto,https://play-lh.googleusercontent.com/a-/AOh14Gi-585IDPZ8Cji0D4FLWp1a-L2i2PCZo5KytXwrdA,"esse jogo é muito maneiro,legal e tudo eu zerei este jogo eu só jogo na arena e na persigisao da peny quando eu era um pouco mas pequeno eu via fases prasima de 24 dias isso era daora de mais todos os mundos tinha mais fases e difíceis isso que era daora agora isso não tem mais por favor criadora ou criador do jogo trás de vou ta as fases.",5,7,8.4.2,2020-10-26 20:05:05
34,ITALO_2006,https://play-lh.googleusercontent.com/a-/AOh14GjjkZT1SZl_Q9vRgk2hTfThFdOzEpqF2z5IojVx6g,"Essas pessoas que tão reclamando sobre ser p2w não jogam direito ou não sabem fazer estratégias, cada planta tem sua vantagem e também desvantagem, é simples, economiza 100 diamantes e compra o espinho guiado, planta muito boa pra ZERAR O JOGO TODO",5,13,8.4.2,2020-10-13 21:55:40
35,André Domicciano,https://play-lh.googleusercontent.com/a-/AOh14GhkTbEKhJCDzavaPN8VWkFS4KJ7_F_1s-9k6-ATUQ,"O jogo é bom mas é pay to win. Chega em determinado ponto em que a dificuldade é tão absurda que só pagando pra passar. Uma pena, ainda mais tendo em vista que o 1o é muito bom e sem essa sacanagem...",2,2,8.4.2,2020-11-04 15:22:23
36,Ari F,https://play-lh.googleusercontent.com/a-/AOh14Gg593IT67OXZlPvbv9awD6vBSgyuRLoGuX7YP9-9og,"O jogo é excelente, empolgante e divertido. Mas é um jogo de estratégia, se vc não souber escolher como gastar os sóis, como e onde plantar vai ficar impossível mesmo. Pra mim, é maaaaassa!",5,8,8.4.2,2020-10-19 07:32:55
37,Carla Janaina da Silva,https://play-lh.googleusercontent.com/-DFuaAB6caK4/AAAAAAAAAAI/AAAAAAAAAAA/AMZuuckwZn-KP4wAp38aY0gqTDjOpf_JPA/photo.jpg,Eu gostei muito desse jogo até mais de plantas e mais de 300 fazes eo evento e arena perseguição penny gostei muito obrigado mas também gostei do 1 só que eu zerei conseguir tudo no 1 desinstalei no 21/10/2020 e agora tô jogando o dois daí um dia eu jogo o 3 obrigado 5 estrelas,5,8,8.4.2,2020-10-23 09:24:31
38,Kelvin kok,https://play-lh.googleusercontent.com/-lEnYWv7rAeg/AAAAAAAAAAI/AAAAAAAAAAA/AMZuucld6mz4J4Ma2Gmz1X6woHX-ID1Pqw/photo.jpg,As pessoas falam das fases que nao ta de passar os níveis dos zumbis são forte e as Plantas são fracas e na idade das trevas 14 que é 5000 sois que tem que produzir as pessoas falam QUe vai até 4000 mais e que as pessoas que são lixo no jogo muito ruim pq passo de boa na quilo e falam que tem que comprar muitos pacotes diamantes pra passar dos níveis mais e mentira consigo e difícil e mais ta pra passar de boa os nives,5,3,8.4.2,2020-11-02 02:23:46
39,Eduardo Cunha Nantes,https://play-lh.googleusercontent.com/-4AnTcPDCq6o/AAAAAAAAAAI/AAAAAAAAAAA/AMZuucntty_q6n6a6OrRHR6XWow71tbVpw/photo.jpg,"Simplesmente Perfeito, Jogabilidade simples, gráficos muito bons,a melhor coisa é conseguir plantas gratuitas só passando de nível.",5,1,8.4.2,2020-11-07 22:39:34
40,Marlon Silva,https://play-lh.googleusercontent.com/a-/AOh14GiaOdMWUYQFnyYN2C44jqe5g-0mzq1OAamckJZIlA,"Sinceramente, odeio aquelas malditas fases em que o jogador nao pode escolher as plantas que quer, por mim perde totalmente a graça essas fases deviam sumir do jogo!! Mas de resto o jogo é excelentíssimo ;)",5,6,8.4.2,2020-10-16 15:25:47
41,Raul Cordeiro,https://play-lh.googleusercontent.com/a-/AOh14Gi4f61gjln-TsSAIvMfVtXkYCZrO-HYBLBrFkih,Oi então eu amo esse jogo é muito legal mas estou sentindo falta da fase memória da múmia essa fase eu adoro e estou com um problema na fase do mar dos piratas eu acho que é na fase 19 sempre que termino de matar todos os zumbis sempre um buga e eu tenho que começar de novo,5,1,8.4.2,2020-11-04 11:38:41
42,criança flor,https://play-lh.googleusercontent.com/a-/AOh14Gj5e5GEwEa3GsuXmcFQj-eH249AhJXbBrwDnGRe,Oi o jogo está muito difícil de ganhar dinheiro e é muito complicado começar como iniciante porque o jogo ta muito difícil ainda mais de ganhar dinheiro e essa atualização e quase impossível de ganhar por que essas plantas da casa moderna e muito difícil ganha então fica difícil e aquela planta nem é tão boa e na arena os zumbi tá muito forte acho que tá lvl max.,3,8,8.4.2,2020-10-12 15:24:03
43,Lili uzumaki,https://play-lh.googleusercontent.com/a-/AOh14GhgCWFgMahwSDwAkJIiw_ymjdcl8lbd5VJwLFzc5A,"o jogo é muito legal mas hoje eu instalei e foi até a fase do mar depois eu sai do jogo para ajudar minha mãe depois que eu foi entrar no jogo e saiu automática mente eu reinicei o celular e tentei entrar de novo 10 vezes mas não vai,alguém me ajuda?",4,9,8.4.2,2020-10-21 19:42:43
44,Rhayssa Carneiro Prado,https://play-lh.googleusercontent.com/-6HwN7VNLwIk/AAAAAAAAAAI/AAAAAAAAAAA/AMZuuck4NoIhxTHhD3fEbIhZuw_sVUI97w/photo.jpg,"Jogo e bom, consegui zerar ele, porém o jogo está apresentando falhas, não sei se e só no meu celular mas ele não está iniciando o que chega a ser ruim no jogo ...",2,0,8.4.2,2020-11-01 00:22:10
45,Monica Oliveira,https://play-lh.googleusercontent.com/a-/AOh14GjJRVX1Q6dP8JrkbX4EYwAoSVgnsCnB-cEbpkODUQ,"Eu amei o jogo,mais tem 3 dias que ele não funciona,estou com medo de desinstalar porque vai voltar tudo pro começo de novo, então resolvam esse problema, por favor !",3,0,8.4.2,2020-11-08 13:03:09
46,Camila Lima,https://play-lh.googleusercontent.com/a-/AOh14GjKzEEMNH37fubEmcg54cel03TMmKdoOlU7sn1s_bM,"Jogo é muito bom, mas tive que desinstalar o jogo e quando voltei a instalar não conseguir recuperar o meu processo de jogo e teria que começar a jogar desde o início, agora parei de jogar porque não quero começar tudo de novo.",1,20,8.4.2,2020-10-12 18:33:45
47,Ana Clara Cazeiro,https://play-lh.googleusercontent.com/a-/AOh14Gga8nPl-W_XPXoFMUEq24v6CZzBRij_uQx6v5Vh,"Gente,muito bom o jogo,mas os zumbis vem muito rápido, e também demora a carregar,adorei que esse vcs fizeram em português, mas Eu PIRO com esse jogo,e de felicidade não, e sim,de DESESPERO tá legal,e otra,tem que ter muinto espasso no ceular",3,2,8.4.2,2020-10-14 23:54:25
48,Felipe Fernandes de Macedo Fernandes de Macedo,https://play-lh.googleusercontent.com/a-/AOh14GgitYMSZlzjh1IE0kHvwqn0OHpQXvfeUJx4Aol7,o jogo possui um erro que acontece com todos que estraga completamente a gameplay: Do nada aparece uma tela de starting que fica carregando e não dá pra entrar e EA não faz nada para corrigir isso. Deveriam fazer uma atualização para corrigir esse erro de uma vez por todas.,1,63,8.4.2,2020-10-05 12:11:00
49,Marcello Saturno,https://play-lh.googleusercontent.com/a-/AOh14GjdZ4YgLLwJYPlC-67UykZQxXnKV2e2y4X3a_5MOA,"Jogabilidade ótima, gráficos bons e muito estratégico. Aprenda a jogar e conseguirá muita coisa. É possível jogar tranquilamente sem gastar.",5,4,8.4.2,2020-10-15 14:02:34
50,Erick Costa,https://play-lh.googleusercontent.com/-X8tzLZ7BJp0/AAAAAAAAAAI/AAAAAAAAAAA/AMZuucmVpTQ5EhTB7xphkbTjO7PBqqLW6w/photo.jpg,É normal o App plAnts iniciar um starting e demora tanto pra abrir novamente??? Já é a segunda vez q isso acontece comigo a primeira vez desinstalei e instalei achando q era o meu aparelho.. mais agora tá o dia todo carregando mais não abre o jogo .. alguém sabe me dizer se isso é normal?,5,20,8.4.2,2020-10-08 17:24:33
51,Sílvia Bueno,https://play-lh.googleusercontent.com/-FuZmUJT2kao/AAAAAAAAAAI/AAAAAAAAAAA/AMZuucmevJHhuTOMPSVAL1gWN5y7Z8ZLOQ/photo.jpg,"Novamente meu jogo bugou ... tela preta e o jogo não abre ... perdi quase mil e cem diamantes e noventa mil moedas, fora os pacotes que já havia ganho ... super chateada, pois não é a primeira vez ... espero que resolvam isso ...",2,30,8.4.2,2020-10-15 00:14:47
52,Tania da cruz ciles,https://play-lh.googleusercontent.com/a-/AOh14GglNX0_DtFI7CsNYHYRIMHtjZBEKsk55PuOg_YWUQ,Muito bom né! Só espero que no final eu não tenha que gastar dinheiro de verdade pra usar todas as plantas pq se não vão perder três estrelas de cara!!!,5,5,8.4.2,2020-10-15 22:40:12
53,pernalonga e sua turma,https://play-lh.googleusercontent.com/-p90-zmcZBpk/AAAAAAAAAAI/AAAAAAAAAAA/AMZuucmy57UfjY4faW0iqD9V8EStQD83Kw/photo.jpg,"Ótimo jogo muito gosto muito dos eventos mas acho que seria ótimo fazer novos mundos acabei vida moderna e não tem mas achei que a parte que tem um portal no final era outro reino , coloquem mas mundos por favor obrigado",4,1,8.4.2,2020-10-29 23:10:20
54,Roberto Maurer da Silva,https://play-lh.googleusercontent.com/a-/AOh14Gijr-QYlaA2rMNBQ_bRpT3Bk5IDtsM3mWF4Di0g,"Eu amei muito esse jogo mas só é um pouco difícil ganhar dinheiro no início mas depois tranquilo , tipo tem gente reclamando dos pressos mas tem jeitos de não gastar muito e ganhar a fase , só pensar , esse é um jogo de escolha e táticas então minha dica , baixem mas prestem atenção para jogar melhor 😌",5,6,8.4.2,2020-10-14 23:49:49
