,userName,userImage,content,score,thumbsUpCount,reviewCreatedVersion,at
0,Kakashi hatake,https://play-lh.googleusercontent.com/a-/AOh14GgQ8CxFrftjD4UC-xAX_ZY8vJRrsuucktCoHgdUaw,"O game é muito bom, pois não te obriga a gastar dinheiro pra comprar carros para certas corridas igual acontece no asphalt, só que poderia melhorar nos gráficos e na jogabilidade porque quando melhoramos um carro, ele vira um foguete! Sai correndo como se quisesse ganhar do flash numa corrida e fica muito difícil controlar o carro. E além dessas melhoras, poderia ter um modo multiplayer em que desse pra jogar com amigos, de resto o game é bom.",4,41,1.8,2020-10-21 17:26:03
1,Risomária Felismino,https://play-lh.googleusercontent.com/-7qhA4xiepYI/AAAAAAAAAAI/AAAAAAAAAAA/AMZuucmlMn2CeXc8kvg8r9PxG33IQvXT2Q/photo.jpg,"O jogo é muito muito muito bom! Os gráficos são otimos a jogabilidade é maravilhosa, os controles são perfeito!💖 e o bom é que ele é offline parabéns aos que criaram esse jogo!💖 eu recomendo pra vcs no meu celular ele funcionou perfeitamente!!💖 Emfim Ameii!💕💕💕",5,0,,2020-11-07 20:13:51
2,Um usuário do Google,https://play-lh.googleusercontent.com/EGemoI2NTXmTsBVtJqk8jxF9rh8ApRWfsIMQSt2uE4OcpQqbFu7f7NbTK05lx80nuSijCz7sc3a277R67g,"Quero falar algumas sugestões para o seu jogo. As sugestões são as seguintes: melhorar a qualidade gráfica do jogo, cada carro tem que ter seu próprio barulho do motor, os carros têm que fazer transmissão da marcha, colocar mais carros e carros mais rápidos, deixar o modo carreira maior (com mais corridas) e adicionar um modo multiplayer (com a opção de criar corridas personalizadas). Só vou dar 5 estrelas se fizerem isso!",3,217,,2020-07-26 04:04:13
3,Isaac Santos,https://play-lh.googleusercontent.com/a-/AOh14Gi0c7NTQIglwcfdMdC2gSyIESNEyzeSeb03sTKd,"Jogo ótimo!!! Muito bom mesmo, tem tudo que um jogo de carro precisa, mas eu acho que podiam aumentar os gráficos! Isso é essencial! Mas de resto, tá ótimo!!",4,69,1.8,2020-09-29 21:32:02
4,Existência Cósmica,https://play-lh.googleusercontent.com/a-/AOh14GgMBD7hI6Oq4bPuGSDAagWSugiRqAbJMrJksQqr,"Eu tinha achado legal e tudo mais, mas agr mudei de ideia, tipo,o jogo em si, pega MT bem no meu tablet, mas ele tem uns bugs, q pega em mim e nos adversários, q tem umas curvas q joga o carro pra cima... Odeio isso E ainda os carros não são nada realistas, tem vez q eles correm mal, e tem vez q superam... Eu tava ganhado q boas, aí tive necessidade de equipar o carro,aí ganhei dnv, só q parece q os adversários evoluem na mesma hr, dificultando incrivelmente... É MT bizarro",4,123,1.8,2020-07-04 17:55:25
5,Ezek Rey,https://play-lh.googleusercontent.com/a-/AOh14GhvnUgODbMXhxbVaPAl7rFe41WU33HsHudZOL_LNw,"Se o jogo não abaixa direito o problema está no seu celular porque eu baixei super rápido e olha que eu uso os dados móveis do meu dispositivo OK, isso é uma resposta a uma resenha que já que não dá para responder direito na pessoa como se fosse um app de conversa né idéia para a Play Store.",5,131,,2020-06-05 05:49:20
6,Suéllen Souza,https://play-lh.googleusercontent.com/a-/AOh14GjU_vLnZaIn67aoF_0g-fL8njDh2AzxsUWjuQRnuw,Eu sou mulher jogo esse joguinho desde 2013 queria que colocacasse a cor rosa. Carro rosa afinal tem mulher que joga. Mais eu amo esse jogo. Aqui em casa eu meu esposo e meu filho temos ele.,5,1,1.8,2020-11-01 16:49:16
7,Arthur Nascimento,https://play-lh.googleusercontent.com/a-/AOh14Gg2K1V1oXNfBD1I42MbF0cZuuAotgESdHSLpmrvfA,Mano o jogo e ótimo eu gostei e bem leve principalmente para meu celular que não tem tanta memória mas eu só não do 5 estrelas porque o jogo divia vim com setinha para vira o carro so tem a opção de vira a tela e o volante mas não gosto desses eu sempre uso a setas para virar porque acho mais fácil por favor adiciona as setas como opção de vira o carro também senão não ganha a última estrela que falta,4,48,,2020-09-23 16:05:38
8,Wanderson poketi,https://play-lh.googleusercontent.com/-uRQ_6HBt12I/AAAAAAAAAAI/AAAAAAAAAAA/AMZuucnCZB6gGX_Pf4bNjSwotpGstLbogw/photo.jpg,Você devia ter atualizado o jogo com modo online mais carro vários cenários diferentes e melhorar um pouco o gráfico gente por favor gente faça isso quem criou o jogo,4,0,1.8,2020-10-06 08:43:32
9,Drag - chan,https://play-lh.googleusercontent.com/a-/AOh14Gh0np_C6A85UFaMm_kqE-S0BYr65rvUicAS3IJtPQ,"Eu adoro esse jogo joguei ele na minha infância lá pra 2013 eu acho o que eu critiquei foi os modelos dos carros e dos mapas, em alguns mapas os carros são pequenos e alguns mapas os carros são um pouco grandes o que eu queria é que vocês fizessem um remake do jogo ia ser muito legal",5,76,,2020-06-12 23:56:20
10,Junivaldo De Freitas,https://play-lh.googleusercontent.com/a-/AOh14GjJ5ooxynkHzqPLC6X820B4smyfuS0STAW8GGIrWg,"O jogo🎮 é legal mas, falta alguns ajustis gráficos e nos efeitos sonoros. O resta ta tudo maravilhoso e eficiente.😊👌✌👍👏",4,2,1.5,2020-08-17 17:59:09
11,MR. Aleatorio,https://play-lh.googleusercontent.com/a-/AOh14Gg76v1NwVqfpd1OreThKmaOnZ_omdzKAfI3WrXX,"O jogo é excelente, leve, com gráficos ótimos, um dos melhores jogos de corrida da player story, recomendo pois foi um dos primeiros jogos que joguei e ele é ótimo. Não me arrependo de jogalo pois na minha opinião ele é perfeito.",5,93,1.8,2020-07-06 03:06:20
12,luiz miguel valentim dos santos,https://play-lh.googleusercontent.com/-pzC4BEPx8mM/AAAAAAAAAAI/AAAAAAAAAAA/AMZuuck-2W4Xenqea1D4pvm4OwBOmETFLg/photo.jpg,O jogo é otimo mais precisa aumentar os gráficos e qui tal adicionar o modo multplayer,4,1,,2020-10-15 00:21:19
13,Leonilson Pereira,https://play-lh.googleusercontent.com/-LkN2XuvDg1o/AAAAAAAAAAI/AAAAAAAAAAA/AMZuucl4S4wxyKcIKEPYnOpmdg63ip7jhw/photo.jpg,"Bom,esse jogo é muito legal e radical mais infelizmente, tem muitíssimos anúncios de outros apps somente isso mais forra isso ótimo.",3,3,1.8,2020-08-04 07:53:17
14,Felipe Tadeu,https://play-lh.googleusercontent.com/-br6b9Fstvk0/AAAAAAAAAAI/AAAAAAAAAAA/AMZuuckRQ32ZYjmLhiasKUaIhJrZmqP5nQ/photo.jpg,"Quando eu era mais novo o jogo tinha turbo e dinheiro no meio dos mapas... Agora nao tem mais e nao esta dando para trocar a cor do carro tbm. Fora isso o jogo e otimo, me faz lembrar minha ifancia",5,4,,2020-07-09 14:04:28
15,Ariel V.,https://play-lh.googleusercontent.com/a-/AOh14GjbSyorJbpYgP-TIh-6t99I06UPDLRpnBWTQjEBVQ,"Se você procura um jogo de corrida que mesmo com poucos MBs seja bom. Esse é o jogo! Corrida bem feita, sem bugs, resolução baixa sem perder a qualidade de experiência.",5,5,,2020-07-01 00:17:38
16,Deassis Lima,https://play-lh.googleusercontent.com/-jMCKnUIG0Vs/AAAAAAAAAAI/AAAAAAAAAAA/AMZuucn04g79MRhExyLmXnMQ12A3bQenHg/photo.jpg,"O jogo não é mt bom ele tem graficos ruins ele sempre usa os mesmos mapas e os graficos do mapa parece ser de papelão, eles deviam adicionar narradores linguas diferentes o modo sozinho de graça e o modo que voce tem que bater o recorde de tempo, mas fora isso o jogo é bom so tem alguns defeitos é leve é bom jogo de corrida quando for viaja abaixar ou etc essa é minha opnião.",4,18,,2019-07-17 16:32:24
17,Luiz Phelipe,https://play-lh.googleusercontent.com/-4HLz5BFU9Rk/AAAAAAAAAAI/AAAAAAAAAAA/AMZuuclFjffyUyjIxNHWmN6lHTiwrQiAbw/photo.jpg,"Muito boooommmm,o jogo é ótimo,gráficos maravilhosos,não tenho o que reclamar,o melhor jogo de carro que já joguei em toda a minha vida!As vezes trava mais é por causa do meu celular que é antigo e péssimo.Parabéns aí aos criadores de Fast Racing,vocês são muito massa!!!",5,702,1.8,2019-06-28 20:06:01
18,Mariamo da Fátima Estambul,https://play-lh.googleusercontent.com/-TpNmrohdl4U/AAAAAAAAAAI/AAAAAAAAAAA/AMZuucmc73_RHGF6Q7K8j3AjEoOS68_0Cg/photo.jpg,"Bom...mas têm um porém, possuí uma única estrada e únicas curvas e sem mudança de ambos. Mas é óptimo jogo sem tanta publicidade e fácil de jogar.",5,4,,2020-05-27 20:00:25
19,Hygor Marques Moreira,https://play-lh.googleusercontent.com/a-/AOh14GjKY5_9kxw5t08H9H-WXCHYZDGK4nMjTG4rDFMi,"Gosto muito desse jogo Mas deveriam melhorar os gráficos,colocar mais carros e mais fases. Jogo ótimo para passar o tempo.",5,5,,2020-07-31 01:59:56
20,Daniel Durães,https://play-lh.googleusercontent.com/-CljGq5NflsM/AAAAAAAAAAI/AAAAAAAAAAA/AMZuucnIXzRN7JuX-YchSoCaXfzIKHuYDw/photo.jpg,"Muito bom meu deus melhor jogo da minha vida . Graficos bons ,sons bons ... eu acho que toda a gente o devia de jogar nao e viciante sem net da para jogar quando vao passear melhor de viagem. Aconcelho -o(a) a jogar . Parabens a quem o criou esta muito bom mas mesmo muito. A toda a gente que gosta de carros e de fazer drift este e um bom jogo para o fazer juro mesmoo meu irmao nso para de o jogar mas volto a dizer nao e viciante ja esta quase a desbloquear um carro ja desbloqueou 3 formas jogar",5,214,1.8,2020-03-15 16:50:54
21,Fabricio santos de melo,https://play-lh.googleusercontent.com/-HH1kIi6_wGI/AAAAAAAAAAI/AAAAAAAAAAA/AMZuuckQWVds_tIe7FlsJSE75b7e_CQNYQ/photo.jpg,"É um jogo muito bom mesmo, bem divertido, jogabilidade ok, a única coisa que deixa a desejar e o gráfico, é muito infantil.",3,2,1.8,2020-07-04 16:09:05
22,Jeova Gabriel29,https://play-lh.googleusercontent.com/-cgBrgwdf35k/AAAAAAAAAAI/AAAAAAAAAAA/AMZuucnZBDanhX_Gw36Nev4L53OFTDqhFw/photo.jpg,bom no meu celular esse jogo trava um pouco mas tenho certeza que o problema é o meu celular porque já joguei esse jogo no meu tablete antes e não travava mas falando sobre o jogo ele é incrivelmente incrível o único problema é que são sempre os mesmos carros se vocês colocássem novos e se fisecem um modo online seria ainda melhor,5,184,1.8,2019-07-17 14:22:43
23,APRENDENDO COM A DHULLY,https://play-lh.googleusercontent.com/a-/AOh14GjSsAcHTO0Eo4zUYBIYcjnJSJhe48clRYvmEUB1,Bom esse app é ótimo mas porém estou ainda no segundo carro mas é pq eu não jogo muito kkk mas legal o jogo.,5,0,1.8,2020-10-27 23:00:50
24,BaTaTa Sniper,https://play-lh.googleusercontent.com/a-/AOh14GgM1Ikz4pmV70y4vNI5Wnrm6n7eLNyH_riaP-torg,"Kkkk n mudou quase nada desde o tempo q eu jogava, jogo exelente muito bom, só precisa melhorar os gráficos e colocar mais uns 4 carros novos, tirando isso os controles são bons a jogabilidade e tudo mais. Essa é jogo marcou minha infância.",5,160,1.8,2019-10-31 18:06:36
25,Indiaa,https://play-lh.googleusercontent.com/a-/AOh14GjgqpBPRdebVZi0S_mooAeFP-74daUTOEXpru6BSw,"Esse jogo é maravilhoso, tô viciada, senti falta de um carro preto, e deveria ter mais pistas. Mas é otimo, podem baixar! 😍",5,6,1.8,2020-05-15 19:02:29
26,Loucura Gamer Oficial,https://play-lh.googleusercontent.com/a-/AOh14GgRpkk0jfFS1npdSLZQ24-S_AwY9OOAIUzPbcrXNg,"(　･ω･)☞ Que nostalgia quando eu era menor eu gostava muito de jogar ele no meu primeiro celular , achei que esse jogo tinha acabado mais em 2020 eu achei. Tô muito feliz !",5,0,,2020-09-08 09:53:58
27,Carlos Silva,https://play-lh.googleusercontent.com/-s1XrARyIhGI/AAAAAAAAAAI/AAAAAAAAAAA/AMZuucnaWCi7myl_EhQsiogqMAjXEfULLw/photo.jpg,"E um ótimo jogo,mais eu já zerei todas às fases😆 e comprei todos os carros 😈 e estou com um dinheiro absurdo e não tenho mais nada com que gasta 😱 atualiza o App e coloque fases novas e carros novos por favor eu adoro esse jogo mais já está ficando muito chato não ter mais nada para fazer 😭",5,211,1.8,2020-04-10 21:41:47
28,Maurício gaymer,https://play-lh.googleusercontent.com/-wz2yvozPERY/AAAAAAAAAAI/AAAAAAAAAAA/AMZuucko3mwkCEcXs90P5wiwR7nJavxDVw/photo.jpg,Atualizar o jogo diminui os preços dos carros deixa os carros realista e as pistas também e só isso mesmo espero que façam isso por favor,5,4,1.8,2020-07-08 19:32:46
29,FLASH GAMES,https://play-lh.googleusercontent.com/a-/AOh14GggQ2pp92lKZ--EKpKVf884cpfbXiccOEE_PJiBgw,"seu jogo é muito bom desenvolvedor. bpm e leve. Poderia competir com jogos mais pesados...mas tem que colocar controle de setas para esquerda e direita e torna_lo mais facil, pois na terceira corrida já fiquei no ultimo lugar.",4,27,1.7,2019-05-15 12:43:32
30,Cesar Aguiar,https://play-lh.googleusercontent.com/-vBWJ6RAB0Wk/AAAAAAAAAAI/AAAAAAAAAAA/AMZuuclhfmrPDFMqxPNhMLfTP179rrBv-A/photo.jpg,Poderia o cupar menos espaso eu não com segi abaixar esa por caria. Será que este jogo é legal pois nunca vou saber não é!?. Me desculpe por a palavra anterior mais é verdade não sou de julgar as coisas sendo malvada más só estou falando à verdade e o que eu sinto desculpime por falar iso do jogo mas vocês podem melhorar iso . Botando o jogo por um pouco .,1,22,,2019-09-29 21:34:01
31,Mary Campos dos Santos,https://play-lh.googleusercontent.com/-xhsEJhV04uk/AAAAAAAAAAI/AAAAAAAAAAA/AMZuuckT3SUwf2UUA3fqP0bfZ-X90c1Aag/photo.jpg,"Olha só para começar é a minha opinião, eu ainda estou instalando, parece bonzinho só para constatar,peximo de baixar que só Deus na causa, se quiserem baixar baixem,se não quiser não baixem até mesmo porque não vai ser eu que vou inpedir.Ah espero que seja bom pra eu não perder meu tempo precioso 👋👋👋.",3,77,,2020-04-13 13:43:49
32,Akat Boruto,https://play-lh.googleusercontent.com/a-/AOh14GicUhYF5cGM95EJ1ck0gqSvzpz0dcQmt165jZIteQ,Esse jogo é bom pra quem tem o celular ruim mas não compensa instalar por que um dia eu tava jogando e eu tava em primeiro lugar e meu carro bateu no nada,1,0,1.8,2020-08-18 19:07:39
33,Eduardo Gomes,https://play-lh.googleusercontent.com/-suu1w81FU24/AAAAAAAAAAI/AAAAAAAAAAA/AMZuucmYJLCZGK1vvTC0WPFBMzaqp-GZ0Q/photo.jpg,"Excellent jogo,joga quem sabe,só que o meu é Multilaser E lite e trava mas dou um jeito!",5,0,1.8,2020-10-12 18:45:48
34,Antonia Paz de Moraes,https://play-lh.googleusercontent.com/a-/AOh14GiKV8IgkHusOoHI5RSwY8ElAvfP908X47lNjBSWkg,"Muito bom. Os anúncios não são muito frequentes. Em relação aos gráficos, não são dos melhores, mas pelo menos, economiza bateria (porque gráficos baixos não gastam muita bateria).",5,80,,2019-12-07 16:30:13
35,Um usuário do Google,https://play-lh.googleusercontent.com/EGemoI2NTXmTsBVtJqk8jxF9rh8ApRWfsIMQSt2uE4OcpQqbFu7f7NbTK05lx80nuSijCz7sc3a277R67g,"O jogo è muito bem, uma coisa que poderia melhorar e os preços dos carros pq são muito caros e demora muito para conseguir tanto dinheiro, até que a pessoa consiga ela já terá enjooado do jogo",5,14,,2018-09-16 12:33:42
36,Xigzay,https://play-lh.googleusercontent.com/a-/AOh14Gg5zp-c-0bzuHz9liD3dGGbDthg6iPqJScoGxrc1Q,"Eu já joguei esse jogo em 2018 e era muito bom. Porém ainda não sei se continua, mas provavelmente sim. É o melhor jogo de corrida com carros na minha opinião.",5,3,,2020-06-22 21:49:38
37,Talyson almeida,https://play-lh.googleusercontent.com/a-/AOh14GgrwvlIg3xAb3_Au0nLjr7idL4bzTiy05SX8q_d,"Olhão jogo é bom, o único problema de eu não ter dado 5 estrelas por causa do controle. eu não consigo ficar virando a tela direto no me acostumei, por favor coloquem um controle de seta para esquerda e para direita👍👍👍",4,10,,2019-07-23 23:06:13
38,Ademir Rodrigues,https://play-lh.googleusercontent.com/-d93xyau2GUM/AAAAAAAAAAI/AAAAAAAAAAA/AMZuuckexJxCmvqKRwhp26tEGzNJTjzQ1w/photo.jpg,Este jogo e muito bom so que os carros podiam ser mais baratos por que eles são muito caros mais fora isso esse jogo e bem legal recomendo que abaixem este jogo,4,3,1.8,2020-05-14 12:24:24
39,Luiz Fernando,https://play-lh.googleusercontent.com/a-/AOh14GiB_gtUtuIhRQsSR2Sfl27WNMOIhLcFuAHhhYEd,Esse jogo é top mais coloca mais carros legais e algum prêmio no final de cada corrida uma roleta da sorte que ganha dinheiro ou diamante diamante serve para alguma coisa tipo comprar coisas para o carro dinheiro para comprar carro e cada roleta dava um prêmio,5,212,1.7,2018-11-08 23:03:32
40,isaac Ribeiro Freitas,https://play-lh.googleusercontent.com/-ZOh88CIOQFU/AAAAAAAAAAI/AAAAAAAAAAA/AMZuucm_Lu82DXoq9kupLqctx_mzdRbR6A/photo.jpg,"Não é tão chato não,alembde ser leve,meu irmão achou legal mas eu instalei ele para ele jogar mas na minha opinião eu acho ele bom,da pro gasto ou melhor do que nada,más o jogo é bom sim não é ruim não.",3,2,1.8,2020-05-14 11:31:53
41,Degradê Gráfica,https://play-lh.googleusercontent.com/a-/AOh14GhNPAuwnS1JpcVJLRXO59iy24jv29kll55yG--QGQ,O jogo é ótimo se reclamarem da velocida de baixar ou de gráfico vai jogar um ps4 então.,5,3,1.8,2020-05-25 15:42:55
42,Matheus Filipe Caldeira,https://play-lh.googleusercontent.com/-BmtT77R_i0g/AAAAAAAAAAI/AAAAAAAAAAA/AMZuucnXbrIcA7WasShrNKQ9NztijR6INQ/photo.jpg,O jogo é o mesmo de 2014 eu jogo desde de pequeno e o jogo não muda nada bora inovar colocar novas fazes novos carros talvez um modo oline mais fora isso o jogo é ótimo mais tem que inovar,5,0,,2020-06-10 17:29:02
43,Abdul Cadre Zeferino,https://play-lh.googleusercontent.com/a-/AOh14Ghn-QHutVCPPWmGNVJkwAzDG2Mi_e2of7-pVu9T,é um jogo muito legal não ocupa muita memoria muito rapido devertido... Baixe não vai si arepender,3,0,,2020-10-15 02:36:01
44,Tecnologia Iniciante Canal,https://play-lh.googleusercontent.com/a-/AOh14GgMJp9TjM8chWl9W2Iosf-HMAEFaiIlojG2wtLV,"Simples, bom, divertido! Perfeito! O melhor jogo de corrida, simples pouca memória, roda em qualquer celular e não tem bugs.",5,18,,2018-11-06 18:50:01
45,Tharso Andryell Dias De Oliveira,https://play-lh.googleusercontent.com/a-/AOh14GgYt5D7o-wK-tnT-sWVlIiDK9J3piQOAfSTZJ-Ugw,JOGO Ñ MUITO BOM Eu compro para iniciar a partida na frente e com o nitro maximo Mas mesmo assim o carro passa de mim!! Os carros ñ tem muitas melhorias Pfv melhorem isso!,1,2,1.8,2020-08-16 13:59:39
46,ninja br,https://play-lh.googleusercontent.com/-uSMQcxmtYSw/AAAAAAAAAAI/AAAAAAAAAAA/AMZuucmshIxM5qTrZM_PE8gme45l7aVMRg/photo.jpg,O melhor jogo de todos de corrida pra android eu jogava td hora esse jogo la pra 2013 e eu ja zerei todas as fases e comprei tds os carros to bilionario e nao tenho nada pra comprar,5,3,,2020-06-29 15:44:35
47,Um usuário do Google,https://play-lh.googleusercontent.com/EGemoI2NTXmTsBVtJqk8jxF9rh8ApRWfsIMQSt2uE4OcpQqbFu7f7NbTK05lx80nuSijCz7sc3a277R67g,"a sensibilidade e muita alta e devia ter mais placas para dobra e quando um carro bate em voce ,fica sem controle",2,8,,2019-01-17 08:16:13
48,Odilon B2C,https://play-lh.googleusercontent.com/a-/AOh14GirUuQ7vvlvPqYqP5IOBvP5a9qxvbuRZsthw0bn,"Tava pronto para dar 5 estrelas até perceber que quando o carro bate ele trava e fica muito tempo ""bicado"" na parede. Resultado: Você que estava em primeiro, fica por último e perde ou tem que reiniciar a corrida 0_o - positivo, tem anúncios mas é insuperável por enquanto",2,4,1.8,2020-05-12 13:54:20
49,F3N1X do GUN'S N ROSES,https://play-lh.googleusercontent.com/a-/AOh14Gh8uAe-4X_MEA-diu_BvHaKD1zsbY4ppZ_25eNm7Q,"Foi um dos primeiros jogos de corrida mobile android que eu joguei, eu ainda me lembro la em 2014 com meu tablet multilaser passando altas horas nesse jogo kkkkkk",5,13,1.8,2019-11-13 13:21:31
50,X_LGS_X HS,https://play-lh.googleusercontent.com/a-/AOh14GjkhWgs4Bv6BVm2ikYWwtlO3AeM2SpyRIqa-J0,Se quiserem que o jogo fique bom então destruam o jogo e faça tudo de novo... eu só dei uma estrela por que eu tenho dó.,1,0,,2020-09-05 19:21:04
51,Francisco Reinaldo Da Silva Costa,https://play-lh.googleusercontent.com/-2EeOXj7aNfA/AAAAAAAAAAI/AAAAAAAAAAA/AMZuucmFNBZ99ts0x4T7iPG_CNu_fR35uQ/photo.jpg,"Um clássico prefeito, mas bem que deveria ter mais pistas diferentes.",4,1,,2020-07-16 19:29:17
52,Nicolly Andrade,https://play-lh.googleusercontent.com/-oau5kLGHwM4/AAAAAAAAAAI/AAAAAAAAAAA/AMZuucm2S1oo7G2dm_yBbhjGpGWugJ3lfg/photo.jpg,Esse jogo é muito bom mais ele poderia melhorar a gente compra um carro novo e em vez dele ficar mais rapido ele fica mais lento que os outros que no jogo sao mais lento,4,12,1.8,2020-04-29 15:15:21
53,Caio Barros,https://play-lh.googleusercontent.com/-zrreYXj0noM/AAAAAAAAAAI/AAAAAAAAAAA/AMZuucllegSFJ3BPaRz3sXMQImn7r3VNmA/photo.jpg,A anos jogo esse jogo e nunca colocaram pistas novas carros e outras coisas deveriam colocar mas coisas parece ate q abondonaram o jogo affs. Mas msm assim ele é bom,2,1,1.8,2020-05-15 03:45:35
54,FENIX FX,https://play-lh.googleusercontent.com/a-/AOh14Gjv-6h5BVdgDqgSWS5ium5kQ8TqgDbzXh5fPpVSNw,legal mas e dificil comprar carros...muito daora..esse jogo entrou na mimha lista de classicos,5,0,,2020-08-03 10:14:07
55,Um usuário do Google,https://play-lh.googleusercontent.com/EGemoI2NTXmTsBVtJqk8jxF9rh8ApRWfsIMQSt2uE4OcpQqbFu7f7NbTK05lx80nuSijCz7sc3a277R67g,"o jogo e bom,mas eu acho que ainda presisa de algumas mudanças,por exemplo,havessi novas fases em climas diferentes como de dia e ate na chuva,os carros podian ser mais baratos e tambem podia a ver outros modelos espero que vcs ajeitem isso em ums futura atualizaçao.",5,124,1.7,2018-12-02 22:54:09
56,Bruno Giovani,https://play-lh.googleusercontent.com/a-/AOh14GhLeVhr2isc73jSPxSDzGIt_KC2Z23o1_Kduu_VhQ,"Um jogo bom que mesmo não tendo altos gráficos ele é um jogo viciante, (principalmente em 2015) parabens. #nostalgia",5,84,,2020-01-08 00:49:02
57,Arthur Serrão,https://play-lh.googleusercontent.com/a-/AOh14GhOVmwg6fxT-9xWEiTzpKiGY8tDZ62533nshSxj_g,Muito legal o jogo gráficos legais e uma jogabilidade muito boa depois que a gente ganha uma corrida a gente até ganha mais do que 2000 cinco estrelas pra esse aplicativo 🏎🎮🌟🌟🌟🌟🌟,5,38,1.8,2020-01-26 22:13:03
58,Kerulin Domingos,https://play-lh.googleusercontent.com/a-/AOh14Ggtr4f5811aJwWjd-k1rDIwA1ZU1-ENsAgtds1HkA,"Adorei: gráfico, jogabilidade, competição, pouco de dificuldade e as fases !",5,30,1.8,2020-03-26 18:48:14
59,Nicías Alves,https://play-lh.googleusercontent.com/a-/AOh14GjVcDl2_aAMveBTMphVZ_eslyu9OqQ1KG7EzxcKt-4,"uma super aventura...muita adrenalina e o melhor! ocupa pouco espaço. recomendo... mas, gostaria de mais opções de mapas.",5,38,1.7,2019-02-17 21:06:47
60,Benvolio Piedade,https://play-lh.googleusercontent.com/a-/AOh14Gi1LdQHl6X7X_xSUFvs1JQKAw1N7TJYeIa3VQ8m5A,Muito bom! Há que reclamar por não saber jogar. O desempenho do jogo no telefone tem a ver com a capacidade também! Parabéns aos programadores,5,57,1.8,2020-02-14 05:34:47
61,Irika Michelle,https://play-lh.googleusercontent.com/a-/AOh14Gix78EJrelR6lWGL6Rrg-WBFpDyLn2LCGjW4W9d_aY,"Gostei muito de instalar esse jogo , só que deveria ter mais carros e modelos de rodas , rebaixar carros , etc",4,22,,2019-12-14 10:08:25
62,Namaste Reiki do Brasil,https://play-lh.googleusercontent.com/a-/AOh14GhhBO9eQ3EK4UOO2czczdkIYUc2ZkI1fsbZnSNY,"Muito legal, só estou desinstalando por falta de memória do meu aparelho. Mas recomendo o jogo.",5,0,1.8,2020-06-22 14:09:52
63,Um usuário do Google,https://play-lh.googleusercontent.com/EGemoI2NTXmTsBVtJqk8jxF9rh8ApRWfsIMQSt2uE4OcpQqbFu7f7NbTK05lx80nuSijCz7sc3a277R67g,Gente como e que se faz pra desbloquear as fases...tem um tempo q to jogando e não saio da primeira fase o que tem q fazer pra desbloquear isto?,3,9,,2018-11-21 20:27:04
64,Aidil Ferreira,https://play-lh.googleusercontent.com/-ilgp3FBfA1M/AAAAAAAAAAI/AAAAAAAAAAA/AMZuucnyykM3SvALUS5aMLWIdGxUgtzdlg/photo.jpg,"Eu achei bem legal , eu acho que a potência da velocidade deveria ser maior , e os carros são muito caros.",5,7,1.8,2020-01-05 18:55:45
65,Um usuário do Google,https://play-lh.googleusercontent.com/EGemoI2NTXmTsBVtJqk8jxF9rh8ApRWfsIMQSt2uE4OcpQqbFu7f7NbTK05lx80nuSijCz7sc3a277R67g,"Eu adoro jogos de carros, principalmente de corridas de carros rápidos!!!!!",5,13,,2018-10-27 16:03:27
66,David Gomes,https://play-lh.googleusercontent.com/-rRGU2009q6I/AAAAAAAAAAI/AAAAAAAAAAA/AMZuucnJ3h8fcRIngBJK7eo3Ma3oDRCOTQ/photo.jpg,esse jogo é muito bom gostei desse jogo essa é a quinta vez que eu instalo e bom msm gostei.,5,1,,2020-10-14 12:03:58
67,João Antônio,https://play-lh.googleusercontent.com/-2QStJ-9iJXk/AAAAAAAAAAI/AAAAAAAAAAA/AMZuucmXExl8uZm_eHA3ZdiCx9gnBcg-nA/photo.jpg,O melhor é mais leve jogo de corrida 3D é divertido e roda até em celulares simples.,5,15,,2019-09-05 19:08:43
68,Um usuário do Google,https://play-lh.googleusercontent.com/EGemoI2NTXmTsBVtJqk8jxF9rh8ApRWfsIMQSt2uE4OcpQqbFu7f7NbTK05lx80nuSijCz7sc3a277R67g,"É muito bom, só podiam deixar a estrada mais realista o céu os carros a sensibilidade e só. Mais em geral é muito bom.",5,16,,2018-10-21 01:41:36
69,p c,https://play-lh.googleusercontent.com/-XMm-GYbNLPQ/AAAAAAAAAAI/AAAAAAAAAAA/AMZuucnA0PwzOBNSkTBI96FNE_JdtE0F_Q/photo.jpg,"Básico fácil de jogar, mas ainda se mantém desafiador e divertido",5,9,1.8,2019-11-24 12:03:04
70,Jhonathan Francisco Leal,https://play-lh.googleusercontent.com/a-/AOh14GiJErg_uTWpxxagBKUzSyFGO_6nWcp3RQhG2npm,Muito bom!!! otima jogabilidade e graficos perfeitos além de ser um jogo leve!,5,13,,2020-02-14 15:32:18
71,Gaby Modesto,https://play-lh.googleusercontent.com/-KpP9cLjOCew/AAAAAAAAAAI/AAAAAAAAAAA/AMZuucm0DODhklrH1mZo7yI3SOWYtYTtjQ/photo.jpg,"O jogo é bom, mas não entendi o carro vai muito em auta velocidade e não dá pra controlar. Não gostei",1,6,1.8,2020-04-10 14:37:51
72,Nilza Cardoso,https://play-lh.googleusercontent.com/-ZiqDwLmIrEI/AAAAAAAAAAI/AAAAAAAAAAA/AMZuuckMGlL2YVAgnLkbafdKC5oQCTC_pA/photo.jpg,"Ótimo jogo controles bons, gráficos bons podiam colocar mais carros e cenários fora isso é um ótimo jogo",4,5,,2020-04-06 22:07:08
73,Luis Gustavo dourado Dourado,https://play-lh.googleusercontent.com/-Az-yPSB9y70/AAAAAAAAAAI/AAAAAAAAAAA/AMZuucnA3N-zaNrZvIPWp1VmDNVesYOP7Q/photo.jpg,Ainda está instalando por isso dou três estrelas mais pelo que eu vi nas imagens é legal e muito top mais quando eu jogar vou fazer outra resenha e mudar meu número de estrelas,3,6,,2020-03-26 19:49:07
74,neilson gamesclub,https://play-lh.googleusercontent.com/a-/AOh14Gg0a4hhbG0ms6O_ReXcmgTWpm_xI0enTwpsO04E,Bom jogo daria 5 estrelas se não fosse uns bugs que apareçem de vez enquanto mana desenvolvedores por favor corrigam isso aí por que se não vou ter que desinstalar,3,8,,2018-10-12 22:55:49
