,userName,userImage,content,score,thumbsUpCount,reviewCreatedVersion,at
0,Artur Sampaio,https://play-lh.googleusercontent.com/a-/AOh14GhwFvsBrXXozXWqzyMOaP5ZCnnHLbdcki9bX9Ct,"O jogo é ótimo com corridas de rua e vários carros para customizar,Sobre a gasolina eu não vejo problema algum na verdade pode ser uma trava para pessoas não se vinciarem no game mesmo que alguns tenham dinheiro ou moedas e consigam reabastecer o tanque,Os dois não são infinitos então na minha opinião o jogo é ótimo com certeza recomendo e por cima não tem anúncios para quem não gosta como eu.",5,39,,2020-10-23 21:33:28
1,HazzarD 007,https://play-lh.googleusercontent.com/a-/AOh14GgGe4AtuAbstFZqLIOgdP-lcorcUtEGjpgSlcLp,"Muuuuito bom, graficos lindo, jogabilidade otima, muitos carros q ate ficamos em duvida de qual escolher, so faltou aumentar a gasolina nem q seja mais cinco galões, mas aumentar seria uma boa, e poderia ter como jogar multiplayer no inicio do jogo msm, com amigos e tudo mais, mas fora isso e otimo o jogo parabens!!",5,103,5.0.1,2020-09-23 08:01:07
2,gabriel vettilo,https://play-lh.googleusercontent.com/-lb7AdAtGzqk/AAAAAAAAAAI/AAAAAAAAAAA/AMZuucntqzNyt8CugJgh57y6Tgsg_VgWyw/photo.jpg,"O jogo é otimo, os gráficos são bons mas tem um bug que fala que faltam 9999999999horas para consiguir uma gasólina e se vc não tem moeda ou você gasta dinheiro de verdade ou você simplesmente para de jogar ficaria feliz se arrumasse mas fora isso o jogo é bem legal e divertido",4,75,5.0.1,2020-09-05 11:09:58
3,Unknown,https://play-lh.googleusercontent.com/a-/AOh14GgbFb_H_NI4NRIkB4wo_01m8XTffI6OvS-BmjrACg,"Um jogo de corrida muito bom, alem de muitos carros diferentes ele não é Pay2Win, e os graficos são pouco ultrapassados mesmo pela epoca que lançou, eu recomendo bastante, é um ótimo jogo pra passar o tempo",5,63,5.0.1,2020-08-13 23:24:22
4,Jonathan Castro,https://play-lh.googleusercontent.com/a-/AOh14GheqdOvsoQBWCASY43Xwca7Sq6038esx7H7bK653Q,"O jogo é muito bom, porém... O jogo não resgatou meu antigo save da nuvem, tendo eu que recomeçar tudo do zero. A prova é tanta que tenho 20 das 39 conquistas. Mas meu save antigo não pode ser recuperado, lamentável!",2,61,5.0.1,2020-09-30 15:15:48
5,GABLADER 2005,https://play-lh.googleusercontent.com/a-/AOh14Gicb1BZTiJmzCf9XRh-ef_qIk25KV1gTjdW8TNTUg,"Até hoje não esqueço da incrível experiência de jogar esse jogo! Por favor @Naturalmotion, Façam pelo menos uma última atualização nele, como vocês fizeram no Csr Classics! Um Abraço.",5,1,,2020-11-06 20:56:00
6,Victor Hugo Zuliani,https://play-lh.googleusercontent.com/a-/AOh14GiIa9sUQy5h1N_9YxQfBs4N_UDz7LFMjLtKNJpaKg,O jogo e antigo mas além de não de ter gasolina suficiente pra fazer as corridas! É muito bom o jogo parabéns!,5,2,,2020-10-14 14:46:02
7,VITOR,https://play-lh.googleusercontent.com/a-/AOh14GgtbuFQYamshqmCoislR_L8qgHkrR-jBI1gGodW,O jogo é otimo. Nao tenho muita coisa a falar do jogo é perfeito e acho que esta melhor que csr 2. Sem muitas frescuras e muito nostalgico. Só acho que era para ter mais gasolina a desposição.,5,4,,2020-08-14 00:11:07
8,Byll Jose Vasconcelos Silva,https://play-lh.googleusercontent.com/-4xWJ8xoHYKc/AAAAAAAAAAI/AAAAAAAAAAA/AMZuuclQ6H-1HXkEoEhs2UmODI3dhMJfnQ/photo.jpg,"O jogo é até bom,mas com essa frescura de ter gasolina pra correr isso é chato e ainda mais que aparece pra fazer melhoria no carro sendo que você não tem dinheiro pra fazer as melhorias e o jogo ainda te dar muito pouco dinheiro nas corridas,desse jeito você nunca vai evoluir nesse jogo...",3,172,5.0.1,2020-07-26 15:10:33
9,Natanael Batista,https://play-lh.googleusercontent.com/-1ORiUyFiiwg/AAAAAAAAAAI/AAAAAAAAAAA/AMZuucnUOwq0hOPnBpDsk7-2kBbsvUb3Ag/photo.jpg,"Muito legal o jogo,é a primeira vez que baixo ele e estou curtindo demais,vários carros esportivos e licenciados parabéns pelo desenvolvimento.",5,3,5.0.1,2020-09-16 19:53:53
10,Vitor Gabriel,https://play-lh.googleusercontent.com/a-/AOh14Gh--h0giZjeVeuoUEczrBF0yhsETQNqEyk1sPHfUA,"O jogo é ótimo,ele possui bons gráficos,uma jogabilidade diferenciada o que da um ótimo ar ao jogo,porém na minha opinião alguns carros deviam ser mais baratos,pq pra pessoas que são free to play(não pagam nada de dinheiro da vida real no jogo)fica muito difícil de conseguir carros melhores",4,147,,2020-07-27 11:47:06
11,Cláudia anjos Cláudia anjos,https://play-lh.googleusercontent.com/-16gPSNoOlAc/AAAAAAAAAAI/AAAAAAAAAAA/AMZuucnhML_sq6QQZqGk8zt58zqDolzE1g/photo.jpg,O jogo e bom. mais o Último líder e impossível vencer eu melhorei meu carro todo e não consegui vencer. Os outros líderes passei normal mas o Último 👎. E era pra ter mais carros mais rápidos,3,1,,2020-10-06 19:30:56
12,roberto DKS,https://play-lh.googleusercontent.com/a-/AOh14GgxrF_5PJrK4SVYFJ7960_KXgLBevEw3lIgF0o0,O jogo é ótimo perfeito mas eu não entendo por quê vcs tiraram o modo multiplayer e tbm o jogo tem um big ou um erro que ele não salva o progresso depois que desistala e reinstala novemte,5,3,5.0.1,2020-09-14 14:46:57
13,Adilton Almeida,https://play-lh.googleusercontent.com/-kjNjAMH-CE0/AAAAAAAAAAI/AAAAAAAAAAA/AMZuuclZjnnQ2-3Uye-ZnE7Y8AlaWamimw/photo.jpg,"Esse jogo tá muito chato cara , tudo gira em trono de dinheiro real , só para baixar q não tem custo de resto tudo tem e para evoluir no jogo então 🤮 Desinstalando !!",1,3,5.0.1,2020-08-14 23:09:31
14,David Gamer,https://play-lh.googleusercontent.com/a-/AOh14Gjcvs4CbdtkahCHtUPML4KC7iWMchOWzZfizNSZ,"O jogo tem um gráfico otimo mas Os desenvolvedores desse jogo Podia criar de corrida e 3D Uma corrida , pela , franca , italia , rio de janeiro, E etc.",4,3,,2020-10-01 19:46:15
15,ViniTV# Ferreira YT,https://play-lh.googleusercontent.com/a-/AOh14GhXX8JLObIa8ZKftgPFl2fDBIR8A-IfxEYs10Bs8A,Esse jogo está melhor a cada ano eu tô jogando de do 2 dia de lançamento só pra IOS e otimo só a única coisa que eu não gosto e dos carros que tá caro pra pessoas que não tem dinheiro .... mas o resto está ótimo.. continuie asim ... AMO VCS QUE FES ESSE JOGO ESSE TA MELHOR DO QUE O CSR2 ... 😀😀,5,35,,2020-07-31 22:44:25
16,Fabiana Rodrigues,https://play-lh.googleusercontent.com/-9n60EQidAlo/AAAAAAAAAAI/AAAAAAAAAAA/AMZuucmuPCfraJXq_fW1FG-TEFAx_wdfNw/photo.jpg,O jogo é muito top não abandone ele não vamos trazer mais carros novos e poder trocar os aros dos carros e rebaixar os carros poder modificar,5,1,,2020-11-02 11:43:37
17,Gump Forrest Gump,https://play-lh.googleusercontent.com/a-/AOh14GjsyVjpPagociWXku7feHt_PWIfjOPrVPXtq5pgHQ,"O jogo é muito bom, jogo desde 2014, mas não estou conseguindo recuperar minhas conquistas que aparecem no Google Play. Comprei outro celular e perdi todos os carros da minha garagem.... Todos estavam no máximo... Como um jogo pode não reconhecer o Google Play. Quando instalei novamente voltou a zero, mas no Google Play aparece que tenho 38/39 conquistas. Gostaria um feedback....",1,270,5.0.1,2020-04-20 09:07:36
18,Gabriel A.,https://play-lh.googleusercontent.com/a-/AOh14Gj-OrCVkix1ufgHrjnRWnmMBCYiIKVWxarCZV2kxw,"Eu perdi todo o meu progresso no jogo - não estou conseguindo recuperá-lo. Por favor tratem de recuperar meu progresso. E, deem mais atenção a esse jogo. Caso vcs não consigam recuperar, desinstalarei o jogo. Estou pedindo na boa porque sei que o jogo é muito bom. Tão bom quanto csr 2. Logo, 1 estrela por esse motivo. E, para o pessoal que vai ver meu comentário, tenham em mente que o jogo, pelo que vi e pelos outros comentários, não é salvo. Perdi meu tempo. Decepcionante e desagradável!",1,305,5.0.1,2020-04-05 05:14:48
19,Enseada Games,https://play-lh.googleusercontent.com/a-/AOh14Ggd3UnTfLGDtUfZIJoZj8jDPS6pFB18iyQOwc5L0w,bom eu não curto muito os jogos de corrida direta eu só tô dando 5 esteiras porque é para mim dar a minha pinhão do jogo não para reclamar porque eu não gosto do jogo então o jogo contém gráficos incríveis e ótimos pena que esse estilo de jogo não é muito a minha cará se você curte abaixa ai,5,9,,2020-06-07 15:18:30
20,Thiago Ruoso,https://play-lh.googleusercontent.com/a-/AOh14Gh5z8S28SZ-FwWriCUaNX8G4ZoZFkd_onx5-KgU,Nossa o melhor jogo de corrida da para evoluir muito ne se jogo mas a coisa são umpouquinho integradas em cada level no meu level eu to no cranios de prata e ta difícil,5,0,,2020-08-30 23:10:46
21,FᄂΛ GӨVΣΛ,https://play-lh.googleusercontent.com/a-/AOh14GhkxPj8c9QrcXxd5ykbSrSlxQyJU5R3IKJZ3O77,"Horrível Quando eu já estava na internacional o meu celular descarregou. Quando eu carreguei e fui jogar o jogo tinha voltado tudo do começo. Não jogo mais, só se jogar com hack. Perdi todo o meu progresso.",1,6,,2020-05-20 05:03:42
22,Um usuário do Google,https://play-lh.googleusercontent.com/EGemoI2NTXmTsBVtJqk8jxF9rh8ApRWfsIMQSt2uE4OcpQqbFu7f7NbTK05lx80nuSijCz7sc3a277R67g,"O que acho é que CSR Racing é jogo incrível. Porém, retirar o modo online piorou o jogo. isso provavelmente é questão de foco no CRS2, que é o mais novo lançamento da empresa. Mas isso não pode acontecer. Seria bacana também se os criadores organizassem os carros na loja por índice de desempenho, e não por marcas. Seria mais fácil. Espero que escutem a comunidade de avaliações.",4,179,,2019-03-20 21:02:29
23,Vinícius Gabriel,https://play-lh.googleusercontent.com/a-/AOh14GgXAkMP5UGaCeoalA6mdTfsT5jh0LQv0ScmOk6mryM,"Perdi todo o meu progresso do nada no jogo, e não consigo obtê-lo de novo, até gastei uma quantia em dinheiro com uma promoção, pra depois sumir todo o meu progresso",1,8,,2020-06-12 03:19:08
24,Arthur machado Machado de Jesus,https://play-lh.googleusercontent.com/-0UblOcC9Yko/AAAAAAAAAAI/AAAAAAAAAAA/AMZuucmVUety4O1pDHAcvSlKnf34Uhz0Dw/photo.jpg,"Oi ótimo jogo, meus parabéns ! Eu curto muito jogos de corrida e esse é ótimo. Porém o meu celular não é compatível com o CSR Racing (2).",4,1,,2020-10-08 22:46:39
25,-_ZBoxH60_- YT,https://play-lh.googleusercontent.com/a-/AOh14Gjbt-1tHLPXJcr8g_tFok2HwqvlpL9M08hmrhxE3w,"Vi nos comentários sobre falhas de salvamento de jogo e carros por tokens muito caros,porém já aconteceu comigo em outros jogos,tokens num jogo sim,mais pra mim sou muito ruim nesse jogo porque não consigo dinheiro,e demora pra instalar tipo 1 ano,e quase sempre vc ta intalando um jogo,depois o download mostra:instalar,e tem que instalar de novo,pra não acontecer,acontece.o motivo de perder contas e manutenção,abandono, e motivação de melhorar outro jogo,e mais coisa ruim que não seja isso.",3,178,,2020-04-10 18:51:42
26,Gabriel S,https://play-lh.googleusercontent.com/a-/AOh14GgQwyx1pOzrLkwnoHh6kyoN3fAUrhFCvmaF8Io2,Estou muinto decepcionado por que eu tenho minha conta a um tempão minutos carros etc ai quando eu desistalei o jogo e fui volta a joga depois de um tempo voltei mais quando eu entro não volto com minha E tenho que começa tudo de novo afs que raiva arrumem isso pq antes dava pra logar também no face e agora não da mais e Ai eu logo pelo Google play games o que eu não entendo e q minhas conquistas tão salvas Mais meus caros nada eu tenho wat ? Alguém me responde (Ou os desenvolvedores help) ?,3,32,5.0.1,2019-01-06 02:36:24
27,Um usuário do Google,https://play-lh.googleusercontent.com/EGemoI2NTXmTsBVtJqk8jxF9rh8ApRWfsIMQSt2uE4OcpQqbFu7f7NbTK05lx80nuSijCz7sc3a277R67g,"o jogo é bom, mas o único problema é de um carro que é o aston Martin v12 vantagem s, o problema dele é que a caixa de marcha dele é muito bugada, quando você tuna a caixa de marcha no máximo exemplo: você tá parado pra larga aí você largou, você tá de primeira quando vai trocar pra segunda ela já pula pra terceira aí quando você vai reduzir ela já pula pra primeira de novo. Criadores arrume isso porque você gasta muito tô dinheiro de graça por favor ☺",3,43,5.0.1,2019-03-31 18:35:52
28,joao victor,https://play-lh.googleusercontent.com/a-/AOh14GgJTOHnz97BUUbQlP_wpd4IrIAYDkE4_5brYUTVips,"O jogo é excelente, na minha opinião o melhor do estilo, porém após a atualização perdi todo o meu progresso e não consigo recuperar, por favor arrumem isso,não deixem o jogo acabar",1,15,5.0.1,2020-07-23 17:45:56
29,Weudez Torres,https://play-lh.googleusercontent.com/a-/AOh14GgBoSlNf4jSRMkj3_GkFpwkEWybWz53m4Lt-8mkG6Q,Boa tarde! Tinha um perfil com muitos carros e com muito dinheiro que ganhei jogando muito na troca de celular pra outro quando fui fazer login no celular novo começo do 0 novamente como iniciante... Não recomendo o aplicativo só faz perder tempo jogando sem nenhum suporte necessário para que possa resolver problema... Não recomendo baixa este aplicativo... WT.,1,46,,2019-08-22 15:07:53
30,Francisco Neto,https://play-lh.googleusercontent.com/-VPqZYbHh0Vc/AAAAAAAAAAI/AAAAAAAAAAA/AMZuuck7xkH8uIDJw6HXlpRsgs4YO5T-Ag/photo.jpg,Jogo massa mais não recomendo para ninguém se você está ai de boas não baixa eu tinha acabado de comprar um carro e o jogo voltou do inicio se você não que parssa raiva baixe outro jogo;-;,1,4,5.0.1,2020-05-18 19:17:31
31,Luis Felipe,https://play-lh.googleusercontent.com/a-/AOh14GgYnzhJuQOmAtf963vQCx2KZaUNiKewsATILfMy7Q,"Antes eu nao esta va gostando pois toda vez que eu instalava falava que eu tinha que baixar de novo mas depois que eu consegui o jogo em si é bem legal só acho que pra melhorar, poderiam colocar um modo de amigos eu queria jogar com meu pai mas nos nao conseguimos prq nao tem como",3,3,5.0.1,2020-05-30 04:05:59
32,Igor Ribeiro Mendes Cordeiro,https://play-lh.googleusercontent.com/a-/AOh14Ggui8lY1bV4FBWeAeBZ0sqYL2QfqXuqfNspfnbC,"Amo esse jogo . Faz uns 3 anos que jogo e parei voltei a jogar esses dias , houve várias atualizações e vocês tiraram o modo online ! Voltem com o modo multiplayer, coloque corrida em tempo real o jogo vai ficar perfeito !",5,33,5.0.1,2018-10-13 08:37:02
33,Washington Teixeira,https://play-lh.googleusercontent.com/-6MAPNUQpCss/AAAAAAAAAAI/AAAAAAAAAAA/AMZuucnhv1E275He0yH99K4aU2n66HP9FA/photo.jpg,sou um mero jogador queria uma plataforma multiplayer o jogo e muito bom sei que vcs estao priorizando o csr racing 2 porem não se esqueça do 1 uma plataforma Multiplayer agradiria todos os jogadores não pesso em meu nome e sim no nome de todos os jogadores que querem a mesma coisa que eu aguardo ansiosamente,5,338,5.0.1,2019-01-27 12:14:29
34,Pedro Vara,https://play-lh.googleusercontent.com/-hpxtUU12o_U/AAAAAAAAAAI/AAAAAAAAAAA/AMZuucmkmLvuieyDsoH6-6k1_AQ5Z-FS_w/photo.jpg,"Nao instalem o jogo, é 1 farsa de todo tamanho! Tinha 5 carros (sendo um deles comprado com dinheiro real) e ia no nivel 4, estava a jogar, o jogo reiniciou sozinho, resultado perdi tudo inclusive o dinheiro! Depois de mandar mail para o p4ogramador....nada de resposta, ja la vao 2 semanas! Nao instalem, nao joguem",1,453,5.0.1,2019-08-05 15:17:44
35,Paulo Emmanuel,https://play-lh.googleusercontent.com/a-/AOh14GixaraxI_r_g7rq_KJE894FJrnW0pyXYz1J4nE36nU,Excelente jogo de drag racing. Gráficos muito bons e ótimos jogabilidade!,5,3,5.0.1,2020-08-02 10:09:29
36,Roberto Maganha,https://play-lh.googleusercontent.com/a-/AOh14GjiKEGTWTfXDycn2Jw9qZiLrGKnizo62H4oc79GtQ,"O inacreditável é não conseguir jogar os campeonatos online, antes, tempos atrás era perfeito, hoje nem aparece mais os campeonatos on line. Abandonaram o jogo, deixaram pra lá... Parabéns administradores...",1,33,5.0.1,2019-10-24 19:41:08
37,Lucas Soares,https://play-lh.googleusercontent.com/-K1oQjgupB1s/AAAAAAAAAAI/AAAAAAAAAAA/AMZuucl5fZ4rKPOQ88KkpdvO4eQCdDEMnw/photo.jpg,olá csr Racing jogo e bom mais a gasolina pode ser infinita por eu joga mais o jogo no estante acabar a gasolina jogo e espetacular por também é ser de arracada de carros dei 4 estrelas mais como atualizar por favor tire essa gasolina que tem que comprar e coloque em infinita vocês tem competência colocar a câmera dentro do carros também sou isso,4,192,5.0.1,2019-02-06 18:39:07
38,Um usuário do Google,https://play-lh.googleusercontent.com/EGemoI2NTXmTsBVtJqk8jxF9rh8ApRWfsIMQSt2uE4OcpQqbFu7f7NbTK05lx80nuSijCz7sc3a277R67g,Olá galera adorei o jogo sim sou testador de betas promovido pela Google play store amei esse app e não tenho é nem vocês o que reclamar as vezes não é compatível com o celular ou iphod e alguns andróides mas na reclame espere pela próxima atualização sua vez vai chegar mas eu só tenho uma coisa pra dizer que o jogo é ótimo.,5,9,,2018-10-17 10:47:42
39,Fabio Florêncio,https://play-lh.googleusercontent.com/-xrO_JmoAGLE/AAAAAAAAAAI/AAAAAAAAAAA/AMZuuckGllCsA_VO80ZfTs0Bvku8Fu_xuw/photo.jpg,"dou cinco estrelas porquê o jogo é muito mesmo e tem bons gráficos, eu recomendo vcs baixaram,,, porém fica aqui minha crítica e ao mesmo tempo um ideal para os desenvolvedores, coloquem pilotos dentro dos carros aí sim o jogo fica top",5,264,5.0.1,2019-04-27 11:15:32
40,Deivid Dos Santos de Jesus,https://play-lh.googleusercontent.com/-SUVzLDfkDSc/AAAAAAAAAAI/AAAAAAAAAAA/AMZuucn106dhFtFIs7sNLQHHBchpBDoLUw/photo.jpg,E um jogo ótimo já tive vários carros o mal que tem limite de gasolina mais é ótimo jogue e vc vai se apaixonar,5,0,,2020-08-22 10:43:41
41,luoliver2001,https://play-lh.googleusercontent.com/-dTwEg6xZPwQ/AAAAAAAAAAI/AAAAAAAAAAA/AMZuucld23vrriDNkT4bmZvJJrwqezXLpw/photo.jpg,"Jogo bacana, porém estava com mais de 90 carros e o faltando pouco para completar todas as etapas, pois já havia ganho de todas as equipes, e indo a copa wold e também com varias etapas concluidas, perdi tudo, não conseguindo mais resgatar.",1,302,5.0.1,2019-03-13 19:38:48
42,Canal do Horácio,https://play-lh.googleusercontent.com/a-/AOh14GgR51CB_GVpY-pAKUsWE5eliFjIBbrPtIbPPxfo,"Não gostei muito foi muito difícil do que eu pensei na fase do Luther o audi a1 s line dele é muito mais rápido do que os outros a1 s line. Para quem chegou nesta fase e está na mesma luta,recomendo desinstalar o csr racing e instalá-lo de novo e comprar um carro carro mais rápido do que o a1 ou por maior preocupação compre o carro mais rápido da série 1",1,35,,2019-10-06 22:01:06
43,Kelven Kel,https://play-lh.googleusercontent.com/-cMI7GNNKCJs/AAAAAAAAAAI/AAAAAAAAAAA/AMZuuckUOkM_2BboUXQk8fzAJifY9Zyy4A/photo.jpg,"O jogo e muito bom , mais depois que tiraram o modo online fico sem graça e desanimador... ""PERDEU A NOSTALGIA QUE ERA ANTES"" quando vocês trouxerem o modo online de novo darei uma nota muito melhor , tragam o modo online de novo !",2,147,5.0.1,2018-12-09 22:16:32
44,Venâncio O Suco de fruta,https://play-lh.googleusercontent.com/a-/AOh14Gh-XGbcbC1rasKRHHhrJ6PE1zeR_8PaxEElzPaQRw,não há salvamento no jogo e essa parada de esperar gasolina encher é um pé no saco.,1,4,5.0.1,2020-06-29 20:17:09
45,Rosana Araújo dos Santos,https://play-lh.googleusercontent.com/a-/AOh14GjPKW-NpNbBFbSmegzKUgV71otrxYrBmPdNonF3Yw,"É um jogo excelente!Ótimos gráficos,boa jogabilidade,varios carros de diversas marcas,e ainda tem varias horas de gameplay.Recomendo mais para quem gosta de jogos de corrida de arrancada!",5,487,,2019-09-07 00:30:59
46,Tatiana Silva,https://play-lh.googleusercontent.com/a-/AOh14GivL3bB2jDNwyesfKY_E9kGQVczIrzSV0On1xCkkw,"O jogo nao é mau , mas podiam melhorar mais a app em questao de ser possivel jogar entre multiplayers e de se conseguir entrar na conta da playstore e de adquirir o carro que é preciso com o donwloud do crs racing 2. De resto nao tenho mais nada a pontar ao jogo.",2,18,,2019-09-07 13:08:28
47,Kauan Maruyama,https://play-lh.googleusercontent.com/-OTNU6J4YQKc/AAAAAAAAAAI/AAAAAAAAAAA/AMZuucmsAPi4naza3a1K3E9CoLnbYolkqw/photo.jpg,"O jogo é muito bom, mas vocês poderias adicionar a opção de comparar os carro!",4,0,,2020-08-15 11:19:40
48,Rosangela Rodrigues,https://play-lh.googleusercontent.com/a-/AOh14Ggpp7iJ5G3Id02dHBdbZRNauttk2pz89goTYUZJ,Um jogo que testa seu limite e tem carros que esistem na vida real e estremamende incrível e radical,5,0,5.0.1,2020-10-06 19:49:06
49,Otavio Carvalho,https://play-lh.googleusercontent.com/a-/AOh14GiHCB5n8O_luAOpUB4QBH_PkuIxYSK368xifCmvlQ,"O jogo é muito bom, mas poderia ter um modo online ou via bluetooth, isso seria bom!!! Mas parabéns à NaturalMotionGames Ltd por todo esforço!!!",4,24,5.0.1,2019-07-28 15:13:06
50,João vitor,https://play-lh.googleusercontent.com/a-/AOh14Ghfu3QE4b-o39voGYw69a4LP9gOcdqgy2QwLV6ybA,"Poderia ter mais coisas ao redor da pista mas a jogabilidade , gráficos e etc e enrresistivel é o jogo não tem muita propaganda só queria que tirasse a quantidade de gasolina e que poderia correr a vontade",5,61,,2019-12-12 16:26:13
51,TheMillerOz,https://play-lh.googleusercontent.com/a-/AOh14GicoCdbzKRJkqmpFci76ijPlkZGbXxcaEeQ-F-yqA,"Jogabilidade excelente, Grafico perfeito, unica coisa ruim é que a gasolina demora muito pra se restabelecer! tirando isso o jogo tem tudo pra ser o melhor",5,6,,2018-12-01 20:12:56
52,Mayko Douglas,https://play-lh.googleusercontent.com/-c1Edfnx9Fc0/AAAAAAAAAAI/AAAAAAAAAAA/AMZuucmgXZpCle478CiCw0KB2ZQP86lF8w/photo.jpg,"Podia ter como vender os carros,Pq eu sou iniciante e estou na série 2,Aí eu estou sem dinheiro pra botar as melhorias certas pro meu carro aí eu não conseguir vencer o jogo é bom,Mas podia ter uma atualização e colocar a opção de vender o carro",3,100,5.0.1,2020-03-03 20:09:36
53,Vitor Fernando,https://play-lh.googleusercontent.com/a-/AOh14Gg3OBApZimtt2h3LOeHYcWym-z5WErqMqR70Mff,O jogo e muito bom mais alguém sabe me dizer se o modo multiplayer ainda funciona,4,0,5.0.1,2020-06-20 09:28:31
54,Cøringa Das sømbras,https://play-lh.googleusercontent.com/a-/AOh14GiwaFFgP1Jx-nLLoKT6hhtMpmeSOr2vGLjKl2URZw,Esse jogo é maravilhoso os gráficos e a movimentação e tudo de bom:v,5,0,,2020-10-07 19:15:12
55,Gui artes,https://play-lh.googleusercontent.com/a-/AOh14GgERwi9KeC4UsIz4B_Q2gdf2TE543IjBvwnkTOd,"O jogo e sencacional mas precisa de um toce de realidade ei fica legal pra desgraça, para bens para os densevolvedores caramba vcs são bom de verdade viu!",5,1,,2020-07-23 18:58:35
56,Canal White,https://play-lh.googleusercontent.com/a-/AOh14GhLpJg9f5C1tOKlSiPr4yFZCuhuUhgogN-rOhhDEQ,Muito legal parece need for speed de arrancadão muito legal.,5,0,,2020-08-13 09:53:33
57,murillo aprontando,https://play-lh.googleusercontent.com/-5vAnbr65ous/AAAAAAAAAAI/AAAAAAAAAAA/AMZuuckDmE0MmmgCptzF_cXVVHYsDpeNLg/photo.jpg,Gostei muito mais acho que deve aumentar o salário na corrida regulamentar e também diminuir o preço de dinheiro nos carros a maioria acho que compro os mais caros e rápidos e da um trabalhão conseguir esses carros sem paga,4,8,5.0.1,2020-04-28 14:23:24
58,Wagner Cardim,https://play-lh.googleusercontent.com/a-/AOh14Gj67i_sWTaiD3EmX4t_uB0Tbs3RRQm693c6g-XR7A,"jogava esse jogo desde 2015, fiz bastante compras no jogo, tinha todos carros do jogo, aí hoje fui voltar a jogar e não consigo entrar com minha conta e começo do zero, se não resolver isso, volto a deletar ele é nunca mais baixo um jogo dessa empresa.",1,7,5.0.1,2019-06-05 21:43:45
59,Abner Vieira,https://play-lh.googleusercontent.com/a-/AOh14Ggpyxnh-0GfndnbOSBfUASBKPnxWRnB7L5fntNy,"Parabéns por criar a Ferrari fxx k, um carro que e da terra ou veio de outro planeta pra ter as melhorias por tokens impossíveis de se conseguir, desinstalei por causa desse método horrível de se melhorar um CARRO que existe na vida real e concerteza não ganha peças por tokens de melhoria.",1,47,,2020-03-27 11:29:07
60,SHALOM CULTURA FJU,https://play-lh.googleusercontent.com/a-/AOh14Gjac75zarEiCGzvYoH4UjeGZMnxBpzfHCkEZm03NQ,"Estou decepcionado com os desenvolvedores perdi uma conta de extrema altura. Eu começei a jogar esse game a muinto tempo la em 2014 ou 2015 ai volto a jogar e perdi tudo... por favor ainda estou na esperaa , vcs tiraram o modo loguin com face eu perdi muinto dinheiro nesse jogo",1,13,,2019-09-28 17:17:54
61,Kellyton Rafael,https://play-lh.googleusercontent.com/-1gHF5M2aHL8/AAAAAAAAAAI/AAAAAAAAAAA/AMZuuclyM_wlNC6qJBbzNG2XjjRiluSnCg/photo.jpg,"Aplicativo muito bom, mais tem um porém troquei de celular, e não voltou meu perfil que eu estava. Não esta no nível que eu estava, nem os carros que eu tinha . Só as conquistas que então carretas.",1,93,5.0.1,2020-02-15 22:13:51
62,Radinildo Brito,https://play-lh.googleusercontent.com/-xIL-3504SBA/AAAAAAAAAAI/AAAAAAAAAAA/AMZuucklrJpY4DSqXBSokgU5rKv5IX129Q/photo.jpg,"Não tem opção de vender carros, o valor das peças são muito alto em relação a premiação das corridas e quase sem condições de ganhar moedas de ouro",3,1,5.0.1,2020-06-25 21:11:55
63,Dorival Dori,https://play-lh.googleusercontent.com/-jtzc469z2-I/AAAAAAAAAAI/AAAAAAAAAAA/AMZuuck3j-RIYjWLKg8vpzIauWoyuJOFHg/photo.jpg,O jogo é muito legal vocês podia também fazer um tipo de jogo de arrancadão só q = Forza Horizon 3 aí você aí você escolhe um carro para daí você fazer corrida de rua aí os carros mais ruins era os mais caros e os mais e os melhores eram os mais baratos tá então um beijo e um abraço para o criador do jogo CR CRS Racing abraço,5,2,,2018-11-14 10:45:09
64,Rúbia Serragioli,https://play-lh.googleusercontent.com/-kTfJjPamizY/AAAAAAAAAAI/AAAAAAAAAAA/AMZuucncD2MDNaXB_lS_VzSj2NJKq_TDYw/photo.jpg,Eu estou instalando esse jogo e esta no 13% e arrumem para instalar mais rápido possível que eu não tenho esse jogo porem as fotos do jogo eu enstalo recomendo baixar o jogo é muito bom pelas fotos do seu jogo mas tenho so 4 jogos dai meu irmão de 14 anos ele falou que eu posso estalar 5 jogos não pesados mas eu achei o jogo legal,5,24,,2019-08-22 08:50:01
65,Luciano Oliveira Mariano,https://play-lh.googleusercontent.com/a-/AOh14Ghv8CkWMmPXAfYDHzCXBs2SA4Wujev3L0ULQBSoxw,"Excelente jogo,porem a gasolina gasta rápido demais e demora recompor",3,1,5.0.1,2020-07-16 02:35:09
66,Samuel Ribeiro,https://play-lh.googleusercontent.com/-qQlmR7RUWiE/AAAAAAAAAAI/AAAAAAAAAAA/AMZuuclUsSym6wvWc7RDEXkjJGBkNGXuNQ/photo.jpg,Seria bom se tivesse modo de customização e mais paisagens,5,0,,2020-10-21 15:07:25
