,userName,userImage,content,score,thumbsUpCount,reviewCreatedVersion,at
0,Um usuário do Google,https://play-lh.googleusercontent.com/EGemoI2NTXmTsBVtJqk8jxF9rh8ApRWfsIMQSt2uE4OcpQqbFu7f7NbTK05lx80nuSijCz7sc3a277R67g,"O jogo é muito chato e também ruim, por que quando eu quero entrar nele, fala assim: Block Craft 3D parou. Que dogra é todo dia isso mais que chato não agento esse jogo horrível, antes eu conseguia entrar mais não consigo mais que droga! Esse jogo precisa melhorar muito ainda colocar mais avatares diferentes mais lugares com cores entre muitos ainda colocar mais blocos diferentes mais cheguei mais pirua tinha que ser assim mais a vida não é assim, a vida é feita de surpresas!",1,60,2.12.17,2020-11-08 11:17:53
1,Adriano Vieira,https://play-lh.googleusercontent.com/-PqhVaVf4amk/AAAAAAAAAAI/AAAAAAAAAAA/AMZuucm8rWZyuODaR9w77k0tJnQ_28f5DA/photo.jpg,"Legal! só poderia ter opção de desbloquear alguns intes que são pagos, exp: atingindo recordes diários... como na opção atual, onde a pessoa escolhe usar gemas para finalizar de imediato a construção ou se vai bloco a bloco terminar... também poder girar o avatar quando a câmera estiver no modo 3a pessoa... ñ estou conseguindo girar, ele gira mais mantendo-se de costas.. fora isso, o jogo é bom sim...",4,1328,2.12.15,2020-10-27 14:31:39
2,Clarinha unicórnia,https://play-lh.googleusercontent.com/a-/AOh14Git_KxBb5Unpc8oPKa7mHM-bBvBqXwVSbxhv_Dq,Jogo muito legal e muito incrivel mas... o problema é que temos que pagar para conseguirmos mas gemas e mas dinheiro isso faz falta no jogo peço que fazem como a cada casinha que fazemos agente ganhase 100 moedas e 100 gemas 😄 Por favor arrumem isso...a e outro problema é que o jogo trava trava trava trava e peço que arrumem tambem ...at3 por que não é tão facil fazer um jogo como esse😊,3,148,2.12.17,2020-11-07 10:45:51
3,Ana Luiza Jacobina França,https://play-lh.googleusercontent.com/-u4Yf7pA4aaA/AAAAAAAAAAI/AAAAAAAAAAA/AMZuucns9FxLmag6gCESEBIR3065bj-IYQ/photo.jpg,"Olha o jogo é ótimo mas não sei se vou conseguir dar 5 estrelas porque as coisas tem um preso muito alto, o pacote natureza é 200 gemas e são muito difíceis de conseguir e se for comprar são muito caros, é difícil achar a vila sertã , a tempo que tento achar a vila do meu irmão e nunca consegui e ainda tem alguns problemas que podem ser encontrados em outros comentários. E aliais eu esqueci de falar sobre a questão do salvamento, eu desinstalei o jogo e quando eu baixei de novo não tava salvo🤦",4,410,2.12.15,2020-11-05 11:46:33
4,Vitoria Gonçalves s2,https://play-lh.googleusercontent.com/a-/AOh14GjYKKn10_jFX6iF6-pltW8Bj1y0tNzAcnZN-3yBCg,Esse app é bom não precisa de internet a não ser que queira trocar anúncio por alguma e as coisas estão muito caras não precisava isso tudo .tudo custa 50diamantes 😩. (😢fora que eu não consigo encontrar a vila da minha irmã que é davila💕... Pq queriamos jogar na mesma vila e o aparece nem um resultado encontrado 😢)se não me engano .e por isso dei 3 estrela,3,601,2.12.16,2020-10-29 15:07:19
5,Jesse FamilyCraft,https://play-lh.googleusercontent.com/a-/AOh14GiSWPTu3wnlvF-wCv7imxF7EdmiSLLLiRzonRxlfQ,"Oi, eu gostei do jogo, e bom para passar o tempo, ele e bom, mas queria que tivesse uma funcao de vc desenhar meu avatar, tipo, como se fosse pixel art, e quando eu terminar de desenhar meu avatar a textura estaria na galeria, seria bom isso, so o avatar do player, nao a dos moradores, e tambem seria bom se o imbolo § funciona-se neste jogo como no minecraft, se eu colocar esse simbolo + alguma letraou numero o texto mudava de cor, seria bom tambem, se fizerem isso darei 5 ⭐ a vcs, e obrigado!",4,1332,2.12.15,2020-10-20 11:21:34
6,Isadora Meotti,https://play-lh.googleusercontent.com/-9sgEXOW8gCY/AAAAAAAAAAI/AAAAAAAAAAA/AMZuucnxPIop2XaUSS3I4IlGkkXhi5OAhg/photo.jpg,"O jogo muito legal não aparece muito anuncio mais e MUITO DIVISÍVEL DE CONSTRUÍ AS CASAS POIS NAO TEM COMO VOAR ... eu sei que tem como comprar mais eu sou uma criança e nao posso comprar e não é só isso eu não uso aqueles tipos de controles eu uso com toque que do outro lado voces pode ter esse controle opcional, o pode ter a opiniao de jogos online ai os amigo podem joga junto Bom se voces nao conseguirem fazem essas coisa tudo bem meu maior problema e vouar, pode se com dinheiro do jogo",3,161,2.12.17,2020-11-05 22:57:09
7,Mocelin Júnior,https://play-lh.googleusercontent.com/-Tz5b5ruDxYQ/AAAAAAAAAAI/AAAAAAAAAAA/AMZuucmNdACVba-A8Zdm5-ueK7oIrkUa_Q/photo.jpg,"Esse jogo é top demais sou nivel 10 e acho muito top,instalem esse jogo no começo eu achei difícil agora sou acostumada e acho fácil.Só uma coisa q eu n entendi direito é q minha vila ta Boa e ngm da like nela acho mt triste!😓😓😓😓😓😓enfim o nome da vila é: vila do comum:e assim eu me divirto nota 1000 só da 5 mais eu ia da 1000 galera esqueci qm for bom eu dou mt like sempre quis like na minha vila eu achei ela top eu amo escreve kkkkkkkkkkk,por enquanto o jogo é otimo halloween vem pfv !!!",5,303,2.12.15,2020-10-31 00:58:00
8,Gabrielly Camargo,https://play-lh.googleusercontent.com/a-/AOh14GhJVKscEgZwcEP0wnfQeREZd04aMFrSL1Ji263gzg,"O jogo é muito bem feito,mais o único ruim é que não tem uns recursos como escada,laje, e etc As coisas tbm são muito caras que te obriga a comprar com dinheiro de vdd ou então esperar,e isso danifica o jogo pq ninguém gosta de ficar esperando.Mais o jogo é ótimo recomendo para todos,espero que coloquem esses recursos 😊",4,839,2.12.15,2020-10-26 18:42:53
9,Heráclito Maques,https://play-lh.googleusercontent.com/a-/AOh14GgfsBsU1yJyiEJhBkViIznI1ZwUoInX8yejWd82xw,"Eu amei amando, esse jogo é muito bom.Tem varias coisas bem legais como torres, objetos, piramedes, florestas etc, também tem como vc ver as vilas e construçoes de outras pessoas. Por isso que aminha nota é cinco estrelas, parabéns as pessoas que fizeram o jogo.👏👏👏👏👏👏",5,166,2.12.15,2020-10-26 20:12:26
10,jose silva,https://play-lh.googleusercontent.com/-7W1He_JahSo/AAAAAAAAAAI/AAAAAAAAAAA/AMZuuck_qRX5NBiXhj2Ktuos34xgMXfFyQ/photo.jpg,"O jogo é muito mas muito bom serio da para construir predios casas navios ate da para construir o titanic,torre efel,estrela da morte e muito mais. eu recomendo que voce estala este jogo voce vai amar este jogo muito Parabéns criadores voces fizeram um dos melhores jogos do mundo.",5,19,2.12.16,2020-10-31 09:12:51
11,Lidia Vitória,https://play-lh.googleusercontent.com/-QVMsRpvDL8A/AAAAAAAAAAI/AAAAAAAAAAA/AMZuuclnZi7-heMafgWc711ulcRNwZubZA/photo.jpg,E legal a minha critica e pq não pode falar com as pessoas e nem tem muitas coisas pra gente construir a metade tudo bloqueando ai fica sem nada a casa mais e legal e divertido! Obs: inclusive os animais não dar pra ter tem que esoerar varias coisas!!! Mais e legal devertido 🙄🙂,4,3,2.12.16,2020-11-05 16:49:30
12,Mario Barreto,https://play-lh.googleusercontent.com/a-/AOh14GiUuXsbndagX4FVzyI_x2eHp7ct9LgZHrqQGHzwgQ,"Esse jogo é muito fofo!😄😇 é bem feito tem animais,🐰 casas para construir,🏠 até navios, e a Torre de Paris😇💖 e outras coisas que você pode imaginar ou construir. E você pode visitar as vilas das outras pessoas, e os moradores ha são tão fofinhos😇😢💖. O jogo é excelente e bonito e muito bem feito! Parabéns!💛💚💙💜💕",5,1216,2.12.15,2020-10-20 18:32:17
13,Simone Linhares,https://play-lh.googleusercontent.com/-xxjvnQFUq34/AAAAAAAAAAI/AAAAAAAAAAA/AMZuuckt8OKWVrCOG4jTjDI7N5g5aMg7KQ/photo.jpg,"Eu amei , adorei , apenas um errinho , pois poderia ter mais limites de bloco , pois este jogo e para nós esperamos nosso pensamento montando é 150 blocos não dá pra nada . Mas o resto tá legal , super recomendo . ❤️❤️❤️❤️❤️♥️",5,604,2.12.15,2020-10-21 19:09:02
14,Thiago Palomo,https://play-lh.googleusercontent.com/-6UfgWtTL9UE/AAAAAAAAAAI/AAAAAAAAAAA/AMZuuckKXbOfAzraxuzL7IlI9MydATnxTw/photo.jpg,"Gostei mas poderia para criar pessoas, por exemplo, minha vila se chama SanThiago mas eu fiz um prédio e ele não tem pessoas dentro. Mas pf se for fazer as pessoas não coloquem para pagar com diamantes. Se vcs fizerem isso eu darei 5 🌟 concordo com os outros comentários",4,236,2.12.15,2020-10-25 12:52:20
15,Thais Queiroz,https://play-lh.googleusercontent.com/-LcjX7SC8akI/AAAAAAAAAAI/AAAAAAAAAAA/AMZuuclspxLSuom2Y2ukgmGRW2GqDBFvcA/photo.jpg,"O jogo é muito bom, melhor que free fire. A gente construi muitas casas🏠🏡,muitos prédios 🏢🏢, a gente mesma(o) construi o que a gente quiser, ganhamos curtidas dos visitantes. Ganhamos animais 🐕🐶🐱🐈🐹🐰🐺🐓🐔🐄🐮🐴🐖🐽🐼🐯🐆🐻e muito mais, visitamos as vila das (o)pessoas . então espero que tenha gostado do jogo Block craft thau thau galerinha. 😗😙😘😚😍",5,32,2.12.15,2020-10-27 18:01:47
16,José Silva,https://play-lh.googleusercontent.com/-NV577dggwWM/AAAAAAAAAAI/AAAAAAAAAAA/AMZuucn3ciLkZvmr5v5V4NUE-S_TzBbZQA/photo.jpg,Oi esse jogo é muito legal eu amei ele Esse jogo é muito maravilhoso mas tem uma coisa ela passei de construir mais caras legais e também esse jogo é ruim porque parece assim menininhos até que é legalzinho mas era para poder né você é mais assim dentinhos mais legalzinho entendeu então meu boné mais ou menos,5,75,2.12.16,2020-10-29 16:36:05
17,Angelica Maria,https://play-lh.googleusercontent.com/-x4TMpvTcz3A/AAAAAAAAAAI/AAAAAAAAAAA/AMZuucmte0vuSEDLQP90mU48scyva-2EbA/photo.jpg,Esse jogo é muito legal eu amo muito por isso eu dou cinco estrelas mas eu acho que poderia ter blocos infinitos assim poderíamos fazer novas construções sem nos preocupar com os blocos mas mesmo assim eu dou cinco estrelas que eu acho muito legal esse jogo,5,11,2.12.16,2020-11-02 10:32:28
18,Anna Beatriz Oliveira pinto,https://play-lh.googleusercontent.com/-IDADybvLwEU/AAAAAAAAAAI/AAAAAAAAAAA/AMZuuclgBW18BpyuifR9efrErsA9ccThpA/photo.jpg,é muito legal esse jogo aliás tem vários blocos várias coisas que podem fazer como que eu vi nas fotos ali que mostra o que dá para fazerpede os casos apartamentos muitas coisas mas na hora que chegar no nível 6 nível 5 e você pode fazer o que você quiser até moto G3 adorei 😍😍💘💘💞💞💞💞💞💞💕💕💕💕,5,0,2.12.17,2020-11-08 21:58:58
19,Salada de Assuntos,https://play-lh.googleusercontent.com/a-/AOh14Gi2ggz9ATUmzBRu-J5lv5rWLebimx9f9VOhtknr2Q,O jogo até q é bom mas depois q a gente passa do nível 2 q no caso depois vai vir o nível 3 ele acaba o tutorial e ai começa a desaparecer blocos eu tinha feito um muro para separar e dps tinha desaparecido os blocos até quando eu irmão tava jogando eu pensava q ele tinha tirados os blocos mas não foi o jogo 😡😡 isso atrapalha mas esse jogo merece 4 estrelas parabéns para quem fez esse jogo 👏👏👏👏,4,131,2.12.15,2020-10-19 21:57:48
20,Elenilde Titan,https://play-lh.googleusercontent.com/-A_zySkO7BlI/AAAAAAAAAAI/AAAAAAAAAAA/AMZuuck7YW9YF43Zt8Ny47Byh07F2nZKJg/photo.jpg,Muito desse jogo do block craft porque dá para viajar dá para fazer tudodestrói a gente se divertir faz todas as coisas entendeuse joga mais bacana que os outros Minecraft mas tem mais alguns Minecraft que são grátis mas tem uma Minecraft que não é chato jogos não são esse jogo não é tão chato mas eu gostei do para c****** dele é muito bacana a gente pode visitar os amigos gente e as estrelinhas são tão legal que não tem nem estrelinha,5,26,2.12.15,2020-10-26 14:08:55
21,Nicolly Cristina,https://play-lh.googleusercontent.com/a-/AOh14GglWhqy1sLzRi53mDqEiJdidg6IGfoEYychc69I,"Amo muito ele, só que não tem como andar mas rápido, queria muito que vocês lesão meu comentário e resolvesse isso, mas fora isso, é incrível 💖",4,2,2.12.16,2020-11-05 14:57:36
22,Élio Lucena,https://play-lh.googleusercontent.com/-eKBL97Bmaqo/AAAAAAAAAAI/AAAAAAAAAAA/AMZuuclFax7SyL92kylvLdec4RglYHyp4w/photo.jpg,O jogo é legal mas se pudesse usar os móveis de botar em casas tipo cama fogão guarda-roupa quando eu jogava eu tava no nível 3 e eu não ganhei nada só ganhava então dono do jogo por favor bote a verdade no jogo mas mesmo assim dou cinco estrelas,5,1,2.12.17,2020-11-07 14:00:18
23,Vanderli Rodrigues Morelin,https://play-lh.googleusercontent.com/-kzdb3-y6FYA/AAAAAAAAAAI/AAAAAAAAAAA/AMZuucnoeSjXByx6eqLqeCEkMckrcu4z2w/photo.jpg,Block Craft é um dos melhores eu gosto dele porque a gente pode viajar em vários lugares mas poderiam também fazer ver mais fáceis passar de nível para conseguir as portas as camas é bem menor tá mas eu adoro Block Craft escreve aí narinha que o Block Craft vai arrasar .,5,14,2.12.17,2020-11-02 14:49:08
24,Esmeralda Carreira,https://play-lh.googleusercontent.com/-CdqVhw_wgkQ/AAAAAAAAAAI/AAAAAAAAAAA/AMZuuck2G-Wx4znWfGT6NZgYCGaddfUPYA/photo.jpg,"E um dos melhores jogos que joguei divertido, imaginativo e outras coisas só que tem alguns problemas um deles imagina se quiser fazer uma árvore e não tem para fazer por isso vem se metem isso é outras coisas. Obrigado",5,8,2.12.16,2020-11-02 16:56:22
25,Maria Eduarda,https://play-lh.googleusercontent.com/a-/AOh14GjypxHY-PWm7Pg5tKEDjmnYzcf-ld72O8oNxQCh,"Este jogo é bom , porém, os que não podem pagar ficam com poucos blocos , não temos bancos para sentar , nem TV, nem portas , nem NADA . Os tripulantes da vila poderiam vir mais rápido, e no começo do jogo a pessoa poderia escolher um animal de estimação, pode ser : um gato ,um cavalo , um lobo , uma galinha ... qualquer animal , mais ele poderia escolher a cor do animal . Seria ótimo, mais amo este jogo . Obrigada se puderem fazer as melhorias . Maria Edudarda .",5,682,2.12.14,2020-10-13 20:21:16
26,•Evelyn Gamer Strawberry•,https://play-lh.googleusercontent.com/a-/AOh14Gj8AFDj_XkbqoDg6s3MvoRIA5OtGLuS-yyhYp_7,"É um jogo muito legal, muito bom! Amei, mas poderia ter uma quantidade de blocos maior(Obs: Eu ""jogo"" pelo iPad). Mas mesmo assim o jogo é incrível! Amei recomendo.",5,199,2.12.15,2020-10-19 15:13:48
27,Stephani,https://play-lh.googleusercontent.com/a-/AOh14GhXURZykzruU2VD3kktXgdPYkA1ZV8jlKV1-m6BgQ,"PÉSSIMO!, espero que arrumem isto, desinstalei o jogo e instalei para jogar, eu tinha várias construções, e sumiram elas quando instalei, fiquei muito triste pois demorou muito as construções, espero que façam uma atualização para arrumarem isto.",1,198,2.12.15,2020-10-20 13:24:01
28,Tyrcua Aquino Da Costa,https://play-lh.googleusercontent.com/a-/AOh14GjhznI5QmHfyfjcJ5pgut1Cu0tUrlcFSI-ilYDk6A,Muuuito bom adorei pena que tem que passar levels para conseguir algumas coisas e também mais roupa para os avates mas tirando isso seria (é) melhor que o minecraft original.,4,1,2.12.17,2020-11-06 15:01:45
29,Magaly Neves,https://play-lh.googleusercontent.com/a-/AOh14Gj2bh7xUchoRlqzHDI9eaqslqgJjWMhi6qufzUZa40,Muito bom eu fiz uma casa Nada e jogo não tem comercial do uma coisa as coisas da verdade tem que ter no nível 3 mas é legal só essa parta mas e muito bom abaixa vc não vai se arrepender e da para vc faze uma casa por explo a minha que é subterani é bem legal vi. Eu amo jogar mas queria que pudesse jogar junto com os amigos sem ter o mesmo Wifi sabe pq o manigrefit e pago é ai é bem chato mas obrigada vc que vi o até ai tá nada bom mas o meu vai ter que tirar coisa etao se vc for baixar,5,1,2.12.17,2020-11-07 00:42:41
30,Flavia Souza,https://play-lh.googleusercontent.com/-x0WEjDm5h8Q/AAAAAAAAAAI/AAAAAAAAAAA/AMZuuckIrcyl1wVr4copZdAZzscrBpoLbA/photo.jpg,Eu já joguei ele é legal só tem umas falias mas fora essas falhas tem muita coisa legal tem uns problemas só que é legal do mesmo jeito só que ele tem muito mb e demora um século para construir as coisas da cidade também não liberam os móveis mas fora isso tem muita coisa legal e também eu gosto que não tem aqueles monstros igual do jogo verdadeiro do Minecraft,4,15,2.12.15,2020-10-20 18:20:24
31,Thiago Alcantara,https://play-lh.googleusercontent.com/-dwouBjfRcxA/AAAAAAAAAAI/AAAAAAAAAAA/AMZuuclTIG9qjFZ0LyPRzJVBJ7F3dCOJdw/photo.jpg,Ótimo jogo mas nós últimos dias um bug está acontecendo com a propaganda e as recompensas. Não estou recebendo a recompensa devida após alguns conteúdos de propaganda.,5,9,2.12.15,2020-10-26 14:10:50
32,Heloisa Oliveira,https://play-lh.googleusercontent.com/-QuLnGRyWj8g/AAAAAAAAAAI/AAAAAAAAAAA/AMZuuckOMHX1322FAsTG429slyqtQaPgdg/photo.jpg,"O jogo é muito bom! É o jogo ""parecido com o Minecraft"" mais legal e bem feito! Ele não tem propaganda, dá para ter animais, moradores e explorar outras vilas! As únicas coisas que eu achei meio desnecessárias foi o uso excesso de compras com as gemas, a maioria de coisas que vamos comprar são com gemas, as únicas coisas que são pagas com moedas são ALGUMAS construções, até porque é muito difícil conseguir gemas. E também eu acho que poderia ter mais blocos grátis! Mas o jogo é maravilhoso!!!💕",5,385,2.12.14,2020-10-15 17:12:03
33,kaique Celestino de jesus,https://play-lh.googleusercontent.com/-OJrWtu_hJEU/AAAAAAAAAAI/AAAAAAAAAAA/AMZuucnDXEQYESpzBZ0dLuLS6dvNxz97Rw/photo.jpg,"Achei maravilhoso, mas só tenho uma sugestão, colocar mais blocos pra construir e torna mais fácil conseguir moedas e animais , beijos e obrigado pela experiência, 😙😙",5,10,2.12.15,2020-10-27 09:23:35
34,Maria das Graças Branzani Pagotto Pagotto,https://play-lh.googleusercontent.com/-nmLfAgDYKEo/AAAAAAAAAAI/AAAAAAAAAAA/AMZuucnVKHWwLqMSAaPuqedcr51jA29MMg/photo.jpg,"O jogo é legal! mas, tem várias coisas q vc n pode usar, pois tem q tar em tal nível e isso e MT ruim. E a movimentação e meio lerda, mas, tirando isso o jogo e mt bom!",3,119,2.12.15,2020-10-18 01:56:43
35,Alécio Polidor,https://play-lh.googleusercontent.com/a-/AOh14GipIl3cg8T2w1LMw6J9lOSjoBpxXJesHPh4VCh5i-Y,"Ese jogo é muito legau o único problema é, os blocos que tem que comprar ou subir de niveu , mais tirando o poblema o jogo é ótimo ok queridas e quiridos instalem esse jogo daora de mais tchau .",5,13,2.12.15,2020-10-26 00:36:38
36,M a r i a f e r n a n d a,https://play-lh.googleusercontent.com/a-/AOh14GjFmj9jK3UFQxfLXjnn3P8HHihxgpdpuh_AEup7sw,"Ele e muito bom muito legal,o único defeito dele e que as vezes o jogo buga,mais acho que isso só dá comigo mais tudo bem,o resto é tudo legal!",4,3,2.12.16,2020-10-31 21:38:39
37,Divertindo com Kah,https://play-lh.googleusercontent.com/a-/AOh14GhdrgpgyQ_hgTV63SUhmRoCKOifH-CF9rWbzBhu,Eu gosto e muutooooo bommmm e n precisa de internet e e muito façil de construir so q as vezes da uma travadinha mais e muito legal amoh esse jogo eu vou viajar e eu posso ficar jogando no meio da viajem😉,5,2,2.12.17,2020-11-05 12:09:51
38,Luciana Oliveira,https://play-lh.googleusercontent.com/-Syga90r9bVc/AAAAAAAAAAI/AAAAAAAAAAA/AMZuucm-Iyy0etGOIU-hoG-_3pXnEEchGQ/photo.jpg,Só não dou 5 estrelas por causa do problema de o jogo não conectarse na minha internet. Ele não conecta na internet e eu não posso comprar coisas ou conhecer outras vilas.,3,3,2.12.16,2020-10-30 19:35:09
39,Marta Palhano,https://play-lh.googleusercontent.com/-JWEwGVwreak/AAAAAAAAAAI/AAAAAAAAAAA/AMZuucnyS4G7tId2tqL3ScRGdEEW8VHCXg/photo.jpg,"Melhor jogo do mundoooooooo ultra bom mais tem um porém,tinha que ter uma atualização tipo...mais variedades de blocos s uma atualização nós gráficos um pouco pq,só os furnitures estão indo bem com a colaboração do jogo já os blocos precisam de atualizações novos blocos e atualizações nele,tbm tinha que ter uma atualização da Vila pois ela está muito difícil de ser atualizada pois tinha que ter uma escavadeira pode ser de moedas que é melhor pois essas máquinas ajudam a reformar minha Vila ok?",4,556,2.12.14,2020-10-12 00:33:40
40,Ana Julya Polo,https://play-lh.googleusercontent.com/a-/AOh14Gjz25F8tYW_lbiZeeXNhyWUC5MPKlchlulAZxxpGg,O joga é muito bom mas ... Só pode canhar as coisas da casa no nível 3 e quando você chega no nível 3 precisa gastar 400 diamantes para desploquear mas tirando isso é muito bom,4,2,2.12.17,2020-11-07 09:08:06
41,Ana Paula Zanin,https://play-lh.googleusercontent.com/-HU5chHjHwnI/AAAAAAAAAAI/AAAAAAAAAAA/AMZuucn25b_yPisAhYMj-BmRCkx5tfwVSQ/photo.jpg,"Jogo legal mais os blocos podia ser infinito, pq quando alguém quer faze uma mansão ñ tem as mesmo bloco pra continua da mesma cor aí tem pegar de outras cores .",3,0,2.12.16,2020-11-01 12:51:23
42,Jeferson Miranda,https://play-lh.googleusercontent.com/a-/AOh14GhCbL15WcEICZZ2yKajbEbSnV_AOa1FKaFvFBc,O jogo podia liberar algumas coisas por gue muito caro pra compra os blocos e as casa famosas custa 400 gemas o jogo e difícil axa gemas e gastar minha Internet por diamantes minha em Internet vai toda em bora melhorem jogo eu gostei do jogo mas si não arrumar eu des instalar Block crfete 😑😑😑😑,1,4,2.12.15,2020-11-04 13:05:05
43,Glenda Jesus,https://play-lh.googleusercontent.com/a-/AOh14Gj4sTT03ciq1pgGMuJuFS9SEPoAh23YXP3gBBMw,Muito bom! Só precisam disponibilar a função de voar e baixar o preço dos animais que aumentou e deixar grátis o pacote natureza 🤗,5,0,2.12.17,2020-11-08 19:08:29
44,Tamiris Fagundes Scardovelli,https://play-lh.googleusercontent.com/a-/AOh14GiSXtfR2Yy7A2KnVYdhNXHwtpTO5gBqHUjfvEqzxQ,Amei esse jogo mas queria que fosse mais fácil ganhar esmeraldas e também queria que quando estiver cavalgando poder construir coisas mas esse jogo é muito bom dou 5 estrels🥰🤩👍⭐⭐⭐⭐⭐.,5,0,2.12.17,2020-11-07 20:12:43
45,rusil_r2 448,https://play-lh.googleusercontent.com/a-/AOh14GgVILuYaQv7mHFttCGtjj9qU0ardoMh933QKm1D-g,Melhor jogo só tem um errinho que depois de eu construir uma casa moderna eu fui fazer tipo como se fosse uma mina e eu achei uma passagem pra algum lugar com Tochas iluminando e tudo e no fundo tava escuro e como eu sou medroso eu não vi tudo,4,154,2.12.15,2020-10-18 09:58:09
46,Daniely Alves,https://play-lh.googleusercontent.com/-OsPpZXwbu8I/AAAAAAAAAAI/AAAAAAAAAAA/AMZuuck2SRp_xAc0WRBTIi3noS9BOeiCnA/photo.jpg,O jogo é extra ordinário o ruim é q não dá para mergulhar na água entre eu recomendo e neo recomendo e ele é bem legal para se destrair e quando não tiver na dá pra fazer e só pegar o cll e jogar,4,0,2.12.16,2020-11-05 16:04:49
47,Luísa Gordiano,https://play-lh.googleusercontent.com/a-/AOh14GisN0IVEKdLohWiswpLi53WbPQx6k_SsprJCWw3Gg,"O jogo é perfeito não tem oque reclamar na minha opinião ,mas tenho algumas sugestões para o jogo ficar ainda melhor. Deveria ter a função de colocar nomes nos animais , ter planta aquática e ter animais marinhos ,como peixes ,tartarugas etc. E tambem os animais receber comandos dos usuarios como eu . E poderia tambem ter animais mais espalhados pelo o mundo( como o cavalo a galinha) alem desses muito mais e poderiamos capitura-los pra se tornar nosso pet . E eles poderiam ter familia.",5,3873,2.12.14,2020-09-08 09:47:38
48,Mel de azevedo silva A. Silva,https://play-lh.googleusercontent.com/a-/AOh14GhehTai44xytcMFEwlJWNW3tHmXZbk1Fy5_bpfx,"Amo. Eu deis de pequena jogo esse jogo e sempre amei, soque ele tem nível e quando vc chega no nível 3 tem quantidade de blocos, pfv melhorem isso e o jogo por mim vai ser 5 estrelas!",4,6,2.12.16,2020-10-30 23:37:13
49,Giovanna Pilger,https://play-lh.googleusercontent.com/-JTvOStvfcy0/AAAAAAAAAAI/AAAAAAAAAAA/AMZuucmlogzuEN3BPoBSW2MLuHhi3Pl2Lg/photo.jpg,O jogo é ótimo mais acho q tinha q ter mais blocos e sem precisar chegar no level 3 Ñ poder jogar juntos e ñ ter montanhas e nem árvores mais o jogo é muito bom,4,2,2.12.16,2020-10-29 20:14:14
50,gatinha YT,https://play-lh.googleusercontent.com/a-/AOh14GjZ0LMHDBeVO9jq5oPKtQHNRLB_QAICx1ZBP6heeg,"Agente tem uma boa experiência com esse jogo porém muitas pessoas estão tendo a enclusão de sugerir que algumas coisas não deviam estar bloqueadas como as construções, móveis,animais,molas,games e etc..mais quanto mais experiência você tiver mais atividades do jogo você fazer a sua jogabilidade ficaria melhor então você vai desbloqueando muitas coisas essências o servidor começará a te dar presentes que podem estar caídos em qualquer lugar na sua vila mas seus visitantes não poderam abri-lo",5,878,2.12.14,2020-09-18 22:05:52
51,Jeferson Gonçalves,https://play-lh.googleusercontent.com/-NOFsW1T5SCQ/AAAAAAAAAAI/AAAAAAAAAAA/AMZuucnu6KZCoMMf5omJf03sr25BnjF2LQ/photo.jpg,"O jogo está muito bem feito em minha opinião. Gostaria que em alguma atualização futura vocês adicionassem mais opções de blocos com tema de construção, por exemplo blocos em formato de escada ou lajes para deixar nossas construções ainda mais bonitas. Mesmo assim, mereceram 5 estrelas, parabéns!",5,972,2.12.14,2020-10-10 18:06:18
52,Heloiisa Lara,https://play-lh.googleusercontent.com/-ERl1y7BEhMY/AAAAAAAAAAI/AAAAAAAAAAA/AMZuuckIWE6tuG2DaGS2i_Rzn7RnRC3Iaw/photo.jpg,Esse jogo e muito bom serio vey tem como a gente construir casas tem animais fofos eu vo joga esse jogo para sempre mds de verdade verdadeira verdade verdadeira msm esse jogo e surpe ipê mega bom minha prima está jogando até meu primo serio eu amei dono ou dona do jogo fazem mais minecreft desse pfv de verdade vou joga esse jogo para sempreeeeeeeeeeeeeeeeee joguem esse jogo eu vou construí uma mansão bem bem bem bem bem bem bem bem bem bem bem bem bem bem bem bem bem bem bem bem bem grande.,5,2,2.12.15,2020-10-24 11:30:05
53,Kelly Souza,https://play-lh.googleusercontent.com/a-/AOh14Gi2C1IGlnvhlrL_gf-gZe8CmsM-h89DCXYKJ_d1dQ,É muito legal recomendo. Só precisa de duas nodificações para botar placa para enciri o nome fixso e ter uma família e pessoas para controlar. É só isso tchau. 😀.,4,1,2.12.15,2020-10-26 21:10:24
