,userName,userImage,content,score,thumbsUpCount,reviewCreatedVersion,at
0,Carine Morais da Silva,https://play-lh.googleusercontent.com/-k-lLYt8OaxE/AAAAAAAAAAI/AAAAAAAAAAA/AMZuuclpbQQkcPHbCumDWhZGu_yUd50kKA/photo.jpg,"Está insuportável essas propagandas constantes, somos obrigados a assistir quase que 30 segundos as vezes mais, acho que deveriam bonificar já que querem passar vídeo toda hora, daí da pra escolher se queremos assistir ou não, e nao nos obrigar, se continuar vou desinstalar, com dor no coração pq o jogo é muito bom !!",2,368,1.7.6,2020-10-30 21:08:46
1,luana ketlen,https://play-lh.googleusercontent.com/a-/AOh14GgJhaVjJuH1Hvx1Ih-4akC4Vj5aDu29aaw5zJ9fRg,"Jogo bom, porém chega una fase que vc só consegue passar se comprar ajuda mas o jogo não da oportunidades de vc conseguir diamantes. Mesmo fazendo tudo direito ele tefaz perder só para comprar ajuda ou assistir anúncio 😴. E a quantidade de anúncios é RIDÍCULA, é INSUPORTÁVEL toda vez que acaba uma partida ter um anúncio totalmente inútil. Se situem.",3,418,1.7.6,2020-10-28 12:07:24
2,Thalita Rios,https://play-lh.googleusercontent.com/a-/AOh14Gh3v-RnP9NT3ozpQVYGbZYmW1xdXOeS1Ai_nn9-sg,"O jogo da um tempo pra completar as missões, mas os próprios bonequinhos demoram uma vida pra pedir, eles vêm andando de um lado da tela até o outro pra fazer o pedido, e o tempo passando, aí a gente não consegue completar as missões se não tiver diamantes! O próprio jogo sabota a gente 🤦🏽‍♀️🤦🏽‍♀️",2,562,1.7.5,2020-10-16 11:54:07
3,Irany Mendonça,https://play-lh.googleusercontent.com/-cp6WoOZfn0s/AAAAAAAAAAI/AAAAAAAAAAA/AMZuucnaExQ_bWrq5GnIraZk-JbrS7ADGQ/photo.jpg,"Deveria ter a opção de ganhar mais tempo após o 13° nível,oque nos obriga a comprar. Estou tentando sem sucesso passar esse nível, pois acaba os clientes e o tempo e não consigo nenhum nem outro que não seja comprando,poderia reavaliar isso e pra mim ficaria top",3,90,1.7.6,2020-10-26 21:41:51
4,Izabel Cristina,https://play-lh.googleusercontent.com/-IGeyYB9N9QQ/AAAAAAAAAAI/AAAAAAAAAAA/AMZuucnuRfzvmfd9segHs8ktxbVFd_7FtA/photo.jpg,"Instalei esse jogo a pouco tempo, já estou no nível 43 e estou no primeiro lugar do ranking ótimo jogo é também é muito viciante não tenho nada a reclamar realmente merece 5 estrelas esse é o melhor jogo culinário do mundo parabéns aos criadores desse jogo",5,3,1.7.6,2020-11-07 18:08:28
5,Viviane Soares,https://play-lh.googleusercontent.com/-AljM00nc2cY/AAAAAAAAAAI/AAAAAAAAAAA/AMZuucntN827NQFCTmF7g0-8WTPRcoOTSg/photo.jpg,"Odiei esse jogo com todas as minhas forças eu comecei amando o jogo mais depois tem alguns níveis que você só pôde passar com diamante. Então você que está lendo essa resenha não perda seu tempo instalando esse jogo,e também passa várias propagandas. E não estou desmerecendo os comentários de quem gostou do Jogo .😠 Se eu fosse você que tá lendo ,leia as resenhas antes de baixar.",1,56,1.7.6,2020-11-05 01:27:56
6,Vanessa Nazário de Freitas,https://play-lh.googleusercontent.com/-PeK9ztHxjeU/AAAAAAAAAAI/AAAAAAAAAAA/AMZuucmQE20z-OSp-NVPbIOZsT_s__WO0g/photo.jpg,Esse jogo é muito bom mas tô tentando instalar ele de novo e não consegui e também tem umas horríveis Por que você não consegue passar e eu já tentei muitas vezes não consegue Isso é verdade porque esse jogo eu não é muito bom assim porque ele não tem como você poder passar os níveis Ué você sempre continua continua e ele nunca deixa você passar Você faz tudo ele não deixa você passar,1,54,1.7.6,2020-11-06 08:52:57
7,Rosangela Souza,https://play-lh.googleusercontent.com/a-/AOh14GgOqzejNnZJ4UBLILCOF9ZwO1MSWyiKD4oVueAl,"Muito bom e empolgante esse jogo, cada fase super bacana, as pessoas reclamam dos anuncios, mas saibam que o jogo é gratis , entao não me incomoda os anuncios, show de bola esse jogo",5,9,1.7.6,2020-11-05 13:14:55
8,Geysllyann Amorim,https://play-lh.googleusercontent.com/a-/AOh14GhFdl--MNHnC24YLgT7AtACw32EGikdNFDQPkfT,"Os anúncios são demasiadamente irritantes , aparecem a cada fase e não te permite sair deles , tem que assistir até o final , anúncios quase 1 minuto .",1,4,1.7.6,2020-11-05 09:25:52
9,Daniele Cristina,https://play-lh.googleusercontent.com/a-/AOh14GjBYKEZjFoggFuTe7nxp347geywgssvynR8YvoX,"Fases bem dificies de passar , toda hora e um anúncio, a energia acaba muito rápido e além disso você não consegue completar as missões ,pois para comprar tem que ter diamantes e tem um certo momento do jogo que você acumula um monte de moeda e se não passar das fases não pode usar para nada. O jogo em si é até bom , porém muito desgastante ficar toda hora tentando cumprir tempo e fora que os bonecos são uns lesados demora muito para fazer o pedido e quando vai ver acabou o tempo. Excluindo.....",1,60,1.7.4,2020-11-07 00:53:25
10,Diário da Marina,https://play-lh.googleusercontent.com/-Lpx0CZDvLcY/AAAAAAAAAAI/AAAAAAAAAAA/AMZuuclV-5QG6EAzAWayDQqCl4TuPi6qdA/photo.jpg,O jogo é maravilhoso eu ia dar 5 estrelas mais eu lembrei que agente tá de boa e do nada a energia acaba donada queria que vcs arrumarem isso por favor mais de resto ré maravilhoso não trava não passa anúncio toda hora só isso mesmo da energia que atrapalha mais de resto tudo maravilhoso recomendo vcs abaixarem espero ter ajudado ❤️,4,154,1.7.5,2020-10-19 16:45:57
11,Elieide Santos,https://play-lh.googleusercontent.com/-gkfPj03Spyo/AAAAAAAAAAI/AAAAAAAAAAA/AMZuucnzDkwonitYLJLTg36DykQksVmIKg/photo.jpg,"O q aconteceu com esse jogo? Tava indo tão bem. Não recomendo. Se vc passa 10 fases são 10 anúncios, se vc atualiza a loja de produtos 10 veses são mais 10 anúncios, e a cada vez q vc perde uma fase mais 2 anúncios. Q falta desrespeito, eu baixei o jogo pra jogar não pra ver quase 30 anúncios. Sem contar q as veses acaba um anúncio e já entra outro sem da opção de pular. Se eu quisesse ver anúncio eu tava no canal do polishop. Me poupe.",1,90,1.7.4,2020-10-21 18:34:45
12,fernanda lima,https://play-lh.googleusercontent.com/a-/AOh14GjYgTCn5QLDZfMpEk0bjo3-SwMkCUHXrkqTMT0K,"sempre gostei muito do jogo, mas depois da última atualização os anúncios aperecem com muita frequência. Por favor arrumem isso, ficou muito chato jogar assim!",3,1,1.7.6,2020-11-07 08:38:58
13,Álen Silveira,https://play-lh.googleusercontent.com/a-/AOh14GiwFHxvhghQ19lKIx8Xx_ejkUYm6x1haRv7tkM9nQ,"O jogo é muito bom, estou dando 3 estrelas pois a energia não carrega para seguir jogando, estou desinstalando por conta desse problema.",3,2,1.7.6,2020-11-04 14:04:13
14,Patrícia Trindade,https://play-lh.googleusercontent.com/a-/AOh14GiaZmsHBAW8jiHCDO7Yy1ZJfT7tYgN6u8VgQA40jPI,"Eu gosto imenso do jogo, mas estou parada no nível 80 há um mês, farto me de ganhar moedas.. Q não servem para quase nada.. E os diamantes só se os comprar.. Vou desinstalar. Fartei me..",2,0,1.7.6,2020-11-08 20:44:06
15,Isadora Sousa,https://play-lh.googleusercontent.com/a-/AOh14GjdhZ7jMzTbKwVTt0V2T8m9EDYvl6u0M2Nwd4ruGg,"É tanta propaganda que é insuportável continuar o jogo, e quando você esta em fase alta você nao pode avançar pois para passar você precisa de diamantes e eles não dao task ou outra forma de ganhar diamantes",1,0,1.7.6,2020-11-06 15:06:07
16,Isabela Souza,https://play-lh.googleusercontent.com/a-/AOh14GgTA6_ftjKahlJKrsOrxhTf5vW5ZkcYrIRPnYgzMw,"Um excelente jogo, mas demora muito para atualizar, e chegar novos restaurantes, fico ansiosa para poder jogar, mas demora muito. Melhorem isso",2,1,1.7.6,2020-11-04 20:45:06
17,Mariana Santos,https://play-lh.googleusercontent.com/a-/AOh14Gjay6dEx3POzKz9XvhKeXErfWfmFZpS7srId4cvZg,"Adoro mas, tem níveis muito difíceis que vc só consegue passar se comprar boosters. E os jogos extras são quase impossíveis... Mas msm assim amo esse jogo! 😎",4,4,1.7.6,2020-10-29 20:43:45
18,Luciana Nunes,https://play-lh.googleusercontent.com/a-/AOh14GhZkCRJRa_FDUO2mAp1VCGMrXstyXxVjY_wr5tz0g,"Esse jogo é interessante ,porém tem momentos que se torna difícil, e nem da opção de ajuda grátis, já eu tenho outro jogo do mesmo procedimento que quando estou conectada na internet ele me oferece ajuda a cada vídeo que eu assisto. Tudo bem que é um saco assistir vídeos , mais se não tem outro meio rápido de ter ajuda , vai assim mesmo . Mais quem sabe nesse jogo possam oferecer mais ajudas ao conectados na internet.",5,38,1.7.4,2020-10-20 15:18:58
19,Paty Girl,https://play-lh.googleusercontent.com/-cUp9MqmHmU8/AAAAAAAAAAI/AAAAAAAAAAA/AMZuucl5ItY_Gn_9eMzmkcHfzAcuKFfS2A/photo.jpg,"Poderia ser mais barato a quantidade de gemas pra comprar os reforços, que são muito necessários pra passar de algumas fases.",5,10,1.7.6,2020-10-30 00:40:26
20,Rafaela Santana,https://play-lh.googleusercontent.com/-VTpNSMC-0J8/AAAAAAAAAAI/AAAAAAAAAAA/AMZuuck71rrygzO9-QmIU7dY_ec3ZCA77Q/photo.jpg,"Eu gostei do jogo estou no nível 119. Mas demoro passar de nível agora. O litime de energia é pouco. Porquê não colocam 10 de energia. Sem falar que é muito difícil ganhar diamantes se o jogo pede 67 diamantes pra uma segunda chance, enquanto o anúncio só te 2 diamantes!!! Melhorem isso que dou 5 estrelas",3,51,1.7.4,2020-10-24 08:56:43
21,Pedro Santos,https://play-lh.googleusercontent.com/a-/AOh14GgHATPs75xwNp9ErZAtXZtop6PTyVgJ0aX2Fbak,É pena que o jogo se torne demasiado difícil e que apenas se possa progredir com o gasto de dinheiro real. Vou acabar por desinstalar.,2,3,1.7.6,2020-10-31 05:49:24
22,Ana Caroline,https://play-lh.googleusercontent.com/a-/AOh14Gg9cezqKZlP2U30zZTXF24MvloHwzEVAQ4Xt4B4NyE,"O jogo é legal, mas o próprio jogo trapaceia e não consigo passar de fase. Os personagens demoram MUUUITO pra fazer o pedido e com isso perdemos tempo. Como eles demoram andar e só pedem quando param isso dificulta a passagem de fase. Dêem uma melhorada nisso já que o jogo é legal e a maioria dos jogadores reclamam disso.",3,6,1.7.4,2020-10-26 20:25:06
23,Aline Mont,https://play-lh.googleusercontent.com/-aFfSyUxjZb4/AAAAAAAAAAI/AAAAAAAAAAA/AMZuucksT_GtVTiUaNqJGRNvjnf17PTNwA/photo.jpg,"O jogo não valoriza bons jogadores pela eficiência e agilidade para servir os pratos. Apenas aqueles que têm muitos diamantes, pois só conseguem passar de nível comprando reforços. Injusto! O jogo manda clientes insuficientes intencionalmente para NÃO batermos a meta. E assim, nos fazer gastar diamantes. E a energia? Poderia ter ao menos uma vez POR MÊS ilimitada! 15' é pouco! Fora essas coisas o jogo é bom. Me aguardem, logo estarei no topo do ranking! ;)",4,560,1.7.2,2020-09-06 17:32:51
24,Diviane Mozer,https://play-lh.googleusercontent.com/--Nlvhh8u8Zo/AAAAAAAAAAI/AAAAAAAAAAA/AMZuucnivet2lKz5KS5CYZ0Upe_W6nWt_w/photo.jpg,"O jogo é muito legal, divertido e viciante, mas o que mais irrita e vcs precisam melhorar isso, é que quando vc tem que usar a agilidade pra preparar pratos rapidamente, e naquele nível não pode jogar comida fora, pq senão vc perde, um movimento mais rápido pq o nível exige, o jogo entende que eu joguei comida fora, sendo que não foi proposital! Isso irrita muito, quando o nível exige rapidez vcs tem que colocar outras estratégias para eliminação, como não queimar a comida .",2,455,1.7.2,2020-09-08 13:19:48
25,Joseane Oliveira,https://play-lh.googleusercontent.com/a-/AOh14Gh0ttU4pndGy83ZhQzZInLMvzsWXFAcQfRE9N0GhQ,"o jogo é ótimo,mais as energia deixa a desejar só 5.E pra carregar demora muito tempo,fora os níveis difícil que exigem que gastamos diamantes. Ontem eu já tinha concluído o nível e sem querer joguei um alimento fora,mesmo assim eu perdir pq aconteceu isso,fiquei muito chateada,eu já tinha concluído a tarefa injusto. Melhorem as energias,com mais e menos tempo pra carregar,e dêem mais tempo no relógio,muitos clientes,pra pouco tempo que loucura,e quando é muitos pratos ,vem clientes insuficiente",5,133,1.7.2,2020-09-17 08:49:12
26,Miriã Linhares,https://play-lh.googleusercontent.com/a-/AOh14GiJDPqFOxE9Iofmcd-0M7PZI_hDEeyvseFoY1K-,"O jogo começa muito legal mas os níveis vão ficando muito difíceis a ponto de você não conseguir ganhar só com sua habilidade, precisa de diamantes pra conseguir mais 30 segundos ou mais 3 clientes. Tem fases muito difíceis. Eu tô quase desinstalando por isso. O jogo força demais a gastar com diamantes. Tirando isso o jogo é bom.",3,8,1.7.4,2020-10-21 23:00:53
27,Susana Gonçalves,https://play-lh.googleusercontent.com/a-/AOh14Gj_V7yua9Y4VfIaeThOa8uCerGm2ONWv5ZWTvrjQQ,Demora imenso tempo para conseguir vidas para jogar. E o jogo das bruxas estou sempre a voltar para trás.,1,0,1.7.6,2020-11-01 19:31:22
28,Miriã Andressa Candotti,https://play-lh.googleusercontent.com/a-/AOh14GgS6hkE0UVD3UarKj82qAV3SlfxySu2K6fSE18q,Eu adoro esse jogo.... As vezes as provas são bem difíceis mais tem que haver persistência. Só mandou 5 estrelas pq os eventos que acontecem é impossível ganhar.,4,1,1.7.6,2020-10-30 10:43:50
29,Kamyla Kethelin dos Santos,https://play-lh.googleusercontent.com/a-/AOh14Gh29Dr5lXQp9Mbi4GYD4wmqEJXCjNLclKeQBBT8Jw,"Gente...o jogo é bom, um ótimo conceito, um gráfico ótimo, porém... irrita a maioria dos momentos, porque você está passando de faze e simplesmente a energia acaba, são só 5 energias, alguns níveis, são muito difíceis de passar, se pelo menos, mudasse isso de ter que ter energias pra jogar, se pudesse jogar infinitamente, valeria mais apena baixar...e também mudar essa coisa de fazes muito, muito difíceis, obg!",1,677,1.7.4,2020-09-23 21:39:28
30,Sandra Cristina Ferreira,https://play-lh.googleusercontent.com/a-/AOh14GiX-Le7LHaSAUgW2AM7ICIYdrNoWbjchbCuOgKl,"O jogo é bom. Mas ao invés de comprar diamantes, deveríamos pagar com as moedas, que no jogo tem pouca serventia, e só acumula. Se o jogo é gratuito, os diamantes também deveriam ser. E nd melhor que utilizar as moedas do próprio jogo, já que elas só ficam acumulando. Também poderiam reduzir o tempo das energias. Demora muito tempo pra reativar. Sobre o tempo limite, poderia ter um sistema pra nós mesmo aumentar um pouco. Pois quando estamos quase completando a fase, o tempo acaba. Frustante",1,409,1.7.2,2020-09-17 14:24:30
31,Lara Ferreira,https://play-lh.googleusercontent.com/--efnjbEfg_o/AAAAAAAAAAI/AAAAAAAAAAA/AMZuucliRvLU5F2EhKGcDhqXZaOTN7KyZg/photo.jpg,Retiro o que eu disse que esse jogo Era muito bom Cheguei na fase 40 não consegui passar mais para outra fica pedindo diamante que você não tem E aí não consegue passar de fase e a energia é muito pouca esse jogo é horrível muito chato fiquei 3 dias tentando passar de nível no começo ele é muito bom mas depois vai ficando muito chato fica pedindo coisas que você não tem fica pedindo diamantes fica pedindo para você ter mais três clientes só que tinha que ter diamante e eu não tinha afi,1,3,1.7.4,2020-10-26 11:09:45
32,LUCIENE ALVES,https://play-lh.googleusercontent.com/-HI6sME3OWFg/AAAAAAAAAAI/AAAAAAAAAAA/AMZuuckNlpKuTZd1thvehq0OhdZIzs0JWA/photo.jpg,"Eu gosto muito, mas as vezes aparece vídeo para ganharmos recompensa depois que o vídeo acaba não vem a recompensa. E também aparece muitos anúncios, chega a ser irritante .É também tem fase que é de tempo, mas os bonequinhos gastam 5 segundos para chegar no balcão e fazer o pedido, daí a gente perde.",3,1,1.7.4,2020-10-22 02:15:10
33,Arthur Bacelar Games YT,https://play-lh.googleusercontent.com/-Xyb0cUVOrR4/AAAAAAAAAAI/AAAAAAAAAAA/AMZuucmFKx8SrkvuTtBLk6O2Wt7Tl6Cm2Q/photo.jpg,"O aplicativo é muito booom. E a minha duvida pq colocaram tempo para atender os clientes depois de 4 ou é 3 niveis espero q tirem esse tempo ok, me responde viu ZenLife Games",5,5,1.7.6,2020-11-02 21:10:02
34,Mika Duda Mika,https://play-lh.googleusercontent.com/-gd4yaPCGo8Y/AAAAAAAAAAI/AAAAAAAAAAA/AMZuuckod-mGbcj5w3jWbJWfpqcaSa1O0w/photo.jpg,Esse jogo é muito legal mas tem um porque tem uma fase dele que é muito rápido as pessoas não não consegue fazer a carne esses negócios de mas aímas ela é muito legal eu amei esse jogo quem for jogar pode levar até que ele é muito legal não fui com medo de abaixar ele é muito ninguém pode ficar com medo de abaixarele é muito legal vocês pode fazer um hambúrguer ele é.,4,213,1.7.4,2020-10-12 10:30:09
35,Roseli Santos,https://play-lh.googleusercontent.com/-qSuYVCYNEGI/AAAAAAAAAAI/AAAAAAAAAAA/AMZuucmUHR3fAIqVqX5LyUC6OhNMLE0Zjw/photo.jpg,"Jogo muito bom,mas tem fases que chegam a ser impossível passar .Fiz o teste e coloquei diamante e só assim passei e voltei a ficar presa na fase novamente independente da habilidade ou concentração não consegue passar de forma alguma.Estou a ponto de desinstalar",1,6,1.7.4,2020-10-19 16:53:25
36,Dilaine Maria,https://play-lh.googleusercontent.com/a-/AOh14Gi_BAQenTacmwOuLGUuC29yIFDuCPpKlUE74Ry9ow8,Jogo e bom mais rouba muito agente consegue conclui o que pede em cada nível mesmo assim não conseguimos a chave pra passa só se gastarmos os diamantes ou joga bastante aquele mesmo nível. 5 de energia e muito pouco poderia ter pelo menos 10 e muito frustrante agente baixa passa ali uma semana com o jogo é desinstalar pq o jogo começa a estressa demais eu gosto de passar tempo jogando ele mais os níveis são tão difíceis que estressa aí não dá instalei ontem mais acho que já vou desinstalar,2,1,1.7.4,2020-10-24 15:04:25
37,Elizangela Araujo,https://play-lh.googleusercontent.com/-oZX3rMde5uM/AAAAAAAAAAI/AAAAAAAAAAA/AMZuucnZEuSFJDXsngvvgjkcMl30Z5Xhhw/photo.jpg,É um jogo bom mais parte têm que ter dinheiro pra jogar isso é muiito apelação esse jogo já tô no estágio quase perto da praia ñ tô conseguindo sair desse estágio horrível nada vê 😡😤,1,0,1.7.6,2020-11-04 16:51:12
38,Hervely Menezes,https://play-lh.googleusercontent.com/a-/AOh14Ggsx2rTBwOVflfNsOZ8A9pm6_xHlb3xcXeM6PZg,"Muito bom porém os reforços são muito caro e os níveis muito difíceis pra pouco tempo que agente tem, tô ficando doida com esse jogo kkkk energia também demora quase meia hora pra chegar uma só, e assim acaba deixando o jogo chato pois é muito viciante se as energias chegarem mais rápido e os reforços forem mais barato e pago com moedas o jogo fica bem mais legal!",4,226,1.7.2,2020-09-10 19:17:55
39,Bruna Mauricio de morais,https://play-lh.googleusercontent.com/-sVV-xb4kE1M/AAAAAAAAAAI/AAAAAAAAAAA/AMZuuckQIJ5Xz-zXWnLpeEnqo_hOvG77Mg/photo.jpg,Alguém pode me dizer se passou da fase 69 acho que depois dessa fase não tem mais jogo por isso não dá pra passar é impossível já usei de tudo diamante e as outras coisas e nada . Fora o anúncio eu sei que se comprar algo não vai mais aparecer anúncio mais meus filhos tenha misericórdia da gente né vou desinstalar o jogo porque já perdi a paciência 😢,1,3,1.7.4,2020-10-23 01:35:21
40,Noedina Chaves,https://play-lh.googleusercontent.com/-jvZl54xb5ek/AAAAAAAAAAI/AAAAAAAAAAA/AMZuuck6PDsxIb_ha_lqwp_Zax6XbUxCbw/photo.jpg,Gosto muito do Delírio Culinário. Só acho que vcs deveriam facilitar um pouco quando termina os clientes e não conseguimos completar a prova!,4,1,1.7.6,2020-10-29 00:28:19
41,markim rato,https://play-lh.googleusercontent.com/a-/AOh14GgfF7qkZ6OsGNYxab48-VA_IAfG_41-PwdxXvwBrNw,"eai?! tão lucrando muito com os anúncios? daqui a pouco to perdendo a paciência e desinstalando o jogo por causa de tanto anuncio não consigo jogar mais de 2 partidas sem ter aqueles anuncios chatos! horroroso, 1 estrela!",1,1,1.7.4,2020-10-22 05:12:17
42,Samara Oliveira,https://play-lh.googleusercontent.com/a-/AOh14GhSONH-LJ8l41wOyySB_w3kbApnpiU5X_EG2Sd6J3w,Eu amei esse jogo mais tem um porém ele repeti as pessoas c vcs colocarem mais pessoas seria mais legal tipo as pessoas são as mesmas vcs podiam n aumentar as pessoas e sim mudar o estilo ne tirando isso amei hehe ^^ :3,5,10,1.7.5,2020-10-15 08:35:34
43,Thaís Portugal,https://play-lh.googleusercontent.com/a-/AOh14GgtOHSVhRUIKYpX5cgQT14KIWHak9vznhnHvmhQ0fY,"Muito bom o jogo, o ruim é que são só 5 energias pra jogar, aí nos níveis difíceis acabam rapidinho, mas fora isso é ótimo, simples de jogar, vários níveis, o tipo da comida muda, muito interessante 😍👏❤️",5,9,1.7.4,2020-10-15 10:22:07
44,May Sena,https://play-lh.googleusercontent.com/-Gncs11R5-bM/AAAAAAAAAAI/AAAAAAAAAAA/AMZuucnUeFVO0I6k0dOBa5z_EzW9dgcL5Q/photo.jpg,"Adoro o jogo, o único ruim é q demora MT liberar outras fases.. sempre viro as fases e para abrir outra demora mas de 1 mês 😞😞",4,3,1.7.6,2020-10-30 13:25:47
45,Fabila Sena,https://play-lh.googleusercontent.com/-dDU75Ni00_Y/AAAAAAAAAAI/AAAAAAAAAAA/AMZuucnqEG03H8tGwLHsE7xrxcRZbLfiLQ/photo.jpg,"Jogo cansativo não sai do lugar não dão tempo e cliente para que seja possível passar de fase parece jogo de azar e não de competência, isso tudo porque eles querem vender pacotes inúteis cansei. Poderiam dar mais clientes e tempo tem nível que é quase impossível sair tem que juntar diamante já que as moedas não servem para nada",1,41,1.7.4,2020-10-11 13:49:22
46,Débora Eller martins,https://play-lh.googleusercontent.com/-I-8c0IUZF08/AAAAAAAAAAI/AAAAAAAAAAA/AMZuuckEG2twUo5CX9-2ztKPvfPEmoxl2A/photo.jpg,"O jogo em si é muito bom, mas com quantidade de anúncio fica IMPOSSÍVEL jogar, a cada nível que passa sao 2 anúncios seguidos aí fica difícil né, por isso estou desinstalando o app não recomendo",1,0,1.7.4,2020-10-26 21:27:09
47,Fernanda Silva,https://play-lh.googleusercontent.com/a-/AOh14Gj8GVtsg7YnSYVZa7UXK2-hMiaJX4WYJuuEbOjT,"Eu particularmente gosto muito do jogo acho bem satisfatório, tirando os anúncios exagerados , mas eu gosto muito, acho que deveria ter como sincronizar ele com email ou Instagram pq já não tenho mais Facebook!",4,6,1.7.4,2020-10-13 21:54:20
48,Valdir Nogueira,https://play-lh.googleusercontent.com/-Mb-NGTpok2U/AAAAAAAAAAI/AAAAAAAAAAA/AMZuuckUs1bO4zghYjNY55FZAV4tzSvwVA/photo.jpg,"Estou dando uma estrela não por causa do jogo, pq até tá muito legal. Mas fala sério, nunca vi um jogo com tanta PROPAGANDA. Dá até raiva, jogo sem internet pq não tenho paciência....",1,3,1.7.4,2020-10-19 05:06:27
49,Janaina Agricio,https://play-lh.googleusercontent.com/-SdDkZdUo_yQ/AAAAAAAAAAI/AAAAAAAAAAA/AMZuuckw6imjtM3Y9rCRKDAZUEx7UwN1LQ/photo.jpg,"Eu amo esse jogo, já tem mais de 1 ano que tenho instalado é maravilhoso, apenas alguns pontos a melhorar como por exemplo o tempo de solicitar vidas, poderia ser a cada 4 ou 5h seria ótimo, e quanto ao bônus diário cada tarefa cumprida poderia ser 5 diamantes .. Mais fora isso é um jogo viciante amo jogar",4,409,1.7.3,2020-09-19 15:33:42
50,Lucieni Massarão,https://play-lh.googleusercontent.com/-s28LcRe120Q/AAAAAAAAAAI/AAAAAAAAAAA/AMZuucmmOc5bBZli3ovKHu7qMuX0cGdqfA/photo.jpg,"Muito bom,o ponto negativo é que somos bem dizer forçados a fazer compra pra poder passar o nível, ñ nos dão escolha,ganhar diamantes é praticamente impossível, dão muito pouco,e todo minuto tem esse monte de anúncio",4,0,1.7.4,2020-10-22 17:45:19
51,Lizandra Dalbello da Silva,https://play-lh.googleusercontent.com/a-/AOh14GgeC5d0j9iQxLmX8wcttPL5JJTIFO_ZiDBYwZjrxQ,"O jogo é ótimo, mas nas fases difíceis quase que te obriga a comprar combos de diamantes e reforços. Fora o erro na fase 71-2, mostra que a comida queimou, sendo que não queimou, concluí os 59 clientes e continuou mostrando que queimei algo e perdi...se continuar assim vou desinstalar",3,127,1.7.2,2020-09-06 23:38:28
52,Emilia Gariglio,https://play-lh.googleusercontent.com/a-/AOh14Gjsbbe9HZx0JcvT3lU-lxwZTp5yA4dh_fCYO8Y6EWU,"Esse jogo tem de tudo para ser bom porém ele só deixa a gente ser beneficiado se pagar ele Também é super trapaceiro , estava pensando em desinstalar esse jogo só não fiz isso por causa do tanto de nível que eu ja passei mas agora tive certeza que era melhor desinstalar mas pensei bem e decidi fazer melhor criticar uma ver por semana",1,202,1.7.4,2020-10-02 15:36:51
53,CPT-CODY-AMÉRICA,https://play-lh.googleusercontent.com/a-/AOh14GhKSXpa2_ejuV1Fa-GCcW_fokybatrNL0FrrtMxhw,O primeiro dia foi bem...mas após... a cada partida você é obrigado a assistir uma propaganda que abre em sua tela sem a opção de fechar...ridículo a quantidade de publicidade a cada 1 partida jogada...desinstalando pois baixei um app de jogo e nao um app de propaganda.,1,54,1.7.4,2020-10-04 18:21:45
54,Tatiana Carneiro,https://play-lh.googleusercontent.com/a-/AOh14Gjn-cJGCAPsOJ_q0Cdmh9ptzn4TtGRtqOEU8VU_0po,"O jogo é muito bom, mais as opções de diamantes e muito pouca tem várias fases difíceis que tem hora que só se resolve com diamante podiam melhorar isso e outra a quantidade de comerciais até se passar de fase tem que ficar assistindo, isso desanima um pouco.",4,49,1.7.4,2020-09-28 01:00:13
55,Bezim Tertuliano,https://play-lh.googleusercontent.com/-g7YWe-gG05g/AAAAAAAAAAI/AAAAAAAAAAA/AMZuucnZh1iasW3PrQxnQj02IKPr_PB6GQ/photo.jpg,O jogo o é bom mas tem horas que dá raiva porque tenho muitas clientes aí tem muita coisa para fazer tem que ser rápido porque senão se não perde os clientes e tem que ser muito rápido Tem que ter muita tem ter muita rapidez nas mãos aí seus dedos canção aí dá raiva então dá cinco estrela por isso é bom mas dá raiva um pouco tchau,5,473,1.7.0,2020-08-22 18:42:14
56,Rita de Cássia Fiorim,https://play-lh.googleusercontent.com/a-/AOh14Ggk3Kh_vp1mS-saiVjK8uKND5Q6LJ2mX_cIc-GVOg,"Amei o jogo a única chateação são as propagandas excessivas, nossa mta propaganda.....só não desinstalei pq gostei demais desse jogo....",4,1,1.7.6,2020-11-02 09:04:39
57,Mariana Camilla,https://play-lh.googleusercontent.com/a-/AOh14Gj8MsIvgx8jGNOH9EPr4nRm0Zboxw3yb3UnFlYQJEA,"O jogo é muito legal, o problema é a propaganda da PETZ que aparece a toda a hora, deixa o jogo injogavel.. pq no meio do jogo aparece a propaganda CHATA . Se continuar..vou desinstalar!!",3,0,1.7.4,2020-10-24 00:53:33
