,userName,userImage,content,score,thumbsUpCount,reviewCreatedVersion,at
0,Regina Brito,https://play-lh.googleusercontent.com/a-/AOh14Ghg9zI2IwLNCM-qI1sHd6HCTHsT3MPjmFFKBFHUVg,"Poderia dar mais moedas como incentivo. Uma moeda por dia fica difícil. E as pessoas desanimam de jogar e o aplicativo fica mandando robô pra jogar com vc, ninguém merece.",4,10,14.611,2020-07-14 14:57:31
1,Néné Dantas,https://play-lh.googleusercontent.com/a-/AOh14GgqrdXpfWCIPoZ5yondQFVczvbkykeEJhPYIiAeGw,"Poderia ser um bom jogo de entretenimento e cultura. Mas não é. Primeiro porque não há a língua portuguesa de Portugal. Depois por que há palavras portuguesas que o jogo não aceita. E depois porque quando o jogo joga connosco inventa palavras como por exemplo: ooforo, tava e tavam, sg. E infelizmente também não deixa pôr os símbolos químicos, que não sendo em português são universais. Sempre é melhor um símbolo químico do que palavras que não existem no dicionário de Português.",1,0,,2020-10-18 17:44:28
2,Tina Bugan,https://play-lh.googleusercontent.com/a-/AOh14GjMwV9Ng7X4HF6fZkF0Dk-uJiImqZ_ulDvwGh5HzUc,"Gosto do jogo, mas tem alguns problemas. Não explica o que é, nem carrega o ""desafio solo"". A pontuação não é clara, cada caixa prêmio tem dois tipos de moedas, uma é contada e a outra desaparece... ?!? Fica confuso para o jogador saber o que ganha. Outro problema é carregar os vídeos para ganhar moedas. Teoricamente o jogador pode ganhar até 30 moedas por dia assistindo vídeos de propaganda. Mas na maioria dos dias não consigo aproveitar essa oportunidade porque os vídeos não carregam.",4,5,13.501,2019-12-07 12:56:28
3,Leticia Boaventura,https://play-lh.googleusercontent.com/-mmL9m13UHvg/AAAAAAAAAAI/AAAAAAAAAAA/AMZuucmdSZe-Oa_aQigTK_P-PUvv_IlVxg/photo.jpg,"O jogo é massa... Vinha jogando no Facebook e baixei o app... No app o ""tabuleiro"" é muito maior, a quantidade de peças também e o jogo não termina nunca, ou pelo menos demora horrores. Massa a parada de treino pra jogar offline. Notei a questão de não aceitar algumas palavras em português e considerar outras em ingles. Os usuários demoram muito pra fazer suas jogadas.",2,1,,2020-01-19 07:33:10
4,ale carvalho,https://play-lh.googleusercontent.com/a-/AOh14GjO46paUtSkknp1wo3CkcrYhq6o_Za9YLAWdmSveQ,"Muitas palavras não são aceitas. Como ""anulemos"", ao passo que outras como ""jj"", que não é uma palavra (entre muitas outras), o jogo aceita. Além disso, quando ganhamos 3x ÷ 10 moedas, o jogo soma apenas as 3. E sempre o número menor. Pra terminar, quando mudamos a cor das peças, funciona apenas esporadicamente.",1,4,12.713,2019-09-03 07:48:50
5,Lucas Modena,https://play-lh.googleusercontent.com/a-/AOh14GhzDU9RAi5UHlQOrEjfdAxnFtHfGtll4gI2dwU2QBU,"O jogo é interessante, mas é completamente bugado na parte de contagem de pontos, conexão com Facebook, etc. Sem contar que você pode estar jogando com um bot sem saber, que eles criam só para enfiar mais propagandas na sua cara.",2,1,,2020-01-10 14:26:10
6,Paulo Roberto Sousa,https://play-lh.googleusercontent.com/a-/AOh14GgATyidXHXNYbAJYrgxFhFXRL7EkV9Ugna4mQkzMk8,"Muito bom! jogo on line em rede. Precisa ampliar o vocabulário atual. Existe muitas palavras válidas não cadastradas, no entanto aceita algumas inexistentes e outras em inglês. Ex: FOUR!",4,12,13.211,2019-10-31 10:26:20
7,Um usuário do Google,https://play-lh.googleusercontent.com/EGemoI2NTXmTsBVtJqk8jxF9rh8ApRWfsIMQSt2uE4OcpQqbFu7f7NbTK05lx80nuSijCz7sc3a277R67g,Entendo que precisam ganhar dinheiro de alguma forma mas o excesso de publicidade no jogo é desanimador. A cada jogada um anúncio que você é obrigado a ver. Marketing de interrupção é muito chato.,1,12,,2019-01-07 19:57:09
8,Felipe Eduardo,https://play-lh.googleusercontent.com/a-/AOh14GiaKLq2ORo958DTN4poVzPQvR_mrI8g47K052Sknw,Um excelente sistema de turnos que deveria estar presente em outros jogos. O jogo em si é divertido.,4,2,13.008,2019-09-25 23:07:02
9,Eriana Gonçalves,https://play-lh.googleusercontent.com/-9sGDh_3Sedw/AAAAAAAAAAI/AAAAAAAAAAA/AMZuuclS-g8kuTGpYPHAOJ9zRK1py3VBKA/photo.jpg,"Adoro! Mas desde ontem está travado, não consigo fazer nada no app, fica carregando e não conclui.",3,6,14.204,2020-04-10 13:48:01
10,EDSON SIQUEIRA,https://play-lh.googleusercontent.com/-5J-2kwfKZdM/AAAAAAAAAAI/AAAAAAAAAAA/AMZuuckBv2sN0_mZDVjHoGMdSiEgKy3V2Q/photo.jpg,As palavras válidas deveriam ser revistas e serem fiéis aos nossos dicionários. Há muitas incoerências.,4,18,13.906,2020-02-27 22:45:41
11,Lara Fujioka,https://play-lh.googleusercontent.com/a-/AOh14GgquSh7EPuaRrMUXMDB3T4IJFZLdhaIuyKb9F0cXA,"O jogo é muito bom, porém é manipulador obrigar assistir aos anúncios...",4,3,11.713,2018-11-17 11:20:57
12,Anderson Eustaquio,https://play-lh.googleusercontent.com/a-/AOh14GjFFDsHh6C2cblZ-Tunvzk7cIgELHnif8VKuv2s-g,Ultimamente o jogo anda travando muito eu jogo e envio as jogadas saio do jogo e quando volto tenho que fazer as msm jogadas novamente.,1,5,14.204,2020-04-19 23:02:54
13,Mel Ribeiro,https://play-lh.googleusercontent.com/a-/AOh14GiDh6A6UD2yURAoAK4r_X8OdiJJHS7_YukxCUq1Cg,As palavras são as maus estranhas possíveis e não há um vocabulário em que possamos nos basear.,4,3,12.003,2019-02-08 23:36:36
14,Alexandre Goularte da Silva,https://play-lh.googleusercontent.com/a-/AOh14GjXFk_AIpOdkS1hzOBSYwOvvECPF-EybupvEo8C,Aceita palavras que não existem e não aceita muitas simples do dicionário... Mal feito,1,9,12.271,2019-05-11 22:35:27
15,Roberta Teixeira,https://play-lh.googleusercontent.com/a-/AOh14GjMWgh_qn7gIXB3BscaVrYshPynOsGaVrIbrfPD,"Educativo e interativo, aprendê-lo muito.",5,0,11.613,2018-10-03 07:16:05
16,Elisabete Vareiro,https://play-lh.googleusercontent.com/a-/AOh14GiBjjVvr1ZMl1vtziBI-Ij6FThTRUrXH1PEBTrcqA,"divertido, mas a quantidade de publicidade é absurda!",2,8,12.004,2019-02-25 15:21:12
17,Berna Costa,https://play-lh.googleusercontent.com/a-/AOh14GjI3ItwRPdjoWWuIL4PoV3fQCWn72yEZDK7y9f3,"Forma de estar sempre em contato com parentes e amigos distantes, gosto muito...",5,3,12.003,2019-02-09 21:32:46
18,Paula Xavier,https://play-lh.googleusercontent.com/-w1DgQgrhetM/AAAAAAAAAAI/AAAAAAAAAAA/AMZuuckWKoDEuFwsaCVPDwOPT3632azZMg/photo.jpg,"Excelente. Pena, pena é que algumas palavras são do português do Brasil e não do português de Portugal.",5,1,12.506,2019-07-19 15:59:08
19,Silvana Felici,https://play-lh.googleusercontent.com/a-/AOh14GhEjrXXPvJ0lF6tnlaP-Sv-pEOuuXaLDZa9V73rczo,Meu passa tempo!,5,1,14.611,2020-07-13 22:02:49
20,Carolina Braga,https://play-lh.googleusercontent.com/-vIsZ7IRsMBw/AAAAAAAAAAI/AAAAAAAAAAA/AMZuucm06B2tWhPEEer9w8DZMl3g3aTefA/photo.jpg,Ao tentar atualizar perdemos as insígnias,5,0,,2019-04-28 08:14:36
21,Ana Paula Bragagnolo,https://play-lh.googleusercontent.com/a-/AOh14GhRJnMuEIbh_PZwfGQa-vqoiyXw4VUEjyhBBO_6eA,Eu sou muito viciada nesse jogo amo muito jogar ele ...parabéns,5,0,11.032,2018-10-31 17:44:16
22,Delson Canedo,https://play-lh.googleusercontent.com/-x43poVAJyhk/AAAAAAAAAAI/AAAAAAAAAAA/AMZuucnTReVEa4ym9d0qN5HBddADZMAZqg/photo.jpg,Porque acabaram com a jogada relâmpago???,3,0,12.506,2019-07-25 09:50:33
23,Lana Lúcia,https://play-lh.googleusercontent.com/-Pq9WOJGJYqI/AAAAAAAAAAI/AAAAAAAAAAA/AMZuuckesyLCnpxF8Imlr0F1KKNT5cugjA/photo.jpg,Não muito bom pq não aceita certas palavras.,4,0,14.425,2020-05-11 19:51:20
24,Talita Martins Da Silva,https://play-lh.googleusercontent.com/-eMcwcOSxA_4/AAAAAAAAAAI/AAAAAAAAAAA/AMZuucmS8T7GnonOjLmHmptQEPpUMzN85w/photo.jpg,Muito bom pra desafiar os amigos,5,1,13.906,2020-03-08 22:11:06
25,Patricia Nunes,https://play-lh.googleusercontent.com/a-/AOh14Gg0varDji6I8mmLhjozyVi0giN8BILSTp41DqiXHw,não aceita muitas palavras,3,2,12.506,2019-07-15 23:33:25
26,Bruno dos Reis Apolinario,https://play-lh.googleusercontent.com/a-/AOh14GhNkfTB-k012mfy4IucDZkEqvz5izP2zTIgsSvA,Exercício pra mente.,5,0,11.622,2018-10-28 09:53:27
27,Cristina Kawashima,https://play-lh.googleusercontent.com/-CeUwnR2_ICw/AAAAAAAAAAI/AAAAAAAAAAA/AMZuuclbI5x-OlFNXcyYPEIIwuy-eWv2fQ/photo.jpg,Adorooooo muito instigante,5,0,13.008,2019-09-25 20:32:15
28,Lorena Sousa,https://play-lh.googleusercontent.com/a-/AOh14Ggt3hICEGjk5AefB0I1pRma8um6xWytsA2dOC4LVg,muita propaganda affs,1,0,,2019-03-05 20:29:15
29,lina neves monteiro,https://play-lh.googleusercontent.com/-zjCYnXaixTw/AAAAAAAAAAI/AAAAAAAAAAA/AMZuuck4qTOIN2Poo0TcmJgn0_fhQI8Tpg/photo.jpg,Amooo,5,0,14.611,2020-07-10 18:16:02
30,Gicelia Silva,https://play-lh.googleusercontent.com/-4b0A1rYBYeU/AAAAAAAAAAI/AAAAAAAAAAA/AMZuuclPscQ65yVxD1TVdilB1oeLmLOWWw/photo.jpg,Muito legal!,5,0,14.204,2020-04-01 20:27:01
31,Francilene Costa,https://play-lh.googleusercontent.com/a-/AOh14GgRqi_fbb1H1JTnLWITeDHZbzxzxKL5go2cIj6QOA,Muito bom,5,0,13.906,2020-03-26 16:15:31
32,IARA REGINA DE TUDO UM POUCO,https://play-lh.googleusercontent.com/a-/AOh14Gj5Hr_VrI71M2qlJFWBtK5-qoWLSdakcwV7AZkrcg,Muito bom,5,1,13.611,2020-02-17 13:26:42
33,BALL MRN,https://play-lh.googleusercontent.com/a-/AOh14Gge3jG-M2vvlG4xr2KjfDN-MpHwrNKBdqxvU1hMsg,Legal,4,0,13.610,2020-01-16 23:18:56
34,Denise Rodrigues,https://play-lh.googleusercontent.com/-ev2ZUpE2y0o/AAAAAAAAAAI/AAAAAAAAAAA/AMZuucnqjDEVr58dmx_XAxquEc37N4x-HQ/photo.jpg,"Bom jogo , pena que tem muito anúncio !",5,0,12.361,2019-05-17 12:28:15
35,Carlos Loureiro,https://play-lh.googleusercontent.com/-VUt4omyu0pQ/AAAAAAAAAAI/AAAAAAAAAAA/AMZuucnhOHllGPCUaVTIfZhtMlL7jRODjQ/photo.jpg,muito bom,4,0,12.361,2019-05-26 12:25:20
36,Felipe Ricardo,https://play-lh.googleusercontent.com/a-/AOh14GhrMCCddOTtm42U5TRg0-E41FGQl9393h9PPCagDA,bom,5,0,12.300,2019-05-11 18:31:43
37,Concy Ycnoc,https://play-lh.googleusercontent.com/a-/AOh14GhQJPFjbF4IwnFF7v5EOoptbCic9ZgDOsYQ6RSemA,top,5,0,12.271,2019-04-23 23:23:21
38,Um usuário do Google,https://play-lh.googleusercontent.com/EGemoI2NTXmTsBVtJqk8jxF9rh8ApRWfsIMQSt2uE4OcpQqbFu7f7NbTK05lx80nuSijCz7sc3a277R67g,muito instrutivo,5,0,12.111,2019-03-02 05:01:24
39,Ju Tepedino,https://play-lh.googleusercontent.com/-jXFaQC971Gk/AAAAAAAAAAI/AAAAAAAAAAA/AMZuucnhOvbi6qB_TaTWCswRQ4E2VeQylA/photo.jpg,Adoro !!!,5,1,12.106,2019-02-28 22:41:05
40,Dirce Henrique,https://play-lh.googleusercontent.com/-SgxPcBNNwNQ/AAAAAAAAAAI/AAAAAAAAAAA/AMZuucl2mCSfElSd_lVPoZzfIb_7xQtfrw/photo.jpg,"Muito bom, jogo que necessita grande raciocínio.Adoro.",4,9,11.910,2019-01-31 19:16:27
41,Carlos Bacellar Neto,https://play-lh.googleusercontent.com/a-/AOh14Gi1WjIzJKQVhrGTM3zno3Tx-iszRW6bs4_88cwJHA,Completamente Divertido,5,0,11.910,2019-01-28 20:51:04
42,Sonia Gomes,https://play-lh.googleusercontent.com/-MZb2LAOkoo0/AAAAAAAAAAI/AAAAAAAAAAA/AMZuucnvQ6uMSbajSeDeU07Px00jlqT3Hg/photo.jpg,Muito bom,5,0,11.801,2018-12-02 14:14:23
43,Gerson Menezes,https://play-lh.googleusercontent.com/a-/AOh14GiSlfi68fDwNYOI6-BCDIq2X4TSBTBqi8LgmboFbw,Bom,5,2,11.032,2018-09-05 18:43:06
44,Yrismar Oliveira,https://play-lh.googleusercontent.com/a-/AOh14GjyldylB2gIuUzs5SiB0d8z25ubsg7CmrO03iESuqw,"Gosto desse jogo eu jogava pelo Messenger agora q baixei quero colocar meu 
ID e jogar meu jogo velho não fazer novas jogadas não quero jogar tudo do 
início quero recuperar as minhas jogads",4,1,11.005,2018-07-18 17:47:37
45,Rulzany Oliveira,https://play-lh.googleusercontent.com/a-/AOh14GgGWp4tfpXOXuIRX2kxC0Dkmzd6i3EvL4IBm8sNuQ,Q demais,5,0,11.004,2018-07-10 10:43:16
46,Tiago Gomes,https://play-lh.googleusercontent.com/a-/AOh14GiF7eTHuM_ZqVolp3tun5O0l48SBhpr5Ym3yW1pAg,"Muito chato. Repete letra demais e são letras que não se usam muito em 
português",1,1,10.808,2018-06-09 12:13:33
47,Andrea Fernandes,https://play-lh.googleusercontent.com/a-/AOh14GjBvPn-rL2rHKgRMNOxLm8nXIn1t4XqR2jnOKz0Ng,"A última atualização, fez o jogo regredir em vez de evoluir . Retirou ferramentas que tinham sido inseridas recentemente e tornado o jogo mais atrativo, como a premiação com moedas, previsão dos locais em que as palavras podiam ser jogadas. O jogo voltou a ser monótono. Perdi o interesse em jogar.",2,10,8.423,2017-10-05 07:27:44
48,Murilo Santos,https://play-lh.googleusercontent.com/a-/AOh14GhCqIqcqVx5_OsF-3J1esHix0ucEO598IrHj7w9YA,É legal mas tem MUITO anúncio. Já deu crash umas 3 vezes também.,3,3,8.362,2017-06-15 19:00:06
49,Lucássia Cunha,https://play-lh.googleusercontent.com/-jF4GEqJKApI/AAAAAAAAAAI/AAAAAAAAAJc/AMZuuckppFZT5qjYMuH97VLpTpzBvXkO4g/photo.jpg,"Sim, é legal, contudo há três problemas: 1 - palavras que ele não aceita, como por exemplo ""mofadas"" e ""aditam"", isso foi só um dos casos que lembro; 2 - propagandas demais, chega a ser cansativo, pois termina um jogo, uma propaganda, termina o segundo jogo mais uma propaganda, o terceiro jogo, mais uma propaganda... É ruim até para um jogo bom; 3 - demora demais para um jogo que o adversário não jogou mais desaparecer, to com um há 9 dias que o adversário nao mexe, devia ser mais dinâmico.",3,9,8.303,2017-05-27 08:49:15
50,Thamires Marques,https://play-lh.googleusercontent.com/a-/AOh14GiNCMPQ03Fa6KO81p_3-TjXiQRNw2Xk5xwbGxldF5U,Eu perdi pontos depois de passar um jogo que não tinha mais palavras possíveis,3,4,8.303,2017-05-29 21:45:20
51,Guilherme Zanoni,https://play-lh.googleusercontent.com/a-/AOh14Gi1xCeh1ZMNgLQL8ZhYtuai56AiW9wIDpw1_vJLBa8,"O jogo é divertido, mas tem anúncios muito intrusivos e irritantes",3,1,8.303,2017-06-07 13:39:08
52,Anak Zahard,https://play-lh.googleusercontent.com/a-/AOh14GidtA0a81nNBxVXQXFAn_yBUGuC1tZLZvKuYc23xg,"Tava mt bom até eu estar jogando, e aparecer um anúncio e eu perder minha jogada. Arrumem isso.",3,4,8.231,2017-05-16 15:02:08
53,Endrigo Setragni,https://play-lh.googleusercontent.com/a-/AOh14Gh5yX2eJxGzb6VtBlspa3HN1UWL-hpNTypTW0tbXw,"Só não dou zero pq ñ tem jeito. Quando joga o jogo solo, o próprio jogo inventa palavras que não existem e não disponibiliza o significado da palavra ""inventada "".",1,5,8.111,2017-05-13 12:46:36
54,Darci Marcondes Filho,https://play-lh.googleusercontent.com/a-/AOh14GhHexKSVxdEWy7vcrRPan-kVupQ8euo0L8f1Z57zAc,Very addictive. In the good sense. But drains my phone battery. I ' ll have to uninstall after finishing my games.,3,12,7.7.2,2016-04-03 17:38:33
55,Camila Pontes,https://play-lh.googleusercontent.com/a-/AOh14GiTZ6W564K7FhUdxuZkNn5gUEVucuR8du-daR3FrA,Having great time playing this and improving my English level.,5,2,7.7.2,2016-11-16 20:55:23
56,Bruno Amaral,https://play-lh.googleusercontent.com/a-/AOh14GjFVKptHPT4QIq5XdcuokwFvZwMstvoyqat_Mh9_Wk,Muito bacana! Ótima diversão e aprendizado.,5,26,7.7.2,2016-02-02 09:32:12
57,Um usuário do Google,https://play-lh.googleusercontent.com/EGemoI2NTXmTsBVtJqk8jxF9rh8ApRWfsIMQSt2uE4OcpQqbFu7f7NbTK05lx80nuSijCz7sc3a277R67g,One of the coolest games I've ever played.,5,8,7.7.2,2015-11-24 18:32:14
58,Hedeson Peter,https://play-lh.googleusercontent.com/-eKz8amI35pA/AAAAAAAAAAI/AAAAAAAAAAA/AMZuucliTlFMNSvuuzhs1GsZZzktBlCXPw/photo.jpg,Bem divertido e prático,5,5,7.7.2,2015-10-16 16:27:48
59,Rui S. Cruz,https://play-lh.googleusercontent.com/-UJo1ZlqCX9k/AAAAAAAAAAI/AAAAAAAAAAA/AMZuucl7KfxqwQTd69kcB0FVIYSlAv7Klw/photo.jpg,É muito divertido. Todos os dias aprendo palavras novas. Excelente exercício para a mente.,5,0,7.7.2,2017-01-10 16:44:03
60,Aline Queiroz Fernandes,https://play-lh.googleusercontent.com/a-/AOh14GiuGUferER1IG7hzNav-AMJYlJE-wBgLaX_vSGH-w,Aprendo muitas palavras novas,5,3,7.7.2,2015-10-19 15:08:49
61,Carol Figueira,https://play-lh.googleusercontent.com/-PBW74gEh0KA/AAAAAAAAAAI/AAAAAAAAAAA/AMZuucmdEs5XuIVafu5tfU98DUbRf2ypdg/photo.jpg,It's for people like me who are learning english.,5,0,7.7.2,2016-08-13 14:00:12
62,Ana Carolina Ferreira,https://play-lh.googleusercontent.com/-Hymi19f3tb0/AAAAAAAAAAI/AAAAAAAAAAA/AMZuuclp9GK3AzGR9xLJghoTwZR6E33K9Q/photo.jpg,Muito gostoso de jogar!! Principalmente com amigos e família que estão distantes!,5,0,7.7.2,2016-12-01 12:12:05
63,Jah Mann,https://play-lh.googleusercontent.com/a-/AOh14Gim__fR_OItoafCLRETm6hx_GxbsD-9OSR0BSQB0pM,Play it ..Like it ..enjoy it ..,5,0,7.7.2,2017-01-12 15:47:53
64,Eduardo Henrique Zanella de Arruda,https://play-lh.googleusercontent.com/a-/AOh14GjS-NfSbXAyqODlgypzoYruSGTqXiQkMkI7uf5NeSU,Can't change my language,3,1,7.7.2,2016-01-01 14:23:44
65,L. Stefanelli,https://play-lh.googleusercontent.com/-K9pLk-aG24E/AAAAAAAAAAI/AAAAAAAAAAA/AMZuuckTPTxYqAYprt8LDmAM1hZjPKFDCg/photo.jpg,Não paga mCent,1,1,7.7.2,2016-11-26 19:13:35
66,Pettersson Campos,https://play-lh.googleusercontent.com/a-/AOh14Ghrcm1H1D4H8wy2Pl21DSo1K3CM8DZhF248fPAdtA,Bem legal,5,0,7.7.2,2015-10-22 07:56:54
67,Silvio Rauth Filho,https://play-lh.googleusercontent.com/a-/AOh14GjwbMC-47Z3VHApUYhpOXNoOysGfv1DScZZq5DmSg,Divertido,5,0,7.7.2,2016-01-13 13:33:58
68,Leo FS,https://play-lh.googleusercontent.com/a-/AOh14GhAmphLm_I1T9HeUYJqtZK1HyWJkxi1Cs9mx4v2qQ,Amei,5,0,7.7.2,2015-11-02 16:46:15
69,erick covolo,https://play-lh.googleusercontent.com/a-/AOh14GjpOT_8oHfInNykiReVE5rM-MwzWX0mUvAR5O_a1Q,:),5,2,7.7.2,2015-11-06 14:14:27
70,Márcia Sampaio,https://play-lh.googleusercontent.com/a-/AOh14GjBNVgbQoZvUCdkcdFHniqSkVSFkQJw0eGUZFE8qSg,Wow,5,2,7.7.2,2015-12-21 14:12:39
71,Simon Alves Ferreira,https://play-lh.googleusercontent.com/a-/AOh14Gi9J7doyyfiLJ2lCK-G3EvQA8zClGY1sJmEeUSowA,"É um aplicativo muito bom para pensar em Inglês, conhecer novas. palavras atraves do seu colega de partida e procurar palavras que te ajudem a ganhar pontos (viciante). O único grande defeito do aplicativo são as propagandas insuportáveis que ocorrem sempre após a conclusão de uma jogada,  essas propagandas atrapalham no raciocínio, na memória do celular e ainda por cima consomem um tempo da internet.",3,1,7.6.1,2015-07-19 10:55:25
72,Rafaela Topanotti Meller,https://play-lh.googleusercontent.com/a-/AOh14GhvEIs8lQQXu_TVUPc2Ugfbpr4LsXDwqJGJGjQs8sU,A única coisa que incomoda um pouco são as propagandas. Mas não impedem em nada para jogar.,5,1,7.6.1,2014-10-12 22:20:15
73,Milena Beatriz,https://play-lh.googleusercontent.com/a-/AOh14GiyiqZxa-nsSyuWJtLBK8EpQ_xl0EgZmGyANID89w,+Cauan Damata deve ser seu Aparelho q e uma BOSTA mas o jogo e ruim mesmo,2,0,7.6.1,2015-06-13 19:27:26
74,Bianca Reis,https://play-lh.googleusercontent.com/a-/AOh14GjLZ_iaYTS7uxEb168ZlOkleT7-kKJcZDRa7R8zpg,Realmente as propagandas no jogo são bem chatas.,4,1,7.6.1,2015-09-02 08:49:38
75,Marisa Santos,https://play-lh.googleusercontent.com/a-/AOh14GhWpQ4x_nmWvW1S00pge9HSMkreoyL5chbxwNJAMQ,muito bom adoro,5,2,7.6.1,2015-07-16 18:56:52
76,Cauan Damata,https://play-lh.googleusercontent.com/-9fXruzFFbw4/AAAAAAAAAAI/AAAAAAAAAAA/AMZuucn6qazsE8XC5856LN_0xs-f7ERp5w/photo.jpg,E uma merda trava toda hhora,5,3,7.6.1,2014-09-16 22:30:34
77,Camilla Filgueiras,https://play-lh.googleusercontent.com/-MDST3SiOUvQ/AAAAAAAAAAI/AAAAAAAAbe0/AMZuucnUL99gn5lBAzEoySXdX4bychJyTA/photo.jpg,Enjoying,5,0,7.6.1,2015-09-14 07:41:05
78,Nádia Soares,https://play-lh.googleusercontent.com/a-/AOh14GhvDHE0567yoEjOVON_rj0YkScL0se6UvTRZbOAVA,Thumbs up,5,1,7.6.1,2015-08-14 21:01:54
79,Antonio Reis,https://play-lh.googleusercontent.com/-u0I_0s_AVEc/AAAAAAAAAAI/AAAAAAAAAAA/AMZuucmTcIVo0RE2Ie7CF2yB-2l0EWHLYg/photo.jpg,Exercita o vocabulário e é fácil de usar e  viciar.,5,1,7.5.0,2014-09-10 07:58:12
80,Daniel Chaves,https://play-lh.googleusercontent.com/-gqyGH63YFZM/AAAAAAAAAAI/AAAAAAAAAAA/AMZuuckC1irdIO8GmJeoIbsAGxVRWQUGbw/photo.jpg,Mais ou menos!!!!,4,1,7.4.0,2014-09-04 12:02:43
81,Lucas Lins Baía,https://play-lh.googleusercontent.com/-jxZgH4sl1WQ/AAAAAAAAAAI/AAAAAAAAAAA/AMZuucnKS9M-oQ8ruBqyeS3jqsh9IGZi6A/photo.jpg,Nice!,5,1,7.3.0,2014-08-23 23:29:15
82,Mário Crispim,https://play-lh.googleusercontent.com/a-/AOh14GjDrdsIsecQLYuWvUbFiFxq4CVukfwcUcIrRjTFnw,Bom,4,1,7.3.0,2014-08-23 11:21:07
83,Cristina Torres,https://play-lh.googleusercontent.com/a-/AOh14Gh_gV4tzZJlptofLEuL4lTQlZby9rLpa4jhct06Plo,"Bough the board game on sale in  Entertainer, nice pack that goes everywhere. Found the app that is helping me how to play it. Really fun app.",5,2,7.2.0,2014-07-29 02:56:32
84,Pedro Henrique,https://play-lh.googleusercontent.com/a-/AOh14GjYlQD8jc1CCde4nlD9EHZTqla05PqXfElJY9IpjK0,Se for bom dou 5 estrelas,3,0,7.2.0,2014-07-20 16:09:12
85,Milena Lima,https://play-lh.googleusercontent.com/a-/AOh14GhEKM-zW_goqZ_E08BIyfZ4rYj4VgLTx8-qOQTINg,:),5,1,7.2.0,2014-08-12 16:15:19
86,Um usuário do Google,https://play-lh.googleusercontent.com/EGemoI2NTXmTsBVtJqk8jxF9rh8ApRWfsIMQSt2uE4OcpQqbFu7f7NbTK05lx80nuSijCz7sc3a277R67g,"É bom na língua do Shakespeare, mas quando meterem isto na língua do Camões é que vai ser do ca*****! Para jogarmos Palavras Com Os Amigos. Um grande saravá! E beijinhos à prima.",4,3,7.1.4,2014-05-25 10:48:56
87,Julia Oliveira,https://play-lh.googleusercontent.com/-gcC_hemDIRQ/AAAAAAAAAAI/AAAAAAAAAAA/AMZuucnsN7kO3RKSu9NLJIb-CPCNSFDEsg/photo.jpg,Não sei se for dou mais estrelas se não não,2,0,7.1.4,2014-06-30 14:16:04
88,Lucas Enzo,https://play-lh.googleusercontent.com/-gq9iL-doGik/AAAAAAAAAAI/AAAAAAAAAAA/AMZuuclImpwwer5LQz1LE1lBatk8OS8hCQ/photo.jpg,Parece bom pelos comentários eu vou baixar esse jogo,2,0,7.1.4,2014-04-17 14:31:24
89,Raah Marques,https://play-lh.googleusercontent.com/a-/AOh14GgqiBQrMZhjLCM1L3hK9B0XyTNXmcFBVjnQxAd7,"Muito bom, funciona muito bem e não trava!",5,1,7.1.4,2014-04-25 23:32:39
90,Um usuário do Google,https://play-lh.googleusercontent.com/EGemoI2NTXmTsBVtJqk8jxF9rh8ApRWfsIMQSt2uE4OcpQqbFu7f7NbTK05lx80nuSijCz7sc3a277R67g,Awesome!,5,1,7.1.4,2014-06-16 01:21:15
91,Bruno Dutra,https://play-lh.googleusercontent.com/a-/AOh14GgNKtjktwAmE7JWhCL0scpPJKoz8JwS9XmwnNCP,Filho,2,0,7.1.4,2014-06-10 20:22:29
92,Lisa Henriques,https://play-lh.googleusercontent.com/a-/AOh14Gj1Gke9rHqGrEZ6iK6BUrTnxzx4hDkOlxCFYxZXpA,Awesome game :),5,1,7.1.4,2014-07-04 08:42:29
93,Ruan Gravina,https://play-lh.googleusercontent.com/a-/AOh14GgJOEDQLaHkx47pr9gwJqm-u8V3b1zY_k8nPyeiuw,Legal,5,0,7.1.4,2014-07-06 17:59:56
94,Ricardo Costa,https://play-lh.googleusercontent.com/a-/AOh14GhTLO-ErOjrkXVRfjeOeX3aYIb1uifDvgDvuuUJug,Maravilhoso,5,0,7.1.4,2014-04-13 21:28:38
95,Marilene Neves,https://play-lh.googleusercontent.com/a-/AOh14GhLjnhIX8vNHG6F5T97SOAYPAjHHn1NVMBeTy_esQ,Ótimo,5,1,7.1.3,2014-04-05 19:01:25
96,Rodrigo Melo,https://play-lh.googleusercontent.com/a-/AOh14GhcQJQpEz9eRlhBD2IPexc_bpC_k_Lqq9ftB3sYvVw,Galaxy Note 3 *-*,5,0,6.9.0,2014-02-21 19:25:27
97,Marcos Antunes da Costa,https://play-lh.googleusercontent.com/-OTQrjxy8Pbw/AAAAAAAAAAI/AAAAAAAAAAA/AMZuucmOe5qdv2goyCaefkMVgBAgouv5bg/photo.jpg,"EX, NATO e muitas outras palavras CORRETAS não são aceitas, enquanto palavras incorretas são. MELHOREM O DICIONARIO!",3,1,6.8.4,2014-02-17 01:07:49
98,Marcell Dias,https://play-lh.googleusercontent.com/a-/AOh14GgkVmkmMBUbQ4-5prfCB1bf-ZsVFayIDac-5INPvA,"Muitas pessoas jogando, rende bastante diversão e aprendizado de vocabulário!",5,0,6.8.2,2014-01-20 18:29:17
99,Josias Lopes,https://play-lh.googleusercontent.com/a-/AOh14Gj39f6pVZwxSkL-ggZo3We1OGIMtV2PKoh4TyzK_g,A good game to relax and learn new words,5,0,6.8.2,2014-01-20 10:27:43
