,userName,userImage,content,score,thumbsUpCount,reviewCreatedVersion,at
0,Obson Pereira,https://play-lh.googleusercontent.com/a-/AOh14Gi7ZgWp1gSM_pf3_PrsYZq6EbmC1Xon_gnNFrNp4w,"O jogo é bom, mas precisa melhorar muitas coisas, as aposta aparecem um valor quando a partida acaba é outro, teve partidas que o jogo não fez a leitura certa da minha mão tinha um full house e o jogo mostrou um par, e a divisão dos prêmios saiu totalmente errado. Então o jogo precisa melhorar isso por que fica chato, essas situações me fazem querer parar de jogar, e pra completar não existe históricos de partida, para caso você queira acionar o suporte ter uma prova física.",1,21,1.148,2020-10-12 03:30:59
1,Joao Jr,https://play-lh.googleusercontent.com/-o0nf5BSAoR4/AAAAAAAAAAI/AAAAAAAAABI/AMZuucnFalNO-arKMet3clNYfSMzmoZ7Sg/photo.jpg,"O jogo parecia ser bom, mas simplesmente nao vem mais carta, acho que pelo fato de nao ter feito nenhuma compra ou nao ter visto nenhum anuncio, eu ganhei 1 milhao antes do nivel 40, e agr simplesmente nao consigo mais ganhar, fiz um teste, joguei 12 partidas, em apenas duas eu tinha alguma combinação, na primeira dei all in com um flush e perdi por flush de carta mais alta, na segunda eu ganhei a partida com uma trinca de 3, mas soh ganhei na ultima carta qdo eu ja tava pagando aposta de 20k.",1,13,1.148,2020-10-21 16:38:17
2,Luis Ribeiro,https://play-lh.googleusercontent.com/a-/AOh14GgwSvYg9habnMkYb6rjxPYLeVvgfyNfN9L2nDcKwA,"Interface intuitiva, bons gráficos, mas o servidor fica várias vezes sem responder e acaba perdendo jogadas e fichas porque isso. Em nenhum outro jogo passo por esse problema, lamentável",1,1,1.148,2020-11-09 00:15:38
3,Darllingson Costa,https://play-lh.googleusercontent.com/a-/AOh14GjEw-V40JPQUv4mWDH6cb-lFwiSwgnfHmz9a0_JNg,"Esse jogo tem algum tipo de bug e algumas pessoas fazem algo anormal pra ganhar sempre. Eu demorei um bocado pra chegar em 1M, depois consegui peguei várias mesas que sempre um cara aposta todas mãos muito alto, é até na maioria das vezes apostando tudo, é sempre ganhand9.",1,9,1.148,2020-10-24 00:14:02
4,V4CuO C:,https://play-lh.googleusercontent.com/a-/AOh14GjO_DfBZCL717RQM5eObd1eLO6rXZr-Wyz-W9L4,"Esse jogo de alguma forma beneficia alguns tipos de pessoas, a pessoa tava na partida comigo e constantemente apostava tudo no inicio e sempre ganhava uma atrás da outra, de alguma forma ele sempre tinha dois pares, uma trinca, straight flush, full house",1,9,1.148,2020-10-15 18:29:46
5,Tarciso Nascimento,https://play-lh.googleusercontent.com/a-/AOh14GjpYUbXtBoON3-60rVev_9YntIrIQw7ceSdWMnx,"Péssimo, jogo não dispõe de mesas para todos os players fiquei mais de hora tentando uma mesa e nada, e quando achei uma mesa o jogo simplesmente travou e fechou!",1,3,1.148,2020-10-19 14:34:13
6,Willian Alves,https://play-lh.googleusercontent.com/a-/AOh14GgTKWwVi1EPSDT7uMIOqQkLguXjUI-KwEh3RFVU,"Estou jogando a algumas semanas e é bem fiel, sem trapaças ou hacks !! Nao tive problemas por travamento mesmo fora do wi-fi Só acrescentaria ainda mais tipos de torneio !!! Vale a pena !!",5,17,1.148,2020-09-21 15:57:46
7,Anderson Oliveira,https://play-lh.googleusercontent.com/-PWolz3cTfZA/AAAAAAAAAAI/AAAAAAAAAAA/AMZuucm2OwHPlxFf-TradcEhsmBMJUXlpg/photo.jpg,"Acho o jogo meio manjado, a galera da muito all in, na real não é não é bem assim, não se joga só dando all in rodada após rodada, falta o jogo jogado.",4,0,1.148,2020-11-08 09:08:21
8,Sr Dukray,https://play-lh.googleusercontent.com/a-/AOh14GiGFxpc3_eKkiy0Ttm8F3MsZwKkvsOLzlxy2eqb,"Um app excelente, sem nenhuma reclamação sobre bugs e jogadores super sem noção para ficarmos milhonarios de fichas...",5,0,1.148,2020-10-15 11:21:55
9,Marcio Oliveira,https://play-lh.googleusercontent.com/-8poNFd4wBj8/AAAAAAAAAAI/AAAAAAAAAAA/AMZuucmvDzX55IULrcLT42rF6q1bEeVkVQ/photo.jpg,"Desculpem todos ,mas colaboradores só pensam em uma ia finança.... lamentável ,o jogo em si ótimo mas suas atualizações péssimas estou fora o entendimento virou negócio no jogo ... Desculpem ótima noite",1,11,1.148,2020-10-06 19:33:22
10,Ricardo Tonicioli,https://play-lh.googleusercontent.com/a-/AOh14GjjHBZ7Z-yUQs2YlEI6hlhCjCCFfSRnfvcgmGpjOA,"O jogo era muito bom, agora começou a trapacear provavelmente para pessoas que investem dinheiro.",1,0,1.148,2020-11-03 03:16:02
11,Fabio Manini,https://play-lh.googleusercontent.com/a-/AOh14GjV8U9KTDBs2-bQedRd9i1rt0saSGaqLPK4XcMQ,o jogo era bom. mas algumas partidas não fazem sentido. como eu ter perdido pra uma trica de 2 sendo que estava com uma trinca de às.,1,0,1.148,2020-11-06 12:57:32
12,Black Channel,https://play-lh.googleusercontent.com/a-/AOh14Ggr0hmaOB4Ned-Rvkr7fJbdMtqTb_OJIa9TfXYt,"Perfeito, distribuição de cartas justas, sem enrolação ou Vitória garantida pra quem paga dinheiro.",5,7,1.148,2020-09-29 08:08:17
13,Bruno Torrezam,https://play-lh.googleusercontent.com/a-/AOh14Gjl2z7Mpow4LwbWOZkm7RdIDI8FWtaWBNoLyR4G,Estou jogando a alguns dias mais gostei bastante até o momento. Fácil de jogar e bem legal os modos de jogo.,5,0,1.148,2020-10-12 11:07:39
14,daniel pires,https://play-lh.googleusercontent.com/a-/AOh14Ghm_tZ_e5ukGx0Ql95F9bslmEhN93LU_4XW8Hkepg,"Vou mudar minha avaliação No começo é um jogo justo q claramente é bem embaralhado, depois de um tempo começa a favorecer quem tem mais fichas , só é bom no início . Não jogo mais",1,0,1.148,2020-10-21 22:02:47
15,DrMarcos Pimentel,https://play-lh.googleusercontent.com/a-/AOh14Gjrlnb-BHGbld1f6YGFGemdFDUybmNbVe8A7j3xhg,"Dinâmico, intuitivo e uma ótima recreação.",5,0,1.148,2020-10-23 19:26:39
16,Adriano Rezende,https://play-lh.googleusercontent.com/a-/AOh14GiDQBrKc_EDqHNF9Y6JOxQzJty15NE6hs-9Bnyzvg,"O App é bom, interface simples e tal, mas rouuuuuba que é uma blz.",2,0,1.148,2020-11-08 19:29:42
17,kaneki ken,https://play-lh.googleusercontent.com/-_pydOk7I63I/AAAAAAAAAAI/AAAAAAAAAAA/AMZuucmUeXMtOY865IGyJtdWNcF7BqckGg/photo.jpg,"Muito fiel ao que diz, nao beneficia jogadores com cartas para sempre vencer, sempre bem embaralhado as cartas",5,7,1.148,2020-09-27 15:01:02
18,Mateus Câmara,https://play-lh.googleusercontent.com/a-/AOh14GixhVzgoMSzZCcTGGstGsmlDy-BZGa0cpH0w_h7bw,"Muito bom, ainda mais pra quem está iniciando.. ajuda a decorar o ranking do Poker.",5,0,1.148,2020-10-22 10:48:21
19,Alberto Trovao,https://play-lh.googleusercontent.com/a-/AOh14GhIRr3XzjFWYa6KJ0avT8duiOrJoNLjVw7YEU09RQ,Não funciona no redmi note 9 pro... Instalei e desinstalei 2x e nada... Apenas tela preta e nem inicia o jogo!,1,9,1.148,2020-09-25 05:39:07
20,Paula Ishii,https://play-lh.googleusercontent.com/a-/AOh14Gh-yXl6SbI8X5Y0jA9Rzlm7x9eCt_Ixm-eMfO4_Xbk,"Era o melhor app antes da atualização, agora fica fechando no meio da aposta, qdo vc recebe convites etc. Já foi melhor! Se arrumarem os bugs mudo minha avaliação. obs: já reinstalei 2 vezes e continua o problema! Junho 2020 continua o mesmo problema! App fechando sozinho, agora pior... nem dá tempo de sentar na mesa! Agosto 2020...e o suporte tbm não resolveu nada! Desinstalando já ....",1,56,1.144,2020-08-14 04:22:06
21,Cosmic Sailor,https://play-lh.googleusercontent.com/-GEWBKlKnA7U/AAAAAAAAAAI/AAAAAAAAAAA/AMZuucnNWPpqb50l3dAAf2ukxl6kdlgyNw/photo.jpg,Ótimo jogo intuitivo e divertido. O melhor de poker que já joguei,5,1,1.148,2020-09-30 11:02:19
22,Thiago Thi Tattoo,https://play-lh.googleusercontent.com/a-/AOh14Gg5QD-KVwmItuqA2aeyJ8jXYvbJaMqeG8TuZnNREw,"Excelente! Distribuição equilibrada de cartas que parece verdadeiramente um baralho embaralhado. Melhor que o wsop e zyngapoker. Sugiro apenas a inclusão de mais missões valendo moedas de ouro ou pontos de respeito e até mesmo, raspadinhas grátis. No restante, não mexam. Está perfeito! Diminui uma estrela da avaliação porque vocês precisam corrigir alguns erros e lentidão do servidor.",4,57,1.145,2020-07-12 08:16:22
23,tompero,https://play-lh.googleusercontent.com/a-/AOh14Gg_uLFnRkw1pcOCg0hai52i3ApC91ueZV65G9E_,"O jogo é simplesmente maravilhoso, atendeu todas as minhas expectativas.",5,0,1.148,2020-09-30 15:59:25
24,jorge palheta,https://play-lh.googleusercontent.com/-0laytcuxw7I/AAAAAAAAAAI/AAAAAAAAAAA/AMZuucns8rsOHkG2mNHCcD3Nvij6dyag2Q/photo.jpg,"Excelente jogo, é ideal para iniciantes",5,0,1.148,2020-10-12 16:16:16
25,Carlos Monteiro,https://play-lh.googleusercontent.com/a-/AOh14GjFj8GG6JmQ1Kapelc2jzVSheaXZmCDO5TGy1VL,Um dos melhores jogos de poker que já joguei. Excelente.,5,0,1.148,2020-10-18 15:40:05
26,tulio Ferreira,https://play-lh.googleusercontent.com/a-/AOh14GivGVe_8h1dOMTDqBWBkrQjLJSD6FmAkzM2SIhdTw,Melhor App de poker muito bom parabéns só uma obs(a rede cai muito ) melhorando isso com certeza vou dar 5 estrelas,4,0,1.148,2020-09-22 11:16:20
27,Thiago S.S.,https://play-lh.googleusercontent.com/a-/AOh14Gg78cUmhpzoyTTkEB3I41iu-5xwuvxSxkVMbp8y,"Legal por ser frenético, acredito que deveria ter a opção kick pra jogadores ociosos acima de 3 rodadas",4,28,1.145,2020-07-25 16:53:29
28,Marcos Lopes,https://play-lh.googleusercontent.com/-OdGF2Obo4s0/AAAAAAAAAAI/AAAAAAAAAAA/AMZuuclev1CvsHeoUSIHWmrV8TQqitCZvA/photo.jpg,"Toda vez que estalo esse jogo, ele trava..já tem um tempo esse problema.resolva isso",1,19,1.145,2020-07-01 23:28:44
29,thais giestas,https://play-lh.googleusercontent.com/a-/AOh14GjXhhZrScPQ3w5vCBmt0fqWHq0s5gUH63kayfb0FI4,Baixei porém aí tentar jogar aparece uma tela preta. Não consigo jogar,1,0,1.148,2020-09-28 23:04:23
30,Oldo Pacheco Lenza,https://play-lh.googleusercontent.com/-NcyoAr_VjtY/AAAAAAAAAAI/AAAAAAAAAAA/AMZuuclqj8zonl_h0TUCAJv0O95nTnzA3g/photo.jpg,Muito bom... O jogo flui rápido! Sem propagandas.,5,2,1.145,2020-06-20 19:28:25
31,Matheus Gimenes,https://play-lh.googleusercontent.com/-7Z5e_0trfYU/AAAAAAAAAAI/AAAAAAAAAAA/AMZuuclmiv1hjNGTofJKUmXlbvkbwKsJmA/photo.jpg,"Estou com dó em dar 1 estrela, mas o jogo fecha constantemente, assim fica difícil jogar!!! Uma pena pois o game tá top",1,1,1.145,2020-07-12 18:36:15
32,Rodrigo Calegari,https://play-lh.googleusercontent.com/a-/AOh14GjVq--C_wSBCsOHKQp_HgXC9p4YwmYPsMnrx1hq0A,"Depois você ganha uma quantidade de fichas considerável o jogo passa a te sacanear, eu estava com 40 milhões...a partir daí você muito raramente pega uma mão boa, e quando pega, o jogo trata de te trollar enfiando na última carta da mesa favorável para seu adversário...assim vc é induzido a apostar, e perde! E quando vc pega hand alta o jogo lança cartas baixas na mesa e vice versa! Desinstalando, dando nota mínima e deixando de jogar esse app!",1,0,,2020-11-07 13:27:39
33,Dalcir Schneider,https://play-lh.googleusercontent.com/-JRicy0pHbPs/AAAAAAAAAAI/AAAAAAAAAAA/AMZuucmvM4ZrcJyl38_a-RW3Vw3CzZrAyw/photo.jpg,Como pode o jogo marcar trinca se estou com fullhouse não entendo,2,0,1.148,2020-10-05 18:53:20
34,Thiago Rodrigues,https://play-lh.googleusercontent.com/-T-ke7Z4W5dI/AAAAAAAAAAI/AAAAAAAAAAA/AMZuuclXN8sxCT7iS4O8-t1YDdGoKKB3Ng/photo.jpg,"Ótimo jogo!! interface,comandos tudo em geral!! Parabéns",5,3,1.144,2020-06-07 14:40:43
35,Alfa Comboio,https://play-lh.googleusercontent.com/a-/AOh14GjmpLiGLP3TpqcPQjx1npxOp7mYBLb2FjXOTLaB,"Finalmente encontrei um bom entertimento num jogo de poker. Só acho que o tempo de decidir a passagem de cartas no jogo está muito rápida. Às vezes quando estamos a escolher o valor para por na mesa, já passou o tempo de decisão no jogo.",5,0,1.146,2020-08-26 10:25:12
36,Guitar Roads,https://play-lh.googleusercontent.com/a-/AOh14Gjf0ZDYSP0hCjvtA3F3kSelvc-GznvkubN816w7-A,Simplesmente não carrega para iniciar o jogo. Decepcionado.,1,1,1.145,2020-07-14 07:12:19
37,Érica Natália,https://play-lh.googleusercontent.com/a-/AOh14GiOwVTVPVmYw5swMvw6Rh0FaElxnUsINt8IvrS_Vnk,"Não consigo entrar no jogo. Toda vez que tento entrar, a tela fica preta e o jogo saí ou relata que está com problema. Já tentei desinstalar e instalar de novo mas não funciona. Uma pena porque queria muito continuar jogando...",1,0,1.146,2020-08-22 10:08:40
38,TARLEY Miguel,https://play-lh.googleusercontent.com/-ZDZtrNyrJY0/AAAAAAAAAAI/AAAAAAAAAAA/AMZuucku9k8nVRWQ4E7u6cFyskLXo5GNWQ/photo.jpg,De acordo com a lei 3688/41 artigo 50 da constituição Federal do Brasil é proibido jogos de azar esse mesmo me fez gastar muito dinheiro fazendo alusão a um jogo divertido e legal porém não passa de um jogo sórdido que age de má fé com seus jogadores ocorrendo o crime de estelionato. O mesmo será encaminhado à polícia federal no intuito de me devolver o meu dinheiro junto ao ministério público!,1,4,,2020-06-11 01:22:25
39,Carlos Eduardo Lampert,https://play-lh.googleusercontent.com/a-/AOh14Gic9ab5-YCcEjxjjyXQwjvfAogrpBjVDpbXVi7R,"O jogo não abre, tenho um samsung A70, e o jogo só fica com tela preta. Se isso for corrigido futuramente, faço nova avaliação.",1,0,1.146,2020-08-22 07:40:45
40,Anderson Carvalho,https://play-lh.googleusercontent.com/-JwtMQ6F8XVE/AAAAAAAAAAI/AAAAAAAAAAA/AMZuuclcXHNvygz2dhy_bcf6O2KxA24whA/photo.jpg,"O melhor jogo de poker, sou principiante, já ganhei milhões 🤑🤑🤑",5,0,1.145,2020-07-19 19:24:51
41,Diorge Lucas,https://play-lh.googleusercontent.com/a-/AOh14GjK9nRUIqFp7jcjkSvGnvzMGcfv1jN4vfZZq9Xdgg,"Melhor jogor de poker daqui. Muito intuitivo, rapido, e sem muitas propagandas! Se pudesse daria mais estrelas!!!",5,0,1.146,2020-08-22 14:41:17
42,Its ON,https://play-lh.googleusercontent.com/a-/AOh14GgdYi3y4feh1beWKofL-3Ih3cD6GO9huTl-ZkHrIA,"Parece interessante mas não abre, além de fechar a todo momento, muito mau otimizado.",1,0,,2020-09-04 10:49:57
43,Novel Rossotti,https://play-lh.googleusercontent.com/-blmsTZ_8Fwg/AAAAAAAAAAI/AAAAAAAAAAA/AMZuucmBIQotaroLny3JBEZk5VTw_v7j4A/photo.jpg,"Probabilisticamente observando, o algoritmo de aleatorizar as cartas precisaria ser mais indiferente. Por exemplo, qual a chance de, após correr antes do flop umas 15 vezes durante 1h de jogo (ou seja, eventualmente); em duas dessas abrir fula (mãos difíceis) pra ti; e em outras 4 dessas iguais ou acima de trinca (improváveis)? Nesse casos, tais circunstâncias pode se vislumbrar uma indução ao risco de permanecer bancando. Outras situações semelhantes noutras fases fortalece essa tese.",2,27,1.137,2020-03-01 12:33:58
44,Cláudio Paixão,https://play-lh.googleusercontent.com/a-/AOh14Gghvf6jbuARS0qVRfltWLrRtR60VOs-Bm0S4-JAKg,Deveria ter um rápido tutorial ensinando a jogar. É feito só para quem já nasceu sabendo jogar.,1,0,,2020-08-30 12:00:40
45,cleverson vinicius,https://play-lh.googleusercontent.com/a-/AOh14GhBfQtu8f7fTZ6D5GH_bnuzNq4nEft232e0BB0r,"O melhor de todos na minha opinião, simples prático e objetivo.",4,0,1.146,2020-08-26 19:16:20
46,Luiz Gustavo Da Silva Correia Correia,https://play-lh.googleusercontent.com/a-/AOh14Giv8O0gxQxnm3I5qJKb6mYDdKgp1gxm5UEVPytP,"Muito bom mesmo excelente poker muito justo nas mãos,rápido,e facilidade de jogar muito bom mesmo está de parabéns.",5,0,1.146,2020-08-26 15:52:11
47,Victor Toniato,https://play-lh.googleusercontent.com/a-/AOh14GgafBZ8zbw83_WK7No6uGjWTWjeY9zHBX4KDzLs0w,"Muito boa Uma vez eu apostei 2k e cai, mas tirando essa vez, o jogo nunca cai, é intuitivo e além de tudo é honesto",5,0,1.146,2020-09-13 14:52:55
48,Ícaro Silva,https://play-lh.googleusercontent.com/-1K9opJJLmE4/AAAAAAAAAAI/AAAAAAAAAAA/AMZuuckSKMJ39f6f2_2hc_f8Osmd_xyIUA/photo.jpg,"PQ O JOGO NÃO ENTRA?! QUANDO EU INSTALEI O JOGO E FUI JOGAR, SÓ FICOU NUMA TELA QUE PARECIA SER A TELA DE ""LOADING"" MAS NUNCA PARA DE CARREGAR!! FICA NAQUELA TELA PRA SEMPRE! ATÉ AGORA EU NÃO CONSEGUI VER LITERALMENTE NADA DO JOGO! NEM UM SOM! CONSERTEM ISSO LOGO! E ESTÁ ACONTECENDO A MESMA COISA COM O ""City Poker: Holdem, Omaha"" ! CONSERTEM",1,0,,2020-08-18 08:50:52
49,Jose Leo,https://play-lh.googleusercontent.com/-HcS2CvPeN64/AAAAAAAAAAI/AAAAAAAAAAA/AMZuucmBKgAeKBhoDeWuUPFGy-N6FH0IGw/photo.jpg,Jogo esta pessimo . Toda vez que vc esta com cartas boa e vence uma rodada trava o jogo ai vc perde . Nao jogo mais . Desinstalado o jogo . Pessimo,5,0,1.146,2020-09-14 10:56:08
50,ademir oliveira,https://play-lh.googleusercontent.com/a-/AOh14Gh78FlIPSlew1Ynec8Sv_7HMl9grdhfLnDASdyl,O bug se tá em um torneio e do nada o aplicativo fecha você perde as fichas suas ficha somem não percam tempo neste aplicativo .,1,0,,2020-09-19 11:00:21
51,Patolino Gamer,https://play-lh.googleusercontent.com/a-/AOh14Ggpxd3XiEDm3823_9ZwHLDk9226MsMiRO4gubpExQ,Péssimo! Eles fizeram um sistema que voce aperta para sair do jogo e não consegue. Tem que ficar apertando várias vezes até conseguir sair .,1,0,,2020-08-05 01:29:57
52,Nuno Renato Meireles Ferreira,https://play-lh.googleusercontent.com/a-/AOh14Gj0pTSTBLgaBjgHEwFPJKlcPyhkCFHzeAGbBgOO,Completo e com boas mesas. Rng satisfatório e algo mais pró lado do profissional e não tanto pro relax.,4,0,,2020-08-13 15:57:32
53,Um usuário do Google,https://play-lh.googleusercontent.com/EGemoI2NTXmTsBVtJqk8jxF9rh8ApRWfsIMQSt2uE4OcpQqbFu7f7NbTK05lx80nuSijCz7sc3a277R67g,"Baixei em 2 celulares para fazer o teste. Em um eu comprei fichas no outro não, surpreendentemente no que eu comprei fichas de 30 rodadas eu ganhei 23, e no outro apenas 5. O jogo é tendencioso, ele favorece quem tem mais fichas e quem da all in com mais frequencia. Triste, nunca acho um app de poker honesto.",1,18,,2019-01-04 00:41:36
54,Daniel Cavalcante,https://play-lh.googleusercontent.com/a-/AOh14GgWTKG_CgLh9lLoVMqCvFKc-LdQWa3Gsuek0eZgC7E,Muito divertido. Plataforma intuitiva e jogo bastante claro.,5,0,1.146,2020-07-30 17:33:34
55,as all,https://play-lh.googleusercontent.com/a-/AOh14Gisck1qU_o6I_ne9gotTQ6CZEGsISCDI3rTIT_M,Nem passa perto de uma mesa real todas as apostas sao condicionada. Apostadores pagos sao condicionados a ganhar para continuarem pagando.,1,0,,2020-07-17 10:38:47
56,Éverton Garcia,https://play-lh.googleusercontent.com/a-/AOh14GgaIr9s4hjQG_R4GACK5ij9ujoVY5u_BSigTP3fknk,"O jogo e ótimo. Mas não consigo mais entrar, só trava e cai. Assim vou desinstalar.",2,0,1.146,2020-09-15 23:59:22
57,Lands souza,https://play-lh.googleusercontent.com/-BWjV6m5eHLg/AAAAAAAAAAI/AAAAAAAAAAA/AMZuucmcLjwKVmdYl7_l3XpxgQzludYy1Q/photo.jpg,Péssimo gráfico e jogabilidade horrível,1,3,1.144,2020-05-21 11:05:54
58,Paulo Cesar Siqueira Melo,https://play-lh.googleusercontent.com/a-/AOh14GiOajtQ_LqxX9AOrlrkAOtrwY-8pTnkqYTs_m37WIA,"Péssimo. Antes era o melhor. Agora fica saindo toda hora, você ganha e o prêmio some por causa do sistema que cai. Dá raiva.",1,0,1.105,2020-07-23 18:04:37
59,Roger Batista,https://play-lh.googleusercontent.com/-RnHP6OLCA-I/AAAAAAAAAAI/AAAAAAAAAAA/AMZuuckXkbNXlWNig_mJNfoB_F8W5uzOxw/photo.jpg,Vamos dar uma melhorada ai galera pq o jogo ta ficando muito mentiroso e isso acaba deixando-o chato. De vez enquando aparece uns jogadores na mesa (creio eu que sejam bots) que é perigoso ganharem ate do seu Royal Flush haha Pensando seriamente em mudar de app.,2,5,1.119,2019-03-17 19:40:04
60,Rogério da silva campos,https://play-lh.googleusercontent.com/a-/AOh14GhDM0du-g-SCGfkldMjDstyIDTspYu6lI5t3wum,Presta não para de funcionar e fecha no meio do jogo,2,2,1.145,2020-06-22 07:36:56
61,Israel Codo,https://play-lh.googleusercontent.com/-tyCogTAW_2o/AAAAAAAAAAI/AAAAAAAAAAA/AMZuuckai4v-MBK4WHvRy3RjNBKvrn8VSg/photo.jpg,"o cara entra na mesa -vamos chama-lo de João- e da all in, alguns jogadores pagam e o João ganha com um straight. 2 rodadas dps João da all in e ganha com im straight. 3 rodadas dpa João da all in e ganha com um straight. 2 rodadas depois João da all in e ganhacom um straight o jogo é confiável sim, pode baixar",1,2,,2019-01-25 19:33:43
62,Um usuário do Google,https://play-lh.googleusercontent.com/EGemoI2NTXmTsBVtJqk8jxF9rh8ApRWfsIMQSt2uE4OcpQqbFu7f7NbTK05lx80nuSijCz7sc3a277R67g,"Se não fosse o problema, de ficar dando erro seria ótimo, vamos arrumar isso logo, não consigo jogar toda hora fica saindo do aplicativo.",3,5,1.112,2018-11-12 16:50:13
63,Frederico Trevisan,https://play-lh.googleusercontent.com/-n9DwODNTE3M/AAAAAAAAAAI/AAAAAAAAAAA/AMZuucmhze589EL5pmB9HaiGEkSGR_U9xg/photo.jpg,"Muitos defeitos, trava toda hora, o software deve estar com problema, vou desinstalar",1,0,1.126,2020-07-19 18:57:34
64,Francisco Martins Neto,https://play-lh.googleusercontent.com/-KMLnt00MPKs/AAAAAAAAAAI/AAAAAAAAAAA/AMZuucmNyBChHlYgpjM_pJpfjaY59peR2g/photo.jpg,"Ótimo gráficos, simples e fácil compreensão. Ótimo.",5,6,1.143,2020-05-18 21:09:41
65,Bruno,https://play-lh.googleusercontent.com/a-/AOh14GgwnPYW1ct8s4VxhoE2bE0Wt7vIH9Gf7DFGcI-m,"eu tinha três AS, o outro cara tinha três 5 e levou toda minha fichas, ou seja, o jogo calcula o resultado errado...",1,1,,2020-08-04 17:28:05
66,Wes,https://play-lh.googleusercontent.com/a-/AOh14GiOGBrobuC4qjs4BF3zEhCUazO5sdAytnSlw3sAHQ,Jogo mto acelerado para até corrida.,3,0,1.144,2020-06-08 21:51:18
67,Gonçalo Queiroga,https://play-lh.googleusercontent.com/-YeHU7Yre97o/AAAAAAAAAAI/AAAAAAAAAAA/AMZuucn0Cypior_N35uAUiY0XYa7oI4Hvg/photo.jpg,em 50 jogadas ganhei 3 jogadas. em 900.000 fichas perdi 900.000 fichas em menos de dez minutos. o jogo ou o aplicativo nao deixam ganhar. vergonhoso,1,2,,2019-08-13 19:40:33
68,Paulo Sato,https://play-lh.googleusercontent.com/a-/AOh14GgE5rK4GTrSDFNKL6twOTyrLbfnrzC-DFy9_dZN_A,"Jogo prático, rápido e muito bom",5,0,1.145,2020-06-23 18:41:18
69,Gustavo Ruiz,https://play-lh.googleusercontent.com/a-/AOh14GjDK_X8yPvKFK0MgGxvO5WVTcvnQ6pYEX61--AaKw,Top demais. Algumas coisas são confusas mas de resto o jogo e mto bom.,5,0,1.146,2020-09-06 00:57:41
70,Berg Souza,https://play-lh.googleusercontent.com/a-/AOh14GhLBzY-iE3-FjBZFt8DmHkcz-_hxrdJThPkcmMy6-0,O melhor app pra jogar Poker!! Mais depois q troquei de celular nao está pegando no meu Moto Z Play2 o jogo demora muito pra iniciar qnd consegue iniciar fica com a tela completamente preta mais ao tocar dar ouvir os comandos do jogo,4,0,,2020-04-22 17:34:29
71,sono13,https://play-lh.googleusercontent.com/-q6RRSjyfkMs/AAAAAAAAAAI/AAAAAAAAAAA/AMZuucmjpeNEVZpTmWUtpIXVG_ljkqerrw/photo.jpg,"Péssimo depois da última atualização, nao adianta reinstalar e nem reiniciar, trava a todo momento !",1,3,,2019-05-11 20:59:43
72,West Gun,https://play-lh.googleusercontent.com/a-/AOh14GjgNwyfL8Nz8HBPHxLeoBxsNoS6ASqftz3S1vpUFw,"Bom jogo. Rápido, e boa interface.",5,0,1.146,2020-08-21 11:36:51
73,Joey Maximus,https://play-lh.googleusercontent.com/a-/AOh14Giw0RtSN5qZgnk4BxD2lcUyY1JZj7SiK3_aBesm,Poucas fichas e poucos eventos é a raspadinha é uma fraude bugada.,1,0,,2020-10-26 05:12:33
74,seomar reis,https://play-lh.googleusercontent.com/a-/AOh14GjCTQGAwyfp_GY-u1cyVGElTssTxOm5RGfUcRE3Ig,É muito intuitivo e fácil de jogar,4,0,1.146,2020-09-16 01:27:40
75,Walber Ferreira,https://play-lh.googleusercontent.com/a-/AOh14Gg-BXPkj_TK_ftO9W4po7UjwdzdSR3SHLcOzvbVcg,O melhor app de poker que já vi aqui na Playstore. Falta apenas um opção de criar uma mesa apenas com amigos. Excelente jogo!,5,0,1.146,2020-08-01 08:25:05
76,Um usuário do Google,https://play-lh.googleusercontent.com/EGemoI2NTXmTsBVtJqk8jxF9rh8ApRWfsIMQSt2uE4OcpQqbFu7f7NbTK05lx80nuSijCz7sc3a277R67g,"Simplesmente espetacular, quem é iniciante como eu e quer aprender não existe outro melhor!",5,0,1.109,2018-09-30 14:28:27
77,Luiza Vaz,https://play-lh.googleusercontent.com/a-/AOh14GgTSrN74XdmDCkHb56MA8-uKrEnjSPqv10tNbPdww,Não sei o que arrumaram pq de uns tempos pra cá o aplicativo não para de fechar sozinho. Está insuportável. Jogo ele há mais de um ano e isso nunca tinha acontecido.,2,0,1.115,2018-12-26 18:16:03
78,Professora Francielle,https://play-lh.googleusercontent.com/a-/AOh14GjtPMoeLHsNAc4D7VttgLww5DjyImeDs9fZ5fqjYtI,Excelente e simples de jogar.,5,0,1.146,2020-08-22 01:27:35
79,MarcioGleison SLZ,https://play-lh.googleusercontent.com/-NjDjx6o26x8/AAAAAAAAAAI/AAAAAAAAAAA/AMZuucnDQP-oNvCyXYJ-Fgc-2tCt8FZw9A/photo.jpg,Infelizmente tive que desistalar o APK pois esta travando de mais e fechando sozinho.,1,0,,2020-08-06 06:35:45
80,Julio Nogueira,https://play-lh.googleusercontent.com/a-/AOh14Gg2bUg99mHNq0viIdTYSpxfFWh5JLQlsqx8NEa7kw,Um jogo muito realista... intuitivo e funcional!,5,1,1.119,2019-03-10 05:33:27
81,Nicole ulo,https://play-lh.googleusercontent.com/-Av4zbqAWKIA/AAAAAAAAAAI/AAAAAAAAAAA/AMZuucmiemKtOcxib5UQ0gJSrUAInRVd6w/photo.jpg,Pessimo ... Coisa mais dificil é sair com carta boa,1,4,1.144,2020-05-31 16:12:51
82,Eddy Silva,https://play-lh.googleusercontent.com/-CroHUaKiQmA/AAAAAAAAAAI/AAAAAAAAAAA/AMZuucmDIoyRDGK5sW_QP9Pki7NU8Hnv6Q/photo.jpg,"Cumpre o que promete, simples e fácil.",5,0,1.146,2020-08-25 00:03:29
83,Aline Nascimento,https://play-lh.googleusercontent.com/a-/AOh14Gi7A6Sf5Xw781CCNuhiPlcnslVZ9dqPNLSTsUCdSQ,nao entendo como funciona a regra de ganhar a partida. tenho cartas melhores e o outros ganham. poderiam colocar as regras mais claramente,4,0,1.115,2018-12-29 22:33:18
84,maia maia,https://play-lh.googleusercontent.com/a-/AOh14GjsYTy3lx0LCXSYxy0zUy4tzAnyJ9-0cG0G8z0Y,minha experiencia pessima a anos que jogo esse jogo e me bloquearam por isso tirei as 5 estrela ate me devolverem minha conta e quero minhas fichas grrrrrrrrrr/ minha conta do facebook ainda que jogo com meus amigos/,1,8,1.121,2019-05-13 20:33:43
85,Lais Andrioli,https://play-lh.googleusercontent.com/-uBro7n7M8lk/AAAAAAAAAAI/AAAAAAAAAAA/AMZuucmT-LFe1jZ0tCxTe5tIdhbbk5Nmug/photo.jpg,"Jogo muito bom, roda bem, não trava. Garantia de bons momentos para quem gosta de Poder.",5,7,1.125,2019-06-30 22:09:46
86,Um usuário do Google,https://play-lh.googleusercontent.com/EGemoI2NTXmTsBVtJqk8jxF9rh8ApRWfsIMQSt2uE4OcpQqbFu7f7NbTK05lx80nuSijCz7sc3a277R67g,Bom dia como que vcs atualiza o jogo e faz o jogador zerar as fichas e injusto tva com 12 m e zerou isso dezanima de jogar.,1,3,,2018-09-12 07:16:21
