,userName,userImage,content,score,thumbsUpCount,reviewCreatedVersion,at
87,FĕLïPý BĞŠ Zika,https://play-lh.googleusercontent.com/-gVI9zC7cSWU/AAAAAAAAAAI/AAAAAAAAAFA/AMZuucmxGGpvqJ1hSKLzWG6jNX_p4oeBhg/photo.jpg,Mannnnnnnn o meu nao entra com a conta da goog play antes entrava comeco do nada e agora não entra mas eu tinha no dinhero la pfvr arrumem isso ou deixarão o jogo de aldo pfvr arruma me manda menssagem quando arrumar pq n que da nao ja fis de tudo,1,1,1.109,2018-09-30 20:00:02
88,Claudio Viana,https://play-lh.googleusercontent.com/-wvqFZw3avJs/AAAAAAAAAAI/AAAAAAAAAAA/AMZuuckRf8fmqY2DDQSVBG9RF6yZBoutLg/photo.jpg,o jogo e bom mais ele é muito rápido mal da tempo pra gente pensa acaba o tempo mais e bom,5,7,1.129,2019-11-19 09:57:05
89,Elizier Marcos,https://play-lh.googleusercontent.com/a-/AOh14GiotqwUWhmiSb-36JWqi22VXDt_gLIYeifb89QO4A,Hoje terça dia 24 de março de 2020 ... Acavei de instalar espero quer seja bom gosto bastante dd jogos de poker online por hora 1 estrela mas daki 2 dias volto e dou 5 se for bom,1,1,,2020-03-24 02:11:50
90,Um usuário do Google,https://play-lh.googleusercontent.com/EGemoI2NTXmTsBVtJqk8jxF9rh8ApRWfsIMQSt2uE4OcpQqbFu7f7NbTK05lx80nuSijCz7sc3a277R67g,"adoro jogar este jogo mas o meu está sempre a cair,já expus a situação é continua igual!da para verem o que se passa com o meu jogo???",1,3,1.119,2019-04-03 21:49:48
91,Osmir Américo,https://play-lh.googleusercontent.com/-rP5ju8Zvkgc/AAAAAAAAAAI/AAAAAAAAAAA/AMZuuckJ3ksgQtQ6cn3cPszJypuPT42c7Q/photo.jpg,"Boa noite, já tenho cadastro neste sait, agora não estou conseguindo jogar, pede a idade, más não tem como colocar, o que devo fazer obrigado.",3,1,1.128,2019-10-30 01:06:09
92,Helber,https://play-lh.googleusercontent.com/-23MfXA7Sfmg/AAAAAAAAAAI/AAAAAAAAAAA/AMZuucnyhgxN-WOuv441qKxXCHi6g0CjCQ/photo.jpg,Muito bom o jogo tá de parabéns Só uma fica poderia ter mais jeitos de ganhar fixas.,5,0,1.146,2020-09-09 16:27:18
93,Josimar Monteiro,https://play-lh.googleusercontent.com/-OS5ASkS6gOU/AAAAAAAAAAI/AAAAAAAAAAA/AMZuucle8HxJdoSFTbqs0TWCF4PWuZjRCw/photo.jpg,Como eu tinha ontem 2M de fichas e nem entrei no jogo hoje entrei e sumiu tudo me roubaram. Nota zero.,1,27,1.138,2020-03-15 10:07:43
94,Um usuário do Google,https://play-lh.googleusercontent.com/EGemoI2NTXmTsBVtJqk8jxF9rh8ApRWfsIMQSt2uE4OcpQqbFu7f7NbTK05lx80nuSijCz7sc3a277R67g,"o jogo é bom, porém há menos de uma semana saio do jogo com um valor e qdo volto estou quase sem fichas... já sumiu mais de meio milhão em menos de uma semana",1,5,1.118,2019-02-03 12:12:53
95,Célio André Dias de Oliveira,https://play-lh.googleusercontent.com/-Sakr6Vo1qtM/AAAAAAAAAAI/AAAAAAAAAAA/AMZuucnueyuRRVWvuY2SGc6vY5ZTpE8D2w/photo.jpg,O melhor Aplicativo de jogo gostei até demais Além da conta amei.!,5,0,1.146,2020-08-01 01:44:16
96,Um usuário do Google,https://play-lh.googleusercontent.com/EGemoI2NTXmTsBVtJqk8jxF9rh8ApRWfsIMQSt2uE4OcpQqbFu7f7NbTK05lx80nuSijCz7sc3a277R67g,"Top. Melhor jogo de poker ok line, com toda certeza.",5,2,1.118,2019-02-27 08:16:36
97,Layze Ribeiro,https://play-lh.googleusercontent.com/a-/AOh14GgjPpCJwyHVgkN4W8tS0Mt0KAXPDtAUm8NNcCzbPg,"Não consigo logar com meu facebook pelo android.  Não tenho o facebook, apenas o facebooklight que eu uso e o aplicativo não me deixa logar.",3,12,1.126,2019-07-29 01:23:32
98,Andre Oliveira,https://play-lh.googleusercontent.com/-SB9uK-mjsZQ/AAAAAAAAAAI/AAAAAAAAAH8/AMZuucm7-YuRFvX--K5TG7ly2n50RB5AXQ/photo.jpg,Trava muito e ainda diz que é problema na internet.,1,0,1.146,2020-09-07 09:22:10
99,Beatriz Garbo,https://play-lh.googleusercontent.com/a-/AOh14GgEv7Ojl2L3ODl1dOQWLOiIaR4t8cA4QM7rfNqraQ,acabei e jogar apostando o máximo numa jogada aonde uma trinca ganhou do meu Straigth. Quando uma trinca ganha de um Straigth? Que Roubo descarado,1,3,1.119,2019-04-10 14:52:16
