,userName,userImage,content,score,thumbsUpCount,reviewCreatedVersion,at
44,Anderson Rafael,https://play-lh.googleusercontent.com/-muFsC-t_-CY/AAAAAAAAAAI/AAAAAAAAAAA/AMZuuck6vEUIKtFzyL9TrG-5p3vOW8X4ww/photo.jpg,"Essa atualização está péssima! a física está toda errada ex: o player toma um tiro na cabeça e cai no chão como quem tomou um tiro no corpo. Sinceramente, acho isso muito imcomodante. A sensibilidade também está comprometido, está muito baixa. Essa sem dúvida foi a pior de todas as atualizações. Já faz um tempo que parei de gastar no jogo, e acho que agora vou parar de joga-lo. Obrigado e por favor tentem corrigir isso!.O jogo ta cheio de hackers!!!!!",1,225,1.54.1,2020-11-07 13:57:04
45,Pablo Santos,https://play-lh.googleusercontent.com/-HX25hQbUp7I/AAAAAAAAAAI/AAAAAAAAAAA/AMZuucmXyaUBt0or35wa-sUxVa1vOX9Ayg/photo.jpg,"Sincerente não aconselho nenhum de vocês gastarem dinheiro com esse jogo, no início da tua conta, com 9 diamantes você consegue itens raros, mas não se engane pois a partir da primeira recarga nunca mais você vai ganhar as coisas boas de primeira. Não gastem suas economias. Falo por experiência própria e por todos os meus amigos que já recarregaram. Não vale a pena gastar seu dinheiro, eles sempre dão o grande prêmio no final incentivando a pessoa a recarregar mais dimas para obter o G.Prêmio.",1,15,1.54.1,2020-11-05 16:58:35
46,Gabih Garghetti,https://play-lh.googleusercontent.com/a-/AOh14GitdLm2HwDuCHK6aothncQAoVmzV7lfvOE8nIRu,"bem o jogo é muito bom os gráficos não são as melhores mas é um bom jogo único problema é que nós temos que estar comprando diamantes, e isso é um pouco chato deveria existir alguma maneira de estar ganhando diamantes não apenas comprar também existem muitos hacks no jogo, também gostaria que melhorassem e deixa-sem o preço das skins e roupas mais baratos pois tá muito caro e algumas roupas poderiam deixar pra comprar com moedas pois seria bem melhor e eu alteraria minha nota obrigado!!!!!!!!!",4,3052,1.54.1,2020-10-30 09:07:34
47,Ednaldo Alves dos Santos,https://play-lh.googleusercontent.com/a-/AOh14GiIsL3vxnAPNCsrMoj6t4uSQcV6FUKOwcndoC-m,"Bom,o free fire é um jogo diversificado e único entre outros jogos,tem uma jogabilidade incrível,ótimo gráfico,etc. Porém,o jogo está ficando muito pesado!! Daqui a algum tempo o free fire vai perder sua maior qualidade,que é rodar em celulares fracos!! E outra coisa é o preço das coisas do jogo,quem gasta dinheiro no jogo tem muito mais vantagens do que quem não gasta dinheiro. Uma sugestão minha é que tivesse mais possibilidades de ganhar diamante como eu vejo em outros jogos. Essa éminha opin",4,4481,1.53.2,2020-10-19 11:05:57
48,Mundo Gamer De Sophia,https://play-lh.googleusercontent.com/a-/AOh14GgGme-5UR_NavJsU1_WxvIZyy5zksKCj_9Oc2G3,"O jogo está muito ruim tem muitos hacks e a garena coloca tudo caro,nem todos os jogadores (assim como eu ) tem como gastar mais de 50 reais com um jogo para comprar skins.outra coisa é que a garena coloca muito mais skins masculinas e bem mais bonitos nao tem muitas skins femininas e quase todas as femininas nem se compara com as skins masculinas.e o plano bermuda ??? A garena falou que teria nova mapa etc e até agora não lançou o novo mapa. sinceramente eu só dei 2 estrelas pois ainda jogo.",2,14,1.54.1,2020-11-07 15:06:47
49,yasmin teles,https://play-lh.googleusercontent.com/a-/AOh14Gh4NQMSooVaRdZomCzUiB7MBhVuXDUEHqRm47c4oA,"tenho o jogo baixado a muito tempo , sempre recarreguei dima e sempre chegou , mas hoje recarreguei pela primeira vez na promoção do airdrop e as coisas nao chegaram na minha conta , ja faz 5 horas desde que recarreguei , o dinheiro saiu da conta e chegou a confirmação do pagamento , porem as coisas e o dima nao chegaram , gostaria de saber o motivo , pois adoro o jogo e nunca tive problemas , a nao ser o de hoje . Obrigada desde ja .",4,4,1.54.1,2020-11-07 20:43:07
50,HP- SHERIFF,https://play-lh.googleusercontent.com/a-/AOh14Gj3zpEnXKgH_0vhL7OhAXnVZm7QyHpmZZNt1sWFuw,"O jogo é muito bom,sem falar no gráfico mais agora tá com um bug que o gelo desaparece do nada,se der tempo de procurar ou tá no céu ou atrás da pessoa,por favor consertem isso,eo jogo do nada sai como se eu tivesse minimizado jogo em um xiaomi com 3g ram e quando baixei freefire eu jogava em um tablet de 1g ram e não minimizava tanto assim com um novo telefone agora eu tive que tirar do ultra pra não dar mais esses bug sem falar que tem hora que a tela fica piscando ingual árvore de natal!",5,2,1.53.2,2020-11-08 23:10:43
51,Vinicius Barbosa,https://play-lh.googleusercontent.com/-2Sg7rnWTwys/AAAAAAAAAAI/AAAAAAAAAAA/AMZuucmH9TFe7YPX2YJ5mgBZndwf8GzZTQ/photo.jpg,"O jogo é ótimo. Mai,seria muito legal se tivesse uma opção nos controles. Essa opção poderia ser de Rolar no chão,Ficar encontado na parede para poder ver a movimentação do inimigo melhor. Essas são as minhas duas opiniões,mais,vcs GARENA FREE FIRE,Que irão decidir o que é melhor para o jogo.",5,9,1.54.1,2020-11-08 13:20:35
52,IMarquis,https://play-lh.googleusercontent.com/a-/AOh14GhIufAH1I2Uo2wYw0oqLZPoVBAM_rxmiq95BasxUg,"Jogo faz anos e posso resumir a minha avaliação em 1 palavra; Hack. Tem MUITO hack no jogo, mas MUITO MESMO! Sério, jogue 100 partidas ranqueadas e 95 ou 98 terão hack. É simplesmente impossível de jogar. A partida começa, e em mebos de 5 minutos só ficam umas 7 pessoas vivas, impossível de jogar. O jogo em si n é ruim, mas a empresa NÃO FAZ NADA a respeito dos hacks. Se acham que estou mentindo, baixem o jogo e vão jogar, mas, depois voltem e avaliem a experiência de vocês contra os hackers.",1,236,1.54.1,2020-11-07 06:33:35
53,Cristiano Silva,https://play-lh.googleusercontent.com/-PMrur5WGBDY/AAAAAAAAAAI/AAAAAAAAAAA/AMZuucmLSUWw2wg111O7Dh6N1zbhotpHjg/photo.jpg,"A sensibilidade do jogo é horrivel não e todo mundo que tem condições de comprar um IPHONE,não dá para jogar de igual para igual no android tem que usar DP que as vezes estraga o telefone vcs tem que aumentar essa sensi eu jogo 5 minutos meus dedos ficam vermelhos de tanto forçar na tela as veses não da tempo nem de atirar nos adversarios pq eles se movimentam mais rapido e de melhor forma!",1,7,1.54.1,2020-11-07 22:18:10
54,Jeisy Oliveira,https://play-lh.googleusercontent.com/a-/AOh14Ggapwb1nzsi61zk-VM9K6yUvonczUETjo48tO6fJw,"Tô muito irritada com esse jogo, pois nós gastamos tanto dinheiro com ele e ele cheio de bugs e hackers, toda temporada ou atualização, eles dizem que vão mudar isso, mas desde quando comecei a jogar os bugs só aumentam. O jogo em si é muito legal, mas não tem condições de jogar sem se chatear por conta de todos os bugs e hackers. A pessoa morre no couver; vc dá 300 tiros e não mata o cara, o cara te dá 1 e você morre; a mira continua grudando no cara que ta caído no chão, inimigo atravessa gelo",2,4501,1.54.1,2020-10-27 15:04:24
55,Lucas Almeida,https://play-lh.googleusercontent.com/-BLri6fV4qvs/AAAAAAAAAAI/AAAAAAAAAAA/AMZuuclgP8eiqYo-JQlgfsQBuAba7ezIpQ/photo.jpg,"O jogo em si, apresenta uma ótima jogabilidade,mas tem um certo problema os Hackers.Além de algo muito importante,ressaltando que a Garena tinha que ir ""apertando""mais o banimento dos mesmos.Este jogo tem uma questão ,que é a parte gráfica que tem uma qualidade mediana podemos observar essa proporcionalidade nas árvores,nas rachaduras das casas,etc. Obs:Eu gostei muito do jogo,pois além de ""leve""apresenta uma qualidade ñ gráfica, mas uma boa jogatina",5,387,1.52.0,2020-10-11 21:44:03
56,VICTOR FF,https://play-lh.googleusercontent.com/a-/AOh14GhjDiW7bGvQfRX5HffcyEd0TZl8F7sl6WBgWXUPFw,"O jogo é muito bom tirando os hacks e os bugs,mais eu acho que poderia dar mais salas personalizadas, porque é injusto agente ganhar uma sala por semana enquanto os influenciadores ganham 200. Não precisa ser 200 salas, 10 já tá bom. Tem gente que fala que os influenciadores ganham sala pra treinar mais a gente tbm precisa treinar. Sem contar que vai ficar um jogo bem mais divertido na minha opinião.",4,227,1.54.1,2020-10-25 19:10:15
57,Acassia Araujo,https://play-lh.googleusercontent.com/-EkaPab88veU/AAAAAAAAAAI/AAAAAAAAAAA/AMZuucluhc4NAgee1KMpaYUpya1xFl-szw/photo.jpg,"Eu acho que é um ótimo jogo , mas ele deveria ocupar menos espaço do smartphone , e as compras deveriam ser mais baratas, fora isso o jogo é excelente. Por que se ele ocupar tanto espaço vai ficar difícil de acompanhar o jogo , a garena deveria pensar em diminuir o gb dele, no meu caso ja deu opções de desistalar app . Então fica difícil de continuar jogando. Mas o jogo é muito bom.",3,312,1.54.1,2020-10-31 09:32:21
58,Wesley Victor,https://play-lh.googleusercontent.com/a-/AOh14GiwwTATcZvbn56VWd9EFxUQU3GQx4Unal0ruB4yTA,"Mano, jogava todos os dias agora não tô conseguindo jogar mais. Simplesmente por que meu ping fica ruim e não é a Net, e sim o jogo. Faz tempo que não jogo por causa desse problema. E a cada atualização vai piorando o jogo, de vez a atualização melhorar o game ela só tá piorando, depois dessa última mini atualização o meu ping só fica de 600 pra 999+, sem condições de jogar. Gosto muito do jogo mas desse jeito vou ter que acabar abandonando ele. Vocês não ouvem a comunidade. Ajeitem isso pfv.",1,4003,1.54.1,2020-11-06 12:21:03
59,Mikhail Jirov,https://play-lh.googleusercontent.com/a-/AOh14GjxutgRkzdzbyHVIp7JwmtiflfMg7yJSJeQYmJ_roU,"O gráfico do jogo pode não estar entre os melhores, mas quando a jogabilidade se torna boa, o gráfico vira um mero detalhe! O servidor dele é ótimo - pelo menos eu nunca tive problemas com isso. Edit: Mano, eu achei muito top o despertar do Hayato, assim como o da Kelly, e eu queria muito que o Wolfrahh/Leif despertasse também. Acho que seria incrível a roupa especial do despertar ser parecida com aquelas da incubadora, estilo wolf-neko. PS:Isso não é só porquê ele é meu personagem favorito K.",5,3206,1.54.1,2020-10-25 12:57:13
60,Leandro Gomes,https://play-lh.googleusercontent.com/-NRFoM_cfgl8/AAAAAAAAAAI/AAAAAAAAAAA/AMZuuckGI9UKKpRA_RuC_XeQ-IWeWZBEsA/photo.jpg,"Um dos melhores jogos que já vi, gráficos bons, jogabilidade boa, ótimo jogo, mas como todo o jogo, tem seus problemas como, hackers, skins que chegam em todos os servidores mas aqui no servidor BR não, perda injusta de conta etc. Mas o jogo é ótimo. Quero minha conta de volta, estava jogando quando a internet caiu, quando ela voltou meu nome estava diferente, eu estava bronze sendo que eu estava diamante 2, e também apareceu para mim escolher um nome, era uma conta de 2 anos, podem resolver?",4,4,1.53.2,2020-11-08 10:56:07
61,udeeи 11,https://play-lh.googleusercontent.com/a-/AOh14Ghp6bRlq1OLy82CaQpUmtoqC4eA5VYR7rEfNtFnIw,"É um jogo muito bom,jogo a dois anos,porém há um problema do Free Fire é sua otimização ele trava em vários celulares pois muitas pessoas não tem condições de ter um celular bom e outra coisa é os hackers,mais tirando isso é um jogo excelente e para melhorar tem que treinar muito! e isso é o mais legal do Free Fire! Outro problemas é os bugs que continuam,e a garena não tira! Tirando tudo isso é muito bom mesmo!",5,27,1.54.1,2020-11-05 20:45:13
62,Minato Namikaze,https://play-lh.googleusercontent.com/a-/AOh14Gj8JHYOjeVprO394GEmCACE-NQZKDbv4oMAXAOW,"O jogo é otimo, roda em celulares fracos e seus gráficos são aceitaveis, além da jogabilidade incrivel, mas ultimamente tenho tido alguma problemas. Quando eu vou botar gelo, aperto no botão de atirar e o gelo não sai sendo que ele sumiu da minha mão e eu fiquei sem gelo, isso não é problema de internet, minha internet fica em torno de 20, só gostaria que o problema fosse resolvido rapido",4,152,1.54.1,2020-10-27 21:09:08
63,wagner ribeiro,https://play-lh.googleusercontent.com/a-/AOh14GigaYw_dYzkmLtK2B7af9DrgnwSPyUwXRdVrTkkeQ,"Realmente injusto .ai garena vcs estão roubando com seus joguinho de roleta nada mais é ,que puro jogo de azar .vcs tinham que ser era processados .muito desapontado com uma empresa que hoje é líder do mercado e não tem moral nenhuma pra banir hacker dos games se vcs também estão roubando os jogadores com joguinhos de azar que so comem nossos diamantes.",1,8,1.54.1,2020-11-08 16:38:38
64,Amélia Carvalho,https://play-lh.googleusercontent.com/-9-Ts61FThQY/AAAAAAAAAAI/AAAAAAAAAAA/AMZuucn3njy0D9K0TjruaW6Hzi4tlaEa3Q/photo.jpg,"O joguinho tá ficando muito desproporcional, a barret, svd dentre outras armas são muito roubadas, ganhar uma trocação contra isso se torna quase impossível, não faz sentido jogar um jogo em que as armas ditam quem mata e não a jogabilidade quando o jogo parar de fazer isso com as armas eu volto a jogar e gemar minha conta...",1,7,1.54.1,2020-11-07 20:32:56
65,Pupxl,https://play-lh.googleusercontent.com/a-/AOh14GjniR2Nu-oeYbwY5vxBHcNgloRGRmnvHcNgviANOg,"Oi estou aqui nn pra fala do jogo em si, (que por sinal o jogo e MT bom). Mas ss para dar uma ideia de evento para as pessoa que nn tem condições de compra uma skin de gelo, tipo fazer umas missões e se completar der pra personalizar um gelo botar com figuras e etc, mas com mas detalhes pra cada coisa tipo cor, figuras tivesse uma missão para cada uma delas, eu ia gosta MT de um evento desse tipo, então tá ae a ideia tomara que aprovem a ideia.",4,3,1.54.1,2020-11-07 22:54:31
66,Lucas Marçal,https://play-lh.googleusercontent.com/a-/AOh14Gj9iev_1UEmFFtBhus1xkuA-00JnVEXJh84CVECHQ,"Sinceramente o jogo foi de ótimo para regular, porque simplismente a Garena não da atenção para os bugs do jogo, o ping fica alto o tempo inteiro, o dano não conta, e eu neim preciso falar do Hacks.A unica coisa que a Garena se importa e trazer skins para o jogo toda semana, só pensando em lucrar com eventos roubados e injustos.",1,3,1.54.1,2020-11-09 01:34:42
67,Myeco Silva,https://play-lh.googleusercontent.com/a-/AOh14GifxADU2mDyZJjNSAP3RT0anE9aWWuigvYi5xPKslQ,"Dona Garena, pq colocam que os token fantasmas serão coletados ao fim das partidas nos dias 07-08/11, e hoje, 08/11, não consegui coletar nenhum? Sempre fico até os fins de partida, dano de 300+ e não recebi nenhum token. É frustrante ficar o dia todo jogando pra conseguir resgatar uma skin e não receber o que promete. Arrumem isso por favor!",3,5,1.54.1,2020-11-08 15:49:49
68,FÊNIX 24K,https://play-lh.googleusercontent.com/a-/AOh14GgcfgmYlqMtR5yhTqEF4KFNEqhWYBU-WibZhkoXwA,"O jogo é ótimo, jogabilidade boa, gráficos bons pra todos poderem jogar em celulares inferiores, os hackers infelizmente tem em quase todos os jogos, até nos pagos. Somente o que deveria ser mudado e a forma que nois somos tratados, eventos com 0,01% de ganhar o prêmio principal, roupas que não esconde coletes, diversos bugs. Muitas vezes estão dando BANIMENTO em contas que nunca usarão hacker, experiência própria, nunca usei e nunca vou usar. E tbpoderia abaixar os valores dos diamantes.etc",1,53,1.54.1,2020-10-13 02:20:24
69,Ester Arruda,https://play-lh.googleusercontent.com/a-/AOh14GirdnAOk9NxzJUltDFvUVX82NtakzhYHDy8doWY6w,"Apesar dos hackers e dos bugs de vez em quanto, tem outro problema os chat de bate papo, há pessoas de todos os tipos jogando. A questão do bate papo, poderia prejudicar principalmente crianças(e isso até passou em uma reportagem). O jogo é um exercício da mente, ao qual vc exercita a movimentação e abilidades dentro do jogo. Na minha opinião o FF é o melhor de todos.",4,81,1.54.1,2020-10-23 09:33:54
70,Angel Alves,https://play-lh.googleusercontent.com/a-/AOh14Gg8tFhauxmrjINl4aqwpRi6NhVUs36KUYIO6IslXA,"Seria maravilhoso se o facebook não colaborasse com a divulgação de vídeos de como jogar com hack, depois que começou isso, está cada vez mais difícil de jogar, e outra, vocês deveriam colocar a opção de ""denúncia"" no chat das salas personalizadas porque ninguém merece a nojeira que certos jogadores postam, falta de respeito, e humilhações, principalmente com as mulheres",1,71,1.54.1,2020-11-01 23:53:49
71,Felipe Diogo,https://play-lh.googleusercontent.com/-VILL3yTDm1k/AAAAAAAAAAI/AAAAAAAAAAA/AMZuucltsk3z4u4_Ky3zD7qd_o19mIWKTA/photo.jpg,"É um baita jogo mas pena que tem umas coisas que é injusta no jogo como por exemplo, sala personalizada mano eu estou bolado porque os influenciadores tem mais de 200 salas aí chega nós jogadores o maior público do jogo, os que fazem o jogo andar pra frente, pra só ganhar uma sala personalizada. Aí nós encontramos um jeito para ter bastante sala também, a garena vai lá e tira muita sacanagem isso, porque nem estava prejudicando ninguém, nem o jogo, os jogadores e nem a Garena.",5,378,1.54.1,2020-10-22 15:16:46
72,BIEL CAPUDO,https://play-lh.googleusercontent.com/a-/AOh14GiX4KX5lIiopEGIvl1kIAG2hisKlVz3r_QbW2IbOA,"Excelente jogo. MAS tenho algumas coisas para falar para vcs desenvolvedores. PRIMEIRA COISA:* Exemplo* estou platina 1 no cs ranqueado, está muitas vezes caindo bronze e prata ( que é menor patente que platina) e isso afeta muito a jogabilidade dessas pessoas ( que provavelmente está comecando agora no jogo), então peço para vcs arrumarem isso 2°coisa: Vcs podiam fazer alguns eventos grátis para conseguir sala, pelo menos um a cada semana (GRATIS). É isso. YT: BIEL CAPUDO",4,4,1.54.1,2020-11-07 18:37:30
73,STG H!ROTONT,https://play-lh.googleusercontent.com/a-/AOh14Gg6NzjKpvg7s1Z5iHEKaSychvnyJ7Wr_-x0BxhGKEM,"Bom os tokens fantasmas do evento diz que iria tropa ao fim das partidas, resultado não troparam aí além de perde meu tempo não posso pega a skin grátis, é ainda não vir explicação todos os jogadores reclamando e nada a ser feito. Faz sentido tokens fantasmas já que niguem conseguir ganha!!!! Quero sabe o que aconteceu?",1,1,1.54.1,2020-11-08 20:42:58
74,Elisangela Souza,https://play-lh.googleusercontent.com/-yG4iKco8-EI/AAAAAAAAAAI/AAAAAAAAAAA/AMZuuckJN053SQuwhuZZtB8dKTjwmlu7kw/photo.jpg,"Garena você tem que entender uma coisa... Nem todo mundo tem um celular, com capacidade de rodar um jogo de 617 MB. Ou seja, cada atualização o jogo fica mais pesado e mais difícil de conseguir jogar, meu celular chegou um ponto de travar completamente só de eu entrar na loja pra comprar minhas skins. Vai chegar um tempo que meu celular não vai aguentar nem atualizar mais o jogo, e meu celular não é ruim! Moto G 6 plus 4 de ram não era pra estar assim, Era pra ser um jogo acessivel pra todos!",1,102,1.53.2,2020-10-24 09:17:05
75,Ruan Severino,https://play-lh.googleusercontent.com/-4M5NE98vANg/AAAAAAAAAAI/AAAAAAAAAAA/AMZuucmyZcnCneCTu99ZzRU6TZVCof-ZIw/photo.jpg,"Eu gosto bastante de jogar Free Fire. Ele tem alguns bugs e isso deixa até mais divertido, dá para encontrar esconderijos secretos e bugs com seus amigos! E uma partida é muito emocionante, quando vou batalhar com o adversário, fico com o coração acelerado de tantas emoções, um sentimento de adrenalina, eu fico com medo e ao mesmo tempo sinto a diversão. Recomendo a todos! :Pena que o modo Revolta mortal acabou. Sinto como se o jogo faltasse uma parte de si. Se voltasse o jogo ficaria perfecto.",5,2726,1.54.1,2020-10-27 16:10:57
76,leocueio,https://play-lh.googleusercontent.com/a-/AOh14Gj0bYQpfnZzIsszcIZq1A25B5OcfRAX67nQDPK-VQ,"Vamos comentar a sério agora, os gráficos não chegam a ser bons, mas também não chegam a ser ruins, pois assim a maioria dos celulares rodam numa boa. Sobre a jogabilidade, não tenho o que reclamar, parabéns a garena neste ponto. Os controles são incrivelmente fáceis de manuseio e são bons, nesse ponto vocês ganham também. A unica coisa que me incomodou um pouco foi a optimização do jogo, mas de resto tudo é bom, os eventos são legais, mas de resto é isso. Obrigado pela atencão.",4,149,1.54.1,2020-10-27 13:18:05
77,Sof8 Andrade,https://play-lh.googleusercontent.com/a-/AOh14Gi_TMUMYAJiz7wzsMRuJ_8uO_oLjUENViEqoaIRxQ,"Eu amava esse aplicativo,mais ele me decepcionou muito,suspendeu minha conta por motivo INVÁLIDOS,e até agora não concertou isso. Eu não uso software e nem nada,quer dizer que eu gasto meu dinheiro pra suspenderem minha conta por motivos inválidos? Que sistema injusto é esse? Eu quero que desbanem minha conta,isso não é justo!! Abraço.",1,3540,1.54.1,2020-10-21 21:17:38
78,Hariel,https://play-lh.googleusercontent.com/a-/AOh14GhIq7RjivLAqq0ak8SnISu7gOQVMtBWPwQ_6zjw,"MEUS DEUS GARENA!!! Nós jogadores normais já não ganhamos nada a única coisa boa que tínhamos eram as salas personalizadas, aí vcs fazem uma coisa dessas... SACANAGEM voltem ao normal pfv!!!! Eu gastava 2:00 do meu dia pra pegar apenas 20 salas por semana, e qual o problema? Eu não posso pegar 20 mas os influencers ganham centenas de graça... Poxa que injustiça!!! Não te peço pra liberar sala pra todos, mas não tire o nosso único método de consegui-las. Obs: DISPOSTO A MUDAR A NOTA!",1,56,1.54.1,2020-10-22 22:31:33
79,NoobFortes GP,https://play-lh.googleusercontent.com/a-/AOh14GiDiS1PlzAuHu46V3sKiR-dPf9y75Ewd7AeK8PrXg,"Olá garena, eu lhes parabenizo pelo excelente trabalho no free fire, mas eu queria falar sobre uma situação que é ""comum"" durante as partidas (normalmente de CS ou CS Ranqueado), que é o abandono de partida. Eu gostaria de pedir a vocês uma nova opção de report, com o nome de Anti jogo/inatividade, que tem o intuito de ""castigar"" o jogador que levou o report (justamente) com uma pena de 2h (Duas Horas), para que não haja mais abandono intencional durante as partidas.",4,3922,1.54.1,2020-11-06 03:49:12
80,Maria Eduarda,https://play-lh.googleusercontent.com/-Ul0fKUph5S8/AAAAAAAAAAI/AAAAAAAAAAA/AMZuucmACyZp91JmDsSzMAWyoPbJSHbong/photo.jpg,"É surreal, como é esse jogo.,jogar esse jogo já faz parte do dia da pessoas,hoje só tem os riscos, os que não tinha nada ,hoje tenho tudo,slc jogar esse jogo é uma adrenalina, não consigo ficar bem,e PRA essas pessoas que fala.que o jogo não é nada.,procurar estudar o jogo mais um pouco, e olha a vida que ele mudou de muitas pessoas ❤🙌",5,228,1.54.1,2020-10-28 23:57:37
81,Vitor Barreto,https://play-lh.googleusercontent.com/a-/AOh14GiRCP-obmdUsupL9mxkRPzFFaXQwEwadO0KaWCQUQ,"Pela 4 vez editando novamente e mantendo, a Garena não soluciona os problemas de hackers no jogo, o mesmo está cheio de super homem te matando do céu! Impossível jogar ranqueada nesse jogo, não recomendo a ninguém, o jogo só serve para quem joga competitivo, pois eles ganham salas personalizadas para treinar e competir, inclusive você gasta dinheiro no jogo para ter as skins, enquanto os ""influenciadores"" ganham! Um absurdo! Eu não gasto 1 centavo a mais nesse jogo!",1,154,1.54.1,2020-11-05 19:48:23
82,Daniel S,https://play-lh.googleusercontent.com/a-/AOh14GjUU8mnARLv9xykW1sqtrLAJYXHtIfD6M_LvLR-Dg,"É frustrante um jogador ter passar a temporada inteira tentando pegar mestre, e não conseguir por causa de hackers. Não tem uma partida sequer, que não tenha. Adoraria que existe dentro do app, uma forma de excluir a conta permanente. Outra que daria resultado, seria as pessoas pararem de gastar dinheiro com o jogo! Mas ""burras"" e se contentam em gastar dinheiro em troca de umas skins.",1,4037,1.54.1,2020-11-06 23:30:46
83,JG MODz YTB,https://play-lh.googleusercontent.com/a-/AOh14GiKMiTnDYCM29EVLmJeyfyJZ9pR2ndrD7FWIQ_G6g,"Garena Free Fire, é um jogo muito divertido jogabilidade muito legal também, mais tem um porém, o jogo ta ficando muito pesado, e pessoas que não tem condições de comprar um celular melhor, fica ruim então eu vou dar uma sugestão, ter o Free Fire Lite, séria muito bom as pessoas que tem celular ruim, irão poder jogar denovo!! Jogo em si, é muito bom faz muitas amizades e não quero parar de jogar um jogo que eu gosto então se puderem ter o Free Fire Lite séria muito bom!!",3,191,1.54.1,2020-10-31 19:55:28
84,Pedro,https://play-lh.googleusercontent.com/a-/AOh14GhWxmGdhWOfuY4n0e1sLlHNvrNU6ybbx3NrwNAF,"Gostei muito. Mas acho que o modo de """"treinamento"""" deveria ter um mapa igual ao mapa clássico ou 50 % dele isso faria com que a experiência dos jogadores melhorasse e traria bons resultados para o jogo e para os lucros financeiros que aumentaria cerca de 15% coforme o tempo limitado do treino para evitar a fadiga do jogador seja pro Noob ou nato",5,3956,1.54.1,2020-10-30 14:22:50
85,BONECAH GAymer,https://play-lh.googleusercontent.com/a-/AOh14GhZWCTlW4IyXY1mOZiq_3Ih9Gx5KRScco4gHO-U,"HORRÍVEL, desinstalei, a dinâmica do jogo ultimamente está massante, muito repetitivo, prometeram uma remasterização do mapa bermuda e até agora nada! Os preços dos diamantes estão absurdos, além de que parece ter mais skins masculinas do que femeninas no jogo. Os eventos que vem com as skins masculinas são os mais caros do jogo, é um absurdo você ter que gastar 2000 diamantes para conseguir ter, isso é o equivalente a muito mais que 50 R$, que absurdo! Vocês acham que a gente defeca dinheiro?",1,4780,1.54.1,2020-11-04 04:09:27
86,jeferson gameplay,https://play-lh.googleusercontent.com/a-/AOh14GhoRHZohmy1Mm1Tal7lRN__DcpyMJMDFmU2Pj0yzQ,"não instalem a empresa não tira os hack,ela só quer dinheiro! garena:pq nosso jogo diminuiu e o among us subiu? innersloth:pq agente se preocupa com os hackers! po eu do capa de 264 e o cara ainda fica com 190 de vida?!e eu fui suspenso sem fazer nada eu sou o g4 tioway,mano o cara me denuncia só por eu jogar bem?eu fui suspenso(não foi permanente) poderia só parar de pensar em dinheiro!",1,1,1.54.1,2020-11-06 11:26:21
