,userName,userImage,content,score,thumbsUpCount,reviewCreatedVersion,at
0,Mallu Farias,https://play-lh.googleusercontent.com/-SzosUplX8FY/AAAAAAAAAAI/AAAAAAAAAAA/AMZuucn3n3ylpSFH0FWJhlTEJl2MEHWYkg/photo.jpg,"O jogo é ótimo! Mais poderia atualizár uma coisa... ...poderia ter um botão Para entrar em um mundo online. E tbm vcs poderiam diminuir a fome e mostrar no canto da tela o quanto q tem de vida, o quanto tem de fome virar fêmea e por último ter uma casa de tubarão q ninguém pode entrar. E é só isso pfv atualizem.",4,27,8.1.0,2020-11-08 01:03:44
1,꧁༺cαყҡ ρlαყεɾ༻꧂,https://play-lh.googleusercontent.com/a-/AOh14GixoCwPoje7JmU8nr6HXNXMia8idHeft1lyJ9rZQQ,"Tão de parabéns man, o jogo é ótimo e tal... mas parece que quando vc instala o jogo vem o capeta de brinde vei, jogo todo bugado, trava de vez no meio da jogatina e tem que resetar pra jogar denovo, agora os anúncios mds... quando vc termina uma partida aparece pra assistir um anúncio pra duplicar sua recompensa, por ai tudo ok, o problema é que o anúncio te puxa lá pra play store sem mesmo vc querer mano!! Da raiva demais vey, mas continuo jogando, pfv faz um update consertando os bug man 😉",2,238,8.1.0,2020-11-04 13:30:00
2,Eduardo Rosa Soares,https://play-lh.googleusercontent.com/-HKMKMP8_7pY/AAAAAAAAAAI/AAAAAAAAAAA/AMZuuckbNk_hozpIQfkVuIa-YnPgEO_Wjg/photo.jpg,"Eu achei muito legàu ,esses tubarões são incríveis. Queria que tivece um tubarão premiun de pois de derrotar o canguejo gigante , mais mapa que tivesse que desbloquiar e mais niveis de tubarão e também um geito de deixa o tubarão conseguir poderes especiais",3,22,8.1.0,2020-11-07 21:20:51
3,Uchiha Madara,https://play-lh.googleusercontent.com/a-/AOh14Gh2rnvAzU22NKVzRvQd_c_ua5soMXPnpjhT99NHiA,"Jogo incrível!!! Poderia expandir o oceano, ficaria mais legal, porque ficar nadando pelo mesmo lugar enjoa. Nas próximas atualizações adiciona uma Sereia Assassina,a Titanoboa, um Dragão de Água, e outras criaturas místicas! Ficaria top de mais!E expandir o Ocenao claro. Edit: Eu nunca reclamei de ""bugs"" nesse game,mas há um ""bug"" horrível que faz o tubarão entrar dentro das pedras! 😧 Consertem isso ,por favor.",4,11,8.1.0,2020-11-08 23:39:10
4,Sonia Sierpinski,https://play-lh.googleusercontent.com/-qkTYFfInJeE/AAAAAAAAAAI/AAAAAAAAAAA/AMZuucllVbvZPawwXQWdcjKyrCqNPACSUA/photo.jpg,O jogo é ótimo falo isso sendo um jogador antigo jogo dez de 2011 uma coisa que eu não gostei onde está os tubarões no início vcs reformarão e eu acho que tirou um pouco da essência do jogo mas eu adoro o resto os tubarões e se der reformem o início igual a de 6 anos atrás,5,0,8.1.0,2020-11-08 12:05:37
5,Shadow Foxy,https://play-lh.googleusercontent.com/a-/AOh14GhJeQ89L-FLZqzut4lq7jYnIt3t55WFf-PpgswG,"Gostei muito mais muito desse jogo 😀 o jogo é maravilhoso e muito divertido e bem legal👍 jogo esse jogo desde 2017 Mais agora eu queria que vocês colocasse uma nova recompensa do jogo a recompensa poderia ser de level do tubarão tipo ao envés de você joga com os tubarões pra subir o level do tubarão porque quê não podia ter uma recompensa no dia 30 passa 30 dias e você coleta a sua recompensa para o seu tubarão subir um level a galera mais avançada demora pra subir de level, num dá pra digita",5,4,8.1.0,2020-11-06 04:30:42
6,Rafinha Tittos *V*,https://play-lh.googleusercontent.com/a-/AOh14GiyoN_i5L9XpHYY4TWd1vWZgy3piyMg5ugbbUVc7w,"Olá Ubisoft,está tendo um problema comigo que não é de hoje,agora mesmo apareceu que tava com vinte e sete mil quando terminei uma partida,depois apareceu um anúncio e quando vi estava com catorze mil,por favor arrumem esse bug.",1,15,8.1.0,2020-11-02 12:38:28
7,Vitor B,https://play-lh.googleusercontent.com/-bk2EelnQhnI/AAAAAAAAAAI/AAAAAAAAAAA/AMZuuckpZIMaXMJFMtfBqBxXml6kD8HD5w/photo.jpg,"Esse jogo é muito bom! recomendo e não estranhe os gráficos pois o jogo é de 2012,esse jogo é muito encrivel e o melhor jogo de tubarão de todos os tempos! e tbm você pode personalizar o tubarão!!",5,16,8.1.0,2020-10-28 10:18:40
8,Adriane Amazonas,https://play-lh.googleusercontent.com/a-/AOh14GhPBemJy4w2v0hw_n-8EROiWYZbq3J8pExeVubb-A,O jogo é muito bom mas eu derrotei o chefão caranqueijo 2 vezes e apareceu que eu tinha ganhado 10 mil moedas só que não eu ganhei nada e na segunda vez eu ia ganhar 25 mil moedas só que não ganhei eu fiquei muito triste porque eu queria comprar o tubarão elétrico e tá demorando pra ganhar e eu não ganhei nada se vocês poderem me dar o meu 35 mil moedas eu agradeço demais demais msm pocha E por isso que eu do 3 estrelas,3,95,8.1.0,2020-11-06 11:08:54
9,katia regina,https://play-lh.googleusercontent.com/-7RKTRqsdp6I/AAAAAAAAAAI/AAAAAAAAB60/AMZuuclLIHJZbtLAOb-ZdEvMF6aqpyzvOw/photo.jpg,"O jogo é bom, pois os gráficos são simples, podiam ser melhores, o controle do tubarão e fácil de usar, mas o problema que os tubarões são muito caros!! Demora um tempão para comprar eles, e também podia ter a opção vender, para vender o tubarão que não usamos mais e quando vendemos eles ganham um din din, tirando isso o jogo é muito bom🙂😉",4,888,8.0.6,2020-10-25 23:46:30
10,Davi Matias,https://play-lh.googleusercontent.com/-BXJ11FPJqSo/AAAAAAAAAAI/AAAAAAAAAAA/AMZuucmWOYCALwK1pAjWHnIEUjUR36QLdw/photo.jpg,Esse jogo é incriveeeeeel e a musica entao ela é tao boa que musica top tem vezes que eu fico escutando ela e o tempo passa e eu nao canso😁 Sem contar dos graficos sao muito bons E eu to sem palavras pra explicar o quão bom é esse game né esse jogo Mas... So uma coisa que eu nao gostei. Os tubaroes sao muito caros e os objetos pra equipar tambem sao. Por exemplo o tubarao martelo é 6.000 e olha que ele é so o terceiro Arrumem isso por favor.e me desculpem se ficou longo pra ler,4,116,8.1.0,2020-11-02 14:21:02
11,彡MïtsăkiTēa,https://play-lh.googleusercontent.com/a-/AOh14GjPmomXQ6jVW9z4EX1hbEZ0I1IBIDj01lxfnwfJ,"Eu gostei muito do jogo, é bem divertido na minha opinião. Mas os gráficos são muitos simples, poderiam ser melhores. O controle do tubarão é mediano, não é difícil controlar o peixe, mas ele ainda é meio ""ruinzinho"" digamos assim. Não merece 5 estrelas para mim, mas eu recomendo, outra coisa chata é a DEMORA que é para poder comprar novos tubarões. É caro demais! Não é impossível, mais é até que bem difícil! Em geral, o jogo é bom, recomendo. Obrigado!",3,919,8.0.6,2020-10-22 18:46:13
12,heric game,https://play-lh.googleusercontent.com/a-/AOh14GjY7q3VfqQrdYWnWg8CnoSFFnKLqz6ldnsI16v4,Eu intalei o jogo e adorei muito meimos❤ e quando deixei o meu tubarão no level 10 max foi quando eu descobrir que dava para joga online com outras pessoas de paises de ferente eu sou do brasil vc também é?,5,5,8.1.0,2020-11-04 12:15:24
13,Matheus Magalhães,https://play-lh.googleusercontent.com/-1ed4aOEnk-I/AAAAAAAAAAI/AAAAAAAAAAA/AMZuucnmt7INzh7JoP2boNbtmZ4vv6ETZw/photo.jpg,Poderia ter um ambiente maior no mundo normal para poder ter tubarões maiores e mais lugares para explorar.,4,9,8.1.0,2020-10-30 11:18:09
14,Michel Mendes,https://play-lh.googleusercontent.com/--OsyOIMyzSU/AAAAAAAAAAI/AAAAAAAAAAA/AMZuuclD3gs6oQo3NAyp5xfDyqNu8EgIBw/photo.jpg,"É difícil controla os tubarões, a vida dos tubarões maiores acabam tão rapido que nem compersam joga com eles, a vida acaba muito rapido, tem que consetar isso",4,9,8.1.0,2020-11-02 15:15:29
15,Aurilene Pereira,https://play-lh.googleusercontent.com/-DIqu5QRVkow/AAAAAAAAAAI/AAAAAAAAAAA/AMZuucmm2RAsV-BHQK-n9FomxPI4ZbF5Nw/photo.jpg,muito legal so que e muito caro comprar os peixes. mesmo que ninguem leia. o jogo e otimo. Já joguei milhões de vezes mas a demora pra poder pegar um tubarão melhor continua difícil. Como eu ja disse todos querem diversão mas o bolso fala mais alto. De qualquer forma obrigado.Estou jogando nove mente parece que melhorou a velocidade em trocar de peixe mas pode melhorar.,5,1716,8.0.6,2020-10-11 20:52:30
16,Lucas,https://play-lh.googleusercontent.com/a-/AOh14Gg7WF9z4VPiHtv7LTm2eHoiozKoweqN7XO9PsKtlg,"Joguei o jogo por um tempo, até desbloquear e comprar o Megalodon, salvei todo o meu progresso na nuvem, e dei uma pausa. Com a atualização mais recente, eu tive vontade de jogar o jogo denovo, mas, ao sincronizar com a nuvem, nenhum do meu progresso dentro do jogo foi recuperado. Minha conta da Google Play ainda tem todas as conquistas que eu fiz no jogo, mas não tenho nenhum dos itens, tubarões e moedas que havia conseguido.",1,854,7.9.0,2020-09-17 15:37:48
17,Adailza Aquino,https://play-lh.googleusercontent.com/a-/AOh14Ggzvy1AHJApDD7N-ACponpvunNFK0JVLQvuW49v5Q,"O jogo é muito atraente em ambos os aspetos, bém desenvolvido! Mas já encontrei algumas falhas, quando o polvo morreu não apareceu as opções para voltar a vida, e não conseguia sair do jogo mais o polvo continuava a afundar. E o crocodilo não está afundando os submarinos 👍...02.10.20 poderia ser salvo pelo Facebook, pois troquei de celular e não pude voltar ao nível que já tinha conquistado. E ter que baixar outro App para salvar não vale a pena.",4,225,7.9.0,2020-10-02 10:21:13
18,Gustavo Lima,https://play-lh.googleusercontent.com/-PLI4xOM7LF8/AAAAAAAAAAI/AAAAAAAAAAA/AMZuuclgzJ-R02oWQwb6hSSu58pP4mTF9A/photo.jpg,"Nossa curti! Muito legal! E como um hungry shark world lite, e leve, gráficos ok, parabéns Ubisoft! A fazer esses jogos que nos divertimos muito são jogos bem divertido! Continuem assim! Aconselho demais a todas as pessoas!🙂 E cuidado com o corona vírus Ubisoft, e o resto também😅😷",5,349,8.0.6,2020-10-13 16:49:20
19,Jefte Ricardo,https://play-lh.googleusercontent.com/a-/AOh14GiqJgV-XuB24-Slgh2p6AySgHuKS27mfTS7hqxn,"O jogo é bom, um dos meus preferidos, mas eu acho que as recompensas diárias deveriam aumentar de acordo com o tubarão mais forte que temos, ou vocês poderiam adicionar níveis.",4,2,8.1.0,2020-11-06 17:48:54
20,Jean Carlos de Souza Silva,https://play-lh.googleusercontent.com/a-/AOh14GiLZVDVAwG5ERfiCZh9npV1FPst96N8GBgJ0R-KJKI,"O jogo é bom. Ja foi famoso la em 2013 a 2015 na moda do Pou, Talkings, Minecraft. Era otimo show hoje melhorou em algumas coisas. Mas vou reclamar do HP do tubarões é o seguinte os tubarões perdem HP muito rapido principalmente os monstros do Megalondonte pra cima ele fica chato nisso. Falando do preço amenizem um pouco nisso. E o poder de alguns mobs tbm, por favor Umbisorft vejam nesse caso ae. E os intens pros tubarões tbm é meio dificultuoso. Comparado a antigamente muita coisa melhorou.",3,8,8.0.6,2020-11-01 02:11:55
21,Marlon Victor,https://play-lh.googleusercontent.com/-ODS0aRJAhPg/AAAAAAAAAAI/AAAAAAAAAAA/AMZuuclhudFnNAkKJyCY9Gb1DUiDr_1r5w/photo.jpg,"O jogo precisa melhorar o controle, não da pra controlar o tubarão muito bem, não dá nem pra se sentir controlando o tubarão direito, e também seria muito bom drenar o dano dos tubarões invasores que são da mesma espécie que o quê estamos controlando, o dano deles está desproporcional demais! Resolvendo isso o jogo ficaria excelente.",4,1367,8.0.4,2020-10-02 01:34:18
22,J Gamer,https://play-lh.googleusercontent.com/a-/AOh14GhoELKqOTJiqutqCsksHqIY0q3yJD-uWvkQ7JJa,O jogo e bom so que você tem que diminuir a fome dos tubarões porque eu fico 10 segundos e o bico ja morre :( Pfv leia esse comentário e faça oq eu pedi,4,0,8.1.0,2020-11-07 21:04:18
23,IGR Gamer,https://play-lh.googleusercontent.com/a-/AOh14GhJYiPmSm8_8019q9Wr-c3UCCWgBNa9w9cBKJWq6Q,"O jogo é muito bom mas tem muitas algumas coisas muito erradas, o megalodonte é muito fraco. O dunkleosteus na história chegava a no máximo 10m (tem 14m no jogo), como pode comer um megalodon que média entre 20m e 30m (tem 14,5m no jogo) e não o contrário? O que devia ser o tubarão mais forte do jogo é um dos mais fracos.",2,365,7.9.0,2020-09-15 00:33:21
24,Joao Filipe Da Silva Oliveira,https://play-lh.googleusercontent.com/a-/AOh14Gh0J-RqAoMBHVbJFe6tV2Nwf41DPTIdPivFjisT,"O jogo é bom, Mais quando eu vou jogar eu fico perdido era pra vcs colocarem um mapa pra quem for novato não ficar perdido,e os tubaroes deviam ter roupas igula ao hungry shark world,tirando isso o jogo e otimo😉✌",4,1,8.1.0,2020-10-27 13:10:57
25,Luis Roberto,https://play-lh.googleusercontent.com/-egRk75zka9o/AAAAAAAAAAI/AAAAAAAAAAA/AMZuucnDLAAiRe1myOVorT2vc8ERkzACtg/photo.jpg,"Esse jogo é maravilhoso mesmo nota:10, porém o problema não é o jogo mais sim a Internet,por causa da internet, está fazendo com que o meu jogo de Hungry Shark Evolution travasse toda hora e não está respondendo,por culpa da internet que está fazendo o meu jogo travasse toda hora e não sei o que eu faço 😔",4,639,7.9.0,2020-09-11 15:05:56
26,Filmes e videos,https://play-lh.googleusercontent.com/-mCKFemqklyg/AAAAAAAAAAI/AAAAAAAAAAA/AMZuuckCSEnFbPY0-KPVhHB93J0qGxKSNQ/photo.jpg,"Voltei a jogar recentemente e percebi uma grande diferença,achei legal poder comprar os tubaroes,mas vc ganha muito pouco por partida,eu acho que quando vc esta em uma partida o quadro de missoes poderia ser mais para cima pq atrapalha muito",3,22,8.0.6,2020-10-23 20:56:00
27,Arthur Daniel Monteiro de Oliveira Santos,https://play-lh.googleusercontent.com/-d8Oq61QcKgQ/AAAAAAAAAAI/AAAAAAAAAAA/AMZuucnDXrb5Aq8HhIOVZKQKhK_znjU5qw/photo.jpg,A gente olha para esse jogo de falar meu Deus do céu esse jogo é tão antigo que ele é muito ruim mas quando a gente joga visse a minha mão o jogo bem legal bem divertido e que continue tendo atualizações para eles assim que traga novos tubarões e o jogo é legal gostei por isso que eu tô dando 5 estrelas,5,2,8.1.0,2020-11-05 00:15:23
28,Salomao Bezerra,https://play-lh.googleusercontent.com/a-/AOh14GierWGjykbqUEEK19AF0kIV4kad049fDHmVgcMXKw,O jogo é ótimo muito bom essa nova atualização deixou o jogo mais divertido porque botaram modo Multiplayer agora tem pessoas jogandoeu não sei se é a pessoas de verdade ainda mas eu acho que é só computador o com nome de pessoa..... O jogo é ótimo tem que desbloquear todos os tubarõe para poder zerar o jogo mas tem um chefão que é um caranguejo gigante o o que é o chefão que a gente não consegue matar ele kkkk gostei muito dessa atualização jogo ficou muito bom e dou cinco estrelas jogo bom,5,138,8.0.6,2020-10-19 20:18:34
29,Pedro Santana,https://play-lh.googleusercontent.com/a-/AOh14GhS76qpHIB--3wkWTACOyfMlmTO-LL66AoHej8U,"O jogo é bom. Mas estou tendo problemas. Estou com o tubarão branco no nível máximo, e já estou com o dinheiro para comprar o Megalodonte, porém, aparece a mensagem dizendo que para comprar o tubarão é preciso que o anterior esteja no nível máximo. (MAS JÁ ESTÁ!)",4,972,8.0.0,2020-09-30 10:42:06
30,Edmilson José,https://play-lh.googleusercontent.com/-V3T1UQRwG7Y/AAAAAAAAAAI/AAAAAAAAAAA/AMZuucmJBX4I2TS4yEXD1ppCwwtXwxmY4w/photo.jpg,Jogo muito bom crefico e joga abolida Boa de mais Não tem que dizer não ele é super bom ele é legal tem todos os gráficos jogabilidade perfeito,5,1,8.1.0,2020-11-05 14:28:16
31,Canal do Losco,https://play-lh.googleusercontent.com/a-/AOh14GgmzQZ5gBAx3YEneu1okvJvvP6hgFW1KHBFzT-FXw,O jogo é muito bom mais coisas faltaram como o tamanho dos tubarões como o megalodon que era pra ser maior com 18 ou 20 metros de comprimento e o dunkleosteus com 9 ou 10 metros de comprimento seria bom também se colocassem mais alguns animais como a Titanoboa de 15 m de comprimento e também o Sarcosuchus de 11m de comprimento e mais animais npc como os Marlis poderiam colocar mais animais como eles tipo Golfinhos ou Orcas nadando perto da superfície como os Marlins fazem,4,121,7.9.0,2020-09-18 13:18:15
32,John Salve,https://play-lh.googleusercontent.com/a-/AOh14GjOObZpfqx1Zij7V9fuL8mhhMVrYRX2mzUfNUyAag,"O jogo é encrivel gráficos ótimos,só não acho justo uma coisa que são os tubarões invasores.é legal ter jogadores para competir mas não é justo vocês colocarem eu com tubarão tigre contra um krakem. Mas tirando isso o jogo é ótimo",4,204,8.0.6,2020-10-14 15:46:59
33,Lorena Georg,https://play-lh.googleusercontent.com/-UEmChEJg7aA/AAAAAAAAAAI/AAAAAAAAAAA/AMZuucnPUil3cWiih_JfQJWMKajcY2CKJQ/photo.jpg,O jogo é muito bom só que os peixes é muito caro o primeiro peixe é até que é barato e depois do segundo peixe que começa a ser caro mais o jogo é muito bom os outros tubarõe que tá na água pode te morder e aí você pode morrer,5,2,8.0.6,2020-11-03 11:46:33
34,Jyuusan,https://play-lh.googleusercontent.com/a-/AOh14GhIHTNPOtyZ75lKx7E13X6SGfa5eJ-xz_lBiN81rQ,"Eu jogo esse jogo há 5 anos e amei simplesmente e viciei. Mas uma coisa que eu queria mt nesse jogo é a mudança do mapa, ele é sempre o mesmo e seria muito legal se o oceano fosse muito mais fundo, tipo muito fundo mesmo ao ponto de fazer o jogador sentir medo",5,241,7.9.0,2020-09-28 02:50:05
35,stevão Lima,https://play-lh.googleusercontent.com/a-/AOh14GjPhv6bPVtIn0uKaG5bSakp1sHxCTXXR1qNU9Qt-g,Muito bom o jogo só que eu queria que fosse que nem o hungry shark world que tem muitos mapa e mais missões do que no evolution e também é tudo mais difícil do que no world e também no evolution demora muito para subir de nível e compra outro tubarão e tambem só tem 3 mapas e 2 tem tempo isso é muito ruim e também o mapa normal fosse muito mais fundo ia ser ótimo e mais viciante mais tirando isso esse jogo é ótimo parabéns Ubisoft,5,469,8.0.0,2020-09-30 02:47:49
36,Sabrina Paula,https://play-lh.googleusercontent.com/-gfqujUcJvhk/AAAAAAAAAAI/AAAAAAAAAAA/AMZuucl0WsaZFVERQ8OxXGSQLJ01rLxn0g/photo.jpg,"O jogo é muito bom, o dinheiro é adquirido facilmente, só os diamantes que são mais difíceis, os gráficos são ótimos,os controles também são muito bons",5,24,8.0.6,2020-10-28 13:55:25
37,Duda Feliciano,https://play-lh.googleusercontent.com/a-/AOh14GgszrWN3MUPMoflQcPS0eDEZG7Qz-CRZf4xuqeknQ,Esse jogo é muito bom o problema é que não da para não ser o roubaram não da para ser a pessoa esse e o problema mas eu queria que darse,3,0,8.1.0,2020-11-03 21:08:03
38,Daniel Games,https://play-lh.googleusercontent.com/-qFp0AJi6IP4/AAAAAAAAAAI/AAAAAAAAAAA/AMZuuck5DNb_2Gig_WAFS9CiLRCb8T9cvw/photo.jpg,"O jogo é legal,mas tem muito oque melhorar por exemplo exitem muitas aguas-vivas q dificulta muito o jogador. E outra coisa tem que tirar esses monstros tipo o peixe diabo ele tira muita vida e os caranguejos nao recuperam quase nada de vida mesma coisa com o megalodonte e os bose que aparecem do nada no jogo e tem que enfrentalos mesmo com tubarao fraco, oque aconteceu?",3,52,7.9.0,2020-09-17 12:25:15
39,joao miguel,https://play-lh.googleusercontent.com/a-/AOh14GixgbOpkh7huEZAgJmljLKOlTTAK9g3mEETmkd4kA,O jogo é bom mais para mim tem que melhorar e tambem diminuir os preços dos tubarões e isso fica chato então bora melhorar tirando isso esse jogo é bom então diminuam os preços dos tubarões ai o jogo iria de bom para top mais parabens os graficos são ótimos os controles este jogo é muito bom eu jogo faz um tempão por isso peço para abaixar os preços dos tubarões,3,15,7.9.0,2020-09-23 17:18:10
40,Maria Eloiza Souza,https://play-lh.googleusercontent.com/a-/AOh14GgXyjRNmWhhe8F4DzoN30TXjRAJwLwKGgGrjxBUpg,"Infelizmente, a versão dos teletransportes desse jogo, não funcionam no meu celular!!",3,2,8.1.0,2020-11-04 13:08:43
41,Bruna Santos,https://play-lh.googleusercontent.com/a-/AOh14GggSatd4VciNfPbjknaJYGqoF_AN7uqVL7FLUcvvg,"Muito bom o jogo, o único problema mesmo é o preço dos tubarões, e uma demora muito grande pra poder comprar os outros, e isso é meio chata, mas fora isso ele é muito bom",5,10,8.0.6,2020-10-26 09:48:15
42,Bernardo -572 the gamer,https://play-lh.googleusercontent.com/a-/AOh14GgtBmH7UwZPwSvMb_M_GMFNmgFOA5eWTeVl62NiTA,"Bem.....Ham,o jogo é legal é divertido é bom so q tem uma coisa q está me perturbando sobre os Invasores de Tubarão,eu tenho o Tubarão cabeça de martelo,é sempre q eu começo o jogo com Invasores de Tubarão ligado sempre tem um cara com Moby Dick,Alan,AbysShark,Kraken,Megalodonte,ent por favor deixem apenas players a possamos devorar",3,0,8.1.0,2020-10-29 07:51:06
43,Lucas player 2,https://play-lh.googleusercontent.com/-5WSe125xj7o/AAAAAAAAAAI/AAAAAAAAAAA/AMZuucnMnPlVljhadYWAPBftwlCke0IlHQ/photo.jpg,Eu acho legal porque e conpetitivo tentar pegar os tubarões e poderia ter varios tubarôes para ser mais competitivo mais ainda eu acho legal mesmo nao tendo muitos tubarões,5,0,8.1.0,2020-11-05 22:41:09
44,Kim Tae-Luh,https://play-lh.googleusercontent.com/-yZqR-dsrYU4/AAAAAAAAAAI/AAAAAAAAAAA/AMZuuclGKHaZ0yGpNBhral7AyqAMEthhuA/photo.jpg,"Não consegui carregar meus dados do jogo, instalei novamente, fui jogar pra dps tentar salvar, e não consegui novamente(parte 1), tentei desinstalar e baixar dnv, e quando tentei salvar salvou a última vez que tinha Jogado (parte 1 la em cima) Quero meus dados antigos novamente, pois tenho vários diamantes, mais de 50000 moedas e uma pontuação incrível",3,114,8.0.4,2020-10-05 16:37:31
45,pedro gamer gg,https://play-lh.googleusercontent.com/a-/AOh14GgSItdijxWcVBrCoZIY1MLO4WIQuVjeWnLw_mKd,"O jogo é muito bom,eu só queria que tivesse um equipamento sinal de inimigos, isso sim seria o bom equipamento,e também um modo multiplayer",5,9,8.0.6,2020-10-21 21:07:25
46,Daniela Freitas,https://play-lh.googleusercontent.com/a-/AOh14GgVXBk4p2E8Ocb3rEgrV-J5eYFSecI-53cbyTfphw,O erro do jogo é que o tubarão nada mais rápido embaixo da água e a mulher tá andando muito rápido embaixo d'água aquela escada do tubarão foi feito para andar embaixo da água bem rápido então vai lá e coloca as pessoas mais devagar embaixo d'água que o tubarão embaixo d'água é mais rápido que ela acorda cedo para isso,1,118,7.9.0,2020-09-16 09:51:02
47,Denison Silva,https://play-lh.googleusercontent.com/a-/AOh14GgDfgRvq3N3RTljYmgMzAXEI0MmqiiXqmgYKw-t4Q,"Game fantástico, um já pode se considerar um clássico para os mobiles, alguns bugs bem pequenos q não atrapalham, mania repaginada que ficaram muitos bons, nesse jogo diversão e o que não falta",5,39,7.9.0,2020-09-21 09:33:03
48,Mary Santoa,https://play-lh.googleusercontent.com/-eJ1iu_eZlMI/AAAAAAAAAAI/AAAAAAAAAAA/AMZuuclP7pOav9EcdsLobm3NHGGjQPoRqw/photo.jpg,Deve parar de travar e ageitar o volante de virar para o lado e para o outro,3,1,8.1.0,2020-10-28 20:28:55
49,Lenira,https://play-lh.googleusercontent.com/-anxtWnjGGw8/AAAAAAAAAAI/AAAAAAAAAAA/AMZuuckp0iDBZ36cCejvdgHMnW7dquPzJw/photo.jpg,"Esse jogo e mais ou menos pq "" ele não é dos melhores jogos que eu ve bom na verdade é um dos piores jogos que eu vi , bom vou dar um conselho estaoem ""brwl stars"" ou então ""clash royale""pq esses jogos sim são jogos de verdade diferente desse ai ele é muito intediante mano fica a dica. .. sigam meu conselho.",3,5,7.9.0,2020-10-13 09:17:11
50,dino gamers jk,https://play-lh.googleusercontent.com/a-/AOh14GgHUTS4--lnp3MPIibtMUt31M4VWKTaY-IkEtBN,Ótimo jogo gostei bastante mais poderia ser um pouquinho mais fácil achar peixes gemas mais e tubarões um pouco mais baratos Tirando isso tudo e perfeito só uma coisinha poderiam adicionar um tubarão de duas cabeças por favor muito obrigado por lerem esse comentário,5,132,8.0.0,2020-09-29 20:56:09
51,Kaique Zeldris,https://play-lh.googleusercontent.com/a-/AOh14GiaW1Xil_hWOJFpF98O0WIO_Dge6UzjyLLvPQQL,Eu não dei 5 pq é muito difícil ganhar dinheiro no jogo mas tirando isso o jogo é ótimo. Meus parabéns.,4,1,8.1.0,2020-11-06 20:07:58
52,Milena Faria,https://play-lh.googleusercontent.com/-KkpDLNexhjs/AAAAAAAAAAI/AAAAAAAAAAA/AMZuucmqL4o_YBa5uLasB43vt73GEdNwpg/photo.jpg,"O jogo é muito bom , so que não consigo controlar direito , acho q o controle podia ser um pouco maior ... E aparece uns tubarões mutandes e etc , sendo que não consigo matar pq sou menor e etc , isso não tem muito sentido não da pra jogar assim",4,79,8.0.4,2020-10-10 01:16:24
53,ADRIAN,https://play-lh.googleusercontent.com/a-/AOh14GgXAE8KXi_w1b5MG4BExkZumm5ngMQ0IcSFtdbsnw,"jogo realmente incrível e viciante! porém eu e muitos outros jogadores ficariamos muito felizes e satisfeitos com o jogo se houvesse uma mudança no mapa do jogo como por exemplo: expandir mais, ser mais fundo...",5,68,8.0.0,2020-09-30 02:06:21
54,Cristilli Karolaine,https://play-lh.googleusercontent.com/-4CWQN4WSFng/AAAAAAAAAAI/AAAAAAAAAAA/AMZuucnQxN9gdi32BuP1N0fqny6ALYklMw/photo.jpg,Bom vcs deveriam fazer mais eventos e também eu estou no Sr bocarra é eu to no nível 7 mais eh já tenho o dinheiro para comprar o próximo turabarap faz tempo mais eu tenho que passar de niveo para eu poder comprar o próximo tubarão o problema é que demora muito para passar de niveo,4,7,8.0.6,2020-10-20 15:51:41
55,Rhadassa Carvalho,https://play-lh.googleusercontent.com/a-/AOh14Gh9iIVAPzWz_oYQCiSqhJz3AGpeZ8xPKsmJMTwM,"O jogo em si,não pode deixar o tubarão morrer de fome ,mas tem tubarões que ataca que são mais fortes tals , tem uma opção de não ter esses tubarões dai eu cliquei e quando fui jogar os tubarões estavam ainda , porfavor arrumem isso.",3,7,8.0.6,2020-10-20 10:47:02
56,Júnior Pro13,https://play-lh.googleusercontent.com/a-/AOh14Gho8RLaIjfj3Ce0AesuP5ZAPfw224G3WD1W844DUg,"um jogo muito mais muito bom , façam um modo offline que da pra jogar sem ter tubarões mais fortes que vc não pode te matar , exemplo tenho o Sharkjira a ai o abisshark e o kraken Mata o shakjira",5,8,8.0.6,2020-10-22 13:36:10
57,Melcson.Obito Melcson,https://play-lh.googleusercontent.com/a-/AOh14GjdPet0kLN848iQfUNUbl6luwJg1zcpp-HIqs0n5g,Tem como vcs customizaem pra j6 ta travando muito bota pode baixa o grafico e tira o mapa do rada do canto esquedo da tela ta atrapalhando a controla o tubarao toda vez abre o mapa quando vai meche o tubarao e tubaroes ta muito caro 900 gemas ta loco e ta tendo muito anuncio antes nao tinha essa horor de anuncio tudo pelo dinheiro ne se o jogo for justo fale apena gasta mais de nao for nao vale apena,1,10,8.0.6,2020-10-23 00:00:04
