,userName,userImage,content,score,thumbsUpCount,reviewCreatedVersion,at
0,Valdomiro,https://play-lh.googleusercontent.com/a-/AOh14GgKwYKxGT7-HP-BtfBy0SLOLBdgKXKGXEyeX7Qx,"O jogo é divertido para passar o tempo, embora seja bem cansativo, chato e repetitivo no começo. Porém, quando começamos a fazer mais upgrades nos veículos, fica mais fácil de aprender as mecânicas do jogo para não morrer tão facilmente. O jogo não tem anúncios abusivos e isso é algo ótimo, não é como outros jogos que a cada morte é um anúncio que você é obrigado a assistir. Mas se de alguma forma os anúncios nesse jogo estão te atrapalhando, é só desligar o wi-fi.",4,620,1.47.1,2020-10-19 21:02:54
1,Crash Bandicoot sexy,https://play-lh.googleusercontent.com/a-/AOh14GgiL1TxhpIWZZNL6676nTdbG-r79lTnZyVRtNphZA,"adorei, esse sem sombra de dúvidas é um dos jogos mais nostálgicos da história da Play Store, já desbloqueei 8 veículos e 9 estágios, foi um dos melhores jogos offline da Play Store que eu já baixei, aliás, vocês poderiam ao invés de ter criado o Hill Climb Racing 2, vocês poderiam é ter adicionado o modo Online no primeiro jogo! seria simplesmente ultra STONKS adicionar o modo Online com todos os elementos do primeiro jogo, o jogo seria um sucesso por completo, que jogo LINDO!",4,589,1.47.1,2020-10-18 16:17:05
2,VT GAMER,https://play-lh.googleusercontent.com/a-/AOh14GjfyPj3AZq5PD0sz3fqO8SQxGPbWo25wnYJ1wBs,"Mano vim aqui dar meu palpite rapidinho, 3 estrelas pq o jogo poderia lançar mais pistas como a RODOVIÁRIA, e carros como HOT ROD, ao contrário disso vcs só coloca carros que não corre e é muito caro, tipo o CARRO DE LUXO 2.000.000, sendo que o HOT ROD, é muito melhor, no caso, se vcs colocarem mais pistas como a RODOVIÁRIA e carros como o HOT ROD, o jogo iria ficar muito mais divertido. Minha opinião espero que ajude.",3,119,1.47.1,2020-11-04 22:39:53
3,Ana,https://play-lh.googleusercontent.com/a-/AOh14Gj-Sjg6-Kk-2SRJo6Vm332LgvpzzqlEaIZW8dNs,"Muito bom! Os gráficos são ótimos para o tamanho do pacote do jogo, não tem do que reclamar... Exceto na quantidade de moedas que ganhamos com anúcios (apenas 15000 moedas), que para um player mais avançado não faz diferença alguma :/, e também os mapas dão muito pouco em moedas, tanto que arrisco dizer que ganho mais com ""air time"" na lua do que coletando moedinhas dos mapas...",5,996,1.47.1,2020-09-22 12:16:04
4,Antonia Maria Dos Santos,https://play-lh.googleusercontent.com/a-/AOh14Gip85r3OGYIPQgtWYm9omy5_PMZNOqH1JS8YA5A,"Gostei do jogo, mas não gostei muito do que você fez com aqueles 7 carros, o Monster truck, o quadriciclo, o carro de corrida, o carro de rally, o dragster, o tanque e a moto de neve. Poderia botar eles no grapich moda antiga? Eu gosto mais deles no grapich moda antiga . E que história é essa que o insane Air time só chega ao 25000? E bota o nome do primeiro carro de jipe de novo. Arrumem tudo isso que eu disse, eu vou comprar um celular novo, parece que você está preso em um armário",4,802,1.47.1,2020-10-07 11:30:43
5,fã enaldinho lenda do zap 2 temporada Gomes,https://play-lh.googleusercontent.com/-krfr73jQsTw/AAAAAAAAAAI/AAAAAAAAAAA/AMZuuclR-2grxdO_Yddf9OKm72XGDp63Hg/photo.jpg,O jogo e muito bom! Muito divertido tem muitos carros e mapas incríveis! Mas poderia ter mais mapas do futuro e carros também! E ter alguma atualização de natal pra ganhar diamantes ou dinheiro mas o resto tá tudo ótimo parabéns!!!😃,5,7,1.47.1,2020-11-03 02:03:04
6,Dayvisonpatrickalves Alves,https://play-lh.googleusercontent.com/a-/AOh14GglLmm_ngAwhf-6PskmVX8Rr7SEWN0EcxZchNg3,"jogo muito bom, excelente jogabilidade gráficos ótimos boa dinâmica de rotação além da parte de otimização de resolução para celulares mais fracos com pouca ram de armazenamento isso é ótimo para aqueles que tem celulares fracos.parabéns aos desenvolvedores do app,com o tempo poderiam lançar o 3 com funcionalidades melhores como uma corrida entre dois jogares offiline no wifi local seria muito incrivel agradeço a vocês.",5,491,1.47.1,2020-10-03 13:34:08
7,Cicero Gomes,https://play-lh.googleusercontent.com/-tlW0h5pzi5E/AAAAAAAAAAI/AAAAAAAAAAA/AMZuucmlerEtu6sM6nbTySk5kxpNu-lLJA/photo.jpg,O jogo e muito bom tem vários carros legais e mapas infinitos e muito bônus o e tem uns bugs que acontecem no jogo mas e legal ate mais eles também vão deixar o jogo não tão legal assim mas gosto! Poderia ter uma atualização de Halloween com evento carro de Halloween e ate um mapa também!!,5,76,1.47.1,2020-10-08 15:37:27
8,Francisco Campos,https://play-lh.googleusercontent.com/a-/AOh14GjRCgu-1NzrMfnNBIJ9CdI6tgoYPc3CgqfnWXRDjA,O jogo e insano tô super viciado e o melhor de tudo não trava. So precisaria de mas persongem pra escolher uns deles. E tambem tivesse chuva e noite e a lua la no fundo legal! Mas eu amo esse jogo e olha que eu já sou bem vei pra esse jogo hemm.. 😂,5,0,1.47.1,2020-11-08 23:28:57
9,William Micucci,https://play-lh.googleusercontent.com/-pGvNm0S3iww/AAAAAAAAAAI/AAAAAAAAAAA/AMZuuclTiH_wMPvAmFaxZiCuJ-dEtI2sTQ/photo.jpg,"Jogo divertido, gostaria que houvesse uma atualização do Super Diesel 4x4, colocar teto, e ter opção de tamanho de roda... Poderiam colocar mais opções de carroceria na oficina.",4,3,1.47.1,2020-11-03 13:12:55
10,Pedro Henrique Oliveira,https://play-lh.googleusercontent.com/a-/AOh14GiLOfb4PMGuzPLA4FHhR43w1QOrPC5BV0FhseGCCMI,Limitaram o valor máximo de pontuação de tempo no ar pra 25000 pontos. Triste.,2,3,1.47.1,2020-11-07 13:41:44
11,Ana Beatriz,https://play-lh.googleusercontent.com/-MFoJxU_d_NA/AAAAAAAAAAI/AAAAAAAAAAA/AMZuucnoHFMej_iBAT82gLu21MzJKLwjEw/photo.jpg,o jogo até que é bom mas poderia ser mais fácil as etapas para ganhar os carros poderia custar menos dinheiro mas fora isso é ótimo adorei esse jogo é muito bom já tô instalando eu já conhecia ele desinstalei mas agora pensando em instalar novamente,5,498,1.47.1,2020-09-21 19:40:31
12,Leonardo Aleixo,https://play-lh.googleusercontent.com/-4O6kynNLPQk/AAAAAAAAAAI/AAAAAAAAAAA/AMZuucl9NQtDGmDjN2y1Rckja-nQsS7CuQ/photo.jpg,"O jogo é otimo gostei muito, tenho uma estrategia junte dinheiro e compre o mapa da lua porque la nao tem gravidade e da para fazer muita manobra porque sua moto sobe muito",5,14,1.47.1,2020-10-26 11:06:32
13,Hey Signos,https://play-lh.googleusercontent.com/-8RkjPjTKyT8/AAAAAAAAAAI/AAAAAAAAAAA/AMZuucl1JOxwmno5Yc4HgcIkHBdHEY5gNg/photo.jpg,"Gostei muito,mais uma coisa que poderia melhorar è o preço dos carrinhos e fases.",4,1,1.47.1,2020-11-06 15:33:19
14,Felipe Martins,https://play-lh.googleusercontent.com/-IRTuSvcIRVw/AAAAAAAAAAI/AAAAAAAAAAA/AMZuuclPgCSsoC68b4Vhs4nFECNX1aYNEA/photo.jpg,"O jogo é ótimo, mais por favor coloquem mais modelos de carros ou moto na mecânica e mais coisas para personalizar nossos veículos, vai ficar maravilhoso!!!",5,300,1.47.1,2020-09-26 09:17:22
15,D1NO R3XI,https://play-lh.googleusercontent.com/a-/AOh14GiftWjKnVeyobFDGqRRJBxwJ9xhX9NeGFU8A5ai3Q,"O jogo é muito legal, eu sempre jogo ele, hoje eu tenho 10 anos e eu jogava ele desdos 7 anos!, Eu nunca vou parar de jogar ele até enjoar!, Vou tentar zerar o jogo! Esse e o meu objetivo!!",5,12,1.47.1,2020-10-20 23:46:25
16,Igor Souza,https://play-lh.googleusercontent.com/-W45mG4FXqqA/AAAAAAAAAAI/AAAAAAAAAAA/AMZuucnhG67krfxKFm5FM0n7VIC_8yJISQ/photo.jpg,O jogo é legal tem gráficos muito bons tem uma boa jogabilidade é muito fácil só o que acho que deveriam colocar mais níveis mais é bom tão bom quanto o primeiro,4,67,1.47.1,2020-10-02 11:16:47
17,Marcos. Gusmões,https://play-lh.googleusercontent.com/a-/AOh14Gg5AjK-U44KUZKvpecaDvNKI6Qu1sFM8cdoXV8Y5zc,Depois das últimas atualizações está travando muito lento...Espero q vcs melhorem o aplicativo...Pois ele até então e um dos melhores,4,22,1.47.1,2020-10-09 18:58:33
18,yara watanabe,https://play-lh.googleusercontent.com/-3k7RaiamC_8/AAAAAAAAAAI/AAAAAAAAAAA/AMZuucntb0ZnbaIojPk_5YLBweaEnij3uA/photo.jpg,Amei esse jogo só que as estradas deveriam ser mais baratas para comprar só isso que deveria mudar o resto está muito bom parabéns pelo jogo incrível 👏👏👏👏😁,4,464,1.47.1,2020-09-14 19:36:05
19,Andrea Maia,https://play-lh.googleusercontent.com/-YCYuQmhwvzE/AAAAAAAAAAI/AAAAAAAAAAA/AMZuuclqFW-Q6Af_bRfm0-MZ8eURz0gB9Q/photo.jpg,"Gosto muito desse jogo , gosto mesmo pela diversão , muito legau tem várias coisa pra compra carros motos lugares e nunca dar tédio , por isso tou dando 5 estrelas mais ele merece mais que 5",5,19,1.47.1,2020-10-05 19:25:31
20,BRUNOFERREIRABRITO FERREIRA,https://play-lh.googleusercontent.com/a-/AOh14GiKPpZS35xoRImauuE0hJqvLDdpwaQv1n2ETIFD,Odiei porque já se passaram muitos anos e o jogo continua com a mesma cara os gráficos não mudaram quase nada o jogo merece mais uma melhorada exemplo do pneu rodando no chão falta poeira chuva mais pistas mais veículos para comprar exemplo também do tanque de guerra quando eu encontrasse algo na frente dele poderia atirar no objeto.,1,15,1.47.1,2020-10-15 18:43:45
21,Antônio José,https://play-lh.googleusercontent.com/-LK4kwweQA1k/AAAAAAAAAAI/AAAAAAAAAAA/AMZuuclFPRrTjYfwZqMjlSHlqfqFSmMadg/photo.jpg,O jogo é legal mas poderia poder mudar o personagem e a cor dos veículos,5,3,1.47.1,2020-10-29 21:09:57
22,paulo fontes,https://play-lh.googleusercontent.com/-2SsyYbjAEgg/AAAAAAAAAAI/AAAAAAAAAAA/AMZuuclREZKg9nJEC9fZ30QE9B4TGshXXg/photo.jpg,"Precisava ter carros melhores , o offroad é o único capaz de correr e ter estabilidade o suficiente pra jogar todas as fases. E as fases poderia ter mais moedas , porque depois de comprar todas as fases e todos os carros o jogo vai perdendo a graça. Se tiver fases melhores e carros melhores mesmo q os valores desses sejam maiores seria mais empolgante continuar jogando.",3,578,1.46.6,2020-09-02 16:46:45
23,Matheus Rodrigues Maciel,https://play-lh.googleusercontent.com/a-/AOh14GiRKPlcm8lo-849rzePFPkx11RkUIYy29pQbBls,É bom só que as estradas e os carros são muito caros era melhor que fossem mais baratos assim seria melhor,3,3,1.47.1,2020-10-26 13:24:42
24,Manoelvitor Silva,https://play-lh.googleusercontent.com/a-/AOh14Gi-KWO9fgZq9hgntb1zM9hMpNh-bu7OW_l-eCl_,Jogo top pena que a lua e o unico que da pra fazer bonus como tempo no ar flip e pescoso quebrado,4,0,1.47.1,2020-11-08 11:19:24
25,Edson Messias,https://play-lh.googleusercontent.com/a-/AOh14GjoaUSVdoKVKXVN22rHRBEdCowDTXuJadVM9n0T,"Esse Jogo é muito top,super leve e com gráficos muito loko.",5,7,1.47.1,2020-11-04 13:23:57
26,Pedro Cavalcante,https://play-lh.googleusercontent.com/a-/AOh14Ggaee6vuybnFF2xvYI3yQi8o6QXggApu16z-6hx,Ú jogo de carro é muito bom mais ir a ser melhor qui tir fese pintura tir carro no jogo,5,10,1.47.1,2020-10-13 14:10:18
27,Maria Eduarda,https://play-lh.googleusercontent.com/a-/AOh14GiEduxm1jAipDYGwVuXgtdztEHmSO7wa-HDxN4P,"O jogo é maravilhoso, os gráficos não tenho do que reclamar. Recomendo muito !",4,18,1.47.1,2020-10-03 08:58:56
28,ORIGINAIS,https://play-lh.googleusercontent.com/a-/AOh14Gig5Taq-nnl7it40fgNEdw_kijMLqm_wkijKoZNdA,Esse jogo merece todo respeito que eles não deixa o jogo vim com atualização ruim so melhora mais ainda esse jogo mereceu todo meu respeito tem mais de 4 anos que jogo ele,5,8,1.47.1,2020-10-13 20:38:14
29,Arthur Batista de Souza,https://play-lh.googleusercontent.com/-XPiWs0MjQpQ/AAAAAAAAAAI/AAAAAAAAAAA/AMZuucmtGf-BnMjLTpx9mtwC_0-PgLVXIw/photo.jpg,Muito legal esse jogo é além do mais lança carros novos tem como comprar sua própria fase comprar seu próprio vericulo,5,7,1.47.1,2020-10-18 22:33:17
30,Arthur Henrique,https://play-lh.googleusercontent.com/-gajjDG9K0xY/AAAAAAAAAAI/AAAAAAAAAAA/AMZuucn4ykURWyvrolLbcjivZWg8GdfxzA/photo.jpg,"Muito bom mas da para ficar zangado com esse jogo por que quando nos tamos perto de ganhar a dificuldade começa Mas de resto é bom de mais,🙂🙂🙂🙂",5,14,1.47.1,2020-10-05 13:08:15
31,Sara Souza,https://play-lh.googleusercontent.com/-bK2-nYPNJVU/AAAAAAAAAAI/AAAAAAAAAAA/AMZuucnpj07NKRmmw6l9DUsZAL-a5t6_9A/photo.jpg,"O jogo é bom divertido fácil de saber como joga mais ele tem um problema ,o problema é que para pessoas que não têm internet e só tem um celular e não quer gastar não dá para ficarjogamos fora isso é espetacular divertido é muito antigo e com muita fama",5,739,1.46.6,2020-08-28 19:54:11
32,Noah gamer Albuquerque,https://play-lh.googleusercontent.com/a-/AOh14GjzJOLx_EARD2IXxim-ybJFNU6e7vb8cLGgFeNB,"Fingersoft,adciona um modo que da pra botar uma skin no personagen/carro",5,8,1.47.1,2020-10-08 19:57:10
33,Elias Mesquita,https://play-lh.googleusercontent.com/-83GLJkQZd3U/AAAAAAAAAAI/AAAAAAAAAAA/AMZuucn4ITYXDZNYG57IZ-ZJqxCvOCPqvw/photo.jpg,"Jogo bom, mais e necessario que seja colocado mais pedras joias, porque tem que ter paçiencia de jogar para juntar 500 pedras que sao necessarias para tunar os veiculos da oficina. Corrige isso ai. E necessario mais combustivel tambem, nunca carro andar sem combustivel.",3,905,1.46.6,2020-09-07 19:17:10
34,andrei f,https://play-lh.googleusercontent.com/a-/AOh14GiLpFLFk1w9b3ZsI4AKwSeMt2D4tVz3xWHUMinoqA,O jogo é muito bom mas podia ter personages novos mas o jogo está muito bom,5,2,1.47.1,2020-10-17 09:36:35
35,luciana zagato,https://play-lh.googleusercontent.com/-V7cI_dHaeuE/AAAAAAAAAAI/AAAAAAAAAAA/AMZuuclPwFUl_EE4aNqqpcHLiKjg-32Txw/photo.jpg,O jogo está legal mais tinha que ter mais estradas tipo uma ferrovia para a Maria fumaça sen montanhas grandes uma estrada de campo de corrida para o carro de rali e deveria ter uma atualização que as estradas teria mais texturas tipo o deserto podia ter alguns cactos e o ártico ia ter uma textura de neve que afundasse um pouco o carro na neve e o campo ia ter umas flores pelo caminho por favor essas estradas estão muito sen graça e aquele carro mutante podia ter mais formas por favor ponha isso,3,1327,1.46.6,2020-08-26 21:35:27
36,Estefhany Allves,https://play-lh.googleusercontent.com/a-/AOh14GicxTcvMZsSiMq0_xHJMWGCwogIZAyFfIfKi5hYZg,"Muito bom,não tem oq reclamar excelente.Mas está travando um pouco..",5,3,1.47.1,2020-10-19 23:59:52
37,P4ul0 AB,https://play-lh.googleusercontent.com/-AheZoGRSIxE/AAAAAAAAAAI/AAAAAAAAAAA/AMZuucmtjVwmN7OqfkumVYi0f2BqdT3E_Q/photo.jpg,"Acho o jogo top a fisica e meio zoada mas acho q foi de proposito,eu acho q a corrida tinha que acabar quando o carro para tipo ja fui n embalo sem gasolina e a corrida acabou um centímetro longe do galao ,vcs podiam por uma maneira de converter diamantes em moedas e podia ter outras skins de piloto",5,79,1.46.6,2020-08-24 11:08:41
38,Mundo da Maria,https://play-lh.googleusercontent.com/a-/AOh14GgPS4Owzggk_okCGtljxlyvFUpM5i3xPDhemUg2_Q,Eu amo este jogo e eu não tenho nada do que reclamar porque ele é muito legal e o objetivo dele é correr para ganhar moedas para modificar o seu automóvel e também para comprar mais !!!,5,39,1.46.6,2020-08-29 14:38:52
39,Rafael B. S. Mendes,https://play-lh.googleusercontent.com/-y2MWgLfdtfM/AAAAAAAAAAI/AAAAAAAAAAA/AMZuuckikl3OPB3JgT-ODTMEQq3oTTxZnw/photo.jpg,Jogo muito legal eu gostei demais os gráficos são ótimos e além disso jogo é incrível Demais. recomendo Pra vc que gosta de jogo de carros e tals se vc achou o jogo incrível ponha sua resenha 👍👍👍👍,5,29,1.46.6,2020-08-29 18:37:55
40,Edilson Silva,https://play-lh.googleusercontent.com/a-/AOh14Gh75XM_j2imywSy2meM8IbuN6hG0lTeqstJ3z30-Q,"O jogo é bom mas quando vou comprar um novo carro não dá pra vender e o carro que não vale a pena e eu queria um carro que ele voar com asa de 2 bilhões de moeda e a arena poderia ter uma que seria de baixo da água e ele começa a sair da água ia para praia e depois fosse para estrada e do nada fosse perseguido pela polícia, essas seriam as minhas melhorias a e está é a conta é do meu pai eu só sou uma criança de 10 anos",5,1220,1.46.6,2020-05-31 22:20:47
41,flor raivosa,https://play-lh.googleusercontent.com/a-/AOh14GgkpW_BEkkU6D776lFiNmpYsuNLC7u0XxmkRXjsPA,O jogo é ótimo mas o problema é que as vezes eu fico clicando em começar mas não vai então eu tenho de sair é entrar para funcionar mas quando acontece isso não buga tudo só o botão de começar mas tirando isso é ótimo e tbm... ;-; demora para entrar,4,342,1.46.6,2020-05-31 15:10:30
42,Restaurante Bocaina,https://play-lh.googleusercontent.com/-4YC-CfXGCpk/AAAAAAAAAAI/AAAAAAAAAAA/AMZuucnIfkrc6ZpVwGIRdyXsDLVTeAWEdg/photo.jpg,"Muito bom, mais poderia melhorar na questão de mais variedades de veículos.... Na verdade eu não sei o que eu vou falar !!! Kkkkkkkkkkkkkkkkkkkkkk",4,0,1.46.6,2020-11-07 12:58:58
43,Luh fernanda da Costa,https://play-lh.googleusercontent.com/a-/AOh14GiFg2WHf91K6qJV6XxgzEnWAOw6-_-YEupK8aKP,Excepcional jogo!!!adoro simplesmente!!!!,5,2,1.47.1,2020-10-24 16:08:48
44,Renilda Cristina,https://play-lh.googleusercontent.com/-MUJ-o5ePFHM/AAAAAAAAAAI/AAAAAAAAAAA/AMZuucl_egb45W96W3HIrtdkTfB8pgYQRQ/photo.jpg,O jogo e muito bom so que na MECANICA deveria ser menos diamantes ao inves de 500 diamantes demora muito juntar tudo e podia ter mais carros e pistas,4,12,1.46.6,2020-08-24 16:43:43
45,MARIA APARECIDA DA SILVA DOMINGUES,https://play-lh.googleusercontent.com/-r2zC-hsSu4k/AAAAAAAAAAI/AAAAAAAAAAA/AMZuuclZOdk9zmZiczka1x3Ws-8zhdYgBA/photo.jpg,Não gostei do seu jogo. Aliás o primeiro carro patina muito na pista E a pista da lua é ruim só mente a caminhonete consegue,1,69,1.47.1,2020-09-19 11:52:21
46,Kauan Souza Da Solva,https://play-lh.googleusercontent.com/a-/AOh14Gj6sM5RWiNPV7dT2EdFbnV6hFyVNo_IoQEVgmtD,"Muito bom o jogo, mas tem um pequeno ploblema, os diamantes/pedras eles não tem muitas utilidades, é tipo compra a mecanica e caixas somente isso, vocês poderiam adicionar mais utilidades para os diamantes/pedras.",5,273,1.46.6,2020-08-10 13:50:32
47,Conceiçao Araujo,https://play-lh.googleusercontent.com/-9y2nzUbdZ9Y/AAAAAAAAAAI/AAAAAAAAAAA/AMZuucnTFqUKXxhm72VlJ6E4dl-yyrj0ww/photo.jpg,"Bom!! Por agora dou só 3 estrela, mas quando tô jogando e aparece pra vê um vídeo pra ganhar moedas extras, vejo o vídeo e não carregada as moedas, queria saber o que está acontecendo, porq já atualizado e continua o problema, me respondam por favor. Obrigada!",3,467,1.46.6,2020-05-27 16:26:24
48,Gabriel Alexandre,https://play-lh.googleusercontent.com/-0ohZGFxQIhg/AAAAAAAAAAI/AAAAAAAAAAA/AMZuucm5IUPUvsssCp4MjdUn2hIiyPwjgw/photo.jpg,"Eu não jogo a muito tempo(2016) , decidi voltar e perdi todos os meus carros que eu tinha desbloqueado e na época eu gastei dinheiro no jogo, conectei com a minha conta no play games (app) e mesmo assim não deu certo",1,358,1.46.6,2020-06-04 19:16:22
49,Junio Ferreira,https://play-lh.googleusercontent.com/a-/AOh14GjkzwsIIUZ459KLxrhggechN6W_4n-vuntYiinQ,Otimo jogo pois tem como passar muito tempo se divertindo e juntando dinheiro e desbloqueando novos mapas e carros.,5,18,1.46.6,2020-08-15 19:49:36
50,j Orlando,https://play-lh.googleusercontent.com/a-/AOh14GiYQ4XLhpua3apahH9cnSUfEFdn1O3egKslchR9,Muito bom jogabilidade boa mas o caro capota muito fácil e a gente poderia controlar isso se adicionar isso no jogo ele vai ficar perfeito,3,11,1.46.6,2020-08-27 10:07:02
51,pedro paulo,https://play-lh.googleusercontent.com/-cbxibMaN4WY/AAAAAAAAAAI/AAAAAAAAAAA/AMZuucmOwwIqO92c6KGDZrjXRY4nhs1NAA/photo.jpg,"Muito legal esse jogo graficos bons , carros legais ,temática muito boa ,e o melhor a jogabilidade!",5,25,1.46.6,2020-08-12 09:09:54
52,Ana Regina Fonseca Vieira,https://play-lh.googleusercontent.com/a-/AOh14GgKCEdc5Plx7KTUs6TOa-QOp1c9zFNuENIsMA7M1P8,"Ótimo jogo, dificuldades à cada nível. Amo esse jogo. Parabéns aos desenvolvedores. Já cheguei ao último nível, mas nunca consegui zerar o jogo.",5,26,1.46.6,2020-08-12 14:11:10
53,Alessandra Mariana,https://play-lh.googleusercontent.com/-aPGRvAXtTZ4/AAAAAAAAAAI/AAAAAAAAAAA/AMZuuclyivE05D6PP3EJ6BW5FC1VRZZDqA/photo.jpg,"MUITO BOM GOSTEI DE MAS !!! , OS GRAFICOS E MUITO MAS!!!!",5,9,1.47.1,2020-10-06 17:28:28
54,Augusto Carvalho,https://play-lh.googleusercontent.com/-_qLm8SoWczM/AAAAAAAAAAI/AAAAAAAAAAA/AMZuuckgFywExehz7vu4udFY8psdWoiCkg/photo.jpg,"Ao entrar no jogo pela primeira vez eu me conectei à nuvem, mas me desconectei pois havia entrado com uma conta que não pretendia. Desde então, ao tentar me conectar novamente dizem que não foi possível, e devo checar minha conexão ""network"" (e eu sei que estou conectado à internet).",5,308,1.46.6,2020-07-17 10:26:10
55,Pedro Henrique,https://play-lh.googleusercontent.com/a-/AOh14GiDCH8BJ7bkb7o9ci_N1hP04fdnX6fK4b1Q0DHx,Muito bom mais queria que fosse um pouco mais fácil de ganhar dinheiro fora isso não tenho oq reclamar,4,2,1.47.1,2020-10-21 13:19:12
56,Matheus Nogueira,https://play-lh.googleusercontent.com/a-/AOh14GieZF5EMmmy2ngAJSnQNi5yJxoL6uxN5-zngxBx,O jogo é bom mas um dia eu restaurei o celular... Não perdi o jogo totalmente... Mas em compensação perdi o carro Monster que é super caro...,5,6,1.46.6,2020-09-05 13:35:08
57,Anaodete Dos santos,https://play-lh.googleusercontent.com/-NnLy0fWXcG4/AAAAAAAAAAI/AAAAAAAAAAA/AMZuuclIYkWY0Eye64BIpVuONwyA3M9xww/photo.jpg,E pq ainda vai abrir eu tinha esse jogo desde os 4 anos de idade eu gosto muito desse jogo ele E perfeito e que bom que inventaram O 2 dele porque senão eu taria perdida ele e muito bom mesmo gente tomara que todos vcs gostem como eu e meu irmão tchau beijos 😘😘,5,44,1.46.6,2020-06-27 11:37:07
58,diana cristina santos,https://play-lh.googleusercontent.com/-y9b5j2OOaNg/AAAAAAAAAAI/AAAAAAAAAAA/AMZuucmexwlMkRRtRtHIK8Kj31JTkQisCQ/photo.jpg,"O jogo é muito bom,acho q não tem nada a reclamar dele,tem vários mapas,acho que deveria ser mais barato as coisas",5,109,1.46.6,2020-08-05 20:50:36
59,Edu Ferreira Ferreira Gmail . com. Br Ferreira,https://play-lh.googleusercontent.com/-dwGJMm2xzaM/AAAAAAAAAAI/AAAAAAAAAAA/AMZuuckhmrzMSnZqH-urMZyW9pUugdSHlg/photo.jpg,O jogo tem um problema quando eu jogo com o furgão hippie quando acaba a gasolina ele buga e quando eu volto para o menu à música fica sem barulho mesmo que ela esteja ligada nas configurações consertem aí eu darei cinco estrelas,3,135,1.46.6,2020-06-21 16:28:13
60,Gleisa Magalhaes,https://play-lh.googleusercontent.com/-4ZcaSocoiu8/AAAAAAAAAAI/AAAAAAAAAAA/AMZuucmjJr4urMdMOZgC0bO-wkpgD4RPxg/photo.jpg,Aqui ótimo jogo só os dois problemas são tinha q ter mais carros e o segundo problema é q tem q fazer um jeito de sair do carro tá bemmmmmmmmmmmmmmmmmmmmmmmmmmmmmmmmmmmmmmmmmmmmmmmmmmm,4,5,1.46.6,2020-08-17 19:41:24
61,Lucas Henrique,https://play-lh.googleusercontent.com/-Ubss6EW7SM0/AAAAAAAAAAI/AAAAAAAAAAA/AMZuuclt4q8Hb12qqXqg1tV09euRuOqwkQ/photo.jpg,O jogo é muito bom eu estou doido para eu comprar outro telefone e jogo o segundo jogo,5,0,1.47.1,2020-11-01 06:51:46
62,Francisco José,https://play-lh.googleusercontent.com/a-/AOh14GhwMElGZWlkGvvMgl27DLIQ7I07P5AFix496gb1,E bom mas não era pra acabar a gasolina rápido pra ter desafio ter zumbi pra atacar o bill tirando isso ta legal é só uma coisa botar a cidade paris ou buenos aires,5,7,1.46.6,2020-09-01 11:05:19
63,Celso Ricardo Prieto,https://play-lh.googleusercontent.com/a-/AOh14GgIwNYtIeNEZYpRUW3NoeJkc_OjBiMbCWb8pmcl,"Jogo muito legal e divertido, só precisa ter a opção de poder continuar de onde parou!",4,13,1.46.6,2020-08-16 07:24:27
64,adriane lao Lao,https://play-lh.googleusercontent.com/-tm2hD8FTUuo/AAAAAAAAAAI/AAAAAAAAAAA/AMZuuckzGKn5SEuqfQB4imo_m4iPRZk-0w/photo.jpg,Esse jogo é o melhor que eu já vi ele tem anúncio mas é só desliga a internet daí ele fica perfeito então esse jogo merece cinco estrelas ⭐⭐⭐⭐⭐ 👍👍😘😘,5,93,1.47.1,2020-09-15 10:34:38
65,Francisco Pereira de castro,https://play-lh.googleusercontent.com/-QBQb9BQ8Ha0/AAAAAAAAAAI/AAAAAAAAAAA/AMZuucm4jFZkdcaq0lZh60rkjHws6Ujn7Q/photo.jpg,É muito bom mais poderia ser melhor os veículos são muito lento i as pistas são muito Ruim,2,6,1.46.6,2020-08-22 21:52:13
66,Katerine Costa,https://play-lh.googleusercontent.com/a-/AOh14GjFPpaFyeKqDSlguFiCIXPaAcfkRO_5Wkzpat9M,E muito legal porque eu sou Boa mais devia ter a opção de ter um cachorro dentro do carro,5,1,1.47.1,2020-10-13 21:00:12
67,José Braga games,https://play-lh.googleusercontent.com/a-/AOh14Ghs_c3fxT_XmnKHBZZLfybbp3K7SgfurzflZB4Hjc0,Jogo muito bom parabéns quando eu jogava eu tinha 7anos agora já tenho 10 anos e voltei a jogar o jogo,4,2,1.47.1,2020-10-23 12:07:43
68,Edinei Da costa,https://play-lh.googleusercontent.com/-yjx8sWGJG9I/AAAAAAAAAAI/AAAAAAAAAAA/AMZuuclm4gzeqYKP2HsLE5EGSoouTitmUA/photo.jpg,"Muito bom, divertido é um verdadeiro passa tempo além de ser muito atraente 😀👍",5,0,1.47.1,2020-11-05 19:25:06
69,Gildasio Marques,https://play-lh.googleusercontent.com/a-/AOh14GioHLNKpU8doX2C2WPNhhZEHvvUtDSodRpjQWVAGjE,"Muito legal! Mas seria melhor ainda se fosse possível reviver, mesmo se fosse com metade da gasolina.",4,25,1.46.6,2020-07-13 18:46:55
70,Esther Cristina Pereira De Cerqueira,https://play-lh.googleusercontent.com/-F9Slw9vbhRM/AAAAAAAAAAI/AAAAAAAAAAA/AMZuuck4fH5_7edh35_fyXsPzX9Mch3drw/photo.jpg,"Amei é ótimo não precisa ficar vendo anúncio, você compra os veículos com as moedas que vc ganha no decorrer da partida.",5,42,1.46.6,2020-07-05 21:39:59
71,Elena Gomes,https://play-lh.googleusercontent.com/-rk__KDFrX4o/AAAAAAAAAAI/AAAAAAAAAAA/AMZuuckx3Kt1kwlo7KkfC_v8v80Lm79zqQ/photo.jpg,Excelente. Não trava não tem vídeos é um ótimo jogo. Super recomendo. Baixem por favor vcs não vão se arrepender.❤❤,5,58,1.46.6,2020-07-09 16:12:32
72,julius pai do Chris,https://play-lh.googleusercontent.com/a-/AOh14Gh3mbVsIeGjzwfYCUEloyR5TsDpYCbN7LGPtfUkFQ,A unica coisa que falta no jogo são colocar músicas diferente em cada estágio é mais personagens mas tirando isso o jogo e muito bom gostei,4,27,1.46.6,2020-07-03 13:57:17
