,userName,userImage,content,score,thumbsUpCount,reviewCreatedVersion,at
0,Carla Ramos,https://play-lh.googleusercontent.com/a-/AOh14GgEeGSsC8kNdo0Ay1Lk7KYP-7_Q4NutB0pWNAhM,A última atualização não tava perfeita mas dava p jogar. Agora com essa última atualização trava tanto que a tela congela e é preciso tirar a bateria do celular e ligar de novo ou seja esta prejudicando meu aparelho. Vou esperar essa regata acabar amanhã pra desinstalar de vez esse jogo. E acredita vou fazer isso com meu coração sangrando. Vocês são uns irresponsáveis por fazerem isso com um jogo que foi bom por 4 anos.,1,82,7.9.0,2020-11-07 11:55:08
1,christina costa,https://play-lh.googleusercontent.com/a-/AOh14GhGHHfyq4aRHpq30ksM3Vx7cusYerOPotURBQSmmw,"Ultimamente o jogo está travando muito. Eventos q aparecem e de repente somem ou não abrem. O jogo em si é maravilhoso. Mas com o passar de níveis fica mais difícil. O celeiro exige muitos materiais sem falar nas expansões. O experimento do professor tão bacana ficou com prêmios desanimadores. A regata da temporada então, q tarefas são essas, acho q é pra não conquistar os prêmios.",4,123,7.9.0,2020-11-07 10:43:36
2,Anderson Silva,https://play-lh.googleusercontent.com/a-/AOh14Gg7vamSrI6QHtWEWaJ3FlguyQNois27WzDr4E8oubs,"O que vocês tem na cabeça? 4 expensoēs que só tem 3, e o tempo das expensoēs só estão aumentando, 4 dias e 3 horas? Não colocaram mais prédios públicos, casas e só querem ganhar dinheiro e não fazem por merecer! Será que vocês sabem que tem milhares de pessoas desistindo desse jogo, por causa dos problemas aparentes? Ou já esqueceram?",1,330,7.9.0,2020-11-06 11:26:46
3,CidaLCosta Lima da Costa,https://play-lh.googleusercontent.com/a-/AOh14GjNNfw7j94KS3j61DSzRbCzxXhqX_3W2nyHqVdmFA,"O jogo e maravilhoso. So o celeiro que náo aumenta rapido temos q vender produtos e fazer depois . E tem produtos que demoram 6 hs pra colher e mais 3, ha 4 hs pra ficar pronto . Podem melhorar isso. O jogo ficara muito melhor. Dou 4 estrelas. Aguardo celeiro mais rapido. Menos material.Nada funciona depois q fiz a nova versão. Agora atualizando de novo. Me ajuda meu neto altista e este jogo é a única coisa q o deixa calmo. O celeiro não abre e as fabricas lotadas. Ele tem crise. Ajude por favor",4,113,7.8.6,2020-11-05 23:31:05
4,rosana toledo de assis,https://play-lh.googleusercontent.com/-JvzqcBgX-gk/AAAAAAAAAAI/AAAAAAAAAAA/AMZuuckm0Qm9gQP7sjLAxyXATz8hXD9Cew/photo.jpg,"A competição hora da mina já acabou para todos os jogadores da minha cooperativa e pra mim ainda esta rolando não começou a competição magnata dos transportes que tava aparecendo pra mim que ia começar até sumiu, esses bugs que esse jogo anda apresentando esta desmotivando nós jogadores, e parece que os desenvolvedores do jogo pouco se importa. Ainda envia uma mensagem pronta.",2,3,7.8.6,2020-11-07 01:14:44
5,Rosimere Aparecida Soares Batista,https://play-lh.googleusercontent.com/a-/AOh14GiON_eRNOtZ4Iy5XdZbg9A4gD69QaP8-_B5UhUs,"Desde a atualização o jogo está péssimo... Não consigo ter acesso a regata para receber os prêmios, simplesmente a tela fica preta e o jogo fecha. O jogo está super lento, o progresso no jogo nem sempre é salvo, enfim, está frustrante. Já tenho mais de 2 anos de jogo e nunca havia tido vontade de desinstalar e desistir dele como agora... Por favor, tomem alguma atitude ou irei desinstalar... Sem paciência alguma",1,309,7.8.6,2020-10-27 11:35:13
6,Alexandre Nardini,https://play-lh.googleusercontent.com/a-/AOh14GiLAnYz7ptOppADkYRropDSM6mtrWQ6DB5PwZy1Lw,"Minha esposa desistalou por causa dos buggs do jogo. E quando intslou nao existia mais a cidade dela. E a playrix nao tomou providencia. Agora perdi no meu celular não entra minha cidade. E esse playrix novamente não abandona. Não consigo falar com ninguém, somente com uma máquina que me faz perguntas que não tem nada haver com a situação. Não resolve meu problema. Que raio de suporte que não atende um cliente. Isso tá ficando um lixo.",1,7,7.8.6,2020-11-08 07:08:52
7,Luzia Siano,https://play-lh.googleusercontent.com/a-/AOh14Ggp8eexlWeiuSViHQfCtL-WGb9ODBNzpu3DyS9_cQ,"Depois de muitos perrengues e frustrações o jogo voltou ao normal. Problemas como os que aconteceram devem ser resolvidos rapidamente. Este jogo é excelente. Adoro os detalhes e as situações inusitadas que acontecem com os moradores da minha cidade. Me divirto muito. As missões da regata é que estão ficando muito repetitivas, poderiam diversificar um pouco mais. Abraços à equipe Township.😊",5,356,7.8.6,2020-10-28 13:44:02
8,Danilo Ferreira,https://play-lh.googleusercontent.com/a-/AOh14Ghr7kBmbhFDZDtQhg5eDvYZRCHjcFr3SaurMNFW,"O jogo é bacana, interativo e bem organizado. Só como oportunidade de melhoria e não critica, mas os acessos as ferramentas e aos materiais de construção deveriam ter + opções os tornando mais fáceis a sua obtenção, as vezes chegamos a ficar meses para concluir uma construção na cidade e no zoo, devido às altas quantidades pedidas e as dificuldades em conseguir. As tarefas do prof. verne e o desafio do cômodo do dia das bruxas está impossível de terminar no prazo, muito difícil fechar....",5,179,7.8.6,2020-10-27 18:53:25
9,Breshopp Borboletynha,https://play-lh.googleusercontent.com/a-/AOh14GiphM9sSWMR1Xo2cnTmeBXB2FxhwOZ3R41tGqym,"O jogo está horrível desde as últimas atualizações! Milhares de membros com problema de acessar regatas, jogo trava, tarefas de regata difíceis e demoradas. E para agravar os desenvolvedores escolheram um número X de pessoas para receber o bônus duplo do professor Vernie! Tremenda falta de respeito com os demais membros! Eu amava o jogo, mas está cada vez mais difícil continuar!",1,152,7.8.6,2020-10-29 14:30:26
10,Eugenia Ferreira,https://play-lh.googleusercontent.com/a-/AOh14Gh46cYF-dn2Zh4Tdfs4emny3gUDSBTOgWarETyrsg,"Em termos gráficos está muito bom. Treina a capacidade de gestão, é certo, e incentiva a partilha. No entanto peca pelo facto de ter os cómodos imposssíveis de serem concluídos, o aumento da capacidade do celeiro não se coadunar com o aumento dos materiais exigidos. Jogar exige investimento monetário, por vezes excessivo.",5,128,7.8.6,2020-11-03 21:49:58
11,Michele Mor,https://play-lh.googleusercontent.com/-0WXBVVJa4_Y/AAAAAAAAAAI/AAAAAAAAAAA/AMZuuclhXUw5tKnwgEgxhEG4mMzujrNv1w/photo.jpg,"O que está acontecendo com essa última atualização, no meu celular não abre mais o jogo. Sempre travando, não tem condições de jogar mais. Faz dois dias que o jogo não abre, e ninguém faz nada e muito menos responder pelo que vejo aqui não é só eu que estou com problemas. Vamos resolver isso pessoal, por favor resolvam isso. Na verdade acho que não adianta comentar aqui pois ninguém lê. Triste isso, muito triste",4,222,7.8.6,2020-10-22 10:59:27
12,Jefferson Lucio Discacciati,https://play-lh.googleusercontent.com/a-/AOh14GiTtebo1mALOyuOZyg_vUhcfvLfDnboHhWHd5e0,"Pq o jogo está travando tanto??? ... outra situação que deveria ser revista... é a quantidade de material necessário para se construir os prédios e fábricas, casas...etc.... são absurdamente incompatível com o tanto de material que se ganha!!! Isso deveria ser mais justo...pra que se possa evoluir no jogo com maior frequencia!!!",5,141,7.8.6,2020-10-31 08:59:10
13,Daniela Ortlepp,https://play-lh.googleusercontent.com/a-/AOh14GhKMRcGDt_y7Zp13ypuyGT_U-58Y8yYmzvP7mFl9w,"Essa avaliação é uma crítica. Adoro esse jogo, tem alguns jogos ou tarefas difíceis, mas sempre possíveis de realizar. Encaro como desafios. Porém, esse último do Cômodo da Bruxa, só eu tô achando impossível de passar as fases do jogo? Tá horrível. Eu vou desistir. Poxa, tudo bem ter desafios, mas esse já passou do desafio faz tempo. Não gostei nada disso e então vou avaliar com uma estrela",1,122,7.8.6,2020-10-28 08:16:34
14,Paolla Fagundes,https://play-lh.googleusercontent.com/a-/AOh14GgZlw5OXHt_e-luly3OEcj_SwRY36qMbDt9UlC8,"O jogo é muito bom e envolvente. Mas a sincronização e horrivel, é um dos pontos negativos do jogo. Tenho uma cidade e esta salva no facebook, mas não consigo acessa-la em outros dispositivos. Dediquei muito tempo a ela, para ter que começar outra, sem contar as minhas compras que vou perder. Voces tem que melhorar a sincronização de dados de jogo.",3,122,7.8.6,2020-11-03 21:03:46
15,Sirlene Santana,https://play-lh.googleusercontent.com/-vm4dSQxUIac/AAAAAAAAAAI/AAAAAAAAAAA/AMZuucnf94_FXPMo0ISbGgzWhEpRCx9jcA/photo.jpg,"O jogo era bom no início. Agora está cada vez mais chato. Tenho uma cooperativa e metade dos membros já desistiu de jogar. Um absurdo a quantidade de material pedido em casa construção/melhoria. Celeiro vive cheio. Regatas cada vez mais chatas. Evento do comodo do Hollowen extremamente difícil. Evento da mina que era pra ter começado há pouco não começou. Evento de notas prometido a uns tempos atrás travou e nunca mais voltou... Enfim, tá muito ruim!!!",1,76,7.8.6,2020-11-02 08:42:14
16,Roseane Souza,https://play-lh.googleusercontent.com/a-/AOh14GiVt3rZm7V2IROVHGKS6Zndorm3v0lwiZGse4oa9E4,"Vou usar está avaliação para fazer uma crítica,gosto muito do jogo e dos eventos que sempre ocorrem, mas este evento do cômodo da bruxa está horrível, as fases são quase impossíveis de passar, os pontos quando se passa de fase são entre 10 e 20 e a quantidade de pontos pra cada item é sempre acima de 80. Muito sem noção, se os valores dos itens serão tão altos os níveis devem ser um pouco mais fácil, mesmo sendo desafio tem que ser um desafio plausível.",1,13,7.8.6,2020-10-29 23:22:42
17,Um usuário do Google,https://play-lh.googleusercontent.com/EGemoI2NTXmTsBVtJqk8jxF9rh8ApRWfsIMQSt2uE4OcpQqbFu7f7NbTK05lx80nuSijCz7sc3a277R67g,"Esse jogo é muito bom, com a atualização ficou melhor ainda, tem uma diversidade maneiras de jogar, a cada jogada meu jogo cresce, super recomendo,não tem anúncios e cada vez que tem algo pronto no jogo vem sempre um lembrete, agora estou em clima do dia das bruxas, isso torna o jogo mais interessante, sempre com um tema diferente pra jogar ,excelente 👏👏👏",5,11,7.8.6,2020-10-26 05:10:42
18,Guilherme,https://play-lh.googleusercontent.com/a-/AOh14Gj7RXgymdzzeX5fbGh8w9NSZA0aT4n3O7KhoEJeNQ,"O jogo está cheio de bugs, ele fecha sozinho quando você tenta entrar na regata, as vezes você perde o progresso todo, os eventos que vieram estão horríveis, todo mundo reclamando que tá chato de jogar. O evento do professor o último baú quem não paga o bilhete dourado não consegue abrir. Esse jogo em bom, mas estragaram ele no último mês, por favor arrumem o jogo e volto a dar 5 estrelas",1,164,7.8.6,2020-10-30 19:12:50
19,Marlí Rosemeire de Lima Cantos,https://play-lh.googleusercontent.com/a-/AOh14Gigl3xhDtrvShw5HHC6xG2-4d6ObrDxBJ_pfa3Y,"Amo jogar TOWNSHIP,mas depois da atualização de aniversário,não posso entrar na regata que meu jogo fecha sozinho. E já perdi notinhas township por causa desse bug. Já desinstalei o jogo várias vezes, reclamei com o suporte e não arrumaram. É alem de fechar tudo que foi feito antes ,tem que ser feito novamente. Só que se teve alguma ação onde ganhei notinhas township, na volta do jogo no lugar das notinhas ganho martelo,laje, tijolo ou vidro. Por favor arrumem isso.",1,115,7.8.6,2020-11-09 06:20:10
20,Helena Fernandes,https://play-lh.googleusercontent.com/-c1zWYYTPvXI/AAAAAAAAAAI/AAAAAAAAAAA/AMZuuclEIFVyp6spJ-XGkfMkRn6EaPwlBg/photo.jpg,"O jogo funcionava bem, até esta ultima actualização, sempre que vou as tarefas da regata sai direto.... se há várias ""reclamações "" neste sentido, seria bom ajudar-nos. Obrigada Já tirei mais uma estrela... Palhaçada as tarefas do professor verne, maldita hora que comprei o bilhete dourado, pois metem as tarefas finais impossíveis de se realizar e com pouco tempo. Enfim... a ajuda no próprio jogo é zero e também ninguém ""responde"" a estes comentários........",1,90,7.8.6,2020-10-28 18:27:10
21,Carlos Henrique do Nascimento,https://play-lh.googleusercontent.com/-kkbA2O5TeJ0/AAAAAAAAAAI/AAAAAAAAAAA/AMZuuckgbK5K1I14ToUkEYLXd4ydEPJBCQ/photo.jpg,"Aconselho a todos a não gastarem R$1,00 nesse jogo. Ele é um jogo semi-acabado o tempo todo. Benefícia alguns jogadores e prejudica outros. Eu estou removendo esse Jogo do meu celular depois de saber que no Evento do Doutor ""alguns"" jogadores foram beneficiados com missões com pontuações dobradas enquanto outros ficam se matando para jogar. De verdade foi decepcionante saber disso.",1,81,7.8.6,2020-10-24 17:28:10
22,Karina Monteiro,https://play-lh.googleusercontent.com/a-/AOh14Gji4z2B0utco_nkiS6V4LcR97FuiCoPqTi4HrgTMA,"Demora mto p conseguir fazer as construções, os materiais custam a chegar, faz semanas que não tem novos imóveis p aumentar a população, o jogo do Comodo da bruxinha estava impossível de passar e apareceu ontem no quadro que faltava 7 horas para começar o evento da mina, hoje já apareceu que falta mais de 19 horas!?? Tá puxado, resolvam os bugs p jogo ficar melhor.",3,147,7.8.6,2020-11-02 10:53:25
23,Layane Bento,https://play-lh.googleusercontent.com/a-/AOh14Gigl-3_d4MoJmr_GvU4q_ZKb5l5j1d-jE4-QDeXwCY,"Esse jogo é bem legal, mas esse evento de dia das bruxas de montar o cômodo tá praticamente impossível de fazer. As fases são muito difíceis e com poucos movimentos!!!! Não consigo passar de uma fase, estou a alguns dias empacada nela, e não consigo passar de jeito nenhum. Triste",3,10,7.8.6,2020-10-28 23:12:04
24,Barbara Cavalheiro,https://play-lh.googleusercontent.com/a-/AOh14GhE43B2fz7Z8DVcArBA9ZuKGTI_yXOb_ndu_a5_tA,O jogo estava bom até aparecer bugs e alguns pontos que deixam o jogo chato. O som do meu jogo por exemplo não funciona. Ganhar towship (dinheiro)é algo dificílimo. A competição do cômodo é uma vergonha - você recebe 15 jogadas para fazer algo em torno de 30 objetivos. Vendo as outras avaliações percebo que a reclamação é geral. Agora o que me fez desistir de jogar foi a competição do professor - demoraram para liberar as últimas tarefas e não consegui completar.,3,138,7.8.6,2020-11-02 10:55:17
25,wandersson felipe,https://play-lh.googleusercontent.com/a-/AOh14Gh8YeT40lvs5OjpVJ0ggg6eMQTwB6qI0jAwDQvVNQ,"Gosto muito do jogo, mas esse evento estilo candy crush foi de matar a vontade de jogar, até comprar os bilhetes dourados eu compro, por gostar realmente do jogo considero que vale a pena a empresa ganhar, com um produto digital que é muito bem feito e cuidado, mas esses últimos eventos não estao prestando, se quiséssemos jogar candy crush, vários players instalariam o outro jogo ao invés do Township, pior e obrigar gastar notas por desafios ridículos... é uma bost...",3,11,7.8.6,2020-10-24 22:10:28
26,Afonso Araújo,https://play-lh.googleusercontent.com/-dkdAG8-_9ok/AAAAAAAAAAI/AAAAAAAAAAA/AMZuucl5FvB_odCYrFAH0pDuLqjsTBw8qQ/photo.jpg,"Ante da atualização o jogo era incrível, divertido e jogável. Mas após a última atualização o jogo não funciona, sai derrepente e desaparece tudo o que tinha feito. Hoje nem consigo coletar os prémios da regata pois no preciso momento em que os vou recolher o sai e perde tudo o que fiz, inclusive a subida da pontuação do evento da chiclete. Gostava que resolvessem este problema senão vou ser obrigado a desinstalar um jogo de que eu gostava muito.",3,80,7.8.6,2020-10-26 14:23:44
27,Um usuário do Google,https://play-lh.googleusercontent.com/EGemoI2NTXmTsBVtJqk8jxF9rh8ApRWfsIMQSt2uE4OcpQqbFu7f7NbTK05lx80nuSijCz7sc3a277R67g,Este último cômodo das bruxas está horrível de passar as fases...e quando a gente consegue o marcador não computa a Vitória...estou no 22 há um tempão...já ganhei várias fases e não sai do 22!!! Isso é roubo e muita sacanagem dos desenvolvedores do jogo...e pior não ajudam a gente a resolver o problema!!! Tô pensando em sair deste pois a sacanagem tá muito grande!!!🤔🤬,5,176,7.8.6,2020-10-30 12:35:46
28,Leticia Oliveira de Campos,https://play-lh.googleusercontent.com/a-/AOh14GhDhkP0tSw8FzGgjVwRILRz1ucjGsY84_vpKNjf6A,"O jogo é incrível, há vários jogos dentro do mesmo jogo.Muito interessante criar uma cidade do seu jeito, com toda uma infraestrutura. Gráficos bem feitos, sons ...Embora tenha algumas opções para comprar usando cash de verdade...ninguem é obrigado.Da pra jogar normalmente sem esse recurso.Da oportunidade através de cooperativas fazer amizades com pessoas do mundo todo. Recomendo. Ps:Tirem esse estilo"" candy crush"" , nem todo mundo gosta 👎",5,92,7.8.6,2020-10-27 23:40:22
29,Lisiane Lima Casseres dos Santos,https://play-lh.googleusercontent.com/a-/AOh14Gjb29I8-WMmrZoi3LjtUCQRqYQNGMl_x-miCJR5UQ,"É um absurdo vc eliminar em 17 jogadas mais de 100 peças de gelo e de uma cor tendo que juntar pelo menos 2 peças da mesma cor. Estou há 4 dias tentando ultrapassar esta fase do jogo. Cansei. É um jogo muito divertido, sem violência e que faz vc ter que planejar as próximas etapas. Porém, nesta última atualização está estranho, no tempo e na contagem. Concertem este problema, por favor.",1,116,7.8.6,2020-10-28 19:08:28
30,Évora Germano,https://play-lh.googleusercontent.com/a-/AOh14Ggo0TdwYNx_T-3kgZTSbJOQY-SK9mP1MEiKmRWROA,"Adoro o jogo. Mas depois da última atualização tem sido péssimo, o jogo ficou mais lento e não consigo participar da regata, toda vez que tento abrir o meu jogo fecha e perco todo meu progresso de antes. Infelizmente vou deixar e jogar caso esse problema não seja corrigido logo, vi outros comentários e percebi que não é um problema recente, e sim antigo e comum.",1,13,7.8.6,2020-10-28 09:30:55
31,Rafaela de Castro,https://play-lh.googleusercontent.com/a-/AOh14Gj5Wd1pVlfcIzHwm-yq-pMNsob6jSm1tEvsUEAO,"Tenho o jogo há um bom tempo e sempre gostei, mas ultimamente está deixando a desejar em alguns aspectos, especialmente esse negócio de colocar desafios ao estilo ""candy crush"" para ganhar pontos para fazer cômodo e afins. O motivo por optar pelo Towship foi justamente não ter nada parecido com candy crush (que eu odeio). Se continuar com isso, terei que abandonar o jogo, infelizmente.",3,193,7.8.6,2020-10-22 20:13:13
32,sueli Becker,https://play-lh.googleusercontent.com/a-/AOh14GioMomD5_u6F7f3kkVoA-WAJGPjoHbpEuYa-muY,"Vão ou NÃO resolver o problema desse jogo, já perdi a paciência Só me resta desinstalar, já que depois da última atualização e a tentativa frustrada de entrar em contato com alguma alma que diga alguma coisa, infelizmente todas em vão... Vão sentir falta depois de muitos desistirem... Obrigado pela atenção aos jogadores 👎👎👎👇 Além de estar MUITO difícil passar as fases do cômodo da bruxa, ganhei 2 vezes e não me deram os pontos... Desisto...👎👎👎",1,7,7.8.6,2020-10-30 22:15:43
33,ʚɞ Rąy Ły ʚɞ Mąciel ʚɞ,https://play-lh.googleusercontent.com/a-/AOh14GgJgxhhgixk0u4wBumxJkDrI91jhQww-dcPbj71QQ,"A atualização que tem q montar a casinha da Bruxa o joguinho está muito difícil, não deveria ter limitação de jogadas, o jogo em si já é dificil conseguir passar os níveis está quase impossível. E as Fábricas deveriam ser mais baratas ,são caras e difíceis de conseguir o dinheiro pra comprar as Fábricas.",2,137,7.8.6,2020-10-24 15:05:55
34,Michelle L.,https://play-lh.googleusercontent.com/-vTb1y-kql4c/AAAAAAAAAAI/AAAAAAAAAAA/AMZuucmc6TA58e0-_DugOJsG2UgavqeiPg/photo.jpg,"Estou refazendo minha avaliação! O jogo é ótimo, mas alguns eventos deixam a desejar. O valor para gastar as notas são altíssimos, como: para abrir os baús, vidas para continuar na partidas, os valores gastos com itens para ajudar nas fases dos cômodos são extremamente altos e tem fazes que ficam impossíveis sem qualquer ajuda!",3,13,7.8.6,2020-10-26 11:15:22
35,Pepita Pinheiro,https://play-lh.googleusercontent.com/a-/AOh14Gidy54SdTyrOuCkOpQoqi5Ij7_aORnL20yfhdv8iw,"O jogo é muito, muito bacana, mas ultimamente tem travado demais. Quando acaba uma regata não consigo pegar as recompensas, pois o jogo desliga. Além disso quando o jogo desliga algumas jogadas voltam, é como se não tivesse feito. Isso é bem ruim, pois as vezes estou com um produto quase terminado e quando retorno ao jogo (após ele ter sido desligado), é como se não tivesse colocado-o em produção.",3,10,7.8.6,2020-11-02 09:12:36
36,Ana Maria,https://play-lh.googleusercontent.com/-Vem-FmUZ27E/AAAAAAAAAAI/AAAAAAAAAAA/AMZuuclvRoCau0_TC7-HsEjo86XEVzk4_Q/photo.jpg,"Bom dia programador estou com um grave problema no jogo, ele não deixa entrar na regata já estou ficando desesperada, o problema consiste em liberar a tarefa e ter acesso ao painel de tarefas quando clico em tarefas e me joga para a minha pagina inicial, já desinstalei o jogo 4 vezes já linpei caché e não consigo mais fazer regata me ajudem por favor, meu nome é Ana Maria Cabrita e já jogo a 5 anos",5,5,7.8.6,2020-10-28 04:09:32
37,Ana Luisa Dias,https://play-lh.googleusercontent.com/-uX03bxKwLVA/AAAAAAAAAAI/AAAAAAAAAAA/AMZuuck1Vh9BpTqGktsYDf7ipiHOvuuOSw/photo.jpg,"É bom , mas sem dinheiro (dinheiro do jogo ) vc não tem nada . Demora muito , por exemplo :se vc der comida pra vaca ,ela demora uns 14 minutos para dar o leite . Como eu disse, sem dinheiro , sem nada ,com dinheiro , dá para acelerar o processo . É muito difícil de conseguir dinheiro , mas falta atualizações .",3,4,7.8.6,2020-10-28 10:13:00
38,Daniela Vinheiras,https://play-lh.googleusercontent.com/-hdrf6hEezTg/AAAAAAAAAAI/AAAAAAAAAAA/AMZuuclO1BY-_S_JDBonhIw7fe0SrWi9WA/photo.jpg,"Este jogo está a ficar muito Stressante,... Desde a alteração do formato da regata de Intertemporada, o jogo tem ficado diferente... Uma corrida dos campeões com tarefas exageradas.... com prêmios intermediários impossiveis de ganhar... A construção do último comodo com uma dificuldade extremamente exagerada e para a maioria dos jogadores impossível de completar.... Será melhor fazerem uma revisão para não perderem jogadores....",1,6,7.8.6,2020-11-02 06:12:12
39,Lion Black,https://play-lh.googleusercontent.com/a-/AOh14Ggm-3wLhlGlBFJpWnSgTYUng6pCMrghFCISMjzB,"Horrível, essa última atualização na regata trava e fecha ... entrei mais de 20 vezes e tdas vezes que tento entregar a tarefa, simplesmente fecha. É um estress pra pegar tarefas e entregar. Por favor arrume isso. Eu gosto mto desse jogo, mas se vcs ñ arruma isso.. muita gente vai parar de jogar.. Eu sou uma delas pq ta horrível para jogar.",1,95,7.8.6,2020-10-28 04:30:23
40,Jacqueline Cavalcanti,https://play-lh.googleusercontent.com/a-/AOh14GjTumJcVxNDSsiYzawlOd_-7FuJVp-GxDwKpPmRQmw,"Precisei formatar o Cel e perdi minha cidade. Estou em choque pois estou no nível 80. Sou ativa nos eventos e regata e não consigo acessar mais. Ao reinstalar o jogo, iniciou do zero novamente. Lembrando que já havia desinstalado e instalado por várias vezes e nunca deu problema.",1,3,7.8.6,2020-10-22 01:08:10
41,Mira Teixeira,https://play-lh.googleusercontent.com/-eJhD8cGkz60/AAAAAAAAAAI/AAAAAAAAAAA/AMZuucmq6-WlFbi4w_Rbt8jdOuEiCKbTTA/photo.jpg,"Amo esse jogo, mais infelizmente depois da última atualização meu Deus!!! Ficou horrível, entrar na regata é um martírio (só muita vintadat mesmo), e resgatar os prêmios então, uma prova de paciência, pq o jogo apaga do nada e não salva nada, ou apaga e vc perde todos os prêmios que conseguiu e não tem como reaver. Por favor, eu imploro ajeitem isso de uma vez, pq o que seria pra ser divertido ficou estressante demais.",1,15,7.8.6,2020-11-02 11:49:18
42,Juliana A,https://play-lh.googleusercontent.com/-aajjcPBv70w/AAAAAAAAAAI/AAAAAAAAFpk/AMZuucmmssnoJeQX9b3JW9x-_gR7iReQhw/photo.jpg,"A última atualização travou o jogo geral em todos os aspectos: gráficos, jogabilidade e etc. O cômodo da bruxa é difícil de passar, podia colocar na dinâmica do fishdown. E é muito ruim ter que comprar ferramentas para terminar um prédio público. Demora muito. Muito chato mesmo.",1,9,7.8.6,2020-10-30 09:09:27
43,Adriana Oliveira,https://play-lh.googleusercontent.com/-Ys5vH7sDBQc/AAAAAAAAAAI/AAAAAAAAAAA/AMZuucnPu_TsqurTyBIqmg6OvZxIvl0HeQ/photo.jpg,"Esse jogo está cada vez pior, gosto dele mas sempre trava a cada evento que começa, sem falar das provas da regata que ficam impossíveis de cumprir pois o jogo fecha sempre que tentamos entrar ... já que vocês são os desenvolvedores, porque não tira do ar de uma vez? Ou troca a plataforma que roda o jogo?",1,3,7.8.6,2020-11-04 04:19:34
44,Patricia Souza,https://play-lh.googleusercontent.com/a-/AOh14Gif9qGYazXSnHRfG168jGJ4oIsOEvMSDtFkwlOE,"Adoro o jogo, mas já estou ficando sem paciência. Troquei de aparelho é não consigo acessar o jogo, que teoricamente está no servidor. Quando instalei o app criou uma nova conta no novo aparelho é não consigo mudar.",1,0,7.9.0,2020-11-08 22:37:12
45,Rosa Pedreira,https://play-lh.googleusercontent.com/a-/AOh14GhtVar8t5rfRi2Txg41NDeTlP_a-1YnmZIBc1pGVw,"O Jogo de montar a cidade em si é muito legal, porém essa temática obrigatória é um saco, ninguém e obrigado celebrar dia das bruxas eu não quero deixar uma cidade linda e ver bruxa pra lá E pra cá. E pior o mês inteiro ainda. Maior temática esse mês e outubro Rosa se for assim deveria pelo menos ter opção de não ter temática ou ter outras temáticas. Não quero ver bruxa decorar casa da bruxa só quero jogar o jogo que tirando isso é bom.",3,2,7.8.6,2020-10-26 12:17:23
46,Hayana Barreto,https://play-lh.googleusercontent.com/-8hcclh120xs/AAAAAAAAAAI/AAAAAAAAAAA/AMZuucn1aRLOig-KhMak58h0KFtLb5B92w/photo.jpg,"Péssima!!! Que jogo é esse dos cômodos? Muito apelativo, te obriga a gastar as notas com bônus, fora o bilhete dourado, comprei e depois não veio pontuação em dobro!! Que não haja parcialidade nós jogadores e nem injustiças, todos merecem os mesmo benefícios!! Vamos ser lógicos PlayRix!!!!! 😒",1,1,7.8.6,2020-11-01 07:40:28
