,userName,userImage,content,score,thumbsUpCount,reviewCreatedVersion,at
57,Milena Oliveira,https://play-lh.googleusercontent.com/-7cr0P2L6kLw/AAAAAAAAAAI/AAAAAAAAAAA/AMZuucneGgr50NsZVRRgkzY0qMqWR8O-TQ/photo.jpg,Esse jogo é muito bom eu só tinha desinstalado pq foi um engano mais amei melhor jogo do mundo e eles entendem e passam o jogo quando clicamos sem querer adorei esse jogo a maioria desintala mais eu instalo não desinstalo pq melhor jogo do mundo !!!!!!!❤💛🖤❤💛🖤❤💛🖤❤💛🖤❤💛🖤😊😊,5,4,7.103.005,2020-11-02 12:23:36
58,Claudinei Correa Camargo,https://play-lh.googleusercontent.com/-RPgpx1czOHI/AAAAAAAAAAI/AAAAAAAAAAA/AMZuuclFMcxuPHGIhnioJFAOIXChDy0j9g/photo.jpg,"O jogo e muito incrível 5 estrelas para o jogo 5 estrlas para controles 5 estrelas para os gráficos 5estrelas para jogabilidade Muito bom, pode estalar o jogo ,uma dica sempre lea os comentários sobre o jogo ,assim você pode saber se,o jogo e muito bom, legal ou ruim, Mas mese casa o jogo é super útil meia legal eu ,adoro, o jogo",5,15,7.084.005,2020-10-24 13:53:25
59,Guilherme Breezy,https://play-lh.googleusercontent.com/a-/AOh14GjgcTmtlrXSLGBnrTwobs0XuoXXZM7-Tom8zyMDHZw,"Meu filho de 2 anos comprou o vip sem querer e agora toda semana está descontando 13,99 do meu cartão de crédito, eu não consigo cancelar, isso é um absurdo, vou processar vocês.",1,2,7.103.005,2020-11-05 17:49:46
60,jairan oliveira,https://play-lh.googleusercontent.com/a-/AOh14GjIpER62gp5r20w1qs6JcHWpjyaXdzQwoF_yCWbHQ,"aaaaa está travando ☹️ não sei se é o Jogo ouuu é o meu celular más o meu celular roda muitos jogos sem travar más mesmo assim... eu amo esse jogo, ninguém bate o meu recorde de 22900 na música ""no no no""",5,0,7.103.005,2020-11-06 23:50:53
61,Debora Francieli Da Rosa,https://play-lh.googleusercontent.com/-eG0QCcdUP_Q/AAAAAAAAAAI/AAAAAAAAAAA/AMZuuckXNG7ZlophAzPhEJTqSGCRnKI74g/photo.jpg,"Eu amei, tem anúncios sim, mas é perfeito, e qm fica falando que problema é seu se não fosse de anuncios, gente tem gente que gosta e tem gente que não gostar nem todo mundo é igual, então meus amores não achem q só pq vc gosta dos anúncios não quer dizer q todos gostam ok beijos fiquem com Deus amei o jogo parabéns",5,11,7.084.005,2020-10-24 12:56:29
62,Antonio Marcio Rocha Junior,https://play-lh.googleusercontent.com/-1KHz-PRPJns/AAAAAAAAAAI/AAAAAAAAAAA/AMZuuckEn1CLmgFrzDQFcQBNokhv_N-PxA/photo.jpg,Não gostei muito porque tem muitos muitos anúncios vem 1 ou 2 a cada partida q termina mas se tiraram os anúncios o jogo 🎮 ficará muito bom 👍 👍 daria 10 se tirarem os anúncios e 0 se não tirar os anúncios,3,16,7.101.301,2020-10-23 11:32:45
63,Karla Ortiz,https://play-lh.googleusercontent.com/a-/AOh14GjOttR89uHrwaXeat533s0T_6VI7ZL3nPPoxppD-WM,FURADA TOTAL. Fiz o plano vip por 3 dias .... Além do aplicativo ser péssimo e ser vip e não ser vip não muda nada ainda descontaram no ato 14 reais do meu cartão de crédito sendo que só seria daqui 3 dias.,1,2,7.101.301,2020-10-31 13:54:56
64,clara silva,https://play-lh.googleusercontent.com/-1PDyuQpZRCc/AAAAAAAAAAI/AAAAAAAAAAA/AMZuuckcs27FSkZowwU_a4O086YReiQ_7A/photo.jpg,"Super amei!!!!Mas vocês já incluíram as músicas do Now United??? Se não por favor incluam, pois elas são super legais, atuais, divertidas, e mais adjetivos bons. Coloquem elas no app por favor, vocês irão ver como o app vai ficar ainda melhor e mais completo!!! Por favor. Super recomendo o Magic Tiles, diverte muito!!! Obrigada.",5,427,7.084.005,2020-10-12 17:50:26
65,Micaelle Chaves,https://play-lh.googleusercontent.com/a-/AOh14GhaEWwI1qDNVMXYv1NTooNe4bnBzlEnHRiJ8ezwUBc,"O jogo é muito bom, mas a quantidade de anúncios desestimula! Além de uns bugs, como você clicar na tecla mas o jogo dizer que você perdeu, sendo que você clicou correto. Melhorem isso, por favor! Não adianta de nada encher de anúncios porque isso não faz a pessoa querer comprar o premium (poucos compram), na verdade faz a gente desistir do jogo!",2,3166,7.084.005,2020-10-05 22:53:52
66,Rogeria Costa,https://play-lh.googleusercontent.com/-Cn9-3qctlf8/AAAAAAAAAAI/AAAAAAAAAAA/AMZuucmhg5IvBcbEDhIBsxKSmwZkwMvH1A/photo.jpg,"Diferente de muitas pessoas eu amo esse jogo e acho muito legal !,blz tem gente q não gosta dos anúncios! Meu anjo se vc não gosta de anúncios vc quase não vai ter jogo no seu celular. Minha querida se vc não gosta de anúncios problema é seu os anúncios são fontes de renda de dinheiro muitas lojas conseguem clientes assim Bjsss eu amei esse jogo! Aceito críticas!",5,227,7.084.005,2020-10-22 10:16:56
67,Yohâne Oliveira,https://play-lh.googleusercontent.com/-dcQcArIKSzA/AAAAAAAAAAI/AAAAAAAAAAA/AMZuuclRWf0pKxWdWdNSXzzNewRRxXBfFg/photo.jpg,"Quando entra no jogo ele fica travando e isso é muito ruim ele ñ só trava no jogo mas o cll todo ele deixa tudo bugado mesmo quando tentamos sai do jogo, ñ baixem é um lixo. Quase estragou meu cll novo .",1,9,7.101.301,2020-10-29 13:38:17
68,Nielson H,https://play-lh.googleusercontent.com/a-/AOh14GgW7OElR1oR06hYHLQowx_prn3QpTS9kOi-FUDweQ,"Muito top, as fases mais rápidas usam muito da coordenação motora, show de bola",5,0,7.103.005,2020-11-08 15:38:24
69,Joana Lara,https://play-lh.googleusercontent.com/a-/AOh14Gh_cQ3yysdbS0VhYQQo89jfQqo6FZff-mgDNtNI,"O jogo é legal mais tem muitos anúncios e esses anúncios a pessoa tem que ver ATÉ O FINAL!!! Fora isso, o jogo é muito legal e agradeço aos criadores! 😁😄😃",4,12,7.101.301,2020-10-25 09:07:07
70,Caroline Feitosa,https://play-lh.googleusercontent.com/-nAAFH1TkjcQ/AAAAAAAAAAI/AAAAAAAAAAA/AMZuucljcUxpSc3Pu8oEVXxghQjd0iGoag/photo.jpg,"O jogo é muito legal! Mas tem um problema, o jogo não fecha, não importa o que vc faça, somente quando vc desinstala ou desliga o celular, e demora um pouco para carregar as músicas, mas o resto é ótimo! Tem várias músicas, e só paga o jogo quem quer🤑",5,265,7.084.005,2020-10-16 23:14:41
71,·Dдяk Wølf·,https://play-lh.googleusercontent.com/a-/AOh14GhRgKOL0l0AdqmNbm4sLL2-UGqwSvZwOY8l50henQ,"Achei muito bom.Qualidade boa,o jogo é intereçante e varias opçoes.Mais acho que o jogo teria mais publico se tivesse menos anúncios,pq é um pouco chato a cada partida que vc joga ja vem anuncio, acho que deveria tipo, um anuncio depois de 5 partidas ou um anuncio depois de 7 partidas,Nao sei,só acho que teria mais publico se fizessem essa melhora.",4,93,7.084.005,2020-10-12 02:06:43
72,Mari mineblox,https://play-lh.googleusercontent.com/-dTCFm81AX7s/AAAAAAAAAAI/AAAAAAAAAAA/AMZuucmHml_zxnyM8uxklX-rUoYUxQOvMQ/photo.jpg,O jogo em geral é muito bom mais essa quantidade de anúncios isso não vai fazer a gente pagar pelo Premium e sim desinstalar o jogo,4,1,7.101.301,2020-10-29 16:17:52
73,Alêx Muza Soares Rodrigues Da Silva,https://play-lh.googleusercontent.com/-fBbytaxvv6w/AAAAAAAAAAI/AAAAAAAAAAA/AMZuucnM1UMoHItQS9xvRXrjs5wR8qEuVQ/photo.jpg,"O jogo é bom sem dúvidas, mais pode melhorar muito ainda,como colocar só músicas originais,e também queria dizer que a música WE DON'T TALK ANYMORE poderia ser mais difícil como era antes",3,2,7.101.301,2020-11-01 21:31:26
74,Brena Lauane,https://play-lh.googleusercontent.com/-WIqyw0i4KK4/AAAAAAAAAAI/AAAAAAAAAAA/AMZuucl0sZBVqh50LyEiW_BhUnPoxUEMeA/photo.jpg,"O jogo é bom só que antes era melhor, agora as musicas estão super diferentes. Da outra vez que eu jogava as músicas eram até divertidas e legais só que eu tive que desinstalar o jogo aí quando eu instalei novamente era as mesmas músicas porém com as vozes e o ritmo diferente 🤦 se vcs puderem colocar as músicas como eram antes eu agradeço muiitooo.",3,121,7.084.005,2020-10-19 14:28:28
75,monkey d. luffy,https://play-lh.googleusercontent.com/a-/AOh14GjUAO7rfIhSIZTJkXSVAYHwqyPQLeyVYW-XRntHVg,"Esse jogo está péssimo,pois ele trava não só no meu celular como outros que são melhores que o meu, descarrega um celular muito rápido não deu 5 minutos que estou aqui do 51 foi pro 47 e meu celular supera muitos jogos,os mais pesados não descarregam como esse,além de ter muito anúncio desnecessário do tik tok.espero que me respondam de acordo com o que eu disse,obrigado.",1,142,7.084.005,2020-10-17 22:30:03
76,Curious Insane,https://play-lh.googleusercontent.com/a-/AOh14GgesAQW6U1u8S04CaS3HWTRCvlz1cWRFUd3GBc6OA,"O jogo é muito bom, eu amei. Mas tem como vcs deixarem menos anúncios? Cada vez quando a gente tem q jogar uma música a gente precisa ver um anúncio de 15 segundos, quando nós morremos também precisamos ver um anúncio de 15 segundos. Eu sei q vcs ganham dinheiro com anúncios mas já tá muito chato isso. Pelo menos menos anúncios vou dar 5 estrelas ao jogo.",3,2550,7.082.006,2020-09-26 12:32:29
77,Felipe Rafael Nunes Cavalheiro,https://play-lh.googleusercontent.com/a-/AOh14GirjRAZR772yeo-1A2sT7mi8FYC70KG-aNz9kyG,"Não gostei do jogo porque toda vez que chega no playing with fire eu sempre faço certo aí o jogo buga e clica num lugar que eu não cliquei, e acontece mais na parte de deslizar",3,2,7.101.301,2020-11-01 09:41:34
78,Leduardo Luiz,https://play-lh.googleusercontent.com/-HTyXJvIFqLM/AAAAAAAAAAI/AAAAAAAAAAA/AMZuuclNpf32IJ0M4hWe3yW_Es7w3j5rOg/photo.jpg,Esse aplicativo é orivel toda hora um anúncio super bobo e também ele travou eu encostei na tecla certa é ele marcou que eu tinha colocado meu dedo no lugar errado .🙄,1,2,7.101.301,2020-11-03 14:26:53
79,Nicole Zanin,https://play-lh.googleusercontent.com/a-/AOh14Gi22q_copBePBIvgCCXFSIJBbrgiJcjRLz49PZm,"O aplicativo é muito bom, mas aparece muito anúncio e eu ñ consigo jogar direito. Por exemplo, eu errei uma tecla, pra eu jogar de novo a mesma música é um anúncio. Gostaria muito que melhorasse isso, por que é muito chato, e se eu tiver interesse no aplicativo que mostra no anúncio eu abaixo. Ñ precisa de vários anúncios mostrando vários apps pra eu abaixar. Isso é muito chato. Mas de resto é muito bom",3,3339,7.077.102,2020-09-08 10:18:19
80,Weslley Luiz,https://play-lh.googleusercontent.com/a-/AOh14GhyM4emWPGdgYXxh90ORd3mocCU0KOjYH8PuLzfYQ,"Vocês abusam do fato do jogo ser popular, e enfiam inúmeras propagandas estragando toda a experiência do jogador. Sinceramente, é uma vergonha fazerem isso após todo esse tempo, apenas por causa da base gigante de fãs. Vocês estão estragando o game e deveriam reavaliar essa decisão em relação a publicidade. Espero que analisem nosso feedback de verdade!",1,3859,7.077.102,2020-08-28 23:21:24
81,Cleyy Sales,https://play-lh.googleusercontent.com/a-/AOh14Gh5fko2jrpUYnCPN7gugrNey5BYch-OXYQ-voCYzA,"O jogo por si é bom, eu tinha dado 5 estrela mas voltei atrás..... Dei duas, por conter anúncios muito longo, isso pode ser revolvido...quem sabe quando melhorar eu volto dar 5 estrela....",2,5,7.101.301,2020-10-23 18:17:15
82,Chocolatinho Aventureiro,https://play-lh.googleusercontent.com/a-/AOh14GhOGfDJM3q1m05DAwRkAKJWVSZGY6fuxbJvXZMRtw,"Eu AMAVA o jogo..porém dps da atualização ficou horrível, a barrinha do ""perfect"" as vzs fica muito em cima ou muito embaixo e NÃO gostei disso....tirando isso o jogo é ótimo.",3,4,7.101.301,2020-10-29 22:04:17
83,polar 2595,https://play-lh.googleusercontent.com/a-/AOh14Gg-WPg0Ks8Bm9-ORuGeiukUUMTM7ifpFR_loug8qQ,"Parece até que o jogo não consegue se manter vivo sem colocar anúncios a cada coisa que você faz. Sempre que termina uma música, é um anúncio na minha cara, mesmo que eu tenha negado reviver. Eles tem poucas músicas que eles realmente compraram o direito para colocarem a original, e você precisa assistir mais vídeos pra conseguir jogar essa música. Além do que é um jogo bem pay to win, onde quem tem vip pode reviver sem problemas. Bem ruinzão",1,1127,7.084.005,2020-10-07 13:04:59
84,A família bro,https://play-lh.googleusercontent.com/a-/AOh14GiPEH1d-IDwAnwpjW_o87sX48BEFeqObxBvyc5Y,"Esse jogo é muito bom, Na minha opinião os criadores desse jogo devia tirar um bug que tem que trava demais ,Aí sim esse jogo ia ser maravilhoso.",1,14,7.101.301,2020-10-23 12:41:13
85,Lara franca,https://play-lh.googleusercontent.com/a-/AOh14Gi8KMevEsgQuOVtonKpwtisY_08y6yGaPVsjyRO,"O jogo em si em muito bom mais antes eu jogava e achava melhor q agrl, para começar tem muitos anúncios séria bom diminuir, 20 segundos é muito tempo de espera no mínimo 10 ou 15 segundos de anúncio, as vezes eu clico em uma tecla e simplesmente o jogo n conta a q eu cliquei séria bom melhorar isso, poderia colocar mais músicas e também de diferentes tipos ex:eletrônicas,funk,Internacional,sertanejo,rock,pop,etc Por último para entrar na música demora d mais, vcs podem melhorar td isso q eu sei.",2,1093,7.084.005,2020-09-28 14:13:03
86,SUELY E FÁBIO gomes,https://play-lh.googleusercontent.com/a-/AOh14GhhcXSmVi2uqsJGLUYaC37PXO4VD9fJe1B9IxUo,Tu Pode me ligar depois que eu tô na aula de Clara ok vou fazer isso aqui é Isabela e o meu código de processo Civil da presidência da República de Clara Nunes e maira a Bom termo que eu tô na casa da presidência do dia a dia eu consigo fazer flor como fazer flor com garrafas e o meu código de xixi não é ingremed e o meu código de xixi não me mudar para enrrigae com garrafas e o meu código Barth a aula terminar me liga pra gente jogar pk xd ok Pq n consigo te adicionar o meu código de xixi na ro,5,3,7.101.301,2020-10-29 16:50:06
87,Rafael Da Cruz Machado,https://play-lh.googleusercontent.com/-u2pQZrckFsU/AAAAAAAAAAI/AAAAAAAAAAA/AMZuucnS_JcNP8Oa_-ZrY4BBK-WJkaueSA/photo.jpg,"Um bombástico jogo divertido, estou louco por esse jogo, deixei de jogar ff para jogar este bombástico jogo q te faz sorrir e te faz ter muitas emoções fortes... Agrdeço a vcs por este jogo q eu amei demais obg demais msm😉🙀",5,2,7.101.301,2020-10-30 07:49:49
88,Guilherme Silva 9H N11,https://play-lh.googleusercontent.com/-yqdL5d3yuYc/AAAAAAAAAAI/AAAAAAAAAAA/AMZuucl1B73ZUH4pGmCS5-8blcDAfLJQaA/photo.jpg,"E ótimo esse jogo, sim ele tem bastante anúncio mais e só vc desligar o seu wi-fi e dados móveis e pronto cabo os anúncios, e um jogo bom pra vc jogar com amigos e competir pra ver quem fais mais pontos, por minha parte esse jogo e ótimo, tem vezes que o clique não funciona mais pra mim isso acontece raramente",5,28,7.084.005,2020-10-12 21:27:14
89,Ramonzinho Gamer plays,https://play-lh.googleusercontent.com/a-/AOh14GjD58sqwG8ig0f8hLXHxza8Z2wB8uyzeupbHNWf9g,"O jogo em si é muito bom, mas é um anúncio atrás do outro, você não pode terminar uma música que já aparece anúncio. E é sempre os mesmos, isso se torna chato e faz até perder o interesse no jogo! E eu não vou pagar só pra jogar no Premium. Não gostaria de parar de jogar o jogo por conta disso, então maneirem nós anúncios por favor.",1,3279,7.078.008,2020-09-19 00:47:53
90,ingridi marciano ???,https://play-lh.googleusercontent.com/a-/AOh14GiGPjFMCrMUn9pO_nAO0oGpq9IzuFkCPdonytFfjQ,O jogo e muito bom mas eu deixei três estrelas pq eu não gosto de comercial no jogo só se quiser ver o comercial para voltar a jogar mas quando a a gente perde o comercial passa sem a gente pedir e ainda tem nem jeito da gente tirar o comercial daí Aí se vocês não derem um jeito eu vou desinstalar esse jogo eu e minha família porque todo mundo aqui em casa joga esse jogo ah lembrando essa minha opinião ninguém aqui vai mudar isso eu acho muito desnecessário E se alguém me criticar tô nem aí,3,2,7.084.005,2020-10-24 08:58:26
91,Desiree Dutra,https://play-lh.googleusercontent.com/a-/AOh14GjJWZPxVLDz3rSk6c56mt1I64uYUeuTiOB8Y3cW,"Excelente, estes comentários são torpes e negativos, jogo é ótimo e o controle também, além do mais tudo hoje em dia tem anúncios,é só desligar a internet, e dizer que o jogo atrasa,isto deve ser porque eles não sabem jogar,clicam atrasado ,e colocam a culpa no jogo!!",5,26,7.084.005,2020-10-12 18:20:48
92,frio e calculista,https://play-lh.googleusercontent.com/a-/AOh14GitJwKdP14cCOyacMKmknHSKLFgEqlYyCsS4K7c,"pra ser sincero eu adoro o jogo então não levem isso como crítica mais sim uma crítica construtiva, sabe o jogo em si tem uma ideia muito divertida e eu amo esse jogo mais tem uma coisinha que me incomoda é que as vezes que eu aperto no teclado o jogo não considera. mais algumas pessoas podem se perguntar ue mais é só isso na verdade eu não sei se é só no meu celular mais isso atrapalha muito se puderem ajudar eu agradeço.",4,13,7.084.005,2020-10-13 23:36:18
93,Rafael Colli,https://play-lh.googleusercontent.com/a-/AOh14Gj4R0W2xNXBg1PNXxbEGcWc9WrT_QtXVTDEMvkV7w,"Sinceramente ridículo,se você termina uma fase tem que ver anúncio se você perde a fase tem que ver anúncio também isso é ridículo,além do fato de você clicar na tela e o jogo não considerar,outra coisa extraordinária é as dublagens das músicas quando eles não pegam o direito é constrangedor,nem para pegar alguém com a voz parecida,sem considerar os ótimos privilégios para quem paga o vip com 5000 músicas ah mais incrível capitalismo tá como👌",1,306,7.084.005,2020-10-15 14:42:05
94,Anynha Silva,https://play-lh.googleusercontent.com/a-/AOh14GjIqfAvgRmWZsXK86imxhWQGdLcJ95Z19cA6wno,"O aplicativo está completamente lotado de anúncios, fica muito complicado alguém conseguir tocar algo. Então eu não recomendo que vcs baixem, pq a experiência não é tão boa. Se tivesse menos anúncios, o aplicativo teria mais estrelas e seria muito mais reconhecido. Espero que arrumem esse problema.",1,142,7.084.005,2020-10-17 10:36:57
95,juliana Parassoli,https://play-lh.googleusercontent.com/-Ne96dOrxU8c/AAAAAAAAAAI/AAAAAAAAAAA/AMZuuclMih73Yvz_e5WMYm2-D6i1UTccnQ/photo.jpg,"Pra min é uma distração relaxante por causa das música do ritmo e da melodias...bom é um jogo ""relaxante""😁",5,1,7.101.301,2020-10-27 23:14:25
96,Matilde Helena,https://play-lh.googleusercontent.com/-ubjBs5pES0s/AAAAAAAAAAI/AAAAAAAAAAA/AMZuucmCy0j7DcQ70Qm6ykbsd1v4kmkuUg/photo.jpg,"Adorei,esse jogo é bom mas as vezes quando apertamos em certa tecla não vai,mas tirando isso tá ótimo (E não tem muitos anúncios)",4,0,7.103.005,2020-11-07 21:47:29
97,bibi Leal,https://play-lh.googleusercontent.com/a-/AOh14GhXZ249jT6zFl5ux3Fu2fByjo-x9lDiQWhcElAf,"Achei um máximo, mas tudo tem seus defeitos acho que não era necessário ter três tipos de velocidade",4,2,7.103.005,2020-10-31 02:53:50
98,Noemi jose,https://play-lh.googleusercontent.com/-r3ZTPiUXtEw/AAAAAAAAAAI/AAAAAAAAAAA/AMZuucnkYqu4CHA5Puu4VkJkMWOfhHX9uQ/photo.jpg,"Gostava mais da 1° versão, com apenas as melodias das músicas, agora com a música já nem se pode escutar o melodia. Gostaria que disponibilizassem a 1° versão",4,0,7.101.301,2020-10-29 13:55:11
99,Regina Phalange,https://play-lh.googleusercontent.com/a-/AOh14Gg9qhYcnzIxeRLRZ0gURpz-vWEHfTnZFBawUUYnPg,"Eu sempre gostei de magic tiles, e jogava desde o 1, q era super legal e tals... soq dai vem o 2, q pulou no hype de n gastar quase nada e vender nossa atenção pra outros jogos. Eh um saco, e eh obvio q eles tao fznd td por lucro. N tem nada de errado (mais ou menos) em tentar fzr td por lucro, tipo, td mundo quer bastante dinheiro ne? Mas isso eh um exagero.",3,840,7.084.005,2020-10-03 11:29:06
