,userName,userImage,content,score,thumbsUpCount,reviewCreatedVersion,at
0,Bruna Alves,https://play-lh.googleusercontent.com/-xoCyKCMYTr0/AAAAAAAAAAI/AAAAAAAAAAA/AMZuuclLI_KnzKfRIbF3ml8o57fT7mR-1Q/photo.jpg,"Toda vez, é toda vez que eu instalo não entra espero que melhore esse jogo porque meu deus vocês não sabem o quanto eu quero jogar esse jogo vocês não sabem não sabem : (",1,12,42.0.4,2020-10-05 10:21:45
1,malu gemes,https://play-lh.googleusercontent.com/a-/AOh14GjGYIQqdwZx1JA93CgWnaKUxTsRR8qUKCv7I7CMSg,"Oi,entao eu vim pra fala desse jogo.EU sou gemer gosto de jogos diferentes so que este me decepiscionou muito , de primeiro eu istalei achando que era legal de boa,so que eu entrei fis meu avatar ,e eu absolutamente nao intendi nd pq nao tem opçaos para portugue entao eu nao intendi nd . Mais ate ai de boas.E eu acho que eles tenque melhorar um pouco ne ,mesmo eles nao sendo daqui eles podem muito bem botas opçao pra portugues ne entao espero quee vc melhorem muito ta ,essa e minha op..",1,121,39.1.0,2020-06-02 11:18:51
2,viajando nos games com Tainá,https://play-lh.googleusercontent.com/-whI5nQGDlls/AAAAAAAAAAI/AAAAAAAAAAA/AMZuucmHtz8kbf6dHabOxe6CwNWBsfs_cg/photo.jpg,Esse jogo esse jogo é ruim péssimo horroroso quando a gente tenta entrar não aparece nada só fica aparecendo nem tem Brasil tá para poder entrar você tem que ler espanhola Se você souber né o espanhol e ainda quando a gente vai entrar e para botar lá a senha tem que fazer uma senha difícil muito difícil que você nem sabe depois como entrar de novo porque assim é difícil você esquece esse jogo é horroroso nunca vi um jogo tão ruim como esse caramba vê se melhora aí tá o administrador alguma coisa,1,96,39.1.0,2020-05-31 14:50:48
3,Pancake Dog,https://play-lh.googleusercontent.com/a-/AOh14GhCoUv_qEdytJAiQXa2DWn0eb5VMVK7sLKo477WtQ,"Eu não consigo mais jogar! Quando tento logar em minha conta, simplesmente fala que a senha está incorreta. Quando tento mudar minha senha fala que eu não confirmei meu e-mail, e quando tento confirmar meu e-mail ele me traz para a Google apps! Gostava do jogo, mas não consigo mais jogar. Péssimo!",1,28,26.0.0,2019-03-04 14:00:15
4,๑ Djabin ๑,https://play-lh.googleusercontent.com/a-/AOh14GgjGiUaSbAgsIKDyfipQtBVbauC7U5iF8DE5F9hJQ,"Muito bom! Pena que não tem server br nem nada mas eu adorei, jogo desde 2015 pelo meu notebook antigo e pelo site :)",5,1,41.0.2,2020-09-14 13:48:09
5,Rocilda Joventino,https://play-lh.googleusercontent.com/-TpCORbiWyT4/AAAAAAAAAAI/AAAAAAAAAAA/AMZuucn4EgGf3WRJGxiQl6vHFXVkVXNd5g/photo.jpg,Vc tinha rasão esse jogo é pessimo não dá para abrir quando vc instala esse jogo é muito ruim vcs não baixen esse jogo essa é minha opinião tchau para todos,1,0,40.0.3,2020-08-14 20:50:41
6,Choie Lin,https://play-lh.googleusercontent.com/a-/AOh14GiH3Sh4A-1NznPh4WbQvD6a50TxI8bT4nNGQdu5yA,"Acho que eu poderia gostar do jogo se tivesse a opção para deixá-lo em português, seria ótimo se tivesse um servidor pra Brasileiros e Portugueses, assim poderíamos ter mais facilidade de encontrar pessoas legais, porque sem amigos em um jogo online você enjoa facilmente.",2,22,,2019-09-03 18:26:59
7,I lost my name,https://play-lh.googleusercontent.com/a-/AOh14GiyZuvpToHLJvUikbUscU_LsfyAiawzQz6LWsOT,"O jogo é ótimo, tem roupas maravilhosas e cabelos também, não irão se arrepender se instalarem o jogo, as críticas negativas são por causa do celular, não do jogo, não estou tendo problemas nenhuns ao entrar no jogo ou outra coisa",5,9,,2020-05-03 14:45:42
8,Daniel Souza,https://play-lh.googleusercontent.com/-h-eV4Ope2zY/AAAAAAAAAAI/AAAAAAAAAAA/AMZuucnHDmFO_HYaHD_VxQdkDhu03_EhLQ/photo.jpg,Gente não abaixe esse jogo por que ele é orrivel ele pode parecer bom mais e orrivel a pessoa abaixar e quando vai abrir fica parado não entra de jeito nenhum bom essa é minha opinião se quiser baixar abaixe aí vcs irão falar e mermo bem que ela falou aí vcs vai e desistala bom essa é minha opinião tchau e nu pra vcs todos,1,140,38.0.2,2020-04-18 12:53:16
9,erinalva silva 78,https://play-lh.googleusercontent.com/a-/AOh14Ggm42yYOTcCi_RI-dJdKekHRpOhRZt6Z_9YZFmsdg,Gente esse Jogo e incrível gente não caiam nessa outras pessoas falando que (AI NAO TEM BRASIL)mais é claro que não vai te Brasil se o jogo é francês né prestam atenção no que falam esse jogo e incrível da pra você ter animaçoes a e os que fala isso(AI NAO TEM BRASIL 🙄)Vai planta batatas pq vocês estão perdendo o melhor jogo (Moviestarplanet amo os jogos de vocês parabéns voces são incríveis 🤗,5,0,,2020-08-21 12:09:43
10,Isa Linda,https://play-lh.googleusercontent.com/-ab8o7IjZqVc/AAAAAAAAAAI/AAAAAAAAAAA/AMZuucmQaomwZYMSXH6ysn_XV5VMj0Z0eA/photo.jpg,"O jogo parecia ser bom,mas quando criei a minha conta simplesmente não vai...fiz tudo direitinho.Se vc não tiver paciência então não jogue esse jogo(foi uma dica ok)",1,2,,2020-06-06 10:52:37
11,Debora Aline,https://play-lh.googleusercontent.com/-mhexjuGuUak/AAAAAAAAAAI/AAAAAAAAAAA/AMZuucmB5m-CL96GNfd4lJjQ58DH_avNIA/photo.jpg,"Quando eu tento entrar o jogo não da , na parte de meter o ano e o mês ele cola e vem tem algum problema e não funciona mais.😟😟😟😟",1,61,39.0.1,2020-05-23 17:24:54
12,Lusia Rodrigues,https://play-lh.googleusercontent.com/-kGIaLKSI5g0/AAAAAAAAAAI/AAAAAAAAAAA/AMZuuck-JYZ1wjsh20AYri_1PGxTSGDTtw/photo.jpg,"Para vocês senhores q dizem q o jogo não entra🙄: Bom. . . Na primeira linha vocês colocam o nome de usuário para o jogo, e na segunda VOCÊS COLOCAM A SENHA DO E-MAIL!!!! MEU DEUS!! POVO BURRO!! o jogo é ótimo.",5,3,,2020-06-06 10:15:17
13,Alessia Chiara Zaccaro,https://play-lh.googleusercontent.com/a-/AOh14GgLNnVRu873ly4O6vgoQmznhHiOK9bKOu0a0_q0,Ñ gostei quando vc abre vem i boneco pra vc personalizar e depois vc ñ sabe mais o que fazer vc se perde totalmente ñ gostei nenhum pouco na fotos tà uma coisa é quando instala é totalmente diferente pra maneirar dei mais 1 Estrela pra ficar 2 mais se vc por mim teria zero ou 1 Estrela que ódio,2,8,,2020-01-12 07:51:56
14,batatinha fofa,https://play-lh.googleusercontent.com/a-/AOh14Ggc7fQ3TeJMD0UNBXyHEDNYQw02gz16ltwx6dn91w,Eu gosto desse jogo mas eu tentei colocar a senha e não deu só isso que dá para valer Só que não dá é difícil colocar uma senha é muito mais só que tipo que tá minha meu jogo estava demorando para sair e agora todos que na mente o,2,9,,2019-09-15 22:47:05
15,Kim Taehyung,https://play-lh.googleusercontent.com/a-/AOh14GjNHEkQP7bYTfp1oYgxdOgcdE0cRYqow5TIEQweTg,"Sério isso? O jogo é muito ruim! Demora um ano pra entrar( na vdd nem entrou no meu, só fica na tela e não carrega), isso é falta de mais dedicação... E EU SEI Q É DIFÍCIL FAZER UM JOGO, MAIS Q JOGO É ESSE... AFFSS #SEMPALAVRAS",1,8,,2020-02-13 19:20:22
16,Lara BK,https://play-lh.googleusercontent.com/a-/AOh14GiLoHgTqHPL3gctLqvpv7g2xumZ4Zo9lo8RPAR8dg,"Odiei, esse jogo é horrível num instalem eu num consigo jogar diz que o jogo parou, nunca instalem isso odieiii bem no meu aniversário né? Fala sério olha isso gente olha que feiosos uhg....",1,2,,2020-05-20 11:51:39
17,PQP KPOP,https://play-lh.googleusercontent.com/a-/AOh14GhJ63fyIFMEEgM-jQFARwTppGAI-svprXT7wS1ZbQ,"Ótimo! Eu jogava no pc, e para minha sorte agora tem para celular! Esse jogo é muito bom para passar o tempo O jogo é todo em inglês mas pelo menos eu sei bastante de inglês Recomendo e muitooo",5,99,37.0.2,2020-03-08 09:01:31
18,canal da jujubinha,https://play-lh.googleusercontent.com/a-/AOh14GgElaS98mBuomiIAcdDxC-WqWbA98AjydTcagfq2Q,Eu não gostei porque eu não tava conseguindo fazer o login e também os acessórios não era bonitos e eu na mesma hora que eu instalei joguei e desinstalei por favor melhores esse jogo.,2,10,,2020-02-04 12:45:01
19,crescendo com giovanna alves,https://play-lh.googleusercontent.com/a-/AOh14GibZo9OyGOZ88fIaN-6zK8kzJ66eUySuPZjP9Ljhw,"Eu odiei porque além dos assessórios serem horríveis, ele não tem como mudar o idioma tem pessoas que não sabem inglês igual a mim e precisa de alguma coisa que eu não entendi por que . por que estava inglês eles tinham que colocar mais idiomas ...",1,166,36.0.5,2020-01-19 07:56:32
20,Um usuário do Google,https://play-lh.googleusercontent.com/EGemoI2NTXmTsBVtJqk8jxF9rh8ApRWfsIMQSt2uE4OcpQqbFu7f7NbTK05lx80nuSijCz7sc3a277R67g,Para todos que dogam que é mau o vosso problema é que não pressevem mas a culpa não é do ele é só um jogo francês e eu gosto muito eu percevo porque estou a viver na frança e jogo o jogo com as minhas melhores amigas😘😘,5,29,27.0.2,2018-10-22 14:43:22
21,Júlio Lima Miranda,https://play-lh.googleusercontent.com/-ks6ngW4dOcI/AAAAAAAAAAI/AAAAAAAAAAA/AMZuucl03y0G5CUJ_Z_byFkQjFRd6G50Bg/photo.jpg,Olha ele trava muito mais pra quem tem a internet de deus eu recomendo mais se a sua internet foi ruim pode ate instalar mais vai travar muito,2,6,,2019-09-02 00:34:09
22,Valzinho :3,https://play-lh.googleusercontent.com/-7Pt497yANNs/AAAAAAAAAAI/AAAAAAAAAAA/AMZuucnTWQCAE0K_JmL37uGyPRzCm_kWig/photo.jpg,"Eu jogava,amo esse jogo,porém não estou conseguindo fazer login na minha conta,não sei o que houve eu coloco a senha e o nome tudo certinho e não entra ... Desanimador",1,1,,2020-04-09 03:41:30
23,Angelina Da Cunha Barroso,https://play-lh.googleusercontent.com/-VtGtiptRbMQ/AAAAAAAAAAI/AAAAAAAAAAA/AMZuucl_0HNErSR-4MH426kYA8bXHFENNw/photo.jpg,É muito legal e vc encontra várias pessoas e vc pode ter um pet e pode jogar joginhos mas tem que ter Internete!,5,81,28.1.2,2018-12-26 14:02:25
24,diseasedtoe,https://play-lh.googleusercontent.com/a-/AOh14Gjx5ESDnUzNFIJjw3bg31MFGv0KA-OFMeRImZkW-g,"1- vip é caro.2- ninguém é BR.3-as roupas de início são feias.4- é super enjoante, não vale gastar 300 tão",1,10,26.0.4,2020-04-17 14:24:47
25,Carolina da Silva Demetrio,https://play-lh.googleusercontent.com/a-/AOh14GiNxv6ZH5b8KwkIWjqG_ulqwPkOBsi06IE976yMYw,O jogo deve ser bom....Só q quando vou por o passaport eu fico tentando tentando e Ñ VAI! Concertem isso pq eu nem consigo entrar no jogo 😓😥😢,2,45,38.0.2,2020-04-28 15:05:39
26,Um usuário do Google,https://play-lh.googleusercontent.com/EGemoI2NTXmTsBVtJqk8jxF9rh8ApRWfsIMQSt2uE4OcpQqbFu7f7NbTK05lx80nuSijCz7sc3a277R67g,"Não consigo acessar o jogo,o login é muito complicado de dar e tá inteiramente em inglês!!! Pena pq parecia ser legal😥😔☹️",1,51,29.0.0,2018-12-06 08:06:26
27,Ana Pink,https://play-lh.googleusercontent.com/a-/AOh14Gjj9e6Z2AaBJaU4JqsC67vPUFkn-zPkcd4tPx-_,"Pior jogo do universo e de todos os tempos, por esse lixo ñ presta?, eu não consigo entrar é um coco de lixo e de porco ele não presta, grrrrrrr, convertem logo isso😡😡😡😡😡😡😡😡😡😡😡😠😠😠😠😠😠😠😠😠😠😠😠, melhor pk xd e avakin life e roblox e sims 4 e imvu, e nota 0 pra esse lixo de jogo😡😠",1,123,36.0.5,2020-01-24 18:09:36
28,gêmeas gacha,https://play-lh.googleusercontent.com/a-/AOh14Gip-I-NB8wkP87B79gyOrvLzmUU-tb8MaRPAlLD,Esse jogo é horrível ele não sai da capa de entrada se pudesse dar -300 eu dava,1,78,37.0.0,2020-02-07 17:08:45
29,Isabella Marinho,https://play-lh.googleusercontent.com/-tPdnrz-9Rk0/AAAAAAAAAAI/AAAAAAAAAAA/AMZuucmxoh5XY7sFP-5FeOfmL29XO6XgtQ/photo.jpg,Não sai da capa esperei tanto tempo pra instalar e depois só aparecia a capa 😒,1,2,,2020-04-19 18:23:36
30,Isabella Rodrigues,https://play-lh.googleusercontent.com/a-/AOh14GiVcLF2pG8Rs3v1KDSzCTAiNoPxDfLpYUDKKfjcpbY,Poxa o jogo buga mt e n é como eu esperava de uma ideia de jogo tão boa. Desinstalando 😿,2,0,,2020-04-23 17:07:49
31,yasmim miusic online,https://play-lh.googleusercontent.com/-hvU3ib_xmZs/AAAAAAAAAAI/AAAAAAAAAAA/AMZuuclykeijFiZbeT1r_Fobqmxy7nkKiQ/photo.jpg,Mano demora muito pra instalar aff melhora ai e com wifi que pelo amor de deus agora so tem jogo online aff:/,1,3,,2019-08-28 20:17:04
32,Gatinha geimers fofa,https://play-lh.googleusercontent.com/a-/AOh14GjWgVI3sNra30NA9ylWCtMdq9fcwSaTrg__fF9i,Orrível não gostei desse jogo muito ruim eu consegui abrir mas eu só fiquei arrumando a boneca eu olhei os comentários mais eu pensei que eu ia jogar com amigos por isso eu dou 1estrela 😠😠😠😠😠😡,1,1,,2020-06-16 12:55:49
33,Laah_ Henriquez,https://play-lh.googleusercontent.com/a-/AOh14GhpO-xSD038qVoEAjENz4A9MyXaG3BYtXHVTpVsgg,"Odiei muito....N da pra interagir com as pessoas e fica travando...e do nada,ele sai e tem que voltar do inicio!!!",2,2,,2020-05-12 12:00:37
34,Yasmim Goncalves,https://play-lh.googleusercontent.com/-RIhtQZDCe3w/AAAAAAAAAAI/AAAAAAAAAAA/AMZuuck8643NhzoJe_AdJv-l2MRsqDBBoA/photo.jpg,"O único problema é deveria ter em português, e ruim jogar e não entende nada",1,0,,2020-04-13 23:02:19
35,sophi anjinha anime,https://play-lh.googleusercontent.com/a-/AOh14GjHaQsBK1K0QupQWk7YNIHjoBmHnFnNCM7QIZyYRYI,Bom eu não sei como funciona eu só tô abaixando ele porque porque eu quero abaixar outro jogo aí eu vou esperar outro jogo mandar eu apagar alguma coisa para apagar esse jogo,1,0,,2020-05-05 23:26:07
36,Millena Dos Santos,https://play-lh.googleusercontent.com/-Nt_NfAqLhwA/AAAAAAAAAAI/AAAAAAAAAAA/AMZuucnBIrmMHauhy7EifZTWE2i4C_JoMA/photo.jpg,Eu amei a @ny&bidiverção vc não sabe por que vc não estuda essa línguas e mais uma coisa existe o google tradutor #ficadica e mais uma coisinha bem básica #recomendo e #recalque,5,3,,2020-01-08 21:01:10
37,Marcela Cristina,https://play-lh.googleusercontent.com/a-/AOh14GijtQN9bOm-tPvejOjtYOOAwVtUt-SHYvUEBSYh,"Amei.Eu achava q só tinha esse jogo para pc,mas pra minha sorte tem para celular.",5,68,,2019-09-22 12:01:17
38,Camily Evangelista,https://play-lh.googleusercontent.com/-KYZeemF1obU/AAAAAAAAAAI/AAAAAAAAAAA/AMZuucl7FdUqMwo1pFvUgE5IbnwaBtBZyQ/photo.jpg,Eu odiei esse jogo nunca entra e só fica no 23 por cento eu odeio esse jogo vc vai se arrepender de instalar esse jogo,1,155,34.0.5,2019-10-07 12:20:36
39,Fernanda Ribeiro,https://play-lh.googleusercontent.com/-RiCwKom64DA/AAAAAAAAAAI/AAAAAAAAAAA/AMZuucnfD5DDeQ-U3Hy1pv9j8Qr6uGQNZQ/photo.jpg,Esse jogo e horrivel tem a bandeira de varios paises mas quade a nossa bandeira porque aperto nas outras bandeiras so fica aparecendo nome estranho 😵😶😞😒😲😟🙅🙇.,1,0,,2020-05-03 08:20:30
40,Um usuário do Google,https://play-lh.googleusercontent.com/EGemoI2NTXmTsBVtJqk8jxF9rh8ApRWfsIMQSt2uE4OcpQqbFu7f7NbTK05lx80nuSijCz7sc3a277R67g,"uai,como é que vou jogar,so fica numa tela roxa cheia de enfeites,desenvolvedor faz o game ser compativel para meu celular star sansung",4,11,31.1.1,2019-03-12 18:37:27
41,Um usuário do Google,https://play-lh.googleusercontent.com/EGemoI2NTXmTsBVtJqk8jxF9rh8ApRWfsIMQSt2uE4OcpQqbFu7f7NbTK05lx80nuSijCz7sc3a277R67g,e horivel nao tem nosso país e ainda por cima não da para colocar uma senha por que vc pode colocar o número que for e não da certo,1,2,,2018-12-19 14:12:26
42,nycole In your área,https://play-lh.googleusercontent.com/a-/AOh14GjgOATI6sLj9xYI_yHVcVFgdXujiC9Ph63Ohwf1zQ,Este jogo é chato não tá entrando e eu não sei falar em nenhuma língua que aparece.,1,25,34.0.0,2019-08-18 17:15:53
43,Eu naum sei,https://play-lh.googleusercontent.com/a-/AOh14Ggo4O4WghqbEq48O0UjaYCKNWpOTsGNaq6BySrdxA,Legal mas o problema é que n tem como eu entrar mas eu vi uma musica desse joguinho e foi muito legal,5,96,35.0.2,2019-11-09 16:05:54
44,rui25veiga,https://play-lh.googleusercontent.com/a-/AOh14Ghdu0L6vHi9V1lZsvlM0UtC_FNAM3ju8XwZGa8,"Ruim pos MINHA conta td e n deu 4 vezes e nada e n gosteim mais do jogo, ahh e uma vez eu consequi e uma menina me chingo!",1,0,,2020-08-21 15:27:42
45,Família Gamer,https://play-lh.googleusercontent.com/-vmiPkjxWKFk/AAAAAAAAAAI/AAAAAAAAAAA/AMZuuck8p4n8heS-ZUSxwP3BFLEbmboIeg/photo.jpg,Jogo horrível não recomendo esse jogo porque ele é horrível Não abaixo nunca mais esse jogo e recomendo você também não abaixar,1,0,41.0.2,2020-09-13 16:18:11
46,Cardi B Sou famosa uai,https://play-lh.googleusercontent.com/a-/AOh14Ghsp5MtW1OWJfwW-ZGim75jxMaWG6z-ICr5hpJUgw,App muito bom mais cheio de hackers minha conta foi hackeado e excluída queria a resposta do app,3,4,,2019-09-15 15:30:21
47,Chrishane Magaissane,https://play-lh.googleusercontent.com/-12-roJmuyLo/AAAAAAAAAAI/AAAAAAAAAAA/AMZuucnCRtyniQ20vMam7IMti898QcJm_Q/photo.jpg,"Esse jogo é horível,me arrependo de ter baixado se quesres um comselho""não baixa isso é horível""caso o comtrario vais te arrepender...",1,63,34.0.0,2019-08-15 17:40:37
48,claudia matos,https://play-lh.googleusercontent.com/-OxpW0GfMmg8/AAAAAAAAAAI/AAAAAAAAAAA/AMZuucn9QNbDwT7VvvUE2yHfZ1zDSWh1zQ/photo.jpg,"Eu não sei o porquê de dar 3 estrelas em 5 , só vou dizer que o jogo não é assim muito giro.",3,0,,2020-04-12 07:06:53
49,luisa Maria do Nascimento da silva silva,https://play-lh.googleusercontent.com/a-/AOh14Gg1XlTwQOdEn6LHb3l2X7ubFgCyK4haUrARSngK_Q,E legal mas e online e não tem ninguém jogando e não tem opção português,3,2,,2019-11-25 10:04:18
50,park peppa シ,https://play-lh.googleusercontent.com/a-/AOh14GhhtkuMyLEGJkaXm0uiWHtNRaYfX4UaQBNJ1bTZ,"nao deu pra jogar nem pelo menos tentar! tinha cara de que era legal mais como nao deu pra entrar,1 estrela😔,nao recomendo!!!!consertem isso pfv",1,2,,2020-02-01 17:26:16
51,Kyara Silva,https://play-lh.googleusercontent.com/a-/AOh14GgvFi56EKZ78KmrT888uYuriQNa72bbGrJESCuhGQ,I Love you MSP e um jogo bem fixe mes fixe mes e visiante❤❤❤,5,7,27.0.2,2019-11-15 15:14:23
52,Nara Luisa,https://play-lh.googleusercontent.com/-XTS_SofXLi0/AAAAAAAAAAI/AAAAAAAAAAA/AMZuuckVxAlpytPATYLsG_hqYbBH47nFvg/photo.jpg,E esse jogo é muito ruim eu não gostei por isso que eu não gostei por isso que eu dou uma estrela ele é horrível não consegui jogar,1,0,,2020-03-29 20:49:05
53,Naomi Fds,https://play-lh.googleusercontent.com/a-/AOh14Gh_tfZds4ZqMvbw1oL0fqO2ttdj4FcKBgHcL2rFUA,"As bonecas parecem umas mendigas,todas feias igual a mim na vida real.Odiei o jogo",1,2,,2019-12-26 21:50:00
54,Maria Gotardo,https://play-lh.googleusercontent.com/-XJ5_Fz-1R5Y/AAAAAAAAAAI/AAAAAAAAAAA/AMZuucnoFDMH7RkbIMYLNl_-9w57Pr4pdg/photo.jpg,Eu instalei o jogo mais eu não gostei porque tem que colocar em que estado vc vive e eu não consegui entrar.,1,0,,2020-03-20 10:23:48
55,Nivaldo Rodrigues De Araujo,https://play-lh.googleusercontent.com/-mKkLDy2fGJQ/AAAAAAAAAAI/AAAAAAAAAAA/AMZuucmpY1QgQxEiZiwhzHynjxzvii3g9w/photo.jpg,Gostei mas tive que desintalar por que não fiz algo certo!,5,4,38.0.2,2020-04-18 15:09:15
56,Larissa Lu,https://play-lh.googleusercontent.com/-z6z0OrBrxrM/AAAAAAAAAAI/AAAAAAAAAAA/AMZuucl_w-PoGGigdw_e_J_tT81y9uvvEA/photo.jpg,nossa super legal uauuu.... amei muito....... bem legal tem roupas lindas tem que consigui dinheiro pra comprar roupas...... ♥,5,6,,2019-07-12 20:41:55
57,Um usuário do Google,https://play-lh.googleusercontent.com/EGemoI2NTXmTsBVtJqk8jxF9rh8ApRWfsIMQSt2uE4OcpQqbFu7f7NbTK05lx80nuSijCz7sc3a277R67g,Não dá pra jogar o jogo fica só em uma tela roxa e cheia de enfeites ODIEI!!!!!!!!,1,100,31.1.1,2019-03-19 23:31:33
58,Caetana Santos,https://play-lh.googleusercontent.com/a-/AOh14GjSzZhlq0AS7Z-H_fm05nnYSsUm4CP6F51evWOXsQ,Depois de uma hora estava a negar de fazer login pra eu começar a jogar,4,23,35.0.6,2019-11-20 13:55:20
59,Adrielly Silva,https://play-lh.googleusercontent.com/a-/AOh14Gi0EsrbiZoP19ommcbFbUKcVMJsjHfGHASENixRqg,Sempre que tento colocar o nome e esas coisas ele trava ou sai muito ruin,1,0,,2020-05-29 17:26:46
60,Andrea Mendes,https://play-lh.googleusercontent.com/-CbmoMjBvJuU/AAAAAAAAAAI/AAAAAAAAAAA/AMZuucmuBsLjkn7Tdjm1_mG95E0uihcksQ/photo.jpg,"Oi tudo bem, tudo isso que eu quero ressaltar, mas o problema é que eu te mando o comprovante do que a Veia não quero mais, o que ela falou que o bolo. . . Não sei como é que o Marcos, mas eu não tenho mais de dois anos e o meu pai, o importante é o mesmo que o Patrão, e que eu não vou me sentir o cheiro cheiro cheiro de um novo boleto bancário, 😄😄😄😄",5,1,,2019-10-16 23:06:08
61,Lulu Sakura,https://play-lh.googleusercontent.com/a-/AOh14GhJWVya7Hfun3kL77S7uK_Cf-0RIGPYMqnPxXaWsQ,"Ótimo game :) mas no meu celular não roda por conta do espaço, mas recomendo demais <3",5,4,37.0.2,2020-03-11 15:53:47
62,lαdy sσƒiα τωiligнτ,https://play-lh.googleusercontent.com/a-/AOh14GggQS-qzlCbzfry_DScTxBf8C_FKOj3vwZQfHlU,Não consigui colocar animação no Artbook ;-;,3,15,34.0.2,2019-09-07 14:11:55
63,thamyla silva,https://play-lh.googleusercontent.com/-6QtqrcIAGPE/AAAAAAAAAAI/AAAAAAAAAAA/AMZuuckvwstPk894-QT-raakyyOlkDc_kw/photo.jpg,Odiei esse jogo péssimo quando eu fui jogar não prestava nada eu só vou dar 1 estrela para esse app não gostei desse jogo 😠😠😤😤👎👎,1,1,,2019-10-12 22:08:27
64,Rivaldo Santana,https://play-lh.googleusercontent.com/a-/AOh14GhHrm9COlepLqP_JSAUGvWvwDwregkzSVMV6aRx,Super ruim fiquei horas abaixando e depois eu nen comsegui entrar,1,1,,2019-12-13 18:51:18
65,Ananda,https://play-lh.googleusercontent.com/a-/AOh14Gj1swJkv0qD03GbQc2As7PP_76D8RpOnnZKjttHwQ,"Não instalou ainda, mas creio que seja bom",4,2,,2019-11-30 20:03:21
66,crilaine silva soares,https://play-lh.googleusercontent.com/a-/AOh14GguoF8rYgJ_CqsTeXBVwDHc1Oy5hJZkn80KVDw0Lg,"Odiei, é pécimo, muito ruim, não sai da capa eu não esperava isso ridículo",1,14,38.0.2,2020-04-08 00:58:41
67,Davi Teixeira,https://play-lh.googleusercontent.com/-bi6wokMQbGE/AAAAAAAAAAI/AAAAAAAAAAA/AMZuuckWjJ3S_7-LArfB9aNoCts0Z3AyoA/photo.jpg,Esse jogo eu tentei jogar mas não deu eu arrumei os mas aí eu não consegui jogar De nenhum 😤😤😤😤😤😤😤😤😤😤😤😤😤😤,1,0,,2020-03-07 10:00:38
68,Dilea Torres Dilea,https://play-lh.googleusercontent.com/-SxMae8kauus/AAAAAAAAAAI/AAAAAAAAAAA/AMZuucnaMfLdR47VUyELtxe_85PMfGD1rQ/photo.jpg,Como fãs para entrarno jogo porque eu estou a 1 HORA tentando entrar,1,6,34.0.5,2019-10-03 15:13:39
69,Patricia Rodrigues,https://play-lh.googleusercontent.com/a-/AOh14GjVtTPGq7ATmJSglehmPXyeUvwz9u8aH4-Ab2Tmzw,Email não tem portugues detestei nunca volto a instalar este jogo,1,5,26.0.0,2018-09-15 06:57:08
70,Rosa maria alves dos santos Rosa Maria,https://play-lh.googleusercontent.com/-i4vx4htYs7E/AAAAAAAAAAI/AAAAAAAAAAA/AMZuucmBBAqq5O-Rh5JcQ2kp1oY_b_TCww/photo.jpg,Bom dia boa tarde boa noite vou falar meu comentário odiei odiei odiei odiei odiei só que eu sei falar desse jogo é o que é o odiei pior jogo do universo preciso preciso de outra,1,0,,2020-04-06 15:53:04
71,Nicoly Oliveira,https://play-lh.googleusercontent.com/-Lpua4ekS_4Y/AAAAAAAAAAI/AAAAAAAAAAA/AMZuucnhLclVMVbQWLZm8wQiaPTEzOSFRw/photo.jpg,Gostei comos oun oval aqui nesse jogo e eu já gosto mais ou menos de online por que to acostumado com o roblox,5,0,,2020-04-10 17:03:01
72,sunset shimer br,https://play-lh.googleusercontent.com/-aP-MCQD-PS4/AAAAAAAAAAI/AAAAAAAAAAA/AMZuuckW6grK7ZFOM2CALtdP0mBrAHraTg/photo.jpg,N gostei n da nem pra bota brasilero n da pra intender nd qm fez esse jogo tem problema no serebro ```eu ia da 0estrelas mas n tem opição ```,1,0,,2020-04-12 13:47:14
73,Sonia Ferreira,https://play-lh.googleusercontent.com/a-/AOh14GitKi7RfGJaJIis9y2x8ZAoFUq4OxOJ262cEnpDNQ,Amo este jogo e graças a ele apenas de ser um jogo achei o homem da minha vida da real❤,5,10,20.21.1,2018-09-25 20:42:36
74,livia rodrigues,https://play-lh.googleusercontent.com/-rX6pS8Y99zM/AAAAAAAAAAI/AAAAAAAAAAA/AMZuucnkHHxhYW8pC4BuVTOPySUJ_eO-KA/photo.jpg,Jogo lixooooo de mais não tem idioma português e não da pra entrar no jogo tmb por isso prefiro muito mais pk xd do que esse jogo lixo não recomendo baixar,1,0,,2020-06-10 14:02:57
75,Altair junior Junior,https://play-lh.googleusercontent.com/-rPWWFBdXQNk/AAAAAAAAAAI/AAAAAAAAAAA/AMZuucn7P6gSRoNAcTtU0AdJjmFJ36b9mA/photo.jpg,Muito ruim confia gente prefiro o jogo impostor Não instala,1,0,,2020-05-24 16:32:12
76,Zenilda nilda,https://play-lh.googleusercontent.com/-Vs5efSzMamU/AAAAAAAAAAI/AAAAAAAAAAA/AMZuucmox3z75UzrHy0aC9Z0eDBoUojuvQ/photo.jpg,élegal de mais vc tem que abachat,5,0,39.1.1,2020-07-17 15:47:43
77,Ana Victoria,https://play-lh.googleusercontent.com/-rDZtBq0l-j0/AAAAAAAAAAI/AAAAAAAAAAA/AMZuucm797AEXyH1ZatWohmktLgY69NQ6w/photo.jpg,Não deu para entra no jogo não tem pro brasil,1,4,37.0.0,2020-02-15 11:06:59
78,urdentaler,https://play-lh.googleusercontent.com/a-/AOh14GjXK7fu55zCrRtsXKJAcqWLGRHj7mc9Gn6wXdGyyA,Eu amei esse jogo o problema é que ñ entra só isso,5,4,35.0.7,2019-11-27 18:38:56
79,Lorrane Stheffany,https://play-lh.googleusercontent.com/-NIfaFNN6Qw0/AAAAAAAAAAI/AAAAAAAAAAA/AMZuucnO1_UZad_g_xURseS59cJ7cWoxoA/photo.jpg,O jogo é ótimo,5,0,39.1.0,2020-05-28 23:12:15
80,brincando com a kayla no yotube rocha,https://play-lh.googleusercontent.com/-JMbSBhcFVWM/AAAAAAAAAAI/AAAAAAAAAAA/AMZuuckoJpMlJ2IgqJZkaEVF_fYWa7OOuw/photo.jpg,Não consigo entra nele de jeito nenhum arumen isso por favor,1,0,,2020-07-30 13:38:13
81,NAYARA SOUZA,https://play-lh.googleusercontent.com/-64NlLJzfvY8/AAAAAAAAAAI/AAAAAAAAAAA/AMZuuckqgQF2RcsgdqBn3k3sfqyQppof9w/photo.jpg,As pessoas falam que esse jogo e ruim tudo mentira ele e super bom galera,5,0,,2020-06-06 09:46:25
82,wolf glod,https://play-lh.googleusercontent.com/a-/AOh14GjlS588wSm4GXwFyCeS4wOdZFtHpeCNFvnhE1L_4A,Não gostei não consigui coloca o nome todo nome que eu colocava taça errado,1,3,34.0.0,2019-08-26 13:31:41
83,Regilainy Mendes,https://play-lh.googleusercontent.com/-q-iElQhnZv0/AAAAAAAAAAI/AAAAAAAAAAA/AMZuucmMIl33RCAkZ3szZ2l9u0Fjw28EFQ/photo.jpg,E otimo e pra essa garota que falo que e ruim so te do um conselho cai aprender a escrever vc nao sqbe nem escrever ta querida e se te ver achando que eu sou metida sou mesmo ta agora eu tenho mais oque fazer quidando de aniversário tabom e outra vai crescer e se vc nao gosta do jogo nao precisa ficar dom2ntando ninguém quer saber da sua vida nao,5,4,,2019-09-12 23:19:36
