,userName,userImage,content,score,thumbsUpCount,reviewCreatedVersion,at
89,Lopes & Lopes videos.,https://play-lh.googleusercontent.com/a-/AOh14GjvKs--6afLp8ALzx990JUNX6pg7jBSDGT9bfBErw,"Jogo incrível, legal, viciante, algumas vezes frustante, assim que é esse jogo nenhum defeito importante, mas acho injusto quando alguém está com a internet fraca e ele começa a travar e depois os adversários nos matam, para isso poderia ser melhorado saindo temporariamente da partida ou imortal com sinal de internet fraca ou outro, só resolve isso, recomendo muito.",5,12,30.242,2020-11-06 18:08:03
90,FELIPE,https://play-lh.googleusercontent.com/a-/AOh14Gh4J3Zawn1pSj131q7qoogljb0q90Be_d-l8QxLkQ,"A conexão entre servidores é muito instável,fica indicando sinal de internet fraca toda hora,porém já testei a velocidade da internet e está normal e estável,o problema é no servidor do jogo,e n sou apenas eu,muita gente está tendo o mesmo problema,uma pena esse problema pois o jogo é muito bom.",2,11,30.242,2020-11-03 00:38:11
91,biscoito 1,https://play-lh.googleusercontent.com/a-/AOh14GjKk9YHeTvvpCeLWHTvzc8hTMjNjjklmJczZDdtfw,"O jogo é divertido, tem gráficos bons, mais falta mais adições ao criador de mapa, por exemplo algo que deixe agente ajustar o tamanho do mapa e tbm falta algo para agente se comunicar com os jogadores, como um microfone ou um chat que não sejam palavras para agente escolher e sim para agente escrever as nossas próprias palavras... E só (:",4,14,30.242,2020-11-06 21:55:46
92,Benjamin Gatti Leite Fonseca,https://play-lh.googleusercontent.com/a-/AOh14GiwL3ijSYVdVzF8WJDUTl7dPESAEdfcodzSxT27rw,"Eu já dei muitos Comentários bons para esse jogo, mas... Agora, tá tendo muitos Hackers nas partidas, também acho que eu to caindo com gente muito acima do meu Nível, todos meus personagens estão bom mas eu não estou tão bom, que nem os caras que caem comigo, isso faz eu perder muitos troféis, :( E se vocês poderem deixem pelo menos 15 dias, para a liga de troféis terminassem... Mas, cara esse jogo é tão bom, mas tão bom!que mesmo tendo um monte de coisa ruim, ele ainda é meu jogo favorito.",2,1,30.242,2020-11-04 06:49:38
93,Nelson Ferreira,https://play-lh.googleusercontent.com/-ydreww4uNxg/AAAAAAAAAAI/AAAAAAAAAAA/AMZuucm3zEa0oKOwxxUHiaCk-WslAIkVWw/photo.jpg,O jogo é bom gosto do gráficos é em 3d e tudo. mas uma coisa que eu não gosto dos jogos da supercell é que os preços estão muito caros fora isso o jogo é legal todo mês tem atualizações novas. várias opções de brawlers e mapas(modos de jogo) É um jogo sem nenhum hack e qualquer dúvida pode esclarecer com o jogo é bem fácil de entender controles legais nota 10.,5,11,30.242,2020-11-06 19:20:13
94,ヰj o o j,https://play-lh.googleusercontent.com/a-/AOh14GjJur-Lk4crxv5ZQ6walRr2PTPk1oiEhSfO85bfTQ,"O brawl antes era bom,mas com o tempo ficou piorando,bem eu explico,começando com os incríveis plobemas de internet(q é do próprio jogo em si), balanceamento de players q mesmo nessa nova atualização eles dizem que corrigiram mas n ainda continua errado,e o brawl pass pago q além de custar um olho da cara vem brawlers q vc ganha no brawl pass pago,aí os q compram acabam ficando mais injusto porque os que não compraram ficam mais fracos,porque no BS quem tem mais dinheiro e o mias forte no jogo",2,7,30.242,2020-11-04 12:52:36
95,Vinícius Gamer,https://play-lh.googleusercontent.com/a-/AOh14Gij5E3jEohYte5Dp60lOdH_9M3v4ozb7ExZjtVuqA,"daora jogo louco recomendo,os controles são ótimos e a qualidade também,eles estão dando desconto nas skins o que é muito bom,o jogo não te cobra nada e ele é incrivelmente bem feito,a SUPERCELL é uma ótima desenvolvedora de jogos.atualização do meu comentario: Eu acho que a supercell poderia voltar a o preço normal das gemas porque agora o preço ta absurdo! E eu iria comprar o brawl pass mais agora não da mais,por favor voltem a o preço normal pois esse novo preço ta muito absurdo...",4,15,30.242,2020-10-30 15:59:12
96,Vinicius,https://play-lh.googleusercontent.com/a-/AOh14GgSdbvkZKiCe-V_TLFZkUpK8Lwg-1yYlesjYu-Mvg,"Esse jogo e bom o controle e bom,o gráfico,e a jogabilidade também,eu falava que não gostava do jogo mas falava isso sendo q nunca joguei,mas depois que comecei a joga viciei nesse jogo,não que vicia é uma coisa ruim mas esse jogo me salvou nessa quarentena.Ele tem atualização todo mês,ele é muito top,por favor recomendo instalar,tamo junto✌️😉",5,46,30.242,2020-11-06 15:41:12
97,Lucas Cardoso,https://play-lh.googleusercontent.com/a-/AOh14GidFCmHG37G3Lbh0YCUBWwEYVv-zMd-bmcWmu8Wyg,"o jogo é muito bom, jogabilidade boa, mas o que eu acho que pode melhorar é a questão de conseguir novos personagens, conseguir um personagem ou uma roupa é muito difícil, eu acho que isso poderia ficar mais fácil. As gemas também pideria ser mais fácil de conseguir, a maioria dos itens que estão para vender é de gemas, e muitos não tem condições de comprar gemas, poderia existir algo que nos dê gemas sem custo de fora, um evento, brinde diário, etc..",4,7,30.242,2020-10-27 00:24:54
98,Gabby Barbosa,https://play-lh.googleusercontent.com/a-/AOh14GiSRBOf-XJJqZ7TK4nY6wCv6ty7HEsMD41DSwHwDQI,"o jogo roda liso, tem um gráfico perfeito e as atualizações de modo diários e missões mostram a dedicação da equipe com jogo. Minha sugestão é após as partidas, na hora de escolher jogar novamente ou não, acrescentar opção de trocar o brawl sem desatar a equipe que caiu no random e também que acrescentassem a opção de revanche, seria interessante",5,13,30.231,2020-10-22 11:51:38
99,Hydronick cyan,https://play-lh.googleusercontent.com/a-/AOh14Gj11zZ1FY7Oe2JFVZOD25tVoagngEC57Dc-cW5X,"O jogo é ótimo e a ultima atualização calou algumas reclamações minhas,mas...Primeiro, há um abismo enorme na diferenca entre players veteranos e de alto nível e players novatos e fracos, e não é justo deixar esses players se encontrar numa partida e o sistema que lhe dar mais(caso ganha) ou retirar menos(caso perca)troféus até funciona,mas não seria melhor criar um sistema para evitar q eles se encontrem?Segundo, são alguns bugs no ""criador de mapas"",mas como está em beta espero q resolvam logo",4,23,30.242,2020-10-24 20:28:05
