,userName,userImage,content,score,thumbsUpCount,reviewCreatedVersion,at
0,Roney Rodrigues,https://play-lh.googleusercontent.com/a-/AOh14Ggrn1uxlqZVc5DRlv1ZIbFTWCiEHPitXbxrB-jL,"Um jogo muito bom com experiência ótima q nem a do PS2 q foi transmitida com lucidez para o mobile. Devo dizer q apesar de nn possuir músicas autorais, fui muito bem surpreendido, devo dizer q o game superou minhas expectativas. Nn me incomodo tanto com as propagandas, aliás as assisto para ter prêmios dobrados e assim comprar mais músicas. Moedas recebidas na quantidade certa, sem serem muitas ou poucas, mas sim intermediárias. Parabéns pelo ótimo game!!",5,5,7.1,2020-11-06 14:09:51
1,João victor Lins,https://play-lh.googleusercontent.com/-7s5yUwUJP3U/AAAAAAAAAAI/AAAAAAAAAAA/AMZuucko6MparTegm7AsFAzw1-qQ8a-5ng/photo.jpg,"esse jogo e maravilhoso,um dos jogos mais legais que eu já joguei,o melhor e que vc pode jogar suas próprias músicas,eu amei o jogo por isso nunca mais vou desinstalar esse jogo,joguei uma vez e nunca mais parei de jogar,esse que é o motivo,porque ele é muito viciante.mais geometry dash e melhor,desculpe se te ofendi,e porque eu sou mais viciante em geometry dash,mais o jogo e muito bom 5 ⭐⭐⭐⭐⭐",5,64,7.1,2020-09-16 15:27:59
2,PATOLINO PROZIM DO J1,https://play-lh.googleusercontent.com/-lFSRCcinzh8/AAAAAAAAAAI/AAAAAAAAAAA/AMZuuckS0-BSOMqC_UGU5E1snjpiDgj-RA/photo.jpg,"O Jogo e maravilhoso gostei muito o único que dá pra tocar a nossas músicas. Comesei a tocar a primeira música no meu dispositivo e não parei mais, realmente muito bom!!.",5,31,7.1,2020-10-13 00:42:03
3,꧁mundo dos Jogos꧂,https://play-lh.googleusercontent.com/a-/AOh14Gj-Jfo4o_94oxhxkt3-JXW1Zv5-odAGfgsxdpV1,Vou dar creditas positivas colocar efeito espécias trovão quando atiger alge momento certo mudanças quitarra ficar radical um momento música ficar todo azul ficar tudo mesmo cor e outra músicas eu jóquei não vem pressionar botões tipo vem uma linha música botões aí pressionar não tem colocar uma vídeo encima a onde gente jogar pfvr isso fãs tatal diferenças 2021,5,0,7.1,2020-11-04 01:20:30
4,Pedro Ferreira,https://play-lh.googleusercontent.com/-cM1ztJ45uuw/AAAAAAAAAAI/AAAAAAAAAAA/AMZuuckeVkjEzcRzChCEQsA3D_ib0ojHvg/photo.jpg,"Vale a pena, ao longo do tempo já sabes tudo decor, deviam era actualizar mais musicas.",4,6,7.1,2020-10-29 19:01:21
5,Ana paula silva,https://play-lh.googleusercontent.com/a-/AOh14GgpFIOo64NjBM71CCai6gqDg9mQ8LtvzWAUbni7,"Propaganda obrigatória , e tentam instalar outros app junto, não recomendo.",1,2,7.1,2020-10-23 07:29:39
6,Lucas Gomes,https://play-lh.googleusercontent.com/a-/AOh14GhQK6iJ_9GuD5Qt5XAukCYM_-V1sJLvkEeoykEONA,"Legal, mas tem poucas músicas abertas! Vc tem que tocar muito pra conseguir desbloquear!",2,41,7.1,2020-09-09 00:56:59
7,Ismaell Pereira,https://play-lh.googleusercontent.com/a-/AOh14GhEAV_AMct2-jGugc53VJM6HHNsUuaMi8GFLd0W,Muito bom parabéns aos desenvolvedores deste game.,5,1,7.1,2020-10-24 23:15:59
8,Jailson Santos,https://play-lh.googleusercontent.com/-_ehHsnFEk7A/AAAAAAAAAAI/AAAAAAAAAAA/AMZuuclR61ZFyt3vF4i7OpFV_cfV18HUJA/photo.jpg,Tu é doido é... A cada música que a gente joga tem propaganda... Perde até a graça...,1,0,7.1,2020-10-24 20:07:47
9,Paulo Henrique,https://play-lh.googleusercontent.com/a-/AOh14GhoIOhz-A_d7AckYMTjjs5kU5VIn6RZptppVX71,Showwwww poder tocar as músicas do celular ..... Além de relaxar é como se vc tivesse tocando ao vivo... Parabéns,5,1,7.1,2020-10-31 14:37:29
10,micael arcanjo,https://play-lh.googleusercontent.com/a-/AOh14GhxDLNbPGOM4BNO2nJ8T_Ctd9ScmHgREilMvY9O4w,"Jogo mais legal e mais viviante da minha vida!!!! Joguei 2 mins e não quero mais parar, parabens ao desenvilvedos. Só achei que tem poucas opções de musica e as que tem são muito caras!!",5,101,2.25,2020-08-15 22:39:51
11,Ana Beatriz Fernandes barros,https://play-lh.googleusercontent.com/a-/AOh14GgPLqal0Iv4MoxxNpepu4yjx01u5XL7BG_KacdVig,Muito legal o jogo tem que ter muita concentração maravilhoso,5,0,7.1,2020-10-26 20:51:05
12,Romerito Alves,https://play-lh.googleusercontent.com/-N-9obbUAGSY/AAAAAAAAAAI/AAAAAAAAAAA/AMZuucldPiIMhQi5IwaA0JPiM80Zmw0pJg/photo.jpg,Jogo mais desgraçado do mundo um anúncio atrás do outro,1,0,7.1,2020-10-12 20:40:55
13,Davi Santos,https://play-lh.googleusercontent.com/-LaYXgG8YN_Y/AAAAAAAAAAI/AAAAAAAAAAA/AMZuucmgDjz6SvAqWnBwp3xbVoiuRKxEoQ/photo.jpg,Muito bom de principalmente pra mim que era horrível no Guitarhero,5,20,2.25,2020-08-24 23:55:20
14,Stela Bernardi,https://play-lh.googleusercontent.com/--h_CSw2ECDw/AAAAAAAAAAI/AAAAAAAAAAA/AMZuucl65QLwTbS0AmXJavJKBFiKkFBSEg/photo.jpg,As músicas poderiam ser sincronizadas,3,2,7.1,2020-09-21 13:49:40
15,Riquelmy Play Games,https://play-lh.googleusercontent.com/a-/AOh14GhylFIAR8C2cPcbRPFle8Is2APpkjjV7Igxk1Sg,Ótimo jogo. Pena que tem poucas músicas.,5,7,7.0,2020-08-30 11:21:46
16,Fernanda Costa,https://play-lh.googleusercontent.com/a-/AOh14GiAg8U3saHw4RugN014lpkcNEATg7pAtIwJRFb0,"Muito fora de Ritmo as músicas !! Quando coloca A música do próprio celular , não dá a impressão de estar tocando as musicas , somente de estar apertando um monte de botão aleatório 🙄",1,0,,2020-11-04 22:20:06
17,Ana Cristina Raulino Luciano,https://play-lh.googleusercontent.com/-8NPr2ZuZ8XI/AAAAAAAAAAI/AAAAAAAAAAA/AMZuucn3KyBbWvkG3hXo5lgce9-60l2mZw/photo.jpg,"Muito Bom! Mas qdo vou jogar com minhas próprias músicas,ele para de funcionar,gosto mto do jogo,mas não estou conseguindo resolver.Esta acontecendo a mesma coisa com o Rock Hero 2,não estou conseguindo jogar!!!!",5,0,,2020-05-14 17:35:51
18,Felipe Silva,https://play-lh.googleusercontent.com/-2ORJFWlZggo/AAAAAAAAAAI/AAAAAAAAAAA/AMZuuclde-C6bwoB4AXoKE3tx5QtPQmSNQ/photo.jpg,"O jogo é bom, mas a jogabilidade com a tela na vertical só serve ou pra quem tem mão pequena ou está no tablete.",3,0,,2020-11-07 19:46:17
19,Nelciana Caldeira,https://play-lh.googleusercontent.com/-QPZIe_WcP4I/AAAAAAAAAAI/AAAAAAAAAAA/AMZuucmI6BAHa-I5D1kyEMcCNkIhB_3uOw/photo.jpg,"O jogo ate que e legal so que eu jogo ma velocidade mas rapida e quando eu jogo assim trava demais e o que mas mi incomoda e quando eu acerto as nodas i fica aparecendo(Bom ,Perfeito)bem no meio da tela isso faz que erre mas o jogo e bom tem que atualizar urgentemente e colocar mas musicas .",4,25,2.23,2020-07-29 01:54:29
20,Raphael Moura Bernardo,https://play-lh.googleusercontent.com/a-/AOh14GhdTjp3pvz9BG9uNUhnvi0Nyvf1YpWeD4mhhNE2,"Jogo ruim, mau desenvolvido, os botões ficam num lugar muito próximo dos botões do Android aí jogo fica saindo, muito ruim, revejam isso.",1,0,,2020-10-08 01:30:15
21,Nilvan Rodrigues,https://play-lh.googleusercontent.com/a-/AOh14GhNW17twu-oTFTmg1tTWBFMTp9N-UPBLDT0EAnNKQ,"As longas propagandas irritam, sugiro jogar com o wifi desligado. Os o Botões ficam bem em cima dos botões de baixo do telefone, fazendo com que toda hora você saia do jogo sem querer. Um saco isso.",3,18,2.23,2020-08-02 02:41:10
22,Leonardo Perera,https://play-lh.googleusercontent.com/-qkqZNogo-6E/AAAAAAAAAAI/AAAAAAAAAAA/AMZuucnqGMenySzQJTIZuV3A9HPKiB3Gog/photo.jpg,O jogo é otimo mt bem feito apesar de so ter as cores vermelho verde e azul as msc do jogo sao legais tbm,5,16,2.25,2020-08-13 15:08:44
23,Maria Madalena Bispo,https://play-lh.googleusercontent.com/-tZwb1RJXzeI/AAAAAAAAAAI/AAAAAAAAAAA/AMZuucmlSNywSIZ-57aXhW2KaeWLcjYEWw/photo.jpg,Eu acho o jogo sensacional os rits são muito criativos eu não sei porque dizem o contrário. Além disso me divirto muito é bem desafiador tentar fazer novos recordes de pontuação. É de maaais,5,27,2.23,2020-07-11 21:51:21
24,Dinis Melo,https://play-lh.googleusercontent.com/a-/AOh14GgkpnlWF5znu-DiGTuZHIychfnzhD5E0fJYY3mFFA,"Muito bom, é desafiante e é muito bom o facto de podermos tocar as nossas músicas. É difícil, mas isso também o torna bem desafiante. 5 estrelas ⭐",5,44,2.23,2020-05-27 06:03:29
25,Héricles Júnior,https://play-lh.googleusercontent.com/a-/AOh14GjXMuM35CJiGGb7IXWRVBub9sRGY9OmAKW_x4jgPw,"O jogo em si é bacana, mas deveria ter uma espécie de música para tutorial, pois o nego baixa o jogo e tem que se virar para saber como fazer aquelas notas especiais que vão para os lados. Também eu não curti essa letra enorme dizendo ""PERFECT"", deveriam diminuir o tamanho dela pois atrapalha muito ver o que está por vir no modo difícil. Diferente do Guitar Flash...",3,140,2.23,2020-02-25 22:08:43
26,Sabrina Silva,https://play-lh.googleusercontent.com/-xebR9CLUVA4/AAAAAAAAAAI/AAAAAAAAAAA/AMZuucmmjre_apmyp50o_NGYT_MZNkrZKQ/photo.jpg,"O jogo é bom, porem acho que poderia melhorar . Porque ele não ele não mostra como se joga na primeira vez é muito difícil eu acho que sim na primeira vez e Devia dar uma ajuda. e também não gostei dessas letras grandes para que o tamanho disso não ajuda nada no jogo só atrapalha. O resto do jogo é ótimo por isso estou dando quatro estrelinhas.",4,1,,2020-05-06 21:01:36
27,Yam Gabriel,https://play-lh.googleusercontent.com/-A7SPgCK6cio/AAAAAAAAAAI/AAAAAAAAAAA/AMZuucnZt6eezinu7NDhfMuDOnIAwknhLg/photo.jpg,"O jogo é bom vir meu amigo jogando e ele é muito bom mas tem que botar mas musicas tipo pop,jemes arthur,etc vecês tem que ver esse jogo parabens quem enventou esso jogo maravilhosooooooo",5,0,,2020-10-30 13:06:41
28,Manu Caputo,https://play-lh.googleusercontent.com/a-/AOh14GjQHMsZIuCp9qFWCKz_PKoK3vBxHHMvR_9OXyT73g,Gostei bastante!!! As músicas são legais mas tem uma delas que é preciso baixar um outro jogo... E tbb é muito difícil ganhar dinheiro,5,4,2.23,2020-05-23 13:46:07
29,Felipe A.,https://play-lh.googleusercontent.com/a-/AOh14GhH4dbEZIXeqa_ZanpKj1ynnusoYejaaHjoGUrY6g,"a opção de tocar as músicas do celular é maravilhosa... as vezes a música dá erro e mal aparece notas, mas as vezes ele funciona bem. tem poucas músicas originais, a graça é tocar as músicas do celular. dou 5 estrelas pq há muito tempo eu queria um App desse tipo, e finalmente encontrei",5,219,1.32,2019-05-20 01:29:50
30,RHCP GIRL,https://play-lh.googleusercontent.com/a-/AOh14GjCJ-ulSjquWYj8putzlox3aKg8F_SyxaJq1pd6,o jogo é uma maravilha mas tem uma coisa q me incomoda é a quantidade de notas q só tem 3 sendo q no guitar hero normal 4 ou 5 podia ser igual o Guitar Band Battle,4,0,,2020-05-24 09:13:13
31,Thaís Siaht,https://play-lh.googleusercontent.com/a-/AOh14GjzFxotFEvDqH1vrqPwllPdpS1MdGJlnyx6XeVDDg,"o jogo é muito bom, a opção de tocar as músicas do celular e muito legal, e opção de mudar o nível do jogo junto com o speed é genial, o jogo é um um filé 👌. Apesar que mudou um pouquinho de um tempo pra cá era um pouco melhor mas ainda gosto dele.",5,25,1.32,2019-07-29 01:39:05
32,Luana Santana,https://play-lh.googleusercontent.com/a-/AOh14GhTjgYhL_jnHASRRJfwCsNk8NVVnu6kif38gCX2ZJM,"o jogo em si e bom, mais os controles de clicar em cima mesmo dos botões não e muito necesario e tambem pra que tem um hard se as teclas nem funcionam?, o maior problema e o de comandos de teclas que e muito ruim para acertar toda hora , queria dar 5 estrelas mais nao fizeram o jogo direito então ficou bom não otimo.",3,40,1.32,2019-05-20 23:04:13
33,ControleV,https://play-lh.googleusercontent.com/a-/AOh14GgJk9Hdg47tmidoYnqnUWsNGD2sLw4LOUCewRSymw,"Em minha opinião o jogo é sim muito bom, eu apenas acho que o ""leitor de ritmo"" deveria ser aperfeiçoado, pois de vez em quando, ele não ""bate"" com a música. Obrigado.",5,4,,2018-09-14 22:59:22
34,TheOldMan -,https://play-lh.googleusercontent.com/a-/AOh14GhT7sQXWR1HYQnXdd9IJIN1msKbDlkeUSqfAYac,"Um completo lixo, uma ofensa ao jogos de rock de qualidade. Parece um retardado tentando tocar uma guitarra desafinada. Gostei muito, uma experiência unica de jogo, adorei. Ótimo pra jogar em funerais, vai forçar o choro de qualquer um.",1,1,,2019-02-06 21:30:59
35,Vocé,https://play-lh.googleusercontent.com/a-/AOh14GgTxANQRrB0MXYWTXeONO1cX_2Zz1IhbtNIUE0s,Foi se o tempo que era bom.. parei de joga já faz muito tempo voltei agora e me arrependi .. o jogo não bugava .. quando precionava nas músicas da galeria ia direto agora e um ano só pra escanear a música.. e tbm ficou chato antes era mais agitado agora parece que o jogo tá morrendo de cansaso.. as pedras vem numa velocidade lenta mesmo com ela no máximo e vem menos pedras do que antes ..,1,18,1.46,2020-02-01 10:59:21
36,Gabriel Vestena,https://play-lh.googleusercontent.com/a-/AOh14Ghuky74mtwH69s-KBdAuYKcjIz_iiMnwqBKVPGy,"Muito falso,as notas podiam ser pelo menos realistas é só uma nota nada a ver com a música,nem no ritmo não toca",1,2,2.23,2020-06-28 21:30:45
37,Emerson Douglas,https://play-lh.googleusercontent.com/a-/AOh14GiXf68IIydG8RFEbOKUrcH_Jvnuxg_sXahIMOxL,"Não estou conseguindo jogar o modo local e isso é frustrante, e no modo clasico tem poucas músicas",3,1,2.23,2020-06-09 09:56:12
38,Fernando Corrêa,https://play-lh.googleusercontent.com/a-/AOh14GiD92uRf3UJx0yh2NsipbBb6mh-6yL26HpAhd9TNg,Bem ruim. Alguns poucos segundos de jogo e propaganda. Muita propaganda,1,0,,2020-09-21 23:48:30
39,Neylesousarodriguesneyle Rodrigues,https://play-lh.googleusercontent.com/a-/AOh14GiApi_MV37s138-CtPm4dN9YuIL_O-yDyVdTs8xNQ,é muito legal ...os gráficos ...o desafio do jogo de trazer a dificuldade de aserta é muito viciante ...mais eu acho que a unica coisa q podiam fazer e tipo se fizer bastante pontuação ai iria mudando de estrumento,5,0,,2018-12-11 21:28:25
40,Player Retrô,https://play-lh.googleusercontent.com/a-/AOh14Gj3A4EKxJN44FtrcMW_6DHlfPT9MVwgBxGwEe3FNQ,"Joguinho mó legal, e ainda é de masoquista quando colocamos no difícil e na velocidade máxima, gostei bastante. As propagandas não me encômodao mais pois, acostumei com outros jogos.",5,8,1.41,2019-11-22 00:31:44
41,Um usuário do Google,https://play-lh.googleusercontent.com/EGemoI2NTXmTsBVtJqk8jxF9rh8ApRWfsIMQSt2uE4OcpQqbFu7f7NbTK05lx80nuSijCz7sc3a277R67g,Hock hiro é um jogo muito legal e bem rápido os botões ea música com bastante embalo um jogo bem fácil de aprender nota 10 espero que Léia meu comentário talvez patrocínen meu canal é o Kaio 1010 um abraço é um bom dia boa noite e um boa criatividade para melhorar o jogo cadaves mais 😘😎😄😀👍🅺,5,1,1.6,2018-09-27 22:35:24
42,Lucca lc05,https://play-lh.googleusercontent.com/-X3kLCRJwFMs/AAAAAAAAAAI/AAAAAAAAAAA/AMZuuclqhfku9ElWO4qYDr49wiWKzPtong/photo.jpg,"por acaso vocês odeiam iron maiden? todas as musicas dessa banda ficam travando e quando eu testo as do guns, system of a dawn, etc vai tudo normal. vocês devem ajustar o modo local, pois todas as notas são desincronizadas, não tem notas suficientes e trava demais",3,33,1.25,2019-02-01 11:17:09
43,shadow darker,https://play-lh.googleusercontent.com/a-/AOh14GhIOHB9Zfts5A8lVYgwyXHHtB3d457Je_Ur7pcm,"antes era bom, agora nesse grafico ai ficou uma *#""ta, mas não só os graficos, a dificuldade ta baixa demais para mim, ta muito lento e o LOCAL não esta funcionando",3,0,,2019-01-09 22:23:38
44,Ryan Spooky,https://play-lh.googleusercontent.com/a-/AOh14Ggbzwojj1RwBV1jjIOGA36_tIyZW4IjZMpaYaZCIw,"Ficou um lixo, jogo lento, jogabilidade ficou péssima e no difícil com velocidade máxima parece fácil. Chega da nojo.",1,1,1.15,2018-11-30 21:20:56
45,Nerd Devil,https://play-lh.googleusercontent.com/a-/AOh14GgeZ6tBJH8tzXfZY94RkASdGaDNk9gKwd7uGAoeIA,"a disposição das teclas é horrível, a dificuldade exagerada e além do mais o jogo é todo bugado, tipo eu toco mas não vai. Mas gostei dos gráficos!",2,20,1.21,2019-01-07 04:59:08
46,sharleny barbosa,https://play-lh.googleusercontent.com/-Yq5hko68QmM/AAAAAAAAAAI/AAAAAAAAAAA/AMZuuckJswLTcFZFqA_J4c1CfkxKwqVShw/photo.jpg,"Muito bom, a jogabilidade é ótima, uma coisa q deicha desejar é o modo de escolher uma musica sua para jogar , não é tão bom , mas no geral o jogo é um dos melhores",4,2,,2019-10-10 20:15:35
47,Renata Katiane,https://play-lh.googleusercontent.com/-fMFL9vd-Y_s/AAAAAAAAAAI/AAAAAAAAAAA/AMZuucl1i9aYqlzkPZ1A4suj6uYsC2iD4A/photo.jpg,Eu odiei esse jogo fiquei foi e nervosa nao consegui ganhar nem uma estrela apertava as cores certas e nada tentei nao sei quantas vezes e nada e frustante baixar um jogo pensando que e uma coisa enfim e outra nem um tutorial para explicar como joga tem uma falta total de respeito ao jogador nao quero mais esse lixo ai que nojo perdi meu tempo e internet e nao toca as musicas que tem no celular e e rapido ah se eu soubesse que era isso nem tinha baixado nem em pensamento.CHEGA!!👎😡😤💩💩💩💩🚽.,1,0,2.23,2020-06-04 08:15:01
48,Renato Lois,https://play-lh.googleusercontent.com/-qGsb9tFv1i8/AAAAAAAAAAI/AAAAAAAAAAA/AMZuuclFbhTLKCkUv-bTMLxqez2HFLbLSA/photo.jpg,"O melhor jogo desse tipo o Rock hero 2 não é tão bom quanto esse as músicas são muito boas , mas poderia ter mais músicas pois o jogo é fácil e fica entediante as mesma músicas.",5,2,,2019-12-04 18:38:00
49,Welinton Ligorino,https://play-lh.googleusercontent.com/a-/AOh14GjZhK-1Kh5JxkPFpDa1-v7vaHM-Qm4tijpZeuJBf7o,"Jogo até poderia ser interessante. Mas tem muitos anúncios, e o pior, é obrigado a ver no meio do jogo. Do nada jogo para. Perde sentido totalmente de jogar. Péssimo!",1,11,1.41,2019-11-13 12:10:45
50,Vitor Pereira,https://play-lh.googleusercontent.com/a-/AOh14GgDRUXwhLGqQFoB58JNAdpZvnliJ2YmVJhWzkwV,mano q jogo dahora vei do céu.mas mano acho q tinha q atualizar e colocar mais músicas pq eu já tenho todas as três estrelas em todas as músicas no easy normal e hard em um dia.entao coloca mais músicas ae pfvr(coloquem a free bird pfvr),5,2,1.32,2019-08-16 21:12:13
51,Cassia Oliveira,https://play-lh.googleusercontent.com/a-/AOh14Gg8mLzObD_ZRVLLPwY4W5Dr3MIRGDNSl1XLU2M5Aw,"Erra a nota e para a música, assim como os demais da categoria. Busco in jogo que imita o incomparável guitar hero.",1,0,,2019-09-02 22:02:32
52,Um usuário do Google,https://play-lh.googleusercontent.com/EGemoI2NTXmTsBVtJqk8jxF9rh8ApRWfsIMQSt2uE4OcpQqbFu7f7NbTK05lx80nuSijCz7sc3a277R67g,"sempre gostei do jogo,e agora está muito ruin,por exemplo:quando tenho que apertar 2 botões juntos aparece ""miss"" sendo que estou apertando certo.por favor corrijam o mais rápido possível !",2,218,1.25,2019-02-08 20:57:50
53,Lanai Lima,https://play-lh.googleusercontent.com/a-/AOh14GiirVlRYpbbJPZKDDsLnv8iFIToUvssRoiPdM0i,Ai que ódio nenhum dos dois jogos aparece nada no local tenho milhões de músicas no cel e nada de conseguir jogar minhas músicas por tavor arrumem isso. como faço pra jogar assim não dá!,1,6,1.19,2019-01-03 03:27:15
54,Renato Oliveira,https://play-lh.googleusercontent.com/a-/AOh14GjQlryui3wtCvt0TpPkkAvsLxifiZjPOy9QL4-ySQ,Jogo muito bom. Vc joga com as músicas do seu arquivo pessoal! Mas ainda dá para melhorar os times dos botões. Sincronizar melhor. Corrigindo isso tá quase que perfeito.,4,22,2.23,2020-04-20 04:35:09
55,Vanessa Silva,https://play-lh.googleusercontent.com/-IABtElUElvA/AAAAAAAAAAI/AAAAAAAAAAA/AMZuucl-41MA77tmnzxvEHtJ_IVxTgoydg/photo.jpg,"Esse jogo é Otimo, muito bom pq além d poder tocar as musicas que tem no celular, pode tambem tocar as q tem no jogo msm, tbm pode mudar a velocidade...Otimo recomendo para todos",5,67,2.23,2020-05-02 20:07:01
56,DANILO TOLOI,https://play-lh.googleusercontent.com/a-/AOh14Gj1SBl_Sfpg-8jYSyxd6xo06TuWjlfRpJPik5QAoA,"O jogo era ótimo vocês estragaram ele Pq não deixar como estava, amava jogar no dificuldade no máximo era bem rápido agora é uma lentidão só... odiei espero que volta a ser como era",1,26,1.25,2019-02-23 22:22:33
57,Um usuário do Google,https://play-lh.googleusercontent.com/EGemoI2NTXmTsBVtJqk8jxF9rh8ApRWfsIMQSt2uE4OcpQqbFu7f7NbTK05lx80nuSijCz7sc3a277R67g,"Muito legal,da para usar sem internet,da pra escolher as musicas do seu celular pra jogar e pra quem gosta de Rock e melhor ainda",5,2,1.11,2018-10-19 18:17:28
58,Cecília Miranda,https://play-lh.googleusercontent.com/a-/AOh14GijXPxEnXNGAmnlbgMyNrCdlZdnkARy85doaylb3vM,rapaziada q tá falando q eh bom so pode nao jogou ne pq esse jogo parece q pagaram uma coca cola e um coxinha pro mano da lan house fazer então eh isso não baixem,1,0,,2020-10-30 14:17:17
59,Giselle Fernandes,https://play-lh.googleusercontent.com/a-/AOh14Gj90TUDtwZq-tX91DjXL0HVsALsO4A8EvTuT2A0,"Foi o melhor app desse tipo que já testei, os louvores (armazenados no meu celular) ficaram bem mais sincronizados neste app do que em outros jogos semelhantes.",5,12,2.23,2020-04-22 05:33:29
60,Silvia Braz,https://play-lh.googleusercontent.com/-TUInmdvoJf4/AAAAAAAAAAI/AAAAAAAAAFU/AMZuucmsHR40bdNFkvsl6u4gJe_WsppO_g/photo.jpg,muito legal amei nao falta nada nem tira nada legal do geito que esta eu estou meio ruim ainda mas tenho musicas muito rapidas mesmo mas nao e o jogo o jogo e oque esta demeis olha eu descido escolho nota tantanranran ... 10 parabéns jogo muito divertido Rock Hero o melhor eu nao me emporto se guando aperto 2 aparese mis so me emporto em 2 coisas 1- me divertir 2- ganhar as estrelas as pessoas que estao falando mal do jogo nao sabem oque estao fazendo nem oque estão jogando ó jogo bom,5,6,1.32,2019-07-11 01:37:20
61,Alex Amancio,https://play-lh.googleusercontent.com/a-/AOh14GjQ26knVi0_VDWVX1VQm4r0pdCEiB7y0JOMehFBMQ,era o jogo que eu mais gostava... agualizou e e muito lento...eu jogava muito bem no modo difícil... agora o difícil e muito lento nao da pra jogar 😠,1,6,1.21,2019-01-17 17:08:19
62,Tiago Eny Relim,https://play-lh.googleusercontent.com/a-/AOh14Ghx5vmlOtWjub1Znml3T__decOSM4e_JNCkyOo11Q,Tanto anúncio que não dá para jogar. Interrompe o jogo do nada para passar um vídeo. Falta de bom senso. Ridículo.,1,204,1.41,2019-10-18 20:55:39
63,Um usuário do Google,https://play-lh.googleusercontent.com/EGemoI2NTXmTsBVtJqk8jxF9rh8ApRWfsIMQSt2uE4OcpQqbFu7f7NbTK05lx80nuSijCz7sc3a277R67g,"É muito ruim, não baixem ,vão perder o tempo de vcs, não da pra jogar com as músicas do celular , é horrivel",1,0,,2018-09-29 12:14:49
64,X Nunes,https://play-lh.googleusercontent.com/a-/AOh14Ghk0IB2ssvKaXAmTGRVXmSRUKUk_Bro-f_VXE-Uhg,"o modo hard é devagar e sem dificuldade o botão ele vem em uma volocidade baixa e fica mas baixo ainda quando chega perto do botão, eu tenho mania de fazer só perfect então só aperto quando a nota está quase em cima do botão mas sempre dá miss na versão antiga dava só perfect. resumindo está muito ruim e tem que melhorar muito",2,19,1.25,2019-02-15 16:26:55
65,Empada Cinzenta,https://play-lh.googleusercontent.com/a-/AOh14GiQ6SffIymxEUvz4j9GhTOh9DQpoLS7lljbTVZz,"O jogo é muito bom, porém a maioria das minhas músicas não são adaptadas para ele muito bem. Tirando isso o jogo continua bom como sempre",3,3,1.16,2018-12-07 21:01:42
66,Mila Play BR 15 Opann,https://play-lh.googleusercontent.com/a-/AOh14GiYdAbpUw5GxQWDRZr4yZiQoGz9O7yzHQRI86Hd7w,"É muito bom, só porque no meu celular ele não passa as músicas da galeria do celular só queria que melhorasse isso por favor! Obrigada ...",5,41,1.47,2020-02-09 23:47:10
67,Clara Lima,https://play-lh.googleusercontent.com/a-/AOh14GjQQw4JNN99XF9HLbKub1alsEOeepNvUcsLFL09AQ,"muita propaganda o gráfico é muito bom, a jogabilidade dele é ruim vc mal toca as bolinha e ele já ti da game over.",1,0,,2019-01-26 12:24:35
68,vini gamer pc2,https://play-lh.googleusercontent.com/a-/AOh14GjrhcbXd9NQ0hSboJJmZd05K-g5XwIaxFyqA5ZBMA,"O jogo é muito legal, o unico problema é que ate no facil é dificil",5,0,,2020-08-09 20:58:54
69,Um usuário do Google,https://play-lh.googleusercontent.com/EGemoI2NTXmTsBVtJqk8jxF9rh8ApRWfsIMQSt2uE4OcpQqbFu7f7NbTK05lx80nuSijCz7sc3a277R67g,Eu adoreiiiii esse jogo não é tão difícil mas também não é tão fácil é muito legal e equilibrado Beijos 😘💋💋💋 Tchau.,5,0,,2018-10-30 12:35:43
70,Mz Trajado,https://play-lh.googleusercontent.com/a-/AOh14Gig3Lgsp4RwmC5MsUYEudEeYSzxajxlFljehvWwcQ,O jogo tem poucas músicas e tem anúncios que atrapalham muito.,2,0,,2020-09-02 00:17:21
71,Maria Eduarda Conte,https://play-lh.googleusercontent.com/a-/AOh14Gg_nv1VwAFnw7z10TafDM3XO4X8jZSkZ-xeVpt-jg,"esse jogo e horrível, ele trava , quando clica não vai,e é muito rápido ,impossível jogo ruim não instalem",1,1,,2019-01-07 17:34:59
72,Kinha Always,https://play-lh.googleusercontent.com/a-/AOh14GiQkKaKDvKJ9oc5S2xjn5wgI-ZRsUTT8URJK_oddA8,Concordo plenamente com o novinho das antigas... depois que atualizou não da pra jogar.... Esqueceram do botão....,2,3,1.11,2018-10-17 00:01:59
73,Kimy Kimy,https://play-lh.googleusercontent.com/a-/AOh14Gh3gnyoYugsUQcpj_ttkjl80Wo9WfBGIkXG80DYqG8,"O jogo é bem legal, dá pra você jogar com as músicas do celular mas... a música de introdução do jogo toca junto com as minhas músicas, difícil se concentrar assim",2,32,1.25,2019-03-10 12:37:16
74,Auditor .D.,https://play-lh.googleusercontent.com/a-/AOh14GjgxVi4PbfYtel8rq0drS_HpiJu0fCJrVAevvAaUA,O aplicativo trava quando vai buscar as músicas do dispositivo e as músicas que vem com ele são péssimas.,2,1,1.32,2019-08-17 11:53:18
75,Fernanda Moreira,https://play-lh.googleusercontent.com/-9ar19FuKRgo/AAAAAAAAAAI/AAAAAAAAAAA/AMZuucm5ZEJPg6KWQDOyiyqyBYaslN0CPA/photo.jpg,"Muito bom, diferenciado porque podemos pegar músicas do playlist.",5,26,2.23,2020-03-29 07:54:33
76,Cintia Mara Eggert Uecker,https://play-lh.googleusercontent.com/a-/AOh14GgjszQo_79fIK3g7zC9INCxpf9GrK_HS0YXzcNa2w,O jogo e muito bom adorei e bom tambem por poder tocar a propria musica adorei!,5,0,,2020-10-23 12:41:22
77,HAILTON SILVA,https://play-lh.googleusercontent.com/a-/AOh14GhgcClXxN_Wlbd4DPa-qLRlMrnvwpRuBKtYY9mWIg,"tem que melhor a sensibilidade dos botões, aperto dois juntos e da ""miss"".",3,0,1.32,2019-06-16 13:04:54
78,Batata Nibbles,https://play-lh.googleusercontent.com/a-/AOh14GhL3uYnM6a1oQ2dUhIPXd8wS-FRKmDwKBHjnRKR,"Muito ruim, o som tava lento, como se tivesse travado, esse jogo ja foi bom",1,0,,2020-01-06 16:28:01
