,userName,userImage,content,score,thumbsUpCount,reviewCreatedVersion,at
0,celia Justin,https://play-lh.googleusercontent.com/a-/AOh14Gi_2X8HozB3PSGAGP1W5zixhbEzdKtH1MGxy0ZsMg,O jogo é muito bom mas parece que quando a gente gira roleta pela primeira vez e ganhou personagem parece que depois não ganha mais tirando esses fatos jogam muito bom e também para que quando a gente tira aquela roladinha porque que volta não podia ficar naquele trocinho não podia ganhar mais personagens por favor jogo por favor por favor por favor,5,400,2.14.8,2020-10-18 08:19:55
1,Gabriel Ferreira da Graça Santos,https://play-lh.googleusercontent.com/a-/AOh14GhLCNNNIzpdDu4dc_aKqWDX4n0BBd7IvltUzVg,"Acho o jogo bom mais,desbloquear personagens em minha opnião teria que ser mais facil tipo em uma vitoria sei la desbloqueiar um terço de uma skin acho que o jogo seria melhor assim tambem não consigo ganhar diamantes/gemas não sei se é o jogo ou eu que não sei não sei mesmo ganhar diamante/gemas edit: o jogo é perfeito",5,1023,2.14.8,2020-10-20 11:52:55
2,Emanuel Games,https://play-lh.googleusercontent.com/a-/AOh14Gi22wY1LHFwkwwfe2jrY7GnE9j0Cg1GAlFf56-l,"O jogo é muito bom mesmo, só tem umas coisinhas que tem que melhorar, mas tirando isso o jogo é muito legal divertido, porém tem um bau que você tem que avaliar o jogo mas não funciona, mas não ligo mas para esse bau os personage. Tem os poderes muito legal, cada personagem tem sua roupa os efeitos do final muito divertido.",5,1063,2.14.8,2020-09-22 20:25:45
3,Gonçalo Silva,https://play-lh.googleusercontent.com/-ujLBo5bHXQc/AAAAAAAAAAI/AAAAAAAAAAA/AMZuuclhwGzqUyv3pRxrSmadEnzbC3-trg/photo.jpg,O jogo e muito bom e engraçado e fixe o proble ma é que quando ficamos a trás da montanha não da para acertar no adeverçario mas de rasto é muito bom e optimo gdgdvdhdujsuwhegegeggsyayayahwysgshhdhdgefdyfyyhbffddghcrhgtjvfyhfdawdghjkllnnvcxc hjvhhgyugffhuttyuifghhgthhfthiiigffhjhffuuurfgjjgghhfghgtghfgufhuuhtfnkllkjyg bem e wue me estava em casa do Benjamin Constant a que horas tecposso bem e wue me estava em tratamento pedia wue fizessem apenas o pagamento da renda deste mês são as seguintes al,5,66,2.14.8,2020-10-17 05:52:13
4,João Pedro Aguiar,https://play-lh.googleusercontent.com/a-/AOh14GhhoGo0eZUnfKU12LqVQJZ9s5qqEQu7mrUK766whA,"Jogo top 👌. O jogo é bom, divertido e simples de jogar. Acho que minha única crítica é a roleta troladora que sempre cai nas moedas aí invés de cair nos personagetm, mas isso é padrão de jogo mobile. Parabéns aos desenvolvedores, conseguiram fazer um jogo divertido, bonito e com poucas propagandas.",5,1103,2.14.8,2020-09-25 00:31:26
5,Caio Ferreira,https://play-lh.googleusercontent.com/a-/AOh14GhKV3RA5AWy-IrLh4A2MZucwZ0YPwkeM3xEH0qpzJ8,O jogo é muito legal... Mas trava muito... Fica doido não dá pra mexer em nada quando trava ... Trava muito é o problema não é meu celular e sim o jogo ... Precisa melhorar isso ... É horrível jogar assim.,1,0,2.14.8,2020-11-05 21:35:10
6,Arthur MOG,https://play-lh.googleusercontent.com/a-/AOh14Gj7Je_u0rxBuALN4O2ULYJlo94mI4fSFfschP-JTA,"O jogo é muito bom, gráfico ótimo, mas só tem um prblema, os personagens Premium, pq qm ñ tem como comprar o Premium ñ consegue esses personagens, mas fora isso é muito bom o jogo, parabéns pros desenvolvedores!",5,63,2.14.8,2020-10-25 20:37:12
7,Lucas,https://play-lh.googleusercontent.com/a-/AOh14GhycTSAVruTF3YvoHK0o94wLF9HdJIxpa9GqqJKDw,Eu gostei bastante do jogo é perfeito pra tirar o estresse e desconta_lo nos personagens É um ótimo jogo de violência que só os maiores de +14 anos! Podem jogar mais sei como é o jogo e não me emporto já vi muita violência durante esse tempo quem nunca jogou sem ter idade suficiente 🤣🤣🤣 [ Só que faltava mais alguns personagens Baratos e legais de jogar mais tirando isso tá muito bom também! Continuem assim e mais pessoas vão querer jogar esse jogo! #Bowmasters],5,177,2.14.8,2020-09-23 21:29:29
8,yMiilk goldy,https://play-lh.googleusercontent.com/a-/AOh14GhczBobETyU-HOil0iKf2JTAGBYFfW7IBZmI2t5Mw,"Bom..... O jogo é bom,porém tem o Premium e isso ñ é errado,mais o errado é vc colocar personagens que são apenas para pessoas premium,uma pessoa que ñ tenha condição de pagar premium e quer um personaguem que só da para pessoas que assine o Premium, as pessoas que ñ tem logo ficaram tristes",4,989,2.14.8,2020-09-27 17:20:24
9,Fainunes Gamer,https://play-lh.googleusercontent.com/a-/AOh14GiPcjrBv7EiHP6JrDry9eVMBVd-QIKC7BwFV3Yi,O jogo e muito bom só tem um problema roleta quando vc e iniciante vc ganha o personagem mais quando vc fica pro vc não ganha a roleta e trolagem mais o jogo todo e muito bom esse jogo me ensino a atira flecha mais claro eu tinha um professor mais agora nem presiso mais agora eu só uma boa atiradora de flecha já soube do meu canal fai Nunes gamer o jogo me espirou muito e que tenha mudado a vida de jogo só tem o problema da roleta mesmo mais o resto e tudo bom muito bom o jogo bejuuuuuuuuuuu,5,4,2.14.8,2020-10-23 14:19:36
10,Guilherme,https://play-lh.googleusercontent.com/a-/AOh14Gg9s16ytLF-rNb1dFQ4mpR0Z8TPj3Zmpeugz345yg,"O jogo em geral é muito bom, mas eu acho que precisam mostrar os status dos personagens pra que a gente saiba qual escolher, geralmente alguns causam muito mais dano que outros mas não temos como saber porque o jogo não exibe a quantidade de vida e de dano de cada um.",5,61,2.14.8,2020-10-20 11:21:24
11,Vivian Ferreira,https://play-lh.googleusercontent.com/-hRRCEGWk5EU/AAAAAAAAAAI/AAAAAAAAF-g/AMZuucm3popUinGhRX6cYco0UfSUx4oRtg/photo.jpg,O jogo é bastante simples e bem legal ao mesmo tempo mais no meu tablete ele trava muito não muito mais trava mais o jogo é bastante legal quem quiser instalar instale o e legal eu recomendo pra quem quiser instalar porfavor instalem,4,3,2.14.8,2020-10-31 22:24:35
12,Afonso Cardoso,https://play-lh.googleusercontent.com/-utWt4ZJwt1M/AAAAAAAAAAI/AAAAAAAAAAA/AMZuuclPPde5EgMg0V7tQcXjSt60ZVAgMA/photo.jpg,"O jogo é muito bom e legal, os gráficos são muito bons a jogabilidade também é ainda é offline! Deves em quando tem uma travadas mas isso deixa passar",5,1,2.14.8,2020-11-07 07:36:58
13,Davi Leal,https://play-lh.googleusercontent.com/-BlA9940wj6k/AAAAAAAAAAI/AAAAAAAAAAA/AMZuucki7MnNIqoCMtSQ58KN3knYiIFGXA/photo.jpg,"O jogo é realmente bom, mas o Premium da benefícios demais quando tem a ver com personagens, então acho que todos os personagens teriam que estar disponíveis para todos, mas não dou muita bola pra isso, jogabilidade ótima e modos de jogos impecáveis",5,98,2.14.8,2020-10-07 13:02:22
14,Matheus Vinicius,https://play-lh.googleusercontent.com/a-/AOh14Ghh2e1v3SGQzakjN3BjkRIbvikvE7he8ktj6sl0,"É um otimo jogo, porém como em qualquer outro, anúncios aparecem do nada e isso é ruim... Mas o jogo é otimo tirando esses anúncios.",4,3,2.14.8,2020-10-20 11:46:28
15,gugu gamer 2.0,https://play-lh.googleusercontent.com/a-/AOh14GhCIbUNAliEjPpnb4vJlUUa6nWKJVRIaIkS5vDW,O jogo e um dos melhores passa tempo só que enjoa rápido e era pra te mais mapas e era pra ter eventos de tipo chão lava ou o céu sai meteoros se tiver isso eu volto com 5 estrelas e recomendo pra todos os meus amigos:),4,0,2.14.8,2020-11-03 00:55:50
16,Lisboa gonçalves,https://play-lh.googleusercontent.com/-pSstzTSAKMc/AAAAAAAAAAI/AAAAAAAAAAA/AMZuucmaF9_r_511OgKlxGhy0loc25K14A/photo.jpg,Jogo ótimo ótimo mesmo recomendo para todos mais depois que vc gira a roleta a primeira vez e vc ganha um personagem aliatorio depois vc não ganha mais dei 5 estrelas porque fora a esse probleminha o jogo e muito bom já e bom mais como todos dizem oq já e bom pode melhorar,5,1,2.14.8,2020-10-29 15:06:14
17,Jiraya Crafter,https://play-lh.googleusercontent.com/a-/AOh14Ghkn6Yp229P6r8JxHTpSlE1Q1-zhJo9efLmRVs4Mw,"Muito bom. A jogabilidade do jogo é ótima, os gráficos, mas poderia ter mais personagens, além de ter vários personagens, mas eu gostei muito do jogo. Parabéns aos criadores🎉🥇",5,14,2.14.8,2020-11-07 01:40:05
18,João Vida,https://play-lh.googleusercontent.com/a-/AOh14GhnZkRM9wFdxViUuTx1qafzsKCQb1wqcFARbKYtvw,Amei só não gostei q sempre quando terminar aparece anúncios por favor podem tira não por causa. Q aparece o anúncio o jogo fica ruim e e muito muito muito muito bom eu fala isso e eu convido todos meu amigos para q esse jogo possa crescer e ficar forte e isso dou 5 estrelas,5,150,2.14.8,2020-10-01 19:31:42
19,Celia Alexandre,https://play-lh.googleusercontent.com/-W8qigHp8dqI/AAAAAAAAAAI/AAAAAAAAAAA/AMZuucn4OVIjO_T-3GlTKrKLWoCUPwH4ew/photo.jpg,MANO ESSE JOGO É DEMAIS!!! Mas os personagens todos eles deveriam ser comprados com moedas...mais tirando isso o jogo é ótimo! Parabéns para os desenvolvedor! 🎉🎉,5,2,2.14.8,2020-10-30 14:49:41
20,Leopoldo Belmonte,https://play-lh.googleusercontent.com/-oHsTPyQEFik/AAAAAAAAAAI/AAAAAAAAAAA/AMZuucnFO3GJWoVkpQb2L4dWcQ576qvPRw/photo.jpg,Bom dia bowmasters o jogo está muito legal depois dessa atualização agora tem novos perçonajems super legais então eu baixei neste selular mas ainda estou no modo contra o jogo mas mesmo assim o jogo continua sendo legal eu queria tããããto que todos os personagens tiveçen poderes mas isso seria in justo eu só tenho um personagem que tem poder o dá carta o meu nome é Gabriel,5,10,2.14.8,2020-10-12 14:14:14
21,Maui Dattoli,https://play-lh.googleusercontent.com/-6fqeHlFGGU0/AAAAAAAAAAI/AAAAAAAAAAA/AMZuuclT6IqXA6SLjNcYXy0awZb-nDyuJg/photo.jpg,Nossa um dos mlr jogos que existe mesmo NN tem essa de politicamente correto kkkk o jogo e sangrento kkkkk só não gostei de uma coisa os personagens que vc pode conseguir na roleta nunca vem e quando veio eu tive que comprar com o dinheiro do jogo só isso de crítica pq o resto realmente MT bom mesmo eu recomendo MT vc baixar,5,5,2.14.8,2020-10-20 08:34:03
22,circuit of iron,https://play-lh.googleusercontent.com/a-/AOh14Gjlve3zmT1R8wX9Nqvchmcw2lQeDMy0yYtaQSKSwA,"Jogo incrível, ótimo para o público que costuma viajar, é um ótimo passatempo com uma jogabilidade fácil.",5,1,2.14.8,2020-11-05 08:25:54
23,KEVINHO FF GAMER,https://play-lh.googleusercontent.com/-KCBLPUMsu_g/AAAAAAAAAAI/AAAAAAAAAAA/AMZuucm5cTc51ZgyLzI9ureXeMh0SaNVJg/photo.jpg,"Sem duvidas,o jogo e bom,qualidade otima,a unica coisa ruim ,como sempre,e os anuncios (compras,vendas, apss etc..)por isso dou 4 estrelas,poderiam melhorar isso,fora os anuncios o jogo e perfeito!",4,18,2.14.8,2020-10-06 15:53:14
24,MIGUEL 7ANO C escola valderice,https://play-lh.googleusercontent.com/a-/AOh14Gi_fPg5CGJLrqHFrBudE_ODGzUYOgGcCb5umK1lxAQ,eu achei bem da hora apesar de ser bem violento eu gostei diamante muito caro muito caro parece até que eu vou comprar jogo de verdade alguma coisa juntos eu vou comprar Nossa véi mano muito difícil ainda mais que demora muito para conectar a internet do para o jogo mano que saco que saco que raiva velho tenho tanta raiva tanta raiva eu achei até que chato mais ou menos mas eu gostei e Nossa eu vou dar uma dica eu não sei não tem que escrever tudo isso ou se você quiser ficar falando se você,3,8,2.14.8,2020-10-11 20:22:42
25,Um usuário do Google,https://play-lh.googleusercontent.com/EGemoI2NTXmTsBVtJqk8jxF9rh8ApRWfsIMQSt2uE4OcpQqbFu7f7NbTK05lx80nuSijCz7sc3a277R67g,"Eu amo esse jogo, este jogo está cheio de bugs 😒 e isso q me deixa triste, entro em uma partida e buga fica travado, por favor arrumem o jogo, vou dar 5 estrelas se vcs consertarem 🤗. Ficarei agradecido se vcs consertarem. Esse jogo me deixa emocionado quando vejo a foto do jogo, quando olho os personagens, a música, sons de fundo do jogo, eu adorei ♥️. melhor jogo q tem ( ꈍᴗꈍ).",2,10,2.14.8,2020-10-11 21:58:12
26,Demon. . .,https://play-lh.googleusercontent.com/a-/AOh14Gg84RcT2noF_lbigWbwq29RlPzUoOc9DjylIBpI,"Esse jogo e muito viciante eu só prometi pra min mesmo ""Vó jogar só um pouco e dps eu vô fazer outra coisa"" mais eu fiquei vidrado no jogo, um dos personagens que eu mais gosto e o Steve e o Shark na minha opinião eles estão muito apeloes",5,4,2.14.8,2020-10-21 19:36:12
27,Nilrose Aparecida Andrade,https://play-lh.googleusercontent.com/-_L7hCDzxWkM/AAAAAAAAAAI/AAAAAAAAAAA/AMZuucnG-_F4AqLRzBv24cc5yZ0riRsUhA/photo.jpg,Muito bom so que trava muito para um jogo offiline mais tirando isso o jogo e bom mais outra coisa e que tem anuncio e paga e eu nem clico no anuncio e ele abre du nada eu dei 5 estrelas pq ele e bom,5,0,2.14.8,2020-11-08 13:00:20
28,Elaine Cristina,https://play-lh.googleusercontent.com/-w205qhhLmb4/AAAAAAAAAAI/AAAAAAAAAAA/AMZuucn6YcpJYvBQfscekafXKpu79gyz6w/photo.jpg,"Bom... O jogo tem gráficos bons mais tem alguns bugs quando eu vô gira a roleta e n gira quando vou acerta o inimigo o pordesin n vai,mais tirando isso o jogo e MT legal parabéns a os criadores parabéns(°✓°)",5,13,2.14.8,2020-10-13 18:39:22
29,Yasmin Oliveira,https://play-lh.googleusercontent.com/a-/AOh14GhNtaD4VDSk8OcI6HqzWIWkh1rG9nLVnyH9_fkF,"O jogo e otimo e simples a o mesmo tempo. So que os personagens são muito caros, para melhorar o jogo mudem isso por favor. E tambem tem muito anuncio",4,2,2.14.8,2020-11-02 12:33:18
30,GAME OVER,https://play-lh.googleusercontent.com/-mrh-cU8gvQ0/AAAAAAAAAAI/AAAAAAAAAAA/AMZuucm7DL4I038twR3u0WQvuoaILm4cUA/photo.jpg,Muito muito muito legal. O jogo e otimo pra passar o tempo. Eu já jogava mais desinstalei mais baixei de novo por que é muito bom.,5,0,2.14.8,2020-11-01 20:27:55
31,lissandro martins,https://play-lh.googleusercontent.com/a-/AOh14Gh0GY-v7Csm2aNdZxOFQIrWzNPCrJx2UEh4MeiZVA,"Jogo em si é muito bom e bem facil de jogar, problema é os bugs, quando aperece uma propaganda ele simplesmente trava tudo. Trm momentos no jogo que ele trava do nada e vc so resolve fechando o jogo e abrindo novamente.",2,11,2.14.8,2020-09-30 07:50:23
32,Ellen Bertaglia,https://play-lh.googleusercontent.com/-o4wGX76kVDQ/AAAAAAAAAAI/AAAAAAAAAAA/AMZuucnIik5JFW61YVH811Dn0RxdLdpiag/photo.jpg,"Horrível. Nunca vi um aplicativo travar tanto, a tela fica toda preta, fica tremendo, precisa tirar do aplicativo pra jogar de novo, precisa reiniciar o celular, é muito legal, mas é impossível jogar algo que trave tanto assim",1,27,2.14.8,2020-09-26 15:46:24
33,Tiago FF,https://play-lh.googleusercontent.com/-w-puTiS7u8g/AAAAAAAAAAI/AAAAAAAAAAA/AMZuuclj37plIRPdF1OyZ-45qfwCa3m9Uw/photo.jpg,"Mano o jogo é ecelente,muito bom esse jogo sério é muito divertido e bom pra quando estiver entediado,mais o unico poblema é pq sai muito sangue quando mata o inimigo tipo a cabeça sai voando,o sangue fica saindo e isso é muito nojento,mais é muito bom de se jogar e tem gente aque q fica falando q trava a tela fica preta e blablabla bla bla ,mano isso acontece por causa do celular, o celular q não aguenta,eu tinha um J2 galax sansung e só ficava travando ai eu troquei pro A10 e o jogo roda 👍",4,10,2.14.8,2020-09-28 13:43:19
34,MATHEUS MIRANDA FERREIRA,https://play-lh.googleusercontent.com/a-/AOh14GiOGlJAQIGap-9zKV72KdxMpHLJyBcaWUt7FQeR9g,"Muito bom o jogo é bem legal os gráficos, a jogabilidade, os controles são top , mais deveria colocar linguagem em português.",5,4,2.14.8,2020-10-22 21:23:52
35,Alef HRB,https://play-lh.googleusercontent.com/a-/AOh14GijTqJxm3vLafzqYq8_gd_YpJlv8G4c-2mNsVC6yg,"Jogo e top gosto desse estilo de jogo mas queria que as gemas tivesse alguma outra função no Jogo tipo comprar um personagem ou dinheiro,seria legal também um botão que escolhe um personagem aleatório",4,23,2.14.8,2020-10-26 17:25:53
36,Lucas Alencar,https://play-lh.googleusercontent.com/a-/AOh14Gi18lremdTKQtZppAm0_I6-e89GaeeUMs9JmRbJkw,"O jogo é muito bom, o problema é o excesso de anúncios, entendo a necessidade dos anúncios, mas tudo em excesso é prejudicial",4,0,2.14.8,2020-10-17 13:56:11
37,Elta Ferreira,https://play-lh.googleusercontent.com/-uiqutHOO0SI/AAAAAAAAAAI/AAAAAAAAAAA/AMZuucmh3cSDMIhh-_gLX4izyEdKoNlRWg/photo.jpg,"Muito bom o jogo tem de tudo,a ideia releva bem e a jogabilidade em geral é ótima!Estou muito satisfeito jogando obrigado e continue sendo uma excelente empresa de jogos!Boa sorte!",5,2,2.14.8,2020-10-25 15:21:44
38,emilene martins,https://play-lh.googleusercontent.com/-ELegyeQkoNU/AAAAAAAAAAI/AAAAAAAAAAA/AMZuucn4XW-e8HCdxEo4tGYCXkq4YefcOA/photo.jpg,"Eu gostei desse jogo pelo seu painel de controle ser diferente dos outros jogos, e também pelo seu gráfico e a animação diferente... Porém vou dar 3 estrelas",5,12,2.14.8,2020-09-26 16:55:59
39,Paulo Brito,https://play-lh.googleusercontent.com/-7VX5COi1p8s/AAAAAAAAAAI/AAAAAAAAAAA/AMZuucmwi40MRcVY5S897gSNEvD9t1fBLw/photo.jpg,O jogo é bom mas tem alguns problemas sobre o tiro porque tipo às vezes eu tô quase e não vai né mas jogo é bom bom eu gostei muito jogo todos os santos dias e amei amei o jeito do jogo e gostaria que outras pessoas são caras também para amar porque essa é o jogo mais bom que não enjoa O que é é bom é isso,1,7,2.14.8,2020-10-06 11:57:59
40,GÉSSICA MOLICO SOUZA,https://play-lh.googleusercontent.com/a-/AOh14GipqAP2hhH0AgqqwrpgjA-zrpUR9ehf_1z_cbxirw,E muito legal! E competitivo desbloquear personagens e lutar pra gabhar dinheiro e joias a maioria tem evoluçoes e muito mais!,5,3,2.14.8,2020-10-17 11:39:03
41,Suelem Sabrina,https://play-lh.googleusercontent.com/-aWUtDw0zF-I/AAAAAAAAAAI/AAAAAAAAAAA/AMZuuclPgIXLe5fTl0AHSakttvM4hQOY8A/photo.jpg,"Ele...e otimo mas,a roleta da muita raiva pq so cai nas moedas mas o jogo é muito bom e simples simples e divertido muito bom era só esa reclamação 😊😊😊😊😊😊",5,2,2.14.8,2020-10-16 11:05:54
42,Rui Eli Dias Soares,https://play-lh.googleusercontent.com/a-/AOh14GjGv1zKvurT5XGEr5Y606gaol13JkoKVL6aCxY-dw,Jogo muito carismático. Está servindo de inspiração para o jogo que estou desenvolvendo. Muito divertido. Recomendo.,5,11,2.14.8,2020-09-29 02:16:09
43,Deivison Macedo,https://play-lh.googleusercontent.com/a-/AOh14GgrSvEJH7sGctZ2Z9jV5AzCzSe2OgX4798ZIWnpVw,"O jogo é simplesmente fantástico, mas toda vez que conecto a internet o jogo, trava todo, assistir propaganda, o jogo trava, se puderem dar uma moral nisso ae, agradecido.",4,8,2.14.8,2020-10-08 10:52:12
44,Vera Alves,https://play-lh.googleusercontent.com/-qcqnx-dDKBM/AAAAAAAAAAI/AAAAAAAAAAA/AMZuuckepAAQlEf1YhAgH-QWoJXlC8rfhw/photo.jpg,o jogo é muito bom borem eu queria saber se esse jogo é online mas se esse jogo não for online não têm problema é que é legal jogar online eu adorei o jogo e amei parabéns pelo jogo tá bem legal,5,2,2.14.8,2020-10-15 13:29:03
45,Matheus Gabriel Santana,https://play-lh.googleusercontent.com/-jZplzRsi_hM/AAAAAAAAAAI/AAAAAAAAAAA/AMZuucknNbkDispWRZT_QRnuMEEfZBD2vw/photo.jpg,Eu gostei muito do jogo tem vários bonecos legais e criativos tem até uma cópia do Thor no eu dou cinco estrelas por esse jogo eu gostei muito esse jogo é muito legal e ele é muito criativo tem vários bonecos do Thor também também tenho Mário e o RoBen,5,0,2.14.8,2020-10-27 13:09:57
46,GORDON CODM,https://play-lh.googleusercontent.com/a-/AOh14Ggiv6nIV5FLkbk_ryGflW2jPDZAbx84m6smEgEY8g,Adorei o jogo!!!! A jogabilidade dele é ótima!!! Só que eu queria poder jogar contra outras pessoas no multiplayer! Quando vocês vão adicionar?,5,7,2.14.8,2020-10-02 13:13:30
47,Carlos Fonseca,https://play-lh.googleusercontent.com/a-/AOh14GjiHu04NoaOMJ2ih0718uGgBvyf-HFeSDr1zsRacg,Incrivel o jogo e muito bom se que vcs tem que consetar o bug dos anuncios quando vc entra no anuncio para ganhar um premio vc sai mas vc assim vc ganha o premio mase so isso o resto e incrivel recomendo muito esse jogo pessoal deem 5 estrelas esse jogo merece,4,5,2.14.8,2020-10-08 18:21:21
48,vitor rafael,https://play-lh.googleusercontent.com/a-/AOh14GivnvMsr7VAO-Q2gGCNgBGd7odVKK5aBNUZ2HvW,Eu achei esse jogo muito legal só achei que aquele Thor aquele cara com Marcelo Joga raio tudo a Malu amarelo e tem aquela habilidade jogar um raio uma no lugar muito grande então acho que tu podia diminuir porque senão se alguém tiver aquilo eu jogar Errar É só ativar o poder que aquele técnico da aquele círculo É muito grande não dá para desviar mesmo se desse para gente andar para desviar o treco É muito grande não dava tinha que diminuir,5,0,2.14.8,2020-10-29 17:07:27
49,Cleide Aguiar,https://play-lh.googleusercontent.com/-Lk0-b72fjn0/AAAAAAAAAAI/AAAAAAAAAAA/AMZuuclmd6i9sbRUmzG8arDFcdw77KPnNA/photo.jpg,Muito bom o jogo os gráficos são incríveis e não tem muito anuncio parabéns aos desenvolvedores,5,0,2.14.8,2020-11-02 15:15:01
50,dia legal de ruan,https://play-lh.googleusercontent.com/a-/AOh14GirW5Vxo1VxU2rcFMhjXNJmsU5DglugOhUjm5C2lg,O jogo e bom so que tem que pagar para ter personagem entao eu nao tenho condisons para pagar e mais modos de jogos mais pessonagem mais nao pago tirando isso o jogo e bom coloquem personagem com dinheiro do jogo muito bom,5,105,2.14.8,2020-09-22 16:57:49
51,Gustavo Fonseca,https://play-lh.googleusercontent.com/-KX_8ZVdCHaE/AAAAAAAAAAI/AAAAAAAAAAA/AMZuucnJb-8mDI9M-LROOhfDJ1c4mGpsUQ/photo.jpg,"Gostei desse jogo, os gráficos são bons e os controles são exelentes para a jogabilidade",5,11,2.14.8,2020-09-29 13:55:41
52,Renata Falci Lopes,https://play-lh.googleusercontent.com/-faIoSsS4idY/AAAAAAAAAAI/AAAAAAAAAAA/AMZuuclSG-mdZtTca9mvfN--pYz77q7e_A/photo.jpg,Jogo antes era liso mas agora esta travando muito hoje quando etrei no jogo ele travava e tambem ficava saindo toda hora. Mas o jogo em si e legal quero que resouvam esse poblema,4,1,2.14.8,2020-10-23 06:56:55
53,Batatinha Frita,https://play-lh.googleusercontent.com/-UhFDSqWHkRY/AAAAAAAAAAI/AAAAAAAAAAA/AMZuucl4qNo4W_y_4-uh13Ov3TrwvUUT-Q/photo.jpg,Eu adorei os gráficos e a jogabilidade mas a única coisa que eu não gostei foi a violência extrema,4,1,2.14.8,2020-10-13 14:26:27
54,Marcos Filipe,https://play-lh.googleusercontent.com/-xiHrlAMOuvQ/AAAAAAAAAAI/AAAAAAAAAAA/AMZuucnPEajKjMfKT_62v_PGmG8HROSscg/photo.jpg,Sempre gostei desse jogo mas tem um problema eu queria que entrasse rapido e que desse pra jogar multipley um joga com um celular e o outro com outro celular mas adoro o jogo,5,5,2.14.8,2020-10-05 00:53:45
55,Tiago Queiroz,https://play-lh.googleusercontent.com/-jcMo5jBKPzA/AAAAAAAAAAI/AAAAAAAAAAA/AMZuucmZUL2VEyI5vkwfjE4-TeW9UhsW_w/photo.jpg,Legal super da hora demais esse jogo eu ameijá joguei mais de 3 horas é muito bom é muito bom mesmo muito bom muito bom muito bom muito bom muito é tchau tchaué legalzão legal eu gostei desse jogo tem vários personagens de uso mais o da caverna porque é muito maneiro é meu,1,4,2.14.8,2020-10-12 15:40:28
56,Rogério Gomes,https://play-lh.googleusercontent.com/-P2g-KvJqDXU/AAAAAAAAAAI/AAAAAAAAAAA/AMZuuclMaEWaSknY9xG21mgmw5Bd26G9yQ/photo.jpg,Ótimo encrivel o jogo é perfeito o unico problema é que mostra muito sangue ai uma criança menor baixa e da ruim mais tirando isso é perfeito 👍,5,2,2.14.8,2020-10-18 23:14:26
57,Micael Magalhães,https://play-lh.googleusercontent.com/-oaQU4Q3j0vg/AAAAAAAAAAI/AAAAAAAAAAA/AMZuucmrMw77-USVdyvbSdDcARl3KqqUkQ/photo.jpg,Muito bom mesmo vocês podiam botar para gente desbloquear os personagens com dinheiro real em vez de ser com dinheiro real com as gemas,5,0,2.14.8,2020-10-24 18:23:00
58,Mundo dos Games 208,https://play-lh.googleusercontent.com/a-/AOh14GgdQrp85BGd-17NpFmUx-WyROBTPZyNoNZueWkh9Q,Gosto do jogo porém poderiam diminuir o preço dos personagens quanto nas moedas e de dinheiro real.,4,1,2.14.8,2020-10-14 08:17:06
59,Pimenta Gamer,https://play-lh.googleusercontent.com/a-/AOh14Gih3YSqo3VsRbz81TGZcrCVPJCYPOJZgXayNlAbxQ,Ele é um jogo muito legal e divertido de se jogar. Mas também tem aquela roleta que as vezes te trola você ganha moeda ao em vés de personagem mas tirando isso o jogo é muito legal e eu do cinco estrelas ⭐⭐⭐⭐⭐,5,7,2.14.8,2020-09-28 23:34:25
60,Pedro Henrique,https://play-lh.googleusercontent.com/-ZDdtY1GAS_0/AAAAAAAAAAI/AAAAAAAAAAA/AMZuucmw4Y2DJONgte-fgAga4najW69HKw/photo.jpg,Muito bom o jogo mais oq eu não entendo pq o jogador de futebol americano solta a bola com fogo e da mais dano mais o homem de fogo lança uma garrafa de fogo e da poucos de dano,5,0,2.14.8,2020-10-26 16:35:39
61,Nikolasgamer soares,https://play-lh.googleusercontent.com/a-/AOh14Gi7M8O18V04NTF69skHJFDVKPLRE0iUs5wMV6qjCQ,E muito bom o jogo mas o unico problema e que tem mutos anúncios mas o resto o jogo e perfeito,5,0,2.14.8,2020-10-27 14:02:04
62,Kauzin Clash Brawl Clash,https://play-lh.googleusercontent.com/a-/AOh14GiHxNsuRYziu9vUkHx3GcM9zrWsnyB5UYV9W9xE,Poderia ter um Premium de graça e um pago tipo esse atualmente mas o jogo continua o mesmo o melhor :),5,0,2.14.8,2020-11-08 12:10:57
63,Dio Brando,https://play-lh.googleusercontent.com/a-/AOh14GiKbt0FmyOp6jBbvODst4gVp9ertgqKEUZE6TKNhQ,"Jogo bom,boa jogabilida,e rende boa experiencia,que é melhor ainda no multiplayer",5,2,2.14.8,2020-10-12 08:00:30
64,kakashi o ninja sacana,https://play-lh.googleusercontent.com/a-/AOh14GhRxiF-2XEIUuMZZneCrJZ64eHlmdlWormXKEcy,O joga 3 bombas eu não gostei da roleta por que ela trola demais eu quase ganhei o tubarão é veio mueda só por que eu cliquei na hora errada senda que era pra ser a hora certa,4,1,2.14.8,2020-10-22 17:21:46
65,Renan Mckayser,https://play-lh.googleusercontent.com/-C5iopt3VT90/AAAAAAAAAAI/AAAAAAAAAAA/AMZuuclbNdIlgx22_gb5fpfm00KGmyUOHQ/photo.jpg,"O jogo sem dúvida é bacana, mas é melhor jogar com a internet desativada. Com o celular online, o jogo fica bugando e travando o tempo inteiro.",3,5,2.14.8,2020-10-08 17:31:06
66,Nathan Ribeiro,https://play-lh.googleusercontent.com/a-/AOh14GjVHsX-obpB67Mijzc7LptjTi3psrkzSTU-OUgI,Esse jogo e muito legal e divertido mas para conseguir gemas poderia ser mais facil mais tirando isso ele e perfeito,5,0,2.14.8,2020-11-03 17:51:14
